Transaction_ID,Transaction_Date,Transaction_TS,Store_ID,Customer_ID,Payment_Method,Total_Amount,Total_Discount,Line_Count,Batch_ID,Source_File
T00015467,06/21/24,2024-06-21 17:45:15,S004,C001120,Online,27.34,4.1,1,gen_20251127_091607,transactions_header.csv
T00018733,10/23/24,2024-10-23 18:37:57,S018,C002556,Cash,65.11,0.0,1,gen_20251127_091607,transactions_header.csv
T00012664,12/06/24,2024-12-06 16:42:09,S002,C000410,Card,46.07,0.0,7,gen_20251127_091607,transactions_header.csv
T00015189,2024-07-14,2024-07-14 09:05:44,S007,C003083,Online,53.32,2.67,2,gen_20251127_091607,transactions_header.csv
T00004202,04/30/24,2024-04-30 11:41:37,S007,,Online,107.79,10.78,1,gen_20251127_091606,transactions_header.csv
T00015954,2024-10-28,2024-10-28 05:40:13,S012,C003647,Online,44.51,6.68,1,gen_20251127_091607,transactions_header.csv
T00012634,2024-01-05,2024-01-05 18:26:58,S003,C004194,Card,26.45,1.32,1,gen_20251127_091607,transactions_header.csv
T00001088,2024-11-30,2024-11-30 12:22:09,S030,C002823,Card,39.89,3.99,6,gen_20251127_091605,transactions_header.csv
T00015873,08/10/24,2024-08-10 12:21:03,S005,C003297,Online,31.42,0.0,2,gen_20251127_091607,transactions_header.csv
T00018086,2024-05-07,2024-05-07 05:02:27,S002,C003695,Card,53.62,5.36,4,gen_20251127_091607,transactions_header.csv
T00015323,03/15/24,2024-03-15 16:40:52,S019,C000073,Cash,24.0,1.2,1,gen_20251127_091607,transactions_header.csv
T00015810,07/05/24,2024-07-05 02:54:24,S022,NA,Card,78.64,7.86,1,gen_20251127_091607,transactions_header.csv
T00008351,2024-05-05,2024-05-05 15:49:27,S029,C002067,Card,47.57,2.38,6,gen_20251127_091606,transactions_header.csv
T00010194,11/07/24,2024-11-07 06:57:54,S012,,Online,72.89,3.64,1,gen_20251127_091606,transactions_header.csv
T00002352,06/17/24,2024-06-17 18:45:48,S028,C003160,Card,8.81,0.88,2,gen_20251127_091605,transactions_header.csv
T00014578,07/19/24,2024-07-19 18:36:19,S021,,Card,87.0,8.7,4,gen_20251127_091607,transactions_header.csv
T00019416,10/31/24,2024-10-31 01:33:15,S018,C001308,Card,52.4,2.62,4,gen_20251127_091607,transactions_header.csv
T00002768,2024-11-27,2024-11-27 14:00:24,S021,C000647,Online,86.77,4.34,3,gen_20251127_091605,transactions_header.csv
T00018539,05/22/24,2024-05-22 09:06:53,S018,C001882,Card,71.92,10.79,1,gen_20251127_091607,transactions_header.csv
T00006040,2024-06-14,2024-06-14 19:21:47,S020,C001310,Card,51.41,,1,gen_20251127_091606,transactions_header.csv
T00008196,12/23/24,2024-12-23 07:22:42,S010,C002971,Card,33.33,3.33,1,gen_20251127_091606,transactions_header.csv
T00008571,07/02/24,2024-07-02 11:40:52,S012,C003133,Card,14.59,2.19,6,gen_20251127_091606,transactions_header.csv
T00015133,12/12/24,2024-12-12 09:05:30,S005,C000263,Card,21.6,,1,gen_20251127_091607,transactions_header.csv
T00017860,08/17/24,2024-08-17 12:49:49,S030,C001562,Card,76.52,7.65,2,gen_20251127_091607,transactions_header.csv
T00013345,08/03/24,2024-08-03 01:31:11,S022,C001074,Cash,$84.82,4.24,5,gen_20251127_091607,transactions_header.csv
T00008553,01/05/24,2024-01-05 03:31:38,S030,C002757,Online,66.77,3.34,2,gen_20251127_091606,transactions_header.csv
T00003166,09/10/24,2024-09-10 13:18:52,S002,C004874,Cash,30.81,0.0,2,gen_20251127_091606,transactions_header.csv
T00007563,04/18/24,2024-04-18 08:14:33,S016,C001715,Card,37.71,NA,7,gen_20251127_091606,transactions_header.csv
T00016443,2024-04-17,2024-04-17 21:28:05,S012,C004423,Card,33.56,3.36,6,gen_20251127_091607,transactions_header.csv
T00017440,2024-02-04,2024-02-04 09:16:14,S029,NA,Cash,45.87,0.0,2,gen_20251127_091607,transactions_header.csv
T00004548,2024-01-09,2024-01-09 01:54:30,S009,C000885,Card,28.09,0.0,4,gen_20251127_091606,transactions_header.csv
T00015560,2024-01-28,2024-01-28 11:07:41,S004,C003042,Online,31.77,1.59,3,gen_20251127_091607,transactions_header.csv
T00011942,04/28/24,2024-04-28 13:24:09,S007,C000598,Card,36.09,3.61,2,gen_20251127_091607,transactions_header.csv
T00013564,2024-03-29,2024-03-29 18:58:38,S004,NA,Cash,78.14,11.72,1,gen_20251127_091607,transactions_header.csv
T00008613,12/18/24,2024-12-18 14:10:49,S020,C003489,Cash,35.06,1.75,5,gen_20251127_091606,transactions_header.csv
T00014718,09/03/24,2024-09-03 02:39:56,S026,C004185,Card,0,0.0,1,gen_20251127_091607,transactions_header.csv
T00018165,2024-08-19,2024-08-19 18:49:05,S021,C001581,Cash,19.53,0.98,2,gen_20251127_091607,transactions_header.csv
T00016198,12/18/24,2024-12-18 13:15:21,S030,C002086,Cash,68.58,6.86,1,gen_20251127_091607,transactions_header.csv
T00017150,2024-04-14,2024-04-14 02:30:24,S028,C002966,Online,34.31,1.72,4,gen_20251127_091607,transactions_header.csv
T00018603,03/13/24,2024-03-13 10:54:39,S009,C000038,Card,23.23,2.32,1,gen_20251127_091607,transactions_header.csv
T00012358,2024-09-19,2024-09-19 10:31:24,S010,C002420,Card,51.79,2.59,2,gen_20251127_091607,transactions_header.csv
T00011184,01/30/24,2024-01-30 04:54:28,S006,C002195,Card,111.73,16.76,2,gen_20251127_091606,transactions_header.csv
T00000120,2024-11-21,2024-11-21 22:59:18,S011,C004722,Cash,10.28,0.51,1,gen_20251127_091605,transactions_header.csv
T00003462,2024-02-08,2024-02-08 15:13:36,S021,C001206,Online,74.51,0.0,5,gen_20251127_091606,transactions_header.csv
T00005735,04/04/24,2024-04-04 10:46:47,S019,NA,Online,53.41,8.01,1,gen_20251127_091606,transactions_header.csv
T00018824,2024-07-27,2024-07-27 21:31:42,S027,C002495,Card,18.5,0.93,1,gen_20251127_091607,transactions_header.csv
T00013223,01/06/24,2024-01-06 04:58:08,S010,NA,Card,53.82,5.38,2,gen_20251127_091607,transactions_header.csv
T00000035,2024-07-02,2024-07-02 07:30:46,S027,C003534,Card,58.6,,1,gen_20251127_091605,transactions_header.csv
T00007443,2024-10-16,2024-10-16 13:01:00,S004,C003413,Online,76.0,3.8,1,gen_20251127_091606,transactions_header.csv
T00019931,12/15/24,2024-12-15 08:18:17,S025,C001130,Card,35.7,5.36,1,gen_20251127_091607,transactions_header.csv
T00009955,02/04/24,2024-02-04 18:32:56,S010,C002029,Cash,51.4,2.57,2,gen_20251127_091606,transactions_header.csv
T00018419,2024-04-04,2024-04-04 20:10:39,S011,C002907,Card,84.61,4.23,3,gen_20251127_091607,transactions_header.csv
T00014719,2024-02-08,2024-02-08 01:01:53,S005,C001337,Online,31.74,,1,gen_20251127_091607,transactions_header.csv
T00016454,12/24/24,2024-12-24 21:59:45,S023,C003541,Online,34.37,1.72,5,gen_20251127_091607,transactions_header.csv
T00008648,01/01/24,2024-01-01 12:34:48,S020,C000091,Card,49.38,2.47,7,gen_20251127_091606,transactions_header.csv
T00008065,03/15/24,2024-03-15 22:17:03,S017,C004891,Online,2.75,0.0,5,gen_20251127_091606,transactions_header.csv
T00007748,01/25/24,2024-01-25 06:28:24,S014,C000607,cash,0,0.0,1,gen_20251127_091606,transactions_header.csv
T00004573,2024-02-05,2024-02-05 02:08:23,S003,C003686,Online,87.37,4.37,1,gen_20251127_091606,transactions_header.csv
T00012697,08/16/24,2024-08-16 03:44:03,S014,NA,Card,30.33,1.52,3,gen_20251127_091607,transactions_header.csv
T00005291,05/27/24,2024-05-27 17:52:12,S023,C000801,Cash,45.71,4.57,1,gen_20251127_091606,transactions_header.csv
T00004259,2024-03-08,2024-03-08 05:15:27,S012,C004322,Card,70.1,10.51,1,gen_20251127_091606,transactions_header.csv
T00017404,2024-11-13,2024-11-13 21:11:18,S015,C004088,Online,57.67,,1,gen_20251127_091607,transactions_header.csv
T00004169,08/23/24,2024-08-23 22:28:14,S023,C000501,Card,46.97,0.0,1,gen_20251127_091606,transactions_header.csv
T00009675,08/21/24,2024-08-21 02:13:21,S016,C003656,Cash,57.97,NA,2,gen_20251127_091606,transactions_header.csv
T00006919,06/06/24,2024-06-06 13:11:40,S009,C002148,Cash,39.83,5.97,2,gen_20251127_091606,transactions_header.csv
T00018558,2024-09-30,2024-09-30 04:02:03,S017,C003828,Cash,$23.78,3.57,3,gen_20251127_091607,transactions_header.csv
T00009101,2024-09-05,2024-09-05 00:53:00,S016,C004194,Card,19.1,1.91,2,gen_20251127_091606,transactions_header.csv
T00010883,10/21/24,2024-10-21 07:36:34,S020,C002712,Online,57.83,5.78,4,gen_20251127_091606,transactions_header.csv
T00010837,2024-11-24,2024-11-24 08:27:40,S012,,Cash,103.95,0.0,2,gen_20251127_091606,transactions_header.csv
T00006528,2024-11-21,2024-11-21 10:16:30,S018,C000926,Online,72.01,3.6,5,gen_20251127_091606,transactions_header.csv
T00008772,07/10/24,2024-07-10 18:38:57,S020,C001230,Card,$21.19,1.06,1,gen_20251127_091606,transactions_header.csv
T00006869,2024-08-24,2024-08-24 17:56:55,S010,C004411,Cash,73.15,3.66,5,gen_20251127_091606,transactions_header.csv
T00009690,07/14/24,2024-07-14 08:42:05,S020,C004681,Card,65.78,3.29,2,gen_20251127_091606,transactions_header.csv
T00019797,08/17/24,2024-08-17 14:51:36,S001,C003158,Cash,85.05,NA,4,gen_20251127_091607,transactions_header.csv
T00016506,11/07/24,2024-11-07 14:17:56,S024,C004796,Card,95.84,9.58,2,gen_20251127_091607,transactions_header.csv
T00010329,2024-07-18,2024-07-18 13:21:47,S008,C003411,Cash,90.34,0.0,1,gen_20251127_091606,transactions_header.csv
T00000452,2024-02-28,2024-02-28 05:39:28,S015,C001698,Cash,61.82,6.18,1,gen_20251127_091605,transactions_header.csv
T00013694,2024-03-17,2024-03-17 15:25:19,S028,C004763,Card,68.19,3.41,1,gen_20251127_091607,transactions_header.csv
T00000439,2024-07-19,2024-07-19 09:11:38,S006,C004581,Online,47.71,2.39,6,gen_20251127_091605,transactions_header.csv
T00008815,2024-04-14,2024-04-14 14:08:46,S011,C003959,Cash,58.74,0.0,4,gen_20251127_091606,transactions_header.csv
T00019494,2024-10-31,2024-10-31 19:43:19,S010,C002284,Online,77.04,7.7,2,gen_20251127_091607,transactions_header.csv
T00015372,2024-07-08,2024-07-08 16:03:56,S011,C004227,Online,95.49,14.32,1,gen_20251127_091607,transactions_header.csv
T00009961,06/16/24,2024-06-16 10:30:33,S007,C004255,Cash,$50.12,NA,3,gen_20251127_091606,transactions_header.csv
T00015958,2024-02-20,2024-02-20 19:14:23,S003,C002043,Card,$98.45,9.85,5,gen_20251127_091607,transactions_header.csv
T00005378,2024-03-08,2024-03-08 17:21:26,S029,C002601,Cash,51.08,,1,gen_20251127_091606,transactions_header.csv
T00007724,2024-12-28,2024-12-28 00:05:16,S023,C004793,Cash,50.28,,2,gen_20251127_091606,transactions_header.csv
T00011267,2024-08-24,2024-08-24 05:13:05,S017,C004643,Card,89.86,0.0,1,gen_20251127_091606,transactions_header.csv
T00013889,2024-12-04,2024-12-04 13:51:45,S001,C000282,Cash,69.01,6.9,1,gen_20251127_091607,transactions_header.csv
T00007200,06/30/24,2024-06-30 13:44:37,S006,C001878,Online,55.19,2.76,3,gen_20251127_091606,transactions_header.csv
T00012347,2024-03-10,2024-03-10 18:20:12,S030,C004668,Cash,17.58,1.76,3,gen_20251127_091607,transactions_header.csv
T00002146,09/19/24,2024-09-19 05:26:30,S012,C003681,Card,63.6,3.18,1,gen_20251127_091605,transactions_header.csv
T00005381,2024-02-01,2024-02-01 16:24:36,S021,C002977,cash,69.57,6.96,2,gen_20251127_091606,transactions_header.csv
T00009998,10/26/24,2024-10-26 03:13:50,S013,C004055,Cash,42.83,4.28,1,gen_20251127_091606,transactions_header.csv
T00017459,2024-04-28,2024-04-28 10:34:34,S003,C001033,Cash,52.9,0.0,3,gen_20251127_091607,transactions_header.csv
T00017933,2024-02-24,2024-02-24 04:56:05,S017,C000994,Online,36.92,5.54,1,gen_20251127_091607,transactions_header.csv
T00018951,10/15/24,2024-10-15 23:33:08,S020,C003765,Online,41.68,4.17,1,gen_20251127_091607,transactions_header.csv
T00017678,04/01/24,2024-04-01 18:22:39,S020,C001888,Card,47.09,4.71,1,gen_20251127_091607,transactions_header.csv
T00017237,11/02/24,2024-11-02 19:46:39,S005,,Online,22.81,2.28,4,gen_20251127_091607,transactions_header.csv
T00018249,2024-11-08,2024-11-08 12:25:54,S025,C004267,Cash,58.72,,1,gen_20251127_091607,transactions_header.csv
T00014431,2024-10-10,2024-10-10 13:58:31,S019,C002329,Cash,56.02,2.8,3,gen_20251127_091607,transactions_header.csv
T00002520,2024-09-08,2024-09-08 02:10:02,S016,C001203,Card,57.78,NA,4,gen_20251127_091605,transactions_header.csv
T00019648,2024-12-12,2024-12-12 13:05:03,S002,C004059,Cash,71.04,7.1,1,gen_20251127_091607,transactions_header.csv
T00001693,12/26/24,2024-12-26 11:28:58,S030,,Cash,52.24,5.22,6,gen_20251127_091605,transactions_header.csv
T00006254,01/30/24,2024-01-30 23:08:36,S019,C004261,Card,66.88,3.34,2,gen_20251127_091606,transactions_header.csv
T00015579,07/17/24,2024-07-17 00:18:33,S003,,Card,101.06,10.11,1,gen_20251127_091607,transactions_header.csv
T00019513,02/02/24,2024-02-02 21:22:40,S002,C003397,Card,57.44,0.0,2,gen_20251127_091607,transactions_header.csv
T00019378,12/13/24,2024-12-13 19:52:11,S025,C003242,Online,81.66,8.17,1,gen_20251127_091607,transactions_header.csv
T00004014,04/12/24,2024-04-12 03:35:21,S009,C000518,Online,52.58,0.0,1,gen_20251127_091606,transactions_header.csv
T00007242,02/16/24,2024-02-16 12:42:25,S016,C004469,Online,128.96,0.0,2,gen_20251127_091606,transactions_header.csv
T00019570,2024-01-04,2024-01-04 04:33:34,S017,C000563,Card,85.42,4.27,1,gen_20251127_091607,transactions_header.csv
T00017586,08/29/24,2024-08-29 15:07:38,S008,C004934,Cash,48.87,4.89,1,gen_20251127_091607,transactions_header.csv
T00007725,09/25/24,2024-09-25 11:44:05,S017,C003899,Cash,74.89,3.74,1,gen_20251127_091606,transactions_header.csv
T00009843,2024-12-04,2024-12-04 16:27:12,S002,C004879,Card,4.68,0.47,1,gen_20251127_091606,transactions_header.csv
T00015462,07/07/24,2024-07-07 08:56:21,S028,C002116,Online,33.11,0.0,6,gen_20251127_091607,transactions_header.csv
T00017192,07/25/24,2024-07-25 14:38:51,S009,C003508,Cash,85.61,0.0,1,gen_20251127_091607,transactions_header.csv
T00012248,2024-02-03,2024-02-03 00:11:50,S020,C004166,Card,39.34,5.9,5,gen_20251127_091607,transactions_header.csv
T00019718,2024-08-20,2024-08-20 02:24:56,S008,C000299,Card,119.95,12.0,2,gen_20251127_091607,transactions_header.csv
T00016125,03/02/24,2024-03-02 02:34:45,S024,C001726,Online,37.2,3.72,2,gen_20251127_091607,transactions_header.csv
T00008370,04/12/24,2024-04-12 22:42:17,S009,C001530,Online,58.89,8.83,2,gen_20251127_091606,transactions_header.csv
T00012632,02/23/24,2024-02-23 13:13:56,S024,C003081,Cash,40.37,2.02,1,gen_20251127_091607,transactions_header.csv
T00019630,09/26/24,2024-09-26 04:50:44,S008,C002698,Card,0,0.0,1,gen_20251127_091607,transactions_header.csv
T00007114,2024-12-18,2024-12-18 06:20:59,S009,C003916,Online,15.77,2.37,1,gen_20251127_091606,transactions_header.csv
T00015881,2024-01-02,2024-01-02 05:11:05,S006,C000610,Card,0,0.0,2,gen_20251127_091607,transactions_header.csv
T00001444,08/23/24,2024-08-23 12:26:26,S005,C001180,Card,73.98,0.0,1,gen_20251127_091605,transactions_header.csv
T00008204,2024-05-30,2024-05-30 22:11:26,S010,C003818,Cash,63.59,0.0,6,gen_20251127_091606,transactions_header.csv
T00019962,2024-06-20,2024-06-20 01:10:19,S025,C001081,Online,65.26,6.53,7,gen_20251127_091607,transactions_header.csv
T00014539,2024-07-16,2024-07-16 00:51:32,S018,C001366,Online,$25.37,1.27,1,gen_20251127_091607,transactions_header.csv
T00001053,08/13/24,2024-08-13 22:27:43,S007,C001414,cash,41.12,6.17,3,gen_20251127_091605,transactions_header.csv
T00010533,2024-12-11,2024-12-11 11:07:48,S012,C002244,Online,138.87,13.89,1,gen_20251127_091606,transactions_header.csv
T00017748,05/13/24,2024-05-13 13:44:11,S009,C000887,card,92.4,13.86,6,gen_20251127_091607,transactions_header.csv
T00016873,07/29/24,2024-07-29 22:33:24,S006,C004767,Online,47.85,2.39,1,gen_20251127_091607,transactions_header.csv
T00012121,2024-05-15,2024-05-15 03:10:32,S007,C000822,Online,56.24,8.44,1,gen_20251127_091607,transactions_header.csv
T00014013,10/23/24,2024-10-23 22:19:54,S007,NA,Card,109.4,10.94,1,gen_20251127_091607,transactions_header.csv
T00002642,2024-10-11,2024-10-11 06:46:57,S012,C001041,Cash,53.86,2.69,4,gen_20251127_091605,transactions_header.csv
T00011579,2024-02-04,2024-02-04 18:39:35,S013,C002626,Online,53.8,0.0,2,gen_20251127_091606,transactions_header.csv
T00013086,09/30/24,2024-09-30 01:01:24,S025,C000863,Online,20.09,1.0,1,gen_20251127_091607,transactions_header.csv
T00000219,2024-01-08,2024-01-08 11:20:30,S016,C000609,Cash,76.36,3.82,1,gen_20251127_091605,transactions_header.csv
T00007111,2024-06-08,2024-06-08 12:31:40,S002,C003759,Cash,63.04,6.3,7,gen_20251127_091606,transactions_header.csv
T00017658,2024-11-03,2024-11-03 16:44:35,S006,C002544,Online,$111.32,16.7,1,gen_20251127_091607,transactions_header.csv
T00009249,06/13/24,2024-06-13 12:04:31,S011,C002311,Card,14.95,0.75,6,gen_20251127_091606,transactions_header.csv
T00005307,2024-07-03,2024-07-03 13:15:13,S003,C001096,Online,78.21,11.73,1,gen_20251127_091606,transactions_header.csv
T00005787,05/30/24,2024-05-30 04:30:01,S004,C000815,Online,103.1,5.16,2,gen_20251127_091606,transactions_header.csv
T00007898,04/25/24,2024-04-25 17:10:44,S007,C003342,Cash,41.41,0.0,2,gen_20251127_091606,transactions_header.csv
T00003395,2024-01-27,2024-01-27 21:39:41,S023,C002382,Online,85.4,8.54,1,gen_20251127_091606,transactions_header.csv
T00018765,07/06/24,2024-07-06 03:47:22,S017,,Card,10.67,0.53,3,gen_20251127_091607,transactions_header.csv
T00000607,06/23/24,2024-06-23 01:37:10,S028,C002305,Card,55.31,5.53,2,gen_20251127_091605,transactions_header.csv
T00011287,05/26/24,2024-05-26 12:36:28,S013,C004412,Cash,16.21,NA,1,gen_20251127_091606,transactions_header.csv
T00004286,04/01/24,2024-04-01 11:45:19,S011,C002768,Online,93.97,,1,gen_20251127_091606,transactions_header.csv
T00008050,2024-03-05,2024-03-05 02:19:10,S030,C001654,Cash,73.32,,2,gen_20251127_091606,transactions_header.csv
T00016661,09/02/24,2024-09-02 04:12:05,S024,C001516,Cash,67.73,3.39,6,gen_20251127_091607,transactions_header.csv
T00018491,07/11/24,2024-07-11 14:07:01,S001,C003508,Online,62.84,,1,gen_20251127_091607,transactions_header.csv
T00007666,05/30/24,2024-05-30 00:06:03,S002,C002709,Online,8.96,,3,gen_20251127_091606,transactions_header.csv
T00003430,04/20/24,2024-04-20 14:15:11,S024,C004374,online,70.27,3.51,1,gen_20251127_091606,transactions_header.csv
T00004721,2024-07-29,2024-07-29 06:57:51,S007,C001721,Online,59.81,8.97,1,gen_20251127_091606,transactions_header.csv
T00016907,10/09/24,2024-10-09 12:57:45,S004,C003164,Online,$78.33,3.92,2,gen_20251127_091607,transactions_header.csv
T00018509,07/03/24,2024-07-03 00:23:06,S023,C000927,Cash,84.43,4.22,4,gen_20251127_091607,transactions_header.csv
T00008846,2024-12-30,2024-12-30 14:34:04,S007,C001742,Card,19.92,2.99,6,gen_20251127_091606,transactions_header.csv
T00018648,05/10/24,2024-05-10 08:23:03,S021,,Online,79.41,7.94,1,gen_20251127_091607,transactions_header.csv
T00018674,02/26/24,2024-02-26 18:48:29,S001,C002653,Cash,29.22,,3,gen_20251127_091607,transactions_header.csv
T00000994,06/28/24,2024-06-28 08:06:41,S015,C003071,cash,16.76,1.68,1,gen_20251127_091605,transactions_header.csv
T00003025,2024-06-08,2024-06-08 06:40:23,S028,C002937,Cash,34.75,5.21,2,gen_20251127_091606,transactions_header.csv
T00008916,10/01/24,2024-10-01 06:49:05,S007,C001721,Online,76.83,3.84,1,gen_20251127_091606,transactions_header.csv
T00004073,2024-11-25,2024-11-25 06:28:08,S010,NA,Online,$0.00,0.0,2,gen_20251127_091606,transactions_header.csv
T00011857,2024-04-08,2024-04-08 23:21:24,S025,C003076,card,26.63,0.0,2,gen_20251127_091607,transactions_header.csv
T00013069,2024-03-19,2024-03-19 10:10:50,S005,,Card,$48.38,2.42,1,gen_20251127_091607,transactions_header.csv
T00003223,2024-09-23,2024-09-23 12:57:28,S015,C002252,Cash,90.21,13.53,2,gen_20251127_091606,transactions_header.csv
T00004823,2024-01-06,2024-01-06 11:38:00,S010,,Online,95.17,4.76,2,gen_20251127_091606,transactions_header.csv
T00003847,04/05/24,2024-04-05 16:06:00,S019,C002810,Online,0,0.0,5,gen_20251127_091606,transactions_header.csv
T00003101,2024-09-26,2024-09-26 14:28:58,S023,,Online,100.76,10.08,4,gen_20251127_091606,transactions_header.csv
T00006614,2024-03-30,2024-03-30 06:53:54,S025,C004040,Cash,39.63,5.94,2,gen_20251127_091606,transactions_header.csv
T00018359,11/20/24,2024-11-20 16:48:04,S002,C003598,Card,0,0.0,1,gen_20251127_091607,transactions_header.csv
T00007535,2024-02-24,2024-02-24 04:18:02,S015,C003378,Card,47.57,0.0,3,gen_20251127_091606,transactions_header.csv
T00009894,01/22/24,2024-01-22 14:00:57,S005,C001113,Cash,61.91,6.19,2,gen_20251127_091606,transactions_header.csv
T00003965,2024-01-16,2024-01-16 07:58:37,S028,C004808,Card,43.29,2.16,1,gen_20251127_091606,transactions_header.csv
T00000829,2024-09-02,2024-09-02 22:42:24,S021,C002608,Card,$75.59,7.56,1,gen_20251127_091605,transactions_header.csv
T00018019,05/28/24,2024-05-28 06:06:59,S022,C000606,Card,56.98,2.85,1,gen_20251127_091607,transactions_header.csv
T00010591,2024-06-21,2024-06-21 11:18:21,S015,C001391,Card,6.38,NA,3,gen_20251127_091606,transactions_header.csv
T00000448,2024-09-18,2024-09-18 17:08:06,S001,C002960,Cash,37.53,NA,1,gen_20251127_091605,transactions_header.csv
T00006406,2024-09-03,2024-09-03 01:47:43,S011,C004212,Card,35.57,0.0,1,gen_20251127_091606,transactions_header.csv
T00003753,2024-02-14,2024-02-14 02:01:37,S018,C003917,Cash,$80.49,8.05,5,gen_20251127_091606,transactions_header.csv
T00002313,12/03/24,2024-12-03 14:46:25,S017,C003496,Online,44.46,2.22,1,gen_20251127_091605,transactions_header.csv
T00009017,02/16/24,2024-02-16 18:54:18,S002,C000162,Card,63.52,6.35,3,gen_20251127_091606,transactions_header.csv
T00016129,04/14/24,2024-04-14 01:53:14,S018,C002584,Cash,$93.41,4.67,2,gen_20251127_091607,transactions_header.csv
T00007827,08/25/24,2024-08-25 05:10:25,S022,C003495,Online,39.71,1.99,4,gen_20251127_091606,transactions_header.csv
T00016828,2024-11-14,2024-11-14 23:37:36,S009,C002094,Card,47.93,0.0,2,gen_20251127_091607,transactions_header.csv
T00010055,2024-05-10,2024-05-10 09:42:32,S019,C001075,Online,36.78,5.52,1,gen_20251127_091606,transactions_header.csv
T00016614,2024-09-02,2024-09-02 05:11:52,S021,C000857,card,37.66,1.88,1,gen_20251127_091607,transactions_header.csv
T00002233,2024-01-14,2024-01-14 09:00:51,S028,C004431,Cash,65.85,3.29,2,gen_20251127_091605,transactions_header.csv
T00008380,10/24/24,2024-10-24 13:43:38,S004,,Cash,67.52,0.0,2,gen_20251127_091606,transactions_header.csv
T00017826,2024-01-06,2024-01-06 04:33:45,S009,C003700,Cash,27.18,4.08,1,gen_20251127_091607,transactions_header.csv
T00013856,2024-04-12,2024-04-12 17:19:11,S006,C001704,Card,7.49,1.12,2,gen_20251127_091607,transactions_header.csv
T00002027,2024-06-14,2024-06-14 11:24:12,S003,C002572,Online,38.87,3.89,1,gen_20251127_091605,transactions_header.csv
T00003895,08/10/24,2024-08-10 18:03:53,S008,NA,online,58.93,5.89,2,gen_20251127_091606,transactions_header.csv
T00013915,2024-04-20,2024-04-20 06:37:13,S023,C003976,Card,76.57,7.66,3,gen_20251127_091607,transactions_header.csv
T00002784,10/20/24,2024-10-20 10:00:39,S025,C004598,Cash,27.71,1.39,2,gen_20251127_091605,transactions_header.csv
T00013403,2024-10-21,2024-10-21 13:25:20,S003,C001113,Card,55.43,8.31,1,gen_20251127_091607,transactions_header.csv
T00018367,2024-11-15,2024-11-15 05:35:18,S018,C000228,Card,44.56,2.23,5,gen_20251127_091607,transactions_header.csv
T00013144,08/10/24,2024-08-10 04:07:25,S029,C003777,Cash,60.83,6.08,1,gen_20251127_091607,transactions_header.csv
T00007792,2024-09-12,2024-09-12 09:34:16,S014,C000919,Card,58.69,0.0,1,gen_20251127_091606,transactions_header.csv
T00013174,2024-12-02,2024-12-02 15:56:08,S009,C004012,Online,98.34,9.83,1,gen_20251127_091607,transactions_header.csv
T00019369,05/09/24,2024-05-09 10:04:23,S016,C001676,Card,31.07,3.11,2,gen_20251127_091607,transactions_header.csv
T00014579,06/17/24,2024-06-17 15:31:13,S002,C001476,Cash,$38.32,5.75,1,gen_20251127_091607,transactions_header.csv
T00017068,02/07/24,2024-02-07 04:06:15,S028,C003886,Cash,36.45,3.65,5,gen_20251127_091607,transactions_header.csv
T00014692,02/26/24,2024-02-26 07:27:09,S016,C004580,Cash,47.01,2.35,3,gen_20251127_091607,transactions_header.csv
T00007021,01/20/24,2024-01-20 18:53:05,S020,C002510,Online,19.93,1.99,1,gen_20251127_091606,transactions_header.csv
T00002936,2024-06-22,2024-06-22 02:37:21,S029,C001334,Cash,13.81,0.0,2,gen_20251127_091606,transactions_header.csv
T00016706,12/17/24,2024-12-17 16:40:00,S002,C001018,Cash,95.51,0.0,2,gen_20251127_091607,transactions_header.csv
T00017872,2024-08-20,2024-08-20 18:38:01,S003,C001381,Online,22.0,1.1,2,gen_20251127_091607,transactions_header.csv
T00014002,05/15/24,2024-05-15 11:01:08,S006,C000739,Cash,52.56,7.88,2,gen_20251127_091607,transactions_header.csv
T00001536,2024-05-10,2024-05-10 15:25:47,S019,C002138,Online,103.88,5.19,5,gen_20251127_091605,transactions_header.csv
T00004405,08/23/24,2024-08-23 10:12:52,S014,C003483,Cash,$50.06,0.0,1,gen_20251127_091606,transactions_header.csv
T00005113,11/19/24,2024-11-19 23:11:15,S004,C003482,Cash,33.74,3.37,2,gen_20251127_091606,transactions_header.csv
T00019324,2024-10-20,2024-10-20 12:39:34,S008,C002524,Card,-45.01,6.75,3,gen_20251127_091607,transactions_header.csv
T00015048,2024-01-29,2024-01-29 12:41:29,S007,C001810,Card,67.65,3.38,1,gen_20251127_091607,transactions_header.csv
T00014948,2024-01-05,2024-01-05 00:31:11,S030,C003945,Cash,86.66,13.0,1,gen_20251127_091607,transactions_header.csv
T00012573,2024-12-02,2024-12-02 12:49:20,S015,C004324,Cash,7.28,0.73,8,gen_20251127_091607,transactions_header.csv
T00019552,01/26/24,2024-01-26 04:51:09,S002,C003485,Online,65.09,9.76,3,gen_20251127_091607,transactions_header.csv
T00017148,06/01/24,2024-06-01 22:01:51,S029,C004612,Online,0,0,3,gen_20251127_091607,transactions_header.csv
T00012830,08/03/24,2024-08-03 10:48:37,S018,NA,Card,31.25,0.0,3,gen_20251127_091607,transactions_header.csv
T00011660,04/01/24,2024-04-01 20:29:45,S016,C001585,Card,42.83,2.14,1,gen_20251127_091607,transactions_header.csv
T00009413,01/14/24,2024-01-14 21:38:53,S026,C002012,Card,$121.40,12.14,1,gen_20251127_091606,transactions_header.csv
T00009840,2024-03-12,2024-03-12 10:30:51,S029,C003208,Cash,32.6,4.89,1,gen_20251127_091606,transactions_header.csv
T00017975,2024-05-31,2024-05-31 12:37:30,S001,C003802,Online,76.23,3.81,2,gen_20251127_091607,transactions_header.csv
T00000475,2024-02-04,2024-02-04 11:28:27,S001,C004277,Cash,45.41,4.54,1,gen_20251127_091605,transactions_header.csv
T00015926,07/01/24,2024-07-01 03:54:27,S023,C003028,Online,49.55,2.48,2,gen_20251127_091607,transactions_header.csv
T00008150,2024-02-02,2024-02-02 00:38:10,S008,C002494,Card,35.16,1.76,1,gen_20251127_091606,transactions_header.csv
T00003129,01/04/24,2024-01-04 15:41:05,S024,C000349,Cash,49.25,2.46,1,gen_20251127_091606,transactions_header.csv
T00010993,2024-05-20,2024-05-20 23:53:16,S007,C002844,Cash,112.65,0.0,1,gen_20251127_091606,transactions_header.csv
T00017911,2024-07-04,2024-07-04 01:40:02,S005,C003585,Card,5.92,0.3,1,gen_20251127_091607,transactions_header.csv
T00002190,2024-12-26,2024-12-26 16:48:41,S027,NA,Cash,71.48,7.15,1,gen_20251127_091605,transactions_header.csv
T00015343,2024-11-01,2024-11-01 13:38:53,S005,C003349,Cash,50.15,0.0,4,gen_20251127_091607,transactions_header.csv
T00012478,2024-10-05,2024-10-05 01:32:48,S025,C002168,Card,49.36,NA,1,gen_20251127_091607,transactions_header.csv
T00006088,07/16/24,2024-07-16 21:58:00,S029,C003608,Online,1.98,0.0,1,gen_20251127_091606,transactions_header.csv
T00004672,01/18/24,2024-01-18 13:48:30,S018,C001116,Card,81.83,,1,gen_20251127_091606,transactions_header.csv
T00017512,2024-02-02,2024-02-02 19:26:33,S004,C001722,Cash,31.5,3.15,2,gen_20251127_091607,transactions_header.csv
T00009977,2024-12-21,2024-12-21 00:06:53,S013,C003194,Cash,0,0,2,gen_20251127_091606,transactions_header.csv
T00012310,07/21/24,2024-07-21 05:27:37,S003,C001238,Card,0,,2,gen_20251127_091607,transactions_header.csv
T00004046,2024-10-13,2024-10-13 23:38:37,S014,C001033,Online,69.8,6.98,1,gen_20251127_091606,transactions_header.csv
T00007752,2024-07-05,2024-07-05 22:50:51,S030,C000212,Online,71.44,7.14,2,gen_20251127_091606,transactions_header.csv
T00003435,2024-11-16,2024-11-16 15:24:55,S029,C000575,Online,67.84,0.0,1,gen_20251127_091606,transactions_header.csv
T00000719,01/07/24,2024-01-07 14:37:59,S009,,Online,88.68,13.3,1,gen_20251127_091605,transactions_header.csv
T00013992,04/04/24,2024-04-04 02:39:27,S010,C000140,Card,40.56,2.03,1,gen_20251127_091607,transactions_header.csv
T00016268,06/13/24,2024-06-13 21:16:51,S006,C003099,Online,57.02,2.85,1,gen_20251127_091607,transactions_header.csv
T00019084,12/18/24,2024-12-18 06:14:42,S020,C000246,Card,59.13,0.0,1,gen_20251127_091607,transactions_header.csv
T00015319,2024-04-04,2024-04-04 00:30:38,S009,C002623,Cash,53.94,2.7,2,gen_20251127_091607,transactions_header.csv
T00004773,2024-04-25,2024-04-25 14:30:42,S002,C001206,Online,58.22,5.82,1,gen_20251127_091606,transactions_header.csv
T00000857,01/21/24,2024-01-21 15:40:40,S019,,Online,81.61,0.0,3,gen_20251127_091605,transactions_header.csv
T00018635,10/07/24,2024-10-07 19:04:49,S020,C003179,Online,97.01,4.85,1,gen_20251127_091607,transactions_header.csv
T00011845,06/26/24,2024-06-26 09:09:19,S020,C003305,Online,29.73,2.97,3,gen_20251127_091607,transactions_header.csv
T00004389,12/26/24,2024-12-26 10:21:12,S028,C003479,Cash,61.5,9.22,1,gen_20251127_091606,transactions_header.csv
T00005358,06/06/24,2024-06-06 13:48:19,S001,C001181,Card,96.74,0.0,1,gen_20251127_091606,transactions_header.csv
T00012180,2024-05-29,2024-05-29 17:07:15,S011,C001210,Online,117.36,17.6,2,gen_20251127_091607,transactions_header.csv
T00019785,10/29/24,2024-10-29 04:33:05,S023,C000079,Card,16.81,2.52,2,gen_20251127_091607,transactions_header.csv
T00012750,2024-03-19,2024-03-19 15:46:43,S023,C001325,Online,21.86,,2,gen_20251127_091607,transactions_header.csv
T00014119,2024-08-13,2024-08-13 18:14:09,S003,C002540,Cash,$56.11,2.81,2,gen_20251127_091607,transactions_header.csv
T00019001,2024-07-19,2024-07-19 20:37:37,S005,C003491,Card,0,0,2,gen_20251127_091607,transactions_header.csv
T00012643,06/28/24,2024-06-28 10:05:20,S006,C003391,card,33.58,3.36,1,gen_20251127_091607,transactions_header.csv
T00009665,2024-08-31,2024-08-31 07:14:44,S011,C000750,Online,69.48,3.47,1,gen_20251127_091606,transactions_header.csv
T00012326,2024-11-17,2024-11-17 08:13:45,S029,C004880,Online,58.41,8.76,1,gen_20251127_091607,transactions_header.csv
T00002335,03/14/24,2024-03-14 00:52:20,S026,C002464,Card,67.77,10.17,2,gen_20251127_091605,transactions_header.csv
T00017194,04/01/24,2024-04-01 03:27:47,S024,C001891,Cash,42.56,0.0,1,gen_20251127_091607,transactions_header.csv
T00012048,2024-04-05,2024-04-05 05:19:01,S016,,Online,41.62,2.08,1,gen_20251127_091607,transactions_header.csv
T00002178,01/13/24,2024-01-13 01:48:45,S003,C000813,Online,62.53,9.38,1,gen_20251127_091605,transactions_header.csv
T00014177,12/31/24,2024-12-31 23:29:43,S006,C004286,Card,3.01,0.45,1,gen_20251127_091607,transactions_header.csv
T00011430,2024-10-28,2024-10-28 07:55:56,S002,C003022,Card,$30.14,4.52,1,gen_20251127_091606,transactions_header.csv
T00014241,2024-03-30,2024-03-30 00:31:06,S028,C003795,Cash,81.08,8.11,2,gen_20251127_091607,transactions_header.csv
T00016380,09/27/24,2024-09-27 00:32:51,S018,C001188,Online,42.91,2.15,1,gen_20251127_091607,transactions_header.csv
T00010647,01/10/24,2024-01-10 19:45:58,S002,C000368,Cash,0,0.0,3,gen_20251127_091606,transactions_header.csv
T00006915,2024-09-04,2024-09-04 00:56:16,S006,C004996,Card,26.92,1.35,5,gen_20251127_091606,transactions_header.csv
T00011783,05/27/24,2024-05-27 01:25:55,S018,C000844,Card,80.78,12.12,1,gen_20251127_091607,transactions_header.csv
T00007933,2024-05-01,2024-05-01 05:35:38,S027,C004304,card,$0.00,0.0,2,gen_20251127_091606,transactions_header.csv
T00001511,09/18/24,2024-09-18 03:53:10,S001,C003552,Card,68.88,10.33,2,gen_20251127_091605,transactions_header.csv
T00004872,2024-07-14,2024-07-14 08:26:16,S020,C003784,Cash,20.15,,1,gen_20251127_091606,transactions_header.csv
T00016161,06/03/24,2024-06-03 15:40:50,S013,,Online,30.33,0.0,3,gen_20251127_091607,transactions_header.csv
T00004038,09/04/24,2024-09-04 16:40:15,S017,C002647,Online,30.78,3.08,4,gen_20251127_091606,transactions_header.csv
T00007959,12/10/24,2024-12-10 20:46:04,S015,,card,71.94,0.0,1,gen_20251127_091606,transactions_header.csv
T00008404,2024-03-16,2024-03-16 16:52:49,S021,C000872,Card,75.71,11.36,2,gen_20251127_091606,transactions_header.csv
T00000386,01/16/24,2024-01-16 07:56:30,S008,C002354,Cash,4.74,0.0,1,gen_20251127_091605,transactions_header.csv
T00006479,2024-06-29,2024-06-29 17:48:26,S016,C003944,Card,$84.78,,7,gen_20251127_091606,transactions_header.csv
T00002066,2024-10-09,2024-10-09 16:12:06,S028,C001323,Card,73.73,,5,gen_20251127_091605,transactions_header.csv
T00016594,09/05/24,2024-09-05 11:59:02,S028,C003471,Cash,95.9,9.59,1,gen_20251127_091607,transactions_header.csv
T00009562,01/30/24,2024-01-30 15:51:16,S023,C003487,Cash,72.99,10.95,1,gen_20251127_091606,transactions_header.csv
T00018373,2024-09-05,2024-09-05 11:41:33,S027,C001767,Online,75.98,0.0,1,gen_20251127_091607,transactions_header.csv
T00007772,2024-12-28,2024-12-28 08:09:41,S025,C004045,Cash,83.63,12.54,1,gen_20251127_091606,transactions_header.csv
T00011499,05/28/24,2024-05-28 02:33:16,S007,C000472,Card,76.19,11.43,1,gen_20251127_091606,transactions_header.csv
T00002239,07/06/24,2024-07-06 02:18:05,S005,C003813,Cash,103.03,NA,2,gen_20251127_091605,transactions_header.csv
T00011344,2024-12-19,2024-12-19 04:34:31,S025,C004362,Online,73.66,0.0,1,gen_20251127_091606,transactions_header.csv
T00019548,2024-09-02,2024-09-02 20:17:06,S017,,Online,35.59,5.34,2,gen_20251127_091607,transactions_header.csv
T00012420,05/01/24,2024-05-01 02:43:18,S025,C002159,Online,32.08,4.81,4,gen_20251127_091607,transactions_header.csv
T00005246,02/04/24,2024-02-04 17:20:49,S014,C003886,Card,87.25,13.09,1,gen_20251127_091606,transactions_header.csv
T00004756,2024-01-06,2024-01-06 11:46:50,S007,C001883,Cash,71.81,7.18,3,gen_20251127_091606,transactions_header.csv
T00018773,2024-12-30,2024-12-30 11:29:15,S028,C004866,Cash,0,0.0,3,gen_20251127_091607,transactions_header.csv
T00005072,2024-10-03,2024-10-03 09:22:10,S006,C003932,Cash,45.87,0.0,1,gen_20251127_091606,transactions_header.csv
T00013759,2024-03-27,2024-03-27 06:52:11,S006,C001435,Card,11.85,1.19,1,gen_20251127_091607,transactions_header.csv
T00012810,12/21/24,2024-12-21 21:32:48,S016,C000264,Online,51.83,0.0,1,gen_20251127_091607,transactions_header.csv
T00018505,2024-10-05,2024-10-05 04:35:46,S010,C000578,Online,125.7,18.86,3,gen_20251127_091607,transactions_header.csv
T00007317,09/17/24,2024-09-17 04:56:42,S013,C002249,Card,81.73,0.0,3,gen_20251127_091606,transactions_header.csv
T00000981,2024-12-16,2024-12-16 13:50:25,S009,C001407,Card,20.44,0.0,1,gen_20251127_091605,transactions_header.csv
T00005116,2024-01-02,2024-01-02 09:25:36,S010,C000772,Online,33.22,0.0,2,gen_20251127_091606,transactions_header.csv
T00007553,2024-10-13,2024-10-13 07:04:12,S024,C004090,Cash,52.43,0.0,1,gen_20251127_091606,transactions_header.csv
T00016223,08/02/24,2024-08-02 12:17:48,S003,,Online,0,0.0,5,gen_20251127_091607,transactions_header.csv
T00007113,05/03/24,2024-05-03 05:48:01,S014,,Online,27.54,1.38,1,gen_20251127_091606,transactions_header.csv
T00015705,2024-02-03,2024-02-03 01:23:12,S019,C003184,Cash,56.99,,1,gen_20251127_091607,transactions_header.csv
T00015950,04/08/24,2024-04-08 17:42:42,S018,,Card,$68.98,6.9,2,gen_20251127_091607,transactions_header.csv
T00012089,06/05/24,2024-06-05 19:10:56,S007,C003860,Card,34.84,3.48,1,gen_20251127_091607,transactions_header.csv
T00019775,04/20/24,2024-04-20 23:50:35,S017,C001087,Cash,18.38,,4,gen_20251127_091607,transactions_header.csv
T00017226,06/23/24,2024-06-23 08:11:12,S015,C001241,Online,1.28,0.19,2,gen_20251127_091607,transactions_header.csv
T00009704,2024-03-23,2024-03-23 02:27:29,S023,C003613,Cash,100.28,15.04,1,gen_20251127_091606,transactions_header.csv
T00015990,2024-10-05,2024-10-05 14:38:10,S015,C001416,Online,16.4,0.82,1,gen_20251127_091607,transactions_header.csv
T00002685,02/16/24,2024-02-16 06:22:37,S009,C001862,Card,29.22,2.92,7,gen_20251127_091605,transactions_header.csv
T00018193,2024-09-20,2024-09-20 09:52:20,S018,C002601,Cash,50.12,2.51,1,gen_20251127_091607,transactions_header.csv
T00007067,2024-05-26,2024-05-26 08:20:20,S009,C003859,Card,25.48,1.27,6,gen_20251127_091606,transactions_header.csv
T00005860,04/15/24,2024-04-15 14:58:13,S020,C002228,Cash,11.87,0.59,1,gen_20251127_091606,transactions_header.csv
T00006848,2024-07-23,2024-07-23 01:26:27,S007,,Cash,0,NA,5,gen_20251127_091606,transactions_header.csv
T00004848,2024-06-04,2024-06-04 09:39:45,S011,C004669,Online,71.61,NA,7,gen_20251127_091606,transactions_header.csv
T00012833,2024-01-07,2024-01-07 14:37:11,S004,,Cash,20.32,2.03,5,gen_20251127_091607,transactions_header.csv
T00018860,2024-06-07,2024-06-07 03:17:35,S029,C004185,Online,63.88,3.19,4,gen_20251127_091607,transactions_header.csv
T00002905,09/29/24,2024-09-29 01:46:10,S004,C003105,card,33.57,3.36,1,gen_20251127_091606,transactions_header.csv
T00019869,06/15/24,2024-06-15 22:29:09,S002,C002506,Cash,-59.4,5.94,2,gen_20251127_091607,transactions_header.csv
T00005425,2024-06-02,2024-06-02 17:40:05,S010,C003247,Cash,104.0,15.6,2,gen_20251127_091606,transactions_header.csv
T00013464,08/08/24,2024-08-08 07:31:37,S030,,Online,62.67,9.4,1,gen_20251127_091607,transactions_header.csv
T00003980,06/07/24,2024-06-07 21:14:16,S022,C004111,Online,25.09,NA,7,gen_20251127_091606,transactions_header.csv
T00004975,2024-09-30,2024-09-30 08:31:56,S018,C003137,Card,53.2,2.66,3,gen_20251127_091606,transactions_header.csv
T00006403,2024-11-10,2024-11-10 00:34:37,S018,,Cash,15.84,0.0,1,gen_20251127_091606,transactions_header.csv
T00018173,12/08/24,2024-12-08 04:17:28,S030,C003190,Cash,13.92,1.39,1,gen_20251127_091607,transactions_header.csv
T00002606,06/23/24,2024-06-23 14:57:05,S006,C004278,Card,116.29,NA,2,gen_20251127_091605,transactions_header.csv
T00007696,02/24/24,2024-02-24 03:44:11,S009,C000229,Online,30.96,0.0,1,gen_20251127_091606,transactions_header.csv
T00006498,02/21/24,2024-02-21 17:53:18,S026,C000221,Card,73.69,7.37,1,gen_20251127_091606,transactions_header.csv
T00014081,09/22/24,2024-09-22 11:45:29,S028,C004080,Card,44.63,4.46,1,gen_20251127_091607,transactions_header.csv
T00019278,2024-06-19,2024-06-19 02:52:49,S028,C000841,Card,$74.85,11.23,6,gen_20251127_091607,transactions_header.csv
T00015063,01/07/24,2024-01-07 18:19:54,S003,C003260,Cash,0,0.0,1,gen_20251127_091607,transactions_header.csv
T00008157,2024-06-21,2024-06-21 03:08:58,S011,C004855,Cash,30.94,3.09,2,gen_20251127_091606,transactions_header.csv
T00018069,04/23/24,2024-04-23 07:04:46,S010,C003089,Card,$77.67,7.77,1,gen_20251127_091607,transactions_header.csv
T00003770,06/10/24,2024-06-10 20:50:43,S013,C003182,Online,79.44,3.97,1,gen_20251127_091606,transactions_header.csv
T00012690,10/03/24,2024-10-03 07:42:41,S019,C000140,Cash,49.06,NA,2,gen_20251127_091607,transactions_header.csv
T00009368,2024-10-05,2024-10-05 15:04:04,S015,C004410,online,51.92,7.79,1,gen_20251127_091606,transactions_header.csv
T00001403,08/05/24,2024-08-05 20:11:59,S024,C000841,Online,24.88,NA,1,gen_20251127_091605,transactions_header.csv
T00005360,2024-11-14,2024-11-14 15:09:58,S017,C004889,Online,43.36,4.34,1,gen_20251127_091606,transactions_header.csv
T00015263,2024-01-20,2024-01-20 00:58:41,S027,,Card,55.82,8.37,1,gen_20251127_091607,transactions_header.csv
T00002215,2024-08-17,2024-08-17 08:00:59,S008,C004849,Cash,0,0,3,gen_20251127_091605,transactions_header.csv
T00012095,2024-10-27,2024-10-27 23:58:49,S009,C002327,Online,$80.00,8.0,3,gen_20251127_091607,transactions_header.csv
T00015187,07/06/24,2024-07-06 04:03:10,S001,C000429,Cash,80.57,0.0,3,gen_20251127_091607,transactions_header.csv
T00011669,10/12/24,2024-10-12 10:09:56,S002,,online,31.82,3.18,3,gen_20251127_091607,transactions_header.csv
T00009412,2024-03-06,2024-03-06 10:48:13,S001,C003566,Card,88.17,4.41,3,gen_20251127_091606,transactions_header.csv
T00004129,11/10/24,2024-11-10 08:24:02,S017,C003020,Card,65.39,9.81,1,gen_20251127_091606,transactions_header.csv
T00004187,2024-02-22,2024-02-22 12:17:32,S009,C004605,Online,42.21,0.0,2,gen_20251127_091606,transactions_header.csv
T00011454,05/22/24,2024-05-22 03:00:12,S001,C001303,Cash,27.87,2.79,1,gen_20251127_091606,transactions_header.csv
T00013882,2024-01-03,2024-01-03 18:41:16,S028,C000661,cash,97.68,4.88,2,gen_20251127_091607,transactions_header.csv
T00006424,09/07/24,2024-09-07 17:16:19,S004,C003318,Online,83.54,8.35,2,gen_20251127_091606,transactions_header.csv
T00017702,2024-07-19,2024-07-19 16:45:39,S022,C004320,online,104.88,10.49,1,gen_20251127_091607,transactions_header.csv
T00007780,2024-07-17,2024-07-17 04:05:08,S005,C003444,Cash,48.98,4.9,4,gen_20251127_091606,transactions_header.csv
T00015197,2024-08-07,2024-08-07 15:45:11,S022,C000378,Online,22.36,0.0,4,gen_20251127_091607,transactions_header.csv
T00003422,01/10/24,2024-01-10 15:52:39,S001,C001387,Card,46.88,7.03,6,gen_20251127_091606,transactions_header.csv
T00002648,06/05/24,2024-06-05 12:32:41,S007,C002791,Cash,0,0.0,1,gen_20251127_091605,transactions_header.csv
T00008378,2024-02-02,2024-02-02 18:23:42,S001,C001620,Card,27.98,4.2,2,gen_20251127_091606,transactions_header.csv
T00006847,09/08/24,2024-09-08 23:20:38,S025,C004773,Cash,76.75,NA,1,gen_20251127_091606,transactions_header.csv
T00012778,2024-02-01,2024-02-01 18:52:02,S020,C002046,Cash,62.05,9.31,2,gen_20251127_091607,transactions_header.csv
T00017137,10/31/24,2024-10-31 14:20:25,S013,C000464,Card,11.58,1.74,5,gen_20251127_091607,transactions_header.csv
T00019814,2024-10-09,2024-10-09 03:01:03,S015,C002896,Online,86.92,0.0,4,gen_20251127_091607,transactions_header.csv
T00002409,11/25/24,2024-11-25 23:38:08,S026,C004685,Cash,29.85,1.49,1,gen_20251127_091605,transactions_header.csv
T00001731,2024-10-26,2024-10-26 07:28:20,S022,NA,Online,66.31,6.63,2,gen_20251127_091605,transactions_header.csv
T00009173,2024-01-17,2024-01-17 17:23:08,S004,C001552,Online,-39.15,1.96,1,gen_20251127_091606,transactions_header.csv
T00004903,10/09/24,2024-10-09 15:01:59,S004,C001640,Cash,50.55,7.58,2,gen_20251127_091606,transactions_header.csv
T00007048,12/30/24,2024-12-30 15:42:55,S003,NA,Card,46.36,6.95,1,gen_20251127_091606,transactions_header.csv
T00001078,2024-10-21,2024-10-21 20:07:54,S010,C004042,Cash,72.28,7.23,3,gen_20251127_091605,transactions_header.csv
T00016700,09/21/24,2024-09-21 17:00:11,S023,C004191,Online,40.1,2.01,1,gen_20251127_091607,transactions_header.csv
T00013479,2024-03-19,2024-03-19 11:23:35,S018,C004706,Cash,97.47,9.75,1,gen_20251127_091607,transactions_header.csv
T00004394,2024-04-14,2024-04-14 07:04:38,S018,C004113,Cash,96.56,4.83,2,gen_20251127_091606,transactions_header.csv
T00005218,12/07/24,2024-12-07 09:34:37,S014,C003031,Cash,0,0.0,2,gen_20251127_091606,transactions_header.csv
T00005382,2024-06-04,2024-06-04 21:27:48,S019,C004893,Online,36.72,5.51,1,gen_20251127_091606,transactions_header.csv
T00018647,2024-10-08,2024-10-08 21:13:30,S019,C000424,Cash,$79.43,11.91,2,gen_20251127_091607,transactions_header.csv
T00017461,2024-08-27,2024-08-27 02:06:09,S011,C002456,Cash,51.27,7.69,1,gen_20251127_091607,transactions_header.csv
T00016761,05/31/24,2024-05-31 23:25:02,S013,NA,Card,88.9,13.34,1,gen_20251127_091607,transactions_header.csv
T00000181,2024-04-30,2024-04-30 06:34:01,S030,C003456,Cash,67.77,NA,5,gen_20251127_091605,transactions_header.csv
T00011880,03/10/24,2024-03-10 01:04:55,S013,C003942,Card,55.2,2.76,2,gen_20251127_091607,transactions_header.csv
T00016805,03/30/24,2024-03-30 02:29:35,S024,C002413,Card,119.69,0.0,1,gen_20251127_091607,transactions_header.csv
T00013244,2024-12-21,2024-12-21 07:36:10,S007,C001709,Card,68.13,0.0,1,gen_20251127_091607,transactions_header.csv
T00014746,07/27/24,2024-07-27 16:07:04,S022,C003951,Cash,45.69,,1,gen_20251127_091607,transactions_header.csv
T00004069,03/28/24,2024-03-28 20:07:04,S006,C000453,Online,18.67,1.87,1,gen_20251127_091606,transactions_header.csv
T00014118,2024-05-26,2024-05-26 22:41:05,S021,C002026,Cash,38.51,,2,gen_20251127_091607,transactions_header.csv
T00005275,12/12/24,2024-12-12 14:50:59,S001,C001825,Cash,46.95,,1,gen_20251127_091606,transactions_header.csv
T00001203,2024-09-24,2024-09-24 08:49:18,S002,C000245,Card,66.29,6.63,5,gen_20251127_091605,transactions_header.csv
T00003352,12/14/24,2024-12-14 19:16:11,S002,C003375,Card,37.75,0.0,2,gen_20251127_091606,transactions_header.csv
T00008212,01/25/24,2024-01-25 13:40:05,S015,,Card,79.52,0.0,1,gen_20251127_091606,transactions_header.csv
T00008774,02/13/24,2024-02-13 00:25:58,S025,C004520,Cash,59.9,0.0,2,gen_20251127_091606,transactions_header.csv
T00015013,2024-04-22,2024-04-22 20:38:25,S027,,card,96.85,,1,gen_20251127_091607,transactions_header.csv
T00002301,2024-06-05,2024-06-05 21:41:42,S022,C003520,Online,6.63,0.0,1,gen_20251127_091605,transactions_header.csv
T00013383,09/18/24,2024-09-18 12:15:35,S002,C001356,Online,5.93,0.3,2,gen_20251127_091607,transactions_header.csv
T00017909,2024-10-20,2024-10-20 20:37:08,S017,C002066,Online,75.57,11.34,1,gen_20251127_091607,transactions_header.csv
T00014844,2024-12-10,2024-12-10 13:21:10,S005,NA,Online,79.83,0.0,2,gen_20251127_091607,transactions_header.csv
T00015215,2024-11-11,2024-11-11 13:29:52,S026,C002264,Card,53.41,5.34,2,gen_20251127_091607,transactions_header.csv
T00009624,01/10/24,2024-01-10 16:41:21,S024,C001200,Cash,5.97,0.9,1,gen_20251127_091606,transactions_header.csv
T00006021,03/12/24,2024-03-12 08:24:19,S017,,Online,66.67,10.0,1,gen_20251127_091606,transactions_header.csv
T00013372,08/18/24,2024-08-18 04:20:24,S015,C004655,Card,67.01,6.7,2,gen_20251127_091607,transactions_header.csv
T00011021,2024-08-17,2024-08-17 18:59:14,S002,C001439,Card,63.59,0.0,6,gen_20251127_091606,transactions_header.csv
T00004171,10/07/24,2024-10-07 21:34:24,S010,C003190,Cash,38.33,1.92,2,gen_20251127_091606,transactions_header.csv
T00017731,2024-05-13,2024-05-13 02:57:52,S013,,Cash,71.71,3.59,1,gen_20251127_091607,transactions_header.csv
T00015619,01/12/24,2024-01-12 12:55:13,S002,C002376,Online,61.79,6.18,1,gen_20251127_091607,transactions_header.csv
T00017005,2024-07-30,2024-07-30 13:54:00,S011,C002988,Cash,$84.68,8.47,2,gen_20251127_091607,transactions_header.csv
T00001963,05/31/24,2024-05-31 11:20:49,S007,C004858,Card,23.27,0.0,1,gen_20251127_091605,transactions_header.csv
T00001806,2024-08-05,2024-08-05 01:21:40,S030,C003890,Online,32.44,4.87,1,gen_20251127_091605,transactions_header.csv
T00013198,2024-04-09,2024-04-09 21:19:13,S024,C002930,Online,37.88,3.79,3,gen_20251127_091607,transactions_header.csv
T00009348,2024-04-02,2024-04-02 09:13:41,S014,C002422,Cash,74.97,3.75,1,gen_20251127_091606,transactions_header.csv
T00007655,01/28/24,2024-01-28 15:45:36,S020,C004377,Online,74.89,3.74,1,gen_20251127_091606,transactions_header.csv
T00005848,09/01/24,2024-09-01 05:52:32,S010,C000038,Card,84.12,12.62,1,gen_20251127_091606,transactions_header.csv
T00006046,2024-11-05,2024-11-05 20:17:36,S001,C002756,Cash,38.19,0.0,1,gen_20251127_091606,transactions_header.csv
T00015713,2024-12-28,2024-12-28 17:12:41,S002,C001521,Online,41.4,2.07,1,gen_20251127_091607,transactions_header.csv
T00016967,2024-01-26,2024-01-26 10:29:01,S002,C004028,Card,62.44,3.12,2,gen_20251127_091607,transactions_header.csv
T00000504,2024-07-05,2024-07-05 04:53:16,S015,C003144,Online,101.38,5.07,1,gen_20251127_091605,transactions_header.csv
T00012277,2024-06-11,2024-06-11 09:23:39,S011,C001055,Cash,$82.99,0.0,2,gen_20251127_091607,transactions_header.csv
T00002445,2024-06-27,2024-06-27 14:47:30,S004,C000056,Online,65.3,6.53,1,gen_20251127_091605,transactions_header.csv
T00003499,2024-08-04,2024-08-04 09:20:20,S010,C004535,Cash,51.93,2.6,3,gen_20251127_091606,transactions_header.csv
T00006267,05/11/24,2024-05-11 11:12:29,S007,C003425,Card,74.68,3.73,7,gen_20251127_091606,transactions_header.csv
T00016955,11/28/24,2024-11-28 21:45:40,S019,C003753,Online,82.7,4.14,1,gen_20251127_091607,transactions_header.csv
T00006393,2024-12-12,2024-12-12 09:03:29,S010,C004721,Online,44.61,2.23,2,gen_20251127_091606,transactions_header.csv
T00012426,2024-03-21,2024-03-21 07:59:39,S030,C001066,Cash,97.83,14.67,1,gen_20251127_091607,transactions_header.csv
T00001028,02/19/24,2024-02-19 06:09:57,S021,C002355,Cash,35.1,1.76,1,gen_20251127_091605,transactions_header.csv
T00013515,07/22/24,2024-07-22 23:38:42,S009,C000410,Online,53.33,8.0,1,gen_20251127_091607,transactions_header.csv
T00009573,12/30/24,2024-12-30 13:13:17,S013,C000265,Online,-36.12,NA,5,gen_20251127_091606,transactions_header.csv
T00015783,08/23/24,2024-08-23 10:16:07,S014,C004897,Online,$29.46,4.42,3,gen_20251127_091607,transactions_header.csv
T00005565,09/19/24,2024-09-19 05:22:28,S013,,Cash,33.21,3.32,2,gen_20251127_091606,transactions_header.csv
T00006024,2024-03-23,2024-03-23 14:18:42,S023,C002957,Cash,72.26,,1,gen_20251127_091606,transactions_header.csv
T00004983,04/23/24,2024-04-23 19:02:00,S019,C004966,Cash,20.13,3.02,2,gen_20251127_091606,transactions_header.csv
T00006545,2024-09-11,2024-09-11 23:02:03,S012,C003295,Cash,87.76,13.16,3,gen_20251127_091606,transactions_header.csv
T00003324,07/29/24,2024-07-29 07:17:52,S027,C000498,Card,48.86,2.44,2,gen_20251127_091606,transactions_header.csv
T00011042,2024-01-19,2024-01-19 22:27:38,S003,NA,Cash,44.34,2.22,1,gen_20251127_091606,transactions_header.csv
T00009852,2024-03-28,2024-03-28 22:12:10,S030,C004775,Card,29.08,1.45,2,gen_20251127_091606,transactions_header.csv
T00013710,06/29/24,2024-06-29 11:50:47,S028,C003987,Card,92.41,,4,gen_20251127_091607,transactions_header.csv
T00017094,2024-03-17,2024-03-17 20:11:19,S018,C004991,online,29.95,0.0,3,gen_20251127_091607,transactions_header.csv
T00014024,2024-11-26,2024-11-26 11:52:25,S003,C004662,Cash,25.86,2.59,5,gen_20251127_091607,transactions_header.csv
T00008073,2024-12-31,2024-12-31 21:24:09,S025,C001448,Online,$22.06,0.0,2,gen_20251127_091606,transactions_header.csv
T00003844,12/20/24,2024-12-20 10:42:24,S020,C001057,Card,40.83,2.04,1,gen_20251127_091606,transactions_header.csv
T00004919,2024-12-08,2024-12-08 00:13:49,S003,C001156,Cash,95.88,14.38,1,gen_20251127_091606,transactions_header.csv
T00004085,2024-06-21,2024-06-21 12:23:35,S021,C001207,Cash,58.67,2.93,2,gen_20251127_091606,transactions_header.csv
T00008777,06/29/24,2024-06-29 13:18:48,S023,,Online,43.46,0.0,2,gen_20251127_091606,transactions_header.csv
T00001476,2024-01-31,2024-01-31 05:14:08,S025,C004241,Online,76.16,11.42,1,gen_20251127_091605,transactions_header.csv
T00010034,2024-02-20,2024-02-20 07:04:27,S004,,Card,18.26,0.0,1,gen_20251127_091606,transactions_header.csv
T00016722,03/03/24,2024-03-03 18:42:40,S006,C000957,Card,39.36,0.0,2,gen_20251127_091607,transactions_header.csv
T00010164,2024-10-20,2024-10-20 10:24:12,S023,C003834,Card,59.58,5.96,2,gen_20251127_091606,transactions_header.csv
T00008987,07/18/24,2024-07-18 02:22:58,S016,C002093,Card,0,0.0,3,gen_20251127_091606,transactions_header.csv
T00008704,2024-01-21,2024-01-21 02:31:35,S027,C003020,Cash,0,0.0,1,gen_20251127_091606,transactions_header.csv
T00003972,2024-07-22,2024-07-22 12:22:41,S017,C004195,Cash,45.55,2.28,1,gen_20251127_091606,transactions_header.csv
T00012956,10/26/24,2024-10-26 19:02:48,S011,C004720,online,23.83,1.19,1,gen_20251127_091607,transactions_header.csv
T00011843,2024-07-21,2024-07-21 01:27:15,S004,C000393,Online,99.19,4.96,1,gen_20251127_091607,transactions_header.csv
T00000352,01/15/24,2024-01-15 09:54:08,S022,C004737,Online,19.38,0.0,1,gen_20251127_091605,transactions_header.csv
T00002309,2024-02-09,2024-02-09 08:43:49,S015,C004262,Online,$17.77,0.89,3,gen_20251127_091605,transactions_header.csv
T00001202,2024-07-09,2024-07-09 15:10:40,S019,C003397,card,64.4,6.44,6,gen_20251127_091605,transactions_header.csv
T00002560,2024-05-27,2024-05-27 15:36:45,S022,C004660,Cash,47.84,7.18,2,gen_20251127_091605,transactions_header.csv
T00003169,11/19/24,2024-11-19 20:09:10,S018,C004785,Cash,52.18,5.22,2,gen_20251127_091606,transactions_header.csv
T00017584,2024-07-29,2024-07-29 03:53:08,S005,C001244,Card,86.3,8.63,1,gen_20251127_091607,transactions_header.csv
T00001969,2024-03-18,2024-03-18 17:38:34,S009,C001684,Cash,42.7,NA,1,gen_20251127_091605,transactions_header.csv
T00008318,2024-02-23,2024-02-23 00:25:29,S025,C004743,Cash,77.46,3.87,2,gen_20251127_091606,transactions_header.csv
T00006491,2024-02-16,2024-02-16 15:11:43,S008,C004835,Card,36.81,1.84,1,gen_20251127_091606,transactions_header.csv
T00001523,2024-08-11,2024-08-11 17:54:30,S016,C000829,Online,27.91,4.19,2,gen_20251127_091605,transactions_header.csv
T00018399,2024-07-26,2024-07-26 03:45:44,S016,C000834,Online,58.13,5.81,1,gen_20251127_091607,transactions_header.csv
T00018572,2024-05-22,2024-05-22 20:45:33,S012,C002306,Online,61.55,9.23,7,gen_20251127_091607,transactions_header.csv
T00006410,2024-12-25,2024-12-25 02:35:10,S009,C000911,Online,73.46,NA,6,gen_20251127_091606,transactions_header.csv
T00001713,2024-12-18,2024-12-18 11:53:05,S019,,Card,48.23,NA,1,gen_20251127_091605,transactions_header.csv
T00012797,04/21/24,2024-04-21 00:55:27,S029,C000069,Cash,64.5,9.67,1,gen_20251127_091607,transactions_header.csv
T00016862,2024-02-23,2024-02-23 21:08:02,S004,C000014,Cash,41.16,4.12,1,gen_20251127_091607,transactions_header.csv
T00011276,2024-05-12,2024-05-12 04:18:56,S015,C000268,Cash,77.62,11.64,8,gen_20251127_091606,transactions_header.csv
T00002113,2024-08-05,2024-08-05 00:40:34,S024,C000183,Online,2.07,0.21,1,gen_20251127_091605,transactions_header.csv
T00009162,12/01/24,2024-12-01 00:52:14,S028,C000810,Online,48.61,4.86,5,gen_20251127_091606,transactions_header.csv
T00002761,05/27/24,2024-05-27 06:55:49,S028,C000603,Cash,56.32,2.82,2,gen_20251127_091605,transactions_header.csv
T00017667,2024-01-13,2024-01-13 07:07:00,S018,C002519,Cash,87.06,0.0,1,gen_20251127_091607,transactions_header.csv
T00010625,12/16/24,2024-12-16 15:59:35,S021,C002239,Cash,37.6,1.88,1,gen_20251127_091606,transactions_header.csv
T00007429,08/04/24,2024-08-04 18:30:25,S013,C004160,Cash,54.57,2.73,1,gen_20251127_091606,transactions_header.csv
T00005765,08/20/24,2024-08-20 13:07:58,S017,C003758,Cash,78.63,3.93,1,gen_20251127_091606,transactions_header.csv
T00013703,2024-03-16,2024-03-16 12:14:41,S008,,Card,14.4,0.0,1,gen_20251127_091607,transactions_header.csv
T00009215,2024-06-15,2024-06-15 01:18:27,S026,C000314,Cash,3.39,0.51,1,gen_20251127_091606,transactions_header.csv
T00005383,2024-07-31,2024-07-31 10:38:08,S008,NA,Cash,26.28,1.31,1,gen_20251127_091606,transactions_header.csv
T00013434,2024-02-26,2024-02-26 01:04:52,S023,C002267,Cash,27.84,0.0,1,gen_20251127_091607,transactions_header.csv
T00016733,2024-12-26,2024-12-26 18:08:13,S012,C000349,Cash,$43.01,0.0,2,gen_20251127_091607,transactions_header.csv
T00008461,2024-04-13,2024-04-13 15:55:23,S028,C000509,Cash,$49.74,2.49,5,gen_20251127_091606,transactions_header.csv
T00014298,10/08/24,2024-10-08 19:10:41,S014,C000742,Cash,62.73,9.41,1,gen_20251127_091607,transactions_header.csv
T00012218,07/01/24,2024-07-01 09:34:34,S019,NA,Cash,69.35,10.4,1,gen_20251127_091607,transactions_header.csv
T00016250,2024-06-10,2024-06-10 17:30:07,S012,C003345,Online,$19.38,0.97,1,gen_20251127_091607,transactions_header.csv
T00014315,06/09/24,2024-06-09 12:02:17,S030,C002645,Cash,95.62,0.0,1,gen_20251127_091607,transactions_header.csv
T00004357,2024-12-29,2024-12-29 23:40:37,S008,C000192,Card,27.76,0.0,2,gen_20251127_091606,transactions_header.csv
T00015143,2024-04-19,2024-04-19 08:34:12,S008,C000453,Cash,41.08,2.05,2,gen_20251127_091607,transactions_header.csv
T00013741,06/25/24,2024-06-25 17:00:41,S025,C002207,Cash,49.79,2.49,1,gen_20251127_091607,transactions_header.csv
T00019474,05/13/24,2024-05-13 14:15:10,S024,C003829,Cash,13.26,,2,gen_20251127_091607,transactions_header.csv
T00007730,2024-07-21,2024-07-21 15:46:17,S023,C000055,Online,51.99,5.2,2,gen_20251127_091606,transactions_header.csv
T00015291,07/01/24,2024-07-01 03:53:49,S019,C001186,Online,26.79,4.02,2,gen_20251127_091607,transactions_header.csv
T00004294,01/10/24,2024-01-10 00:30:23,S009,,Online,8.04,0.0,1,gen_20251127_091606,transactions_header.csv
T00007956,2024-09-22,2024-09-22 23:10:24,S004,C002073,Cash,$23.45,2.35,3,gen_20251127_091606,transactions_header.csv
T00011565,08/17/24,2024-08-17 22:25:11,S003,NA,Card,60.94,9.14,2,gen_20251127_091606,transactions_header.csv
T00007440,03/08/24,2024-03-08 04:34:51,S012,NA,Card,92.4,9.24,2,gen_20251127_091606,transactions_header.csv
T00014239,2024-10-01,2024-10-01 20:18:08,S009,C002996,Cash,58.89,5.89,2,gen_20251127_091607,transactions_header.csv
T00001007,2024-01-27,2024-01-27 17:55:03,S028,C003363,Cash,62.81,6.28,1,gen_20251127_091605,transactions_header.csv
T00014340,12/13/24,2024-12-13 07:41:42,S015,C003141,Cash,26.66,1.33,1,gen_20251127_091607,transactions_header.csv
T00002749,11/17/24,2024-11-17 06:39:50,S020,C004068,Cash,54.22,8.13,1,gen_20251127_091605,transactions_header.csv
T00014514,2024-09-17,2024-09-17 07:58:43,S020,C002594,Card,24.38,1.22,1,gen_20251127_091607,transactions_header.csv
T00008710,06/24/24,2024-06-24 09:05:47,S024,C002906,Cash,89.22,4.46,2,gen_20251127_091606,transactions_header.csv
T00004227,2024-12-27,2024-12-27 06:28:08,S019,C003709,Card,29.58,4.44,2,gen_20251127_091606,transactions_header.csv
T00006330,09/05/24,2024-09-05 20:03:53,S013,C001596,Cash,42.34,NA,1,gen_20251127_091606,transactions_header.csv
T00007803,06/19/24,2024-06-19 14:50:57,S001,C001536,Card,50.09,5.01,2,gen_20251127_091606,transactions_header.csv
T00004098,12/05/24,2024-12-05 07:35:28,S005,C001372,Online,36.08,3.61,4,gen_20251127_091606,transactions_header.csv
T00019729,2024-11-12,2024-11-12 19:15:39,S014,C001273,Card,12.78,1.92,2,gen_20251127_091607,transactions_header.csv
T00007431,2024-08-25,2024-08-25 03:55:50,S018,C003840,Cash,43.97,0.0,2,gen_20251127_091606,transactions_header.csv
T00016998,01/03/24,2024-01-03 10:08:13,S004,C001128,Online,$37.81,3.78,1,gen_20251127_091607,transactions_header.csv
T00002268,2024-08-23,2024-08-23 23:37:17,S004,,cash,66.83,0.0,1,gen_20251127_091605,transactions_header.csv
T00018088,2024-07-02,2024-07-02 00:23:16,S010,C000652,Online,63.15,3.16,1,gen_20251127_091607,transactions_header.csv
T00005785,2024-07-19,2024-07-19 23:51:58,S024,C001110,Online,72.63,10.89,1,gen_20251127_091606,transactions_header.csv
T00016599,07/04/24,2024-07-04 16:45:45,S008,C003816,Card,94.01,,1,gen_20251127_091607,transactions_header.csv
T00001605,2024-06-26,2024-06-26 16:19:53,S004,C002044,Online,57.65,0.0,1,gen_20251127_091605,transactions_header.csv
T00002617,2024-01-02,2024-01-02 02:45:57,S029,C002665,Online,74.55,3.73,1,gen_20251127_091605,transactions_header.csv
T00000323,2024-06-10,2024-06-10 21:36:33,S014,C003065,Card,51.04,0.0,1,gen_20251127_091605,transactions_header.csv
T00016018,2024-02-08,2024-02-08 02:29:32,S011,C004676,Online,111.53,5.58,1,gen_20251127_091607,transactions_header.csv
T00004388,04/02/24,2024-04-02 03:29:40,S023,,Cash,8.38,0.0,1,gen_20251127_091606,transactions_header.csv
T00007072,2024-11-20,2024-11-20 09:13:54,S028,C000312,Cash,53.46,0.0,1,gen_20251127_091606,transactions_header.csv
T00001085,05/16/24,2024-05-16 21:22:17,S011,C000362,Card,112.6,0.0,1,gen_20251127_091605,transactions_header.csv
T00015132,07/17/24,2024-07-17 02:54:27,S001,C002197,Online,$56.53,0.0,2,gen_20251127_091607,transactions_header.csv
T00000384,2024-01-23,2024-01-23 11:05:17,S017,NA,Online,56.96,5.7,2,gen_20251127_091605,transactions_header.csv
T00005622,2024-09-26,2024-09-26 23:25:27,S016,C002928,Card,25.2,2.52,1,gen_20251127_091606,transactions_header.csv
T00008511,08/25/24,2024-08-25 20:08:08,S014,C002874,Online,89.99,13.5,1,gen_20251127_091606,transactions_header.csv
T00005212,2024-11-22,2024-11-22 12:06:12,S009,C002104,Cash,45.39,4.54,3,gen_20251127_091606,transactions_header.csv
T00017807,2024-11-30,2024-11-30 22:35:03,S008,C004532,Card,9.41,0.94,2,gen_20251127_091607,transactions_header.csv
T00010534,2024-06-14,2024-06-14 06:36:56,S028,C003752,cash,1.85,0.19,2,gen_20251127_091606,transactions_header.csv
T00007108,2024-10-03,2024-10-03 11:24:13,S024,C000504,Card,50.95,7.64,8,gen_20251127_091606,transactions_header.csv
T00004520,07/29/24,2024-07-29 18:47:50,S005,C000843,Card,66.87,,3,gen_20251127_091606,transactions_header.csv
T00005834,07/02/24,2024-07-02 08:45:47,S017,C002633,Cash,59.27,5.93,2,gen_20251127_091606,transactions_header.csv
T00000937,2024-12-08,2024-12-08 00:53:18,S012,C000460,Card,57.87,0.0,1,gen_20251127_091605,transactions_header.csv
T00012269,2024-02-15,2024-02-15 19:50:50,S014,C004629,Cash,54.1,5.41,1,gen_20251127_091607,transactions_header.csv
T00015394,2024-05-19,2024-05-19 15:16:38,S005,C000445,cash,68.62,6.86,2,gen_20251127_091607,transactions_header.csv
T00006956,08/04/24,2024-08-04 15:37:31,S028,C001162,Online,$32.60,0.0,3,gen_20251127_091606,transactions_header.csv
T00019067,2024-08-22,2024-08-22 00:18:21,S005,C001253,Card,56.21,,1,gen_20251127_091607,transactions_header.csv
T00007577,09/15/24,2024-09-15 11:36:53,S022,,Card,87.22,8.72,1,gen_20251127_091606,transactions_header.csv
T00019920,2024-08-25,2024-08-25 16:13:34,S003,C001549,card,35.63,1.78,1,gen_20251127_091607,transactions_header.csv
T00002993,2024-11-13,2024-11-13 07:07:13,S016,,Card,0.38,0.04,2,gen_20251127_091606,transactions_header.csv
T00019545,2024-11-05,2024-11-05 16:53:47,S010,C001083,Cash,35.74,0.0,1,gen_20251127_091607,transactions_header.csv
T00004402,2024-02-06,2024-02-06 12:37:18,S016,C001187,Cash,84.55,12.68,6,gen_20251127_091606,transactions_header.csv
T00004768,2024-01-26,2024-01-26 21:58:36,S011,,Card,35.47,5.32,2,gen_20251127_091606,transactions_header.csv
T00012557,2024-02-02,2024-02-02 06:53:39,S029,C003374,card,56.24,5.62,3,gen_20251127_091607,transactions_header.csv
T00016751,2024-12-10,2024-12-10 03:27:59,S016,C000771,Card,38.33,,1,gen_20251127_091607,transactions_header.csv
T00001291,08/20/24,2024-08-20 07:53:56,S002,NA,Card,3.15,0.16,1,gen_20251127_091605,transactions_header.csv
T00004297,04/17/24,2024-04-17 12:50:49,S024,C004785,Cash,37.63,5.64,4,gen_20251127_091606,transactions_header.csv
T00002200,2024-08-10,2024-08-10 05:53:40,S003,,Cash,50.78,,1,gen_20251127_091605,transactions_header.csv
T00015113,2024-09-28,2024-09-28 11:51:05,S014,,Cash,104.11,15.62,3,gen_20251127_091607,transactions_header.csv
T00007884,09/25/24,2024-09-25 13:11:30,S011,C002889,Card,54.75,0.0,3,gen_20251127_091606,transactions_header.csv
T00003849,02/28/24,2024-02-28 12:27:42,S021,C003159,Online,35.95,5.39,1,gen_20251127_091606,transactions_header.csv
T00004967,07/21/24,2024-07-21 16:17:07,S006,C004402,Card,$42.87,,1,gen_20251127_091606,transactions_header.csv
T00009460,2024-07-27,2024-07-27 21:04:16,S007,C003153,Card,30.45,4.57,2,gen_20251127_091606,transactions_header.csv
T00008969,2024-02-03,2024-02-03 01:14:52,S016,C002462,Card,92.8,4.64,3,gen_20251127_091606,transactions_header.csv
T00018792,2024-07-08,2024-07-08 12:35:23,S023,C000569,Card,21.49,3.22,2,gen_20251127_091607,transactions_header.csv
T00008945,11/05/24,2024-11-05 12:36:11,S003,C004782,Cash,56.23,5.62,8,gen_20251127_091606,transactions_header.csv
T00004337,08/28/24,2024-08-28 10:36:27,S023,C000950,Card,30.25,NA,1,gen_20251127_091606,transactions_header.csv
T00009888,2024-04-05,2024-04-05 20:12:17,S013,C004337,Cash,17.61,1.76,7,gen_20251127_091606,transactions_header.csv
T00006779,07/02/24,2024-07-02 20:21:11,S028,C001037,Online,0,0.0,5,gen_20251127_091606,transactions_header.csv
T00010970,09/29/24,2024-09-29 00:45:59,S007,C004675,Online,27.56,2.76,4,gen_20251127_091606,transactions_header.csv
T00000929,2024-12-01,2024-12-01 01:14:03,S015,C003341,Card,39.63,5.94,8,gen_20251127_091605,transactions_header.csv
T00008479,10/19/24,2024-10-19 16:39:12,S024,C000173,Card,39.54,0.0,1,gen_20251127_091606,transactions_header.csv
T00015591,2024-09-08,2024-09-08 14:23:04,S017,,Online,25.54,0.0,1,gen_20251127_091607,transactions_header.csv
T00016646,06/20/24,2024-06-20 13:39:29,S015,C003474,Online,47.65,2.38,1,gen_20251127_091607,transactions_header.csv
T00006207,2024-10-20,2024-10-20 11:52:47,S029,C004883,Cash,78.89,3.94,1,gen_20251127_091606,transactions_header.csv
T00010232,06/12/24,2024-06-12 20:40:52,S021,,Cash,-25.25,2.53,1,gen_20251127_091606,transactions_header.csv
T00012033,05/21/24,2024-05-21 13:30:12,S027,C001619,Cash,37.02,1.85,2,gen_20251127_091607,transactions_header.csv
T00001283,09/28/24,2024-09-28 20:33:22,S007,C000082,Card,37.87,,3,gen_20251127_091605,transactions_header.csv
T00006268,08/19/24,2024-08-19 19:39:52,S025,C000725,Cash,27.34,,2,gen_20251127_091606,transactions_header.csv
T00014404,11/06/24,2024-11-06 17:26:34,S013,,Card,67.59,6.76,2,gen_20251127_091607,transactions_header.csv
T00012923,2024-04-05,2024-04-05 11:37:31,S004,C004606,Online,38.07,5.71,2,gen_20251127_091607,transactions_header.csv
T00001528,11/07/24,2024-11-07 02:08:03,S005,C003092,Online,63.03,3.15,1,gen_20251127_091605,transactions_header.csv
T00009072,03/17/24,2024-03-17 16:50:04,S029,C003012,Cash,0,0.0,1,gen_20251127_091606,transactions_header.csv
T00013532,2024-09-01,2024-09-01 17:14:29,S022,,Online,109.87,16.48,1,gen_20251127_091607,transactions_header.csv
T00010193,08/18/24,2024-08-18 09:55:00,S001,C003213,Online,70.98,7.1,1,gen_20251127_091606,transactions_header.csv
T00015816,2024-07-07,2024-07-07 11:11:41,S005,C000022,Cash,82.91,12.44,4,gen_20251127_091607,transactions_header.csv
T00012499,2024-12-08,2024-12-08 12:01:48,S029,C004750,Online,96.73,9.67,3,gen_20251127_091607,transactions_header.csv
T00009724,05/05/24,2024-05-05 17:31:47,S026,C004892,Card,80.79,8.08,1,gen_20251127_091606,transactions_header.csv
T00018335,05/10/24,2024-05-10 21:09:09,S016,C003486,Online,55.1,8.27,7,gen_20251127_091607,transactions_header.csv
T00017890,09/15/24,2024-09-15 13:28:26,S006,C001592,Online,19.23,0.0,5,gen_20251127_091607,transactions_header.csv
T00003927,12/15/24,2024-12-15 15:44:55,S010,C003063,Card,41.24,4.12,1,gen_20251127_091606,transactions_header.csv
T00001714,2024-03-30,2024-03-30 11:33:12,S004,C002220,Card,0,0.0,1,gen_20251127_091605,transactions_header.csv
T00012595,2024-09-12,2024-09-12 20:14:14,S015,,Online,65.48,3.27,1,gen_20251127_091607,transactions_header.csv
T00009516,2024-08-17,2024-08-17 17:06:31,S001,C003955,Cash,105.7,5.29,2,gen_20251127_091606,transactions_header.csv
T00005473,2024-07-16,2024-07-16 08:53:36,S012,C002789,Cash,36.94,NA,1,gen_20251127_091606,transactions_header.csv
T00005764,2024-10-23,2024-10-23 19:07:22,S005,C001508,Card,70.99,10.65,1,gen_20251127_091606,transactions_header.csv
T00007758,05/26/24,2024-05-26 21:29:37,S010,C000026,Cash,33.88,1.69,7,gen_20251127_091606,transactions_header.csv
T00003266,09/29/24,2024-09-29 11:19:28,S017,C000233,Online,27.22,1.36,1,gen_20251127_091606,transactions_header.csv
T00009299,2024-09-17,2024-09-17 05:04:33,S023,C001196,Cash,72.91,NA,2,gen_20251127_091606,transactions_header.csv
T00005227,10/18/24,2024-10-18 03:55:53,S010,,Online,86.26,0.0,4,gen_20251127_091606,transactions_header.csv
T00002772,2024-02-07,2024-02-07 10:58:38,S004,C000788,Card,53.56,5.36,1,gen_20251127_091605,transactions_header.csv
T00013788,02/10/24,2024-02-10 11:43:26,S001,C004120,online,52.15,2.61,1,gen_20251127_091607,transactions_header.csv
T00008122,10/16/24,2024-10-16 19:52:44,S015,C004148,Card,77.87,3.89,3,gen_20251127_091606,transactions_header.csv
T00007361,2024-04-01,2024-04-01 01:34:23,S018,C004126,Cash,69.53,,6,gen_20251127_091606,transactions_header.csv
T00019838,02/24/24,2024-02-24 05:00:37,S027,C002724,Online,35.3,0.0,1,gen_20251127_091607,transactions_header.csv
T00006504,2024-03-14,2024-03-14 02:46:54,S011,C003670,Online,74.42,0.0,1,gen_20251127_091606,transactions_header.csv
T00006287,06/06/24,2024-06-06 02:24:44,S030,C003735,Online,46.17,6.93,3,gen_20251127_091606,transactions_header.csv
T00005077,2024-12-14,2024-12-14 17:19:28,S004,C001159,Card,81.31,8.13,1,gen_20251127_091606,transactions_header.csv
T00005744,2024-03-30,2024-03-30 02:16:22,S012,C001563,Online,59.31,8.9,1,gen_20251127_091606,transactions_header.csv
T00002947,2024-11-26,2024-11-26 19:01:18,S009,C001283,Online,$7.83,0.0,2,gen_20251127_091606,transactions_header.csv
T00007753,2024-06-05,2024-06-05 11:31:46,S023,C002903,Online,18.84,,1,gen_20251127_091606,transactions_header.csv
T00015992,2024-08-09,2024-08-09 17:53:21,S011,C003075,Card,6.12,0.92,1,gen_20251127_091607,transactions_header.csv
T00009797,2024-03-04,2024-03-04 13:32:43,S005,C003684,Card,48.67,0.0,3,gen_20251127_091606,transactions_header.csv
T00011510,2024-03-01,2024-03-01 02:28:30,S021,C001813,Cash,0,0.0,7,gen_20251127_091606,transactions_header.csv
T00015226,02/24/24,2024-02-24 13:58:03,S004,C002582,Online,56.65,5.67,2,gen_20251127_091607,transactions_header.csv
T00016650,2024-01-03,2024-01-03 08:23:51,S006,C000183,Cash,2.3,0.11,2,gen_20251127_091607,transactions_header.csv
T00006665,01/12/24,2024-01-12 15:58:48,S017,C000094,Card,0,0.0,1,gen_20251127_091606,transactions_header.csv
T00014228,11/22/24,2024-11-22 12:57:32,S024,C002670,Cash,35.81,0.0,1,gen_20251127_091607,transactions_header.csv
T00008500,2024-04-24,2024-04-24 07:05:27,S002,,Card,77.63,7.76,1,gen_20251127_091606,transactions_header.csv
T00014371,2024-05-24,2024-05-24 22:49:50,S027,C001097,Online,108.12,10.81,2,gen_20251127_091607,transactions_header.csv
T00000128,03/27/24,2024-03-27 19:59:33,S002,C002328,card,70.75,NA,6,gen_20251127_091605,transactions_header.csv
T00005217,2024-07-12,2024-07-12 08:10:08,S025,C001986,Cash,82.73,0.0,2,gen_20251127_091606,transactions_header.csv
T00001912,10/19/24,2024-10-19 10:24:50,S028,C004673,Cash,60.49,6.05,1,gen_20251127_091605,transactions_header.csv
T00014810,2024-12-10,2024-12-10 10:11:53,S002,C001064,Online,39.7,5.96,1,gen_20251127_091607,transactions_header.csv
T00011554,2024-06-09,2024-06-09 15:54:02,S022,C002075,Online,64.14,0.0,1,gen_20251127_091606,transactions_header.csv
T00014324,10/26/24,2024-10-26 19:46:06,S009,C002677,Online,76.15,0.0,1,gen_20251127_091607,transactions_header.csv
T00010364,2024-05-30,2024-05-30 19:19:35,S004,C003845,Card,57.78,0.0,1,gen_20251127_091606,transactions_header.csv
T00014380,2024-09-25,2024-09-25 04:04:37,S008,C001487,Cash,63.32,0.0,2,gen_20251127_091607,transactions_header.csv
T00018502,02/13/24,2024-02-13 04:31:29,S019,C004476,Card,60.61,6.06,1,gen_20251127_091607,transactions_header.csv
T00008676,2024-02-19,2024-02-19 18:19:03,S022,C004389,Cash,$112.37,11.24,1,gen_20251127_091606,transactions_header.csv
T00006092,04/28/24,2024-04-28 01:08:27,S011,C002075,Card,15.02,0.75,1,gen_20251127_091606,transactions_header.csv
T00000248,01/21/24,2024-01-21 20:03:59,S023,,Cash,10.55,0.53,3,gen_20251127_091605,transactions_header.csv
T00012271,2024-12-09,2024-12-09 08:26:02,S030,C003276,Cash,110.1,5.5,1,gen_20251127_091607,transactions_header.csv
T00018615,09/20/24,2024-09-20 20:58:34,S030,C002556,online,35.32,1.77,2,gen_20251127_091607,transactions_header.csv
T00017406,10/25/24,2024-10-25 15:12:00,S019,C003740,Card,84.87,0.0,1,gen_20251127_091607,transactions_header.csv
T00015683,2024-08-27,2024-08-27 22:53:43,S023,C003677,Cash,52.17,2.61,1,gen_20251127_091607,transactions_header.csv
T00013303,2024-06-11,2024-06-11 13:15:30,S020,C003088,Card,46.9,2.35,3,gen_20251127_091607,transactions_header.csv
T00009196,2024-04-19,2024-04-19 18:55:58,S007,C004190,Online,$56.03,0.0,1,gen_20251127_091606,transactions_header.csv
T00013827,01/26/24,2024-01-26 00:50:56,S022,C004454,Card,24.76,0.0,1,gen_20251127_091607,transactions_header.csv
T00017108,12/23/24,2024-12-23 01:38:29,S016,C000928,Card,91.21,0.0,1,gen_20251127_091607,transactions_header.csv
T00015953,2024-03-15,2024-03-15 01:30:14,S010,C001089,Cash,13.41,0.0,4,gen_20251127_091607,transactions_header.csv
T00003205,05/04/24,2024-05-04 00:57:57,S018,C002559,Card,67.46,3.37,2,gen_20251127_091606,transactions_header.csv
T00011533,2024-12-28,2024-12-28 06:09:53,S019,,Online,41.12,4.11,1,gen_20251127_091606,transactions_header.csv
T00012205,2024-11-11,2024-11-11 20:06:29,S007,C004293,Online,0,0.0,4,gen_20251127_091607,transactions_header.csv
T00010000,01/03/24,2024-01-03 10:25:56,S006,C000619,Online,70.81,10.62,1,gen_20251127_091606,transactions_header.csv
T00016486,2024-12-01,2024-12-01 18:56:33,S023,C001697,Card,69.97,7.0,1,gen_20251127_091607,transactions_header.csv
T00011093,09/28/24,2024-09-28 13:15:44,S011,C004702,Cash,69.53,NA,1,gen_20251127_091606,transactions_header.csv
T00013203,07/31/24,2024-07-31 04:20:47,S020,C000060,Online,45.0,2.25,1,gen_20251127_091607,transactions_header.csv
T00010891,07/08/24,2024-07-08 11:47:16,S022,C000594,Online,108.9,10.89,1,gen_20251127_091606,transactions_header.csv
T00019517,2024-03-28,2024-03-28 19:42:45,S002,C002121,Cash,53.21,2.66,2,gen_20251127_091607,transactions_header.csv
T00005047,2024-04-23,2024-04-23 20:03:34,S012,C001707,Cash,26.67,4.0,1,gen_20251127_091606,transactions_header.csv
T00004844,2024-06-02,2024-06-02 05:15:13,S029,C003961,Card,33.4,,1,gen_20251127_091606,transactions_header.csv
T00007160,03/17/24,2024-03-17 22:10:00,S023,C002977,cash,46.8,7.02,1,gen_20251127_091606,transactions_header.csv
T00019444,04/23/24,2024-04-23 14:53:07,S018,C003914,Cash,46.57,0.0,1,gen_20251127_091607,transactions_header.csv
T00004640,10/18/24,2024-10-18 08:06:01,S022,C000078,Online,99.28,0.0,1,gen_20251127_091606,transactions_header.csv
T00018568,09/27/24,2024-09-27 19:42:52,S024,C002874,Card,61.86,6.19,1,gen_20251127_091607,transactions_header.csv
T00017125,2024-10-16,2024-10-16 23:58:21,S004,C001520,Card,74.43,3.72,2,gen_20251127_091607,transactions_header.csv
T00007232,2024-12-22,2024-12-22 23:22:17,S029,C000056,Online,57.26,NA,1,gen_20251127_091606,transactions_header.csv
T00004603,2024-10-31,2024-10-31 15:39:46,S003,C000292,Online,0,0,2,gen_20251127_091606,transactions_header.csv
T00007463,04/19/24,2024-04-19 19:20:47,S030,C003428,Card,106.62,15.99,1,gen_20251127_091606,transactions_header.csv
T00015259,2024-06-23,2024-06-23 08:18:03,S026,C003004,Online,7.4,1.11,1,gen_20251127_091607,transactions_header.csv
T00018996,2024-08-13,2024-08-13 02:54:43,S010,C004978,Cash,0,,3,gen_20251127_091607,transactions_header.csv
T00010934,01/12/24,2024-01-12 06:07:52,S002,C001367,Online,56.31,8.45,1,gen_20251127_091606,transactions_header.csv
T00001057,05/16/24,2024-05-16 23:36:14,S017,C002960,Card,19.86,,1,gen_20251127_091605,transactions_header.csv
T00004310,03/18/24,2024-03-18 13:19:04,S007,C000773,Cash,52.11,7.82,1,gen_20251127_091606,transactions_header.csv
T00017781,2024-01-20,2024-01-20 08:34:39,S030,C000992,Cash,78.56,0.0,2,gen_20251127_091607,transactions_header.csv
T00018169,11/26/24,2024-11-26 14:53:23,S016,C001488,Cash,55.79,0.0,2,gen_20251127_091607,transactions_header.csv
T00018190,09/24/24,2024-09-24 17:31:18,S026,C002727,Cash,54.77,0.0,2,gen_20251127_091607,transactions_header.csv
T00000804,12/22/24,2024-12-22 09:09:59,S007,C003556,Online,103.54,10.35,5,gen_20251127_091605,transactions_header.csv
T00007591,09/01/24,2024-09-01 10:41:43,S016,C004153,Cash,27.76,4.16,1,gen_20251127_091606,transactions_header.csv
T00003589,11/24/24,2024-11-24 20:23:12,S015,C002860,Online,36.23,1.81,1,gen_20251127_091606,transactions_header.csv
T00000116,2024-04-23,2024-04-23 06:13:38,S027,C002453,Cash,38.92,5.84,6,gen_20251127_091605,transactions_header.csv
T00006115,05/06/24,2024-05-06 19:27:49,S029,C001207,Online,0,0.0,3,gen_20251127_091606,transactions_header.csv
T00011290,2024-06-06,2024-06-06 18:42:59,S016,NA,Online,27.04,2.7,1,gen_20251127_091606,transactions_header.csv
T00012970,2024-12-13,2024-12-13 20:35:23,S018,C003660,Card,$0.00,0.0,5,gen_20251127_091607,transactions_header.csv
T00013582,04/02/24,2024-04-02 16:14:26,S026,C004324,Card,21.63,3.24,1,gen_20251127_091607,transactions_header.csv
T00018229,2024-04-13,2024-04-13 22:57:50,S015,C004238,Card,65.09,6.51,1,gen_20251127_091607,transactions_header.csv
T00002700,06/02/24,2024-06-02 05:00:41,S018,C002947,Cash,$88.97,0.0,1,gen_20251127_091605,transactions_header.csv
T00010500,2024-10-12,2024-10-12 20:25:42,S028,C001105,Card,82.92,8.29,1,gen_20251127_091606,transactions_header.csv
T00006799,2024-10-31,2024-10-31 15:27:39,S024,C003246,Online,46.51,0.0,2,gen_20251127_091606,transactions_header.csv
T00005712,07/27/24,2024-07-27 06:22:30,S009,C002830,Card,7.23,0.36,2,gen_20251127_091606,transactions_header.csv
T00000485,04/09/24,2024-04-09 23:18:02,S029,C002571,online,53.71,0.0,1,gen_20251127_091605,transactions_header.csv
T00016785,2024-10-11,2024-10-11 17:02:30,S006,C000558,Card,67.13,0.0,1,gen_20251127_091607,transactions_header.csv
T00006243,2024-06-12,2024-06-12 04:36:11,S021,C001686,Online,32.75,4.91,5,gen_20251127_091606,transactions_header.csv
T00013035,02/17/24,2024-02-17 16:12:33,S021,C001382,Cash,52.95,5.3,2,gen_20251127_091607,transactions_header.csv
T00011228,04/11/24,2024-04-11 03:14:33,S001,C001507,Cash,29.17,4.38,3,gen_20251127_091606,transactions_header.csv
T00001351,2024-10-14,2024-10-14 01:30:18,S018,C003862,Card,89.63,0.0,5,gen_20251127_091605,transactions_header.csv
T00001789,2024-12-22,2024-12-22 04:21:38,S006,C001398,Online,64.6,6.46,4,gen_20251127_091605,transactions_header.csv
T00002857,01/06/24,2024-01-06 03:20:46,S025,C001383,Online,92.71,0.0,5,gen_20251127_091606,transactions_header.csv
T00017923,12/03/24,2024-12-03 22:28:53,S006,C003002,Cash,85.93,4.3,2,gen_20251127_091607,transactions_header.csv
T00004000,2024-04-10,2024-04-10 06:33:47,S003,C001468,Card,37.85,3.79,1,gen_20251127_091606,transactions_header.csv
T00019828,01/03/24,2024-01-03 19:54:21,S021,C002617,Online,24.0,2.4,1,gen_20251127_091607,transactions_header.csv
T00000342,11/29/24,2024-11-29 01:11:14,S010,C004357,Cash,55.29,0.0,5,gen_20251127_091605,transactions_header.csv
T00003785,01/25/24,2024-01-25 06:52:42,S030,C001821,Cash,120.68,12.07,1,gen_20251127_091606,transactions_header.csv
T00003377,2024-04-18,2024-04-18 18:46:55,S014,C003404,Cash,28.27,2.83,1,gen_20251127_091606,transactions_header.csv
T00004915,05/31/24,2024-05-31 10:22:09,S001,C004480,Online,96.32,0.0,4,gen_20251127_091606,transactions_header.csv
T00011007,2024-07-13,2024-07-13 21:21:08,S020,C000230,Card,37.21,0.0,2,gen_20251127_091606,transactions_header.csv
T00000314,06/26/24,2024-06-26 06:17:43,S013,C001307,Cash,44.48,0.0,8,gen_20251127_091605,transactions_header.csv
T00014314,2024-03-20,2024-03-20 04:18:02,S022,C002672,Cash,20.19,2.02,1,gen_20251127_091607,transactions_header.csv
T00014634,06/26/24,2024-06-26 03:45:32,S018,C002628,Online,55.18,2.76,2,gen_20251127_091607,transactions_header.csv
T00005562,06/23/24,2024-06-23 13:42:33,S030,C000757,Online,7.02,0.7,1,gen_20251127_091606,transactions_header.csv
T00001148,06/19/24,2024-06-19 09:13:33,S013,C002622,Card,63.6,3.18,3,gen_20251127_091605,transactions_header.csv
T00008716,2024-04-12,2024-04-12 20:23:16,S017,C000947,Online,$6.50,0.97,5,gen_20251127_091606,transactions_header.csv
T00000410,2024-08-12,2024-08-12 04:58:46,S018,C004841,Online,19.48,0.97,1,gen_20251127_091605,transactions_header.csv
T00016694,2024-06-21,2024-06-21 21:45:34,S014,C003027,Online,42.41,0.0,1,gen_20251127_091607,transactions_header.csv
T00015340,01/10/24,2024-01-10 19:49:17,S001,C000790,Card,80.88,0.0,1,gen_20251127_091607,transactions_header.csv
T00000813,2024-02-21,2024-02-21 05:05:57,S001,C000007,Card,61.53,6.15,1,gen_20251127_091605,transactions_header.csv
T00010622,2024-11-25,2024-11-25 05:46:25,S011,C001689,Card,31.55,4.73,1,gen_20251127_091606,transactions_header.csv
T00016666,2024-11-13,2024-11-13 08:51:41,S012,C002708,Online,16.36,0.0,1,gen_20251127_091607,transactions_header.csv
T00006269,10/26/24,2024-10-26 12:49:11,S006,C003402,Card,75.42,3.77,3,gen_20251127_091606,transactions_header.csv
T00012167,08/01/24,2024-08-01 17:24:29,S020,,Cash,29.16,4.37,2,gen_20251127_091607,transactions_header.csv
T00002271,03/28/24,2024-03-28 20:27:02,S007,C002355,Online,3.84,0.58,5,gen_20251127_091605,transactions_header.csv
T00005150,2024-05-12,2024-05-12 05:16:09,S013,C001325,Online,4.39,0.66,2,gen_20251127_091606,transactions_header.csv
T00013881,2024-04-27,2024-04-27 22:50:19,S014,C003799,Cash,21.31,0.0,2,gen_20251127_091607,transactions_header.csv
T00018739,2024-07-04,2024-07-04 03:42:43,S017,C001721,Card,29.44,0.0,1,gen_20251127_091607,transactions_header.csv
T00007949,03/28/24,2024-03-28 05:44:23,S021,,Online,74.68,11.2,1,gen_20251127_091606,transactions_header.csv
T00017655,03/06/24,2024-03-06 17:43:27,S020,C002535,Cash,0,0.0,1,gen_20251127_091607,transactions_header.csv
T00010505,2024-12-15,2024-12-15 07:18:46,S027,C003488,Card,68.94,,2,gen_20251127_091606,transactions_header.csv
T00005663,08/23/24,2024-08-23 17:36:22,S025,C003004,Cash,24.04,3.61,2,gen_20251127_091606,transactions_header.csv
T00018677,04/10/24,2024-04-10 11:01:39,S011,C001736,Cash,25.76,3.86,2,gen_20251127_091607,transactions_header.csv
T00002579,2024-04-02,2024-04-02 16:21:33,S016,C002223,Online,64.44,9.67,3,gen_20251127_091605,transactions_header.csv
T00009721,09/04/24,2024-09-04 02:54:09,S017,C004251,Online,16.13,0.81,1,gen_20251127_091606,transactions_header.csv
T00000739,04/28/24,2024-04-28 21:09:25,S011,,Cash,42.67,0.0,2,gen_20251127_091605,transactions_header.csv
T00011020,2024-10-09,2024-10-09 12:46:41,S008,C004161,Card,70.55,10.58,1,gen_20251127_091606,transactions_header.csv
T00005427,2024-06-29,2024-06-29 02:25:29,S026,C000524,Cash,56.65,8.5,3,gen_20251127_091606,transactions_header.csv
T00001329,2024-01-12,2024-01-12 02:32:12,S022,C002253,Cash,46.37,0.0,1,gen_20251127_091605,transactions_header.csv
T00019351,2024-03-23,2024-03-23 06:14:39,S007,C004060,card,65.08,6.51,3,gen_20251127_091607,transactions_header.csv
T00013618,2024-11-24,2024-11-24 13:18:42,S021,C002826,Cash,23.56,3.53,4,gen_20251127_091607,transactions_header.csv
T00008879,2024-03-11,2024-03-11 11:16:05,S008,C003511,Cash,66.37,0.0,3,gen_20251127_091606,transactions_header.csv
T00011068,08/03/24,2024-08-03 19:42:23,S021,C000894,Cash,69.6,10.44,1,gen_20251127_091606,transactions_header.csv
T00005761,2024-04-20,2024-04-20 22:49:16,S015,C000146,card,51.01,,1,gen_20251127_091606,transactions_header.csv
T00010896,2024-01-30,2024-01-30 09:16:54,S029,C003991,Card,35.39,3.54,2,gen_20251127_091606,transactions_header.csv
T00006893,10/30/24,2024-10-30 06:43:53,S006,C002312,Online,20.37,,2,gen_20251127_091606,transactions_header.csv
T00012610,2024-12-24,2024-12-24 07:13:12,S018,C004306,Card,62.79,9.42,1,gen_20251127_091607,transactions_header.csv
T00002120,08/14/24,2024-08-14 03:02:59,S024,C002429,Online,20.29,3.04,1,gen_20251127_091605,transactions_header.csv
T00016495,02/18/24,2024-02-18 04:19:28,S028,C003834,Card,75.08,7.51,6,gen_20251127_091607,transactions_header.csv
T00014929,2024-11-13,2024-11-13 14:41:42,S019,C004478,Online,41.06,2.05,1,gen_20251127_091607,transactions_header.csv
T00006071,2024-08-10,2024-08-10 12:20:54,S017,C000347,Card,16.58,2.49,6,gen_20251127_091606,transactions_header.csv
T00005935,08/07/24,2024-08-07 03:58:23,S022,C002012,Cash,63.98,0.0,1,gen_20251127_091606,transactions_header.csv
T00017984,2024-04-07,2024-04-07 10:35:44,S027,C002049,Cash,86.54,4.33,1,gen_20251127_091607,transactions_header.csv
T00001206,2024-08-15,2024-08-15 23:19:11,S026,C003714,Cash,56.98,2.85,1,gen_20251127_091605,transactions_header.csv
T00001531,2024-06-07,2024-06-07 13:37:52,S030,C000803,Cash,0,0.0,1,gen_20251127_091605,transactions_header.csv
T00001982,2024-11-07,2024-11-07 21:08:51,S005,C000633,Online,61.21,9.18,1,gen_20251127_091605,transactions_header.csv
T00016137,03/19/24,2024-03-19 03:35:24,S013,C000905,card,149.36,22.4,5,gen_20251127_091607,transactions_header.csv
T00004376,2024-04-07,2024-04-07 22:41:21,S014,C002392,Online,27.18,2.72,1,gen_20251127_091606,transactions_header.csv
T00008680,2024-11-30,2024-11-30 05:49:27,S028,C003889,Online,8.02,1.2,1,gen_20251127_091606,transactions_header.csv
T00017424,12/12/24,2024-12-12 06:45:33,S003,C003985,Cash,48.9,0.0,2,gen_20251127_091607,transactions_header.csv
T00018460,01/18/24,2024-01-18 08:49:32,S012,,Card,113.33,17.0,1,gen_20251127_091607,transactions_header.csv
T00007945,2024-06-05,2024-06-05 09:18:12,S007,C001258,Card,30.97,4.65,1,gen_20251127_091606,transactions_header.csv
T00018727,08/29/24,2024-08-29 19:47:27,S019,C003015,Cash,23.5,NA,5,gen_20251127_091607,transactions_header.csv
T00013665,12/22/24,2024-12-22 22:12:21,S028,C002851,Card,86.95,13.04,1,gen_20251127_091607,transactions_header.csv
T00004565,2024-09-20,2024-09-20 16:44:05,S008,C002734,Cash,79.47,7.95,2,gen_20251127_091606,transactions_header.csv
T00019141,2024-12-04,2024-12-04 17:20:00,S029,,Card,$61.90,0.0,1,gen_20251127_091607,transactions_header.csv
T00001979,02/09/24,2024-02-09 17:33:06,S019,C004655,Card,31.29,1.56,2,gen_20251127_091605,transactions_header.csv
T00014985,2024-07-22,2024-07-22 23:29:45,S022,C003942,online,116.93,17.54,2,gen_20251127_091607,transactions_header.csv
T00000961,2024-05-19,2024-05-19 11:13:03,S009,C000109,Online,110.14,5.51,2,gen_20251127_091605,transactions_header.csv
T00006057,07/10/24,2024-07-10 10:25:29,S028,C002692,cash,108.36,16.25,7,gen_20251127_091606,transactions_header.csv
T00000252,07/13/24,2024-07-13 16:53:30,S022,C001581,Cash,11.97,0.0,1,gen_20251127_091605,transactions_header.csv
T00001035,07/20/24,2024-07-20 00:14:58,S006,C000016,Card,154.35,7.72,1,gen_20251127_091605,transactions_header.csv
T00008426,2024-06-23,2024-06-23 01:41:45,S019,C000140,Online,59.06,0.0,2,gen_20251127_091606,transactions_header.csv
T00006596,09/06/24,2024-09-06 14:49:48,S018,C003128,Online,58.65,0.0,2,gen_20251127_091606,transactions_header.csv
T00008133,11/14/24,2024-11-14 09:08:15,S014,C003101,Card,59.75,,7,gen_20251127_091606,transactions_header.csv
T00003624,07/08/24,2024-07-08 21:14:12,S030,C004970,Card,0,,1,gen_20251127_091606,transactions_header.csv
T00011947,2024-11-15,2024-11-15 13:23:22,S003,C000773,Online,58.2,NA,1,gen_20251127_091607,transactions_header.csv
T00018278,2024-03-17,2024-03-17 05:53:06,S018,C003167,Card,55.45,8.32,4,gen_20251127_091607,transactions_header.csv
T00005533,2024-11-23,2024-11-23 15:56:23,S013,C003639,Card,90.44,4.52,2,gen_20251127_091606,transactions_header.csv
T00006713,06/14/24,2024-06-14 04:13:57,S007,C000284,Card,57.6,8.64,3,gen_20251127_091606,transactions_header.csv
T00013247,2024-09-12,2024-09-12 21:49:38,S024,C001578,Card,80.68,0.0,1,gen_20251127_091607,transactions_header.csv
T00000327,02/29/24,2024-02-29 00:45:33,S008,C001271,Cash,29.78,4.47,2,gen_20251127_091605,transactions_header.csv
T00003227,06/21/24,2024-06-21 17:38:20,S001,C004988,Online,2.32,0.35,1,gen_20251127_091606,transactions_header.csv
T00004044,06/20/24,2024-06-20 21:51:10,S002,C004318,Online,4.77,0.0,1,gen_20251127_091606,transactions_header.csv
T00009672,09/28/24,2024-09-28 16:47:25,S015,C002942,Card,46.66,4.67,1,gen_20251127_091606,transactions_header.csv
T00014317,2024-12-10,2024-12-10 23:00:55,S010,C003053,Online,14.43,1.44,2,gen_20251127_091607,transactions_header.csv
T00007809,07/17/24,2024-07-17 08:11:14,S024,,Card,97.36,0.0,1,gen_20251127_091606,transactions_header.csv
T00015321,10/16/24,2024-10-16 04:09:53,S018,,Cash,14.37,0.0,2,gen_20251127_091607,transactions_header.csv
T00005573,2024-04-10,2024-04-10 04:37:11,S015,,Online,26.81,2.68,1,gen_20251127_091606,transactions_header.csv
T00017064,10/15/24,2024-10-15 04:28:04,S027,C003247,Card,21.5,3.23,1,gen_20251127_091607,transactions_header.csv
T00017491,2024-08-14,2024-08-14 00:44:55,S014,C003512,Card,$0.00,0.0,4,gen_20251127_091607,transactions_header.csv
T00017493,2024-05-22,2024-05-22 05:26:50,S012,C000845,Online,22.68,2.27,1,gen_20251127_091607,transactions_header.csv
T00004769,2024-06-26,2024-06-26 02:06:49,S004,C004461,cash,$49.39,,1,gen_20251127_091606,transactions_header.csv
T00011584,05/12/24,2024-05-12 19:49:48,S016,C004697,Card,33.87,1.69,1,gen_20251127_091606,transactions_header.csv
T00013848,10/12/24,2024-10-12 12:45:22,S006,C004176,Cash,27.44,4.12,1,gen_20251127_091607,transactions_header.csv
T00004703,2024-06-11,2024-06-11 21:55:22,S012,C000566,Card,24.51,NA,1,gen_20251127_091606,transactions_header.csv
T00006163,08/06/24,2024-08-06 15:20:30,S022,C000898,Card,50.73,0.0,1,gen_20251127_091606,transactions_header.csv
T00016135,03/29/24,2024-03-29 14:02:11,S007,C002350,Online,64.1,,1,gen_20251127_091607,transactions_header.csv
T00016651,2024-05-11,2024-05-11 00:57:24,S020,C004703,Card,73.98,3.7,1,gen_20251127_091607,transactions_header.csv
T00012676,10/13/24,2024-10-13 21:58:23,S022,C003023,Online,83.12,0.0,2,gen_20251127_091607,transactions_header.csv
T00016149,2024-12-04,2024-12-04 14:17:03,S013,C000719,Cash,15.54,2.33,5,gen_20251127_091607,transactions_header.csv
T00010072,2024-07-25,2024-07-25 02:13:26,S023,C002632,Cash,0,0.0,3,gen_20251127_091606,transactions_header.csv
T00018805,07/12/24,2024-07-12 11:33:35,S007,,Card,67.53,0.0,3,gen_20251127_091607,transactions_header.csv
T00017666,09/07/24,2024-09-07 12:48:59,S007,,Cash,108.99,0.0,3,gen_20251127_091607,transactions_header.csv
T00008890,02/29/24,2024-02-29 22:29:43,S019,,Card,121.26,6.06,1,gen_20251127_091606,transactions_header.csv
T00019450,03/24/24,2024-03-24 10:03:55,S008,C002966,Cash,0,0.0,5,gen_20251127_091607,transactions_header.csv
T00002584,02/13/24,2024-02-13 22:24:03,S016,C000661,Cash,11.59,1.74,1,gen_20251127_091605,transactions_header.csv
T00017912,2024-10-01,2024-10-01 23:56:46,S021,C003145,Online,62.33,9.35,1,gen_20251127_091607,transactions_header.csv
T00017142,2024-02-08,2024-02-08 12:35:33,S020,C003872,Online,42.11,6.32,2,gen_20251127_091607,transactions_header.csv
T00006742,05/30/24,2024-05-30 17:13:45,S018,C001283,Card,43.21,6.48,2,gen_20251127_091606,transactions_header.csv
T00010595,12/18/24,2024-12-18 00:08:38,S010,C001560,Online,58.73,5.87,2,gen_20251127_091606,transactions_header.csv
T00008566,02/27/24,2024-02-27 19:06:41,S007,C003386,Card,$39.39,5.91,1,gen_20251127_091606,transactions_header.csv
T00016006,09/28/24,2024-09-28 08:23:29,S029,C004291,Online,73.97,,1,gen_20251127_091607,transactions_header.csv
T00016779,2024-10-10,2024-10-10 15:25:32,S007,C003134,Card,12.56,1.26,2,gen_20251127_091607,transactions_header.csv
T00013463,05/30/24,2024-05-30 22:34:25,S011,C002421,Online,73.66,7.37,1,gen_20251127_091607,transactions_header.csv
T00019970,2024-11-25,2024-11-25 15:28:05,S013,C004244,Online,59.14,0.0,1,gen_20251127_091607,transactions_header.csv
T00017950,2024-02-02,2024-02-02 15:12:24,S014,C004529,Cash,85.51,NA,2,gen_20251127_091607,transactions_header.csv
T00007498,2024-01-31,2024-01-31 09:45:36,S009,C000384,Card,$72.92,7.29,1,gen_20251127_091606,transactions_header.csv
T00015975,2024-08-17,2024-08-17 07:27:26,S029,,Online,42.97,4.3,1,gen_20251127_091607,transactions_header.csv
T00005762,2024-10-11,2024-10-11 19:49:07,S002,NA,Cash,58.11,,1,gen_20251127_091606,transactions_header.csv
T00006467,2024-10-08,2024-10-08 00:55:43,S005,C002836,Cash,60.99,0.0,4,gen_20251127_091606,transactions_header.csv
T00009607,09/22/24,2024-09-22 15:40:32,S014,C004909,Cash,89.65,8.97,1,gen_20251127_091606,transactions_header.csv
T00014701,09/14/24,2024-09-14 04:13:11,S019,C003647,Cash,$60.60,,3,gen_20251127_091607,transactions_header.csv
T00012221,2024-07-24,2024-07-24 19:23:34,S012,C000451,Cash,$40.93,0.0,1,gen_20251127_091607,transactions_header.csv
T00000696,11/19/24,2024-11-19 08:48:48,S019,C002265,Card,61.1,0.0,2,gen_20251127_091605,transactions_header.csv
T00009828,2024-01-18,2024-01-18 08:03:33,S022,,Card,3.17,0.48,3,gen_20251127_091606,transactions_header.csv
T00001428,2024-02-20,2024-02-20 12:40:15,S020,C001535,Card,40.11,4.01,1,gen_20251127_091605,transactions_header.csv
T00002458,01/25/24,2024-01-25 19:45:15,S018,C001688,Card,45.22,0.0,1,gen_20251127_091605,transactions_header.csv
T00018668,10/07/24,2024-10-07 23:42:27,S021,C000683,online,31.06,,1,gen_20251127_091607,transactions_header.csv
T00008063,12/02/24,2024-12-02 15:45:08,S030,C001268,Cash,49.41,0.0,3,gen_20251127_091606,transactions_header.csv
T00001513,05/23/24,2024-05-23 16:39:12,S028,C000332,Card,0,0.0,2,gen_20251127_091605,transactions_header.csv
T00007269,02/23/24,2024-02-23 23:03:12,S007,C003190,Cash,73.97,7.4,2,gen_20251127_091606,transactions_header.csv
T00015131,2024-09-27,2024-09-27 01:16:09,S025,C004941,Online,46.62,6.99,4,gen_20251127_091607,transactions_header.csv
T00009889,03/04/24,2024-03-04 15:34:09,S005,C003862,Cash,97.5,NA,1,gen_20251127_091606,transactions_header.csv
T00011286,05/19/24,2024-05-19 04:18:58,S011,C001002,Cash,26.46,1.32,5,gen_20251127_091606,transactions_header.csv
T00002827,01/21/24,2024-01-21 20:02:58,S002,C002839,Online,39.57,3.96,4,gen_20251127_091605,transactions_header.csv
T00019531,11/23/24,2024-11-23 03:19:12,S003,C002598,cash,$62.23,6.22,3,gen_20251127_091607,transactions_header.csv
T00008893,06/11/24,2024-06-11 21:03:18,S030,C001002,Online,91.22,0.0,6,gen_20251127_091606,transactions_header.csv
T00006735,05/29/24,2024-05-29 17:06:25,S024,C000450,online,58.12,8.72,1,gen_20251127_091606,transactions_header.csv
T00001289,2024-08-13,2024-08-13 00:04:29,S027,C004009,Cash,41.26,NA,1,gen_20251127_091605,transactions_header.csv
T00003212,2024-03-05,2024-03-05 02:48:42,S028,C004003,Online,21.43,2.14,1,gen_20251127_091606,transactions_header.csv
T00015531,2024-04-26,2024-04-26 14:26:22,S003,C003317,Online,63.63,0.0,1,gen_20251127_091607,transactions_header.csv
T00016480,2024-03-12,2024-03-12 02:27:51,S006,C004040,Cash,57.59,2.88,1,gen_20251127_091607,transactions_header.csv
T00004575,04/09/24,2024-04-09 15:38:46,S008,C004481,card,104.09,,3,gen_20251127_091606,transactions_header.csv
T00018809,10/23/24,2024-10-23 18:37:15,S012,NA,Cash,$41.25,6.19,2,gen_20251127_091607,transactions_header.csv
T00009947,12/21/24,2024-12-21 12:19:52,S008,C004913,Card,55.27,,1,gen_20251127_091606,transactions_header.csv
T00005020,07/24/24,2024-07-24 17:38:47,S018,C001705,Online,78.97,0.0,1,gen_20251127_091606,transactions_header.csv
T00006811,2024-11-08,2024-11-08 17:55:36,S001,C002320,Online,44.96,4.5,2,gen_20251127_091606,transactions_header.csv
T00000140,12/13/24,2024-12-13 15:59:14,S027,C003721,Cash,70.82,10.62,6,gen_20251127_091605,transactions_header.csv
T00002726,03/20/24,2024-03-20 08:15:18,S015,C002137,Card,55.04,NA,2,gen_20251127_091605,transactions_header.csv
T00001338,2024-05-29,2024-05-29 06:40:35,S027,C003184,Cash,86.02,8.6,2,gen_20251127_091605,transactions_header.csv
T00009878,2024-10-04,2024-10-04 02:12:25,S027,C000511,Online,10.64,0.53,2,gen_20251127_091606,transactions_header.csv
T00007576,2024-04-04,2024-04-04 22:52:17,S002,C002936,card,$0.00,0,1,gen_20251127_091606,transactions_header.csv
T00003143,07/14/24,2024-07-14 07:52:33,S007,C001012,Card,23.39,1.17,7,gen_20251127_091606,transactions_header.csv
T00013644,2024-04-05,2024-04-05 10:24:35,S018,NA,Card,63.05,6.3,1,gen_20251127_091607,transactions_header.csv
T00012037,2024-10-03,2024-10-03 06:46:24,S029,C004609,Card,46.03,6.9,3,gen_20251127_091607,transactions_header.csv
T00003170,2024-01-27,2024-01-27 14:01:50,S011,C003237,Online,14.61,2.19,2,gen_20251127_091606,transactions_header.csv
T00007135,2024-02-22,2024-02-22 10:07:20,S009,C002348,Cash,18.46,0.0,5,gen_20251127_091606,transactions_header.csv
T00013921,01/26/24,2024-01-26 12:19:20,S019,C004386,Online,62.01,6.2,5,gen_20251127_091607,transactions_header.csv
T00012296,2024-05-14,2024-05-14 16:50:57,S003,C004325,Cash,20.38,1.02,7,gen_20251127_091607,transactions_header.csv
T00015507,2024-07-15,2024-07-15 00:20:03,S030,C003121,Cash,$24.80,0.0,2,gen_20251127_091607,transactions_header.csv
T00004464,06/12/24,2024-06-12 07:02:34,S019,,Online,78.87,7.89,1,gen_20251127_091606,transactions_header.csv
T00011052,09/11/24,2024-09-11 12:58:24,S017,C003983,Card,57.54,,2,gen_20251127_091606,transactions_header.csv
T00003214,2024-09-12,2024-09-12 18:18:05,S007,C003639,Online,52.88,NA,1,gen_20251127_091606,transactions_header.csv
T00014678,06/04/24,2024-06-04 16:33:34,S030,C001605,Online,63.47,6.35,1,gen_20251127_091607,transactions_header.csv
T00005633,2024-03-30,2024-03-30 10:21:26,S014,C000295,Cash,41.41,4.14,4,gen_20251127_091606,transactions_header.csv
T00008142,2024-09-13,2024-09-13 07:43:36,S004,C001452,Online,27.47,,5,gen_20251127_091606,transactions_header.csv
T00003287,2024-11-22,2024-11-22 08:20:18,S005,C000842,Online,81.33,0.0,1,gen_20251127_091606,transactions_header.csv
T00005183,2024-04-30,2024-04-30 16:05:41,S011,C000697,Card,43.44,2.17,1,gen_20251127_091606,transactions_header.csv
T00011869,2024-04-16,2024-04-16 19:32:08,S001,C003294,Cash,37.14,5.57,1,gen_20251127_091607,transactions_header.csv
T00011725,06/18/24,2024-06-18 20:21:42,S009,C003944,Online,81.5,4.08,2,gen_20251127_091607,transactions_header.csv
T00014843,2024-05-28,2024-05-28 00:15:16,S029,C000229,Card,12.82,0.64,3,gen_20251127_091607,transactions_header.csv
T00006804,01/17/24,2024-01-17 02:27:05,S022,C002477,Card,71.64,7.16,4,gen_20251127_091606,transactions_header.csv
T00003354,11/06/24,2024-11-06 14:21:41,S024,C004401,Cash,39.42,,1,gen_20251127_091606,transactions_header.csv
T00003231,2024-10-20,2024-10-20 03:55:44,S028,C003035,Online,84.23,8.42,6,gen_20251127_091606,transactions_header.csv
T00018734,05/20/24,2024-05-20 03:46:08,S005,C004681,Card,2.1,0.32,1,gen_20251127_091607,transactions_header.csv
T00017139,07/12/24,2024-07-12 08:29:11,S025,,Online,35.23,3.52,4,gen_20251127_091607,transactions_header.csv
T00019860,09/20/24,2024-09-20 12:54:55,S017,C000060,Online,45.33,4.53,1,gen_20251127_091607,transactions_header.csv
T00010511,01/25/24,2024-01-25 23:29:01,S008,C002022,Card,97.77,9.78,2,gen_20251127_091606,transactions_header.csv
T00005679,2024-08-25,2024-08-25 21:35:10,S021,C003711,Online,54.46,5.45,2,gen_20251127_091606,transactions_header.csv
T00010002,02/10/24,2024-02-10 15:27:59,S022,C000269,Card,77.8,11.67,2,gen_20251127_091606,transactions_header.csv
T00014384,07/17/24,2024-07-17 04:28:10,S015,C001545,Card,30.8,4.62,1,gen_20251127_091607,transactions_header.csv
T00015056,2024-01-27,2024-01-27 05:23:00,S025,C002203,online,32.78,3.28,1,gen_20251127_091607,transactions_header.csv
T00002688,2024-08-08,2024-08-08 20:37:13,S013,C004647,Online,108.48,5.42,1,gen_20251127_091605,transactions_header.csv
T00011271,2024-10-01,2024-10-01 13:25:18,S017,C004647,Cash,4.48,0.22,2,gen_20251127_091606,transactions_header.csv
T00018397,12/19/24,2024-12-19 19:20:09,S017,C000380,Online,59.76,2.99,2,gen_20251127_091607,transactions_header.csv
T00008695,2024-08-29,2024-08-29 04:23:02,S025,,Card,66.55,6.66,1,gen_20251127_091606,transactions_header.csv
T00016625,2024-01-14,2024-01-14 02:02:21,S014,C000306,Card,116.55,,1,gen_20251127_091607,transactions_header.csv
T00002236,05/09/24,2024-05-09 22:43:57,S007,C004933,Card,45.29,,1,gen_20251127_091605,transactions_header.csv
T00008747,2024-07-21,2024-07-21 03:07:48,S010,C002950,Cash,18.7,0.0,1,gen_20251127_091606,transactions_header.csv
T00010385,01/03/24,2024-01-03 01:13:02,S028,C001726,Online,51.39,0.0,3,gen_20251127_091606,transactions_header.csv
T00002278,2024-04-21,2024-04-21 19:02:19,S008,C002458,Cash,70.4,10.56,3,gen_20251127_091605,transactions_header.csv
T00002009,09/04/24,2024-09-04 01:50:16,S030,C003758,Online,61.0,0.0,3,gen_20251127_091605,transactions_header.csv
T00013803,09/14/24,2024-09-14 04:36:45,S004,C002692,Card,21.67,2.17,2,gen_20251127_091607,transactions_header.csv
T00015731,2024-11-30,2024-11-30 16:45:50,S030,C003267,Online,52.94,0.0,1,gen_20251127_091607,transactions_header.csv
T00018029,01/15/24,2024-01-15 01:51:40,S024,C004561,Cash,34.7,1.74,5,gen_20251127_091607,transactions_header.csv
T00007039,2024-05-20,2024-05-20 10:30:22,S026,C003881,Card,44.76,NA,3,gen_20251127_091606,transactions_header.csv
T00004990,2024-11-27,2024-11-27 04:49:18,S004,C002462,Cash,24.68,0.0,2,gen_20251127_091606,transactions_header.csv
T00010539,2024-07-30,2024-07-30 13:08:57,S025,C004233,Online,$29.56,2.96,2,gen_20251127_091606,transactions_header.csv
T00011248,05/31/24,2024-05-31 16:39:51,S029,C001116,Card,56.52,,2,gen_20251127_091606,transactions_header.csv
T00004352,2024-06-11,2024-06-11 03:33:51,S024,C000865,Cash,13.79,0.69,2,gen_20251127_091606,transactions_header.csv
T00014459,01/27/24,2024-01-27 19:58:54,S028,C004258,Online,3.39,0.0,1,gen_20251127_091607,transactions_header.csv
T00007287,04/13/24,2024-04-13 04:39:53,S024,,Online,30.61,1.53,1,gen_20251127_091606,transactions_header.csv
T00012691,01/25/24,2024-01-25 23:19:39,S029,C003489,Cash,41.98,0.0,1,gen_20251127_091607,transactions_header.csv
T00016363,11/21/24,2024-11-21 20:54:45,S006,C002682,Cash,92.08,0.0,3,gen_20251127_091607,transactions_header.csv
T00009458,2024-05-05,2024-05-05 14:06:40,S030,C004323,online,48.91,2.45,4,gen_20251127_091606,transactions_header.csv
T00019858,2024-11-11,2024-11-11 13:04:35,S001,C001324,Online,36.25,3.62,3,gen_20251127_091607,transactions_header.csv
T00019262,2024-01-06,2024-01-06 16:25:17,S001,,Cash,50.82,2.54,2,gen_20251127_091607,transactions_header.csv
T00002496,09/01/24,2024-09-01 15:23:43,S011,C001614,Cash,39.73,3.97,1,gen_20251127_091605,transactions_header.csv
T00010444,01/17/24,2024-01-17 22:42:23,S016,C003294,Online,71.21,10.68,2,gen_20251127_091606,transactions_header.csv
T00018054,06/08/24,2024-06-08 23:09:49,S008,C004992,Online,71.52,3.58,3,gen_20251127_091607,transactions_header.csv
T00002580,2024-06-14,2024-06-14 14:44:20,S016,C003744,Cash,87.32,4.37,1,gen_20251127_091605,transactions_header.csv
T00008827,04/02/24,2024-04-02 08:01:00,S028,,Cash,23.85,2.39,1,gen_20251127_091606,transactions_header.csv
T00019050,2024-01-31,2024-01-31 23:43:34,S006,,Card,86.18,0.0,2,gen_20251127_091607,transactions_header.csv
T00004075,2024-04-08,2024-04-08 03:58:03,S008,,Online,45.71,2.29,3,gen_20251127_091606,transactions_header.csv
T00016537,2024-09-09,2024-09-09 19:31:11,S001,C003387,Cash,0,0,1,gen_20251127_091607,transactions_header.csv
T00019941,11/02/24,2024-11-02 14:06:01,S030,C000339,Card,84.13,0.0,7,gen_20251127_091607,transactions_header.csv
T00018267,11/05/24,2024-11-05 19:11:19,S024,C003758,Online,59.54,NA,1,gen_20251127_091607,transactions_header.csv
T00004642,03/15/24,2024-03-15 17:29:29,S012,C003846,Card,75.75,11.36,1,gen_20251127_091606,transactions_header.csv
T00008352,04/20/24,2024-04-20 16:47:53,S018,C000988,Cash,35.53,,2,gen_20251127_091606,transactions_header.csv
T00015270,2024-01-15,2024-01-15 03:04:36,S002,C001588,Online,128.16,12.82,2,gen_20251127_091607,transactions_header.csv
T00001494,2024-04-04,2024-04-04 23:50:25,S015,C002251,Cash,46.9,7.03,1,gen_20251127_091605,transactions_header.csv
T00009708,2024-02-07,2024-02-07 19:45:23,S020,C001240,Cash,57.3,2.87,4,gen_20251127_091606,transactions_header.csv
T00012396,03/09/24,2024-03-09 12:36:48,S015,C001632,Online,3.99,0.0,1,gen_20251127_091607,transactions_header.csv
T00014655,2024-10-18,2024-10-18 15:25:26,S026,C000492,Online,40.33,4.03,1,gen_20251127_091607,transactions_header.csv
T00013956,12/17/24,2024-12-17 03:09:22,S029,C004780,Cash,71.43,7.14,1,gen_20251127_091607,transactions_header.csv
T00013409,2024-11-20,2024-11-20 03:58:44,S011,C004298,Online,44.1,0.0,2,gen_20251127_091607,transactions_header.csv
T00005929,2024-01-11,2024-01-11 12:48:20,S001,C000469,Cash,52.88,2.64,1,gen_20251127_091606,transactions_header.csv
T00012540,2024-12-29,2024-12-29 00:22:20,S020,C003660,Online,-13.11,0.66,1,gen_20251127_091607,transactions_header.csv
T00010159,2024-07-11,2024-07-11 05:15:04,S007,NA,Online,79.11,7.91,1,gen_20251127_091606,transactions_header.csv
T00006700,2024-01-22,2024-01-22 15:30:16,S022,,Card,0,0.0,1,gen_20251127_091606,transactions_header.csv
T00015520,2024-09-15,2024-09-15 02:14:58,S015,C000092,Online,18.36,0.92,1,gen_20251127_091607,transactions_header.csv
T00012012,2024-05-16,2024-05-16 08:43:54,S022,C001893,Card,60.57,0.0,3,gen_20251127_091607,transactions_header.csv
T00016721,05/23/24,2024-05-23 07:37:15,S005,,Card,39.17,1.96,5,gen_20251127_091607,transactions_header.csv
T00007699,2024-07-17,2024-07-17 06:19:05,S006,C002432,Card,23.34,,6,gen_20251127_091606,transactions_header.csv
T00001298,10/05/24,2024-10-05 01:06:41,S015,C002555,Online,54.24,8.14,2,gen_20251127_091605,transactions_header.csv
T00018035,2024-10-03,2024-10-03 21:17:37,S019,C003112,Card,57.6,5.76,3,gen_20251127_091607,transactions_header.csv
T00000211,11/14/24,2024-11-14 05:41:02,S025,C002218,Card,20.77,3.12,1,gen_20251127_091605,transactions_header.csv
T00005144,2024-01-13,2024-01-13 20:42:11,S008,C003279,Cash,65.26,9.79,3,gen_20251127_091606,transactions_header.csv
T00015492,04/22/24,2024-04-22 18:07:09,S004,C000281,Cash,82.04,4.1,1,gen_20251127_091607,transactions_header.csv
T00019713,05/07/24,2024-05-07 03:17:14,S017,C004156,Card,61.4,9.21,3,gen_20251127_091607,transactions_header.csv
T00014372,06/25/24,2024-06-25 06:20:50,S026,C000980,card,76.94,,1,gen_20251127_091607,transactions_header.csv
T00013044,08/07/24,2024-08-07 22:15:32,S015,C001361,Card,62.52,9.38,3,gen_20251127_091607,transactions_header.csv
T00019109,09/10/24,2024-09-10 19:53:06,S026,C003782,Cash,99.93,9.99,1,gen_20251127_091607,transactions_header.csv
T00015830,2024-07-22,2024-07-22 04:56:02,S030,C001312,Online,45.56,2.28,6,gen_20251127_091607,transactions_header.csv
T00002141,2024-05-10,2024-05-10 12:29:08,S023,C000901,Cash,46.0,0.0,2,gen_20251127_091605,transactions_header.csv
T00009807,2024-08-30,2024-08-30 19:49:27,S011,C003047,Cash,56.89,2.84,1,gen_20251127_091606,transactions_header.csv
T00011818,04/17/24,2024-04-17 07:32:55,S025,C001182,Cash,59.93,0.0,1,gen_20251127_091607,transactions_header.csv
T00012246,08/05/24,2024-08-05 11:39:41,S001,C004706,Cash,6.33,0.0,2,gen_20251127_091607,transactions_header.csv
T00000425,05/29/24,2024-05-29 12:22:18,S013,C003964,Online,$36.01,5.4,1,gen_20251127_091605,transactions_header.csv
T00011763,12/15/24,2024-12-15 20:03:54,S003,C003947,Cash,68.92,6.89,1,gen_20251127_091607,transactions_header.csv
T00003922,2024-07-14,2024-07-14 19:58:04,S015,C004377,Card,$47.31,4.73,2,gen_20251127_091606,transactions_header.csv
T00012930,2024-10-15,2024-10-15 12:26:17,S022,C003926,Cash,57.05,8.56,5,gen_20251127_091607,transactions_header.csv
T00019077,2024-03-19,2024-03-19 07:43:28,S028,C000308,Card,51.46,7.72,1,gen_20251127_091607,transactions_header.csv
T00010672,2024-05-11,2024-05-11 01:14:53,S006,C001528,Card,34.93,5.24,1,gen_20251127_091606,transactions_header.csv
T00008929,07/22/24,2024-07-22 22:34:50,S011,C003073,Card,23.55,3.53,4,gen_20251127_091606,transactions_header.csv
T00011839,2024-11-30,2024-11-30 14:32:38,S016,C002877,online,$44.67,0.0,2,gen_20251127_091607,transactions_header.csv
T00004195,2024-06-13,2024-06-13 00:08:23,S026,C002195,Online,70.65,0.0,1,gen_20251127_091606,transactions_header.csv
T00012026,09/30/24,2024-09-30 16:58:12,S016,C003113,Cash,31.11,NA,1,gen_20251127_091607,transactions_header.csv
T00016549,2024-04-12,2024-04-12 19:24:04,S021,C001999,Cash,78.37,11.76,4,gen_20251127_091607,transactions_header.csv
T00012841,2024-06-29,2024-06-29 00:28:18,S002,,Online,20.14,,1,gen_20251127_091607,transactions_header.csv
T00009617,2024-09-21,2024-09-21 11:28:40,S003,C001688,Online,131.85,19.78,2,gen_20251127_091606,transactions_header.csv
T00001347,10/24/24,2024-10-24 15:43:58,S010,C003479,Cash,71.99,10.8,1,gen_20251127_091605,transactions_header.csv
T00014218,08/02/24,2024-08-02 20:06:32,S025,C001068,Cash,86.73,4.34,1,gen_20251127_091607,transactions_header.csv
T00008509,2024-04-28,2024-04-28 09:17:02,S018,C000007,Card,11.89,0.0,3,gen_20251127_091606,transactions_header.csv
T00008301,02/25/24,2024-02-25 21:26:59,S005,C001436,Online,13.99,2.1,1,gen_20251127_091606,transactions_header.csv
T00000328,2024-11-30,2024-11-30 16:45:15,S019,C001189,Cash,26.34,1.32,2,gen_20251127_091605,transactions_header.csv
T00011744,04/27/24,2024-04-27 16:23:25,S027,C001408,Cash,87.54,8.75,1,gen_20251127_091607,transactions_header.csv
T00002982,2024-07-15,2024-07-15 04:00:22,S008,C000165,cash,55.31,2.77,2,gen_20251127_091606,transactions_header.csv
T00016469,09/06/24,2024-09-06 23:27:54,S026,C001736,Online,$23.78,2.38,2,gen_20251127_091607,transactions_header.csv
T00012888,2024-06-28,2024-06-28 05:52:02,S022,NA,Card,72.65,10.9,5,gen_20251127_091607,transactions_header.csv
T00000721,2024-07-22,2024-07-22 00:06:12,S011,C000321,Cash,64.54,0.0,2,gen_20251127_091605,transactions_header.csv
T00019265,2024-08-24,2024-08-24 12:35:03,S018,C002770,Card,31.63,0.0,1,gen_20251127_091607,transactions_header.csv
T00007004,2024-10-06,2024-10-06 16:35:04,S004,C000693,Cash,46.79,7.02,1,gen_20251127_091606,transactions_header.csv
T00018201,2024-08-17,2024-08-17 15:27:00,S015,C002436,Online,92.32,4.62,3,gen_20251127_091607,transactions_header.csv
T00014645,10/31/24,2024-10-31 18:58:04,S011,C000654,Cash,70.78,0.0,1,gen_20251127_091607,transactions_header.csv
T00006904,2024-12-18,2024-12-18 21:55:56,S030,,Card,0,0.0,1,gen_20251127_091606,transactions_header.csv
T00008047,2024-09-16,2024-09-16 08:14:12,S013,C004462,card,72.14,0.0,4,gen_20251127_091606,transactions_header.csv
T00000089,12/18/24,2024-12-18 02:38:09,S017,C003935,Online,25.67,2.57,1,gen_20251127_091605,transactions_header.csv
T00019270,2024-11-16,2024-11-16 05:16:36,S015,C003317,Cash,93.03,0.0,4,gen_20251127_091607,transactions_header.csv
T00005141,08/21/24,2024-08-21 09:45:33,S020,C000295,Cash,54.31,5.43,2,gen_20251127_091606,transactions_header.csv
T00016180,03/02/24,2024-03-02 18:23:51,S023,C002122,Card,22.68,0.0,5,gen_20251127_091607,transactions_header.csv
T00017126,08/28/24,2024-08-28 13:46:30,S029,C003688,Online,59.93,3.0,1,gen_20251127_091607,transactions_header.csv
T00001871,01/01/24,2024-01-01 21:15:30,S030,C000094,Card,0,0.0,3,gen_20251127_091605,transactions_header.csv
T00013299,2024-11-23,2024-11-23 11:28:50,S027,C004952,Card,28.4,2.84,1,gen_20251127_091607,transactions_header.csv
T00008671,2024-07-04,2024-07-04 18:04:52,S017,C002603,Cash,85.26,,1,gen_20251127_091606,transactions_header.csv
T00003480,02/12/24,2024-02-12 01:33:35,S006,C002371,Online,59.05,5.91,1,gen_20251127_091606,transactions_header.csv
T00005457,2024-04-02,2024-04-02 14:52:24,S019,C003185,Cash,0,,2,gen_20251127_091606,transactions_header.csv
T00006546,05/17/24,2024-05-17 02:56:30,S013,C002033,Online,0,0.0,1,gen_20251127_091606,transactions_header.csv
T00004955,2024-04-29,2024-04-29 13:18:03,S012,C004938,Cash,121.83,18.27,1,gen_20251127_091606,transactions_header.csv
T00012270,11/01/24,2024-11-01 06:26:13,S003,C002939,Online,6.4,0.64,2,gen_20251127_091607,transactions_header.csv
T00009933,2024-12-21,2024-12-21 22:39:52,S021,C004708,Cash,18.79,2.82,2,gen_20251127_091606,transactions_header.csv
T00008242,05/16/24,2024-05-16 00:44:28,S014,C003527,Cash,59.99,3.0,2,gen_20251127_091606,transactions_header.csv
T00007740,2024-10-30,2024-10-30 01:02:16,S023,C004374,Online,21.5,3.23,2,gen_20251127_091606,transactions_header.csv
T00019364,2024-03-01,2024-03-01 00:08:48,S019,C001727,Online,120.09,0.0,3,gen_20251127_091607,transactions_header.csv
T00015860,2024-06-30,2024-06-30 23:15:27,S010,C000064,Card,64.43,9.66,3,gen_20251127_091607,transactions_header.csv
T00002451,2024-04-25,2024-04-25 08:06:05,S004,C004604,Card,63.56,3.18,6,gen_20251127_091605,transactions_header.csv
T00002535,08/22/24,2024-08-22 03:18:02,S016,C002133,Card,2.38,,2,gen_20251127_091605,transactions_header.csv
T00006552,2024-10-30,2024-10-30 14:17:36,S011,C003607,Card,51.61,5.16,1,gen_20251127_091606,transactions_header.csv
T00018600,10/18/24,2024-10-18 08:16:56,S025,C003334,Card,60.23,6.02,1,gen_20251127_091607,transactions_header.csv
T00015317,12/31/24,2024-12-31 07:01:30,S015,C004584,Online,58.56,5.86,3,gen_20251127_091607,transactions_header.csv
T00011828,10/07/24,2024-10-07 03:49:55,S002,C002570,Cash,72.67,NA,1,gen_20251127_091607,transactions_header.csv
T00011087,10/31/24,2024-10-31 00:48:00,S020,C003374,online,12.97,1.95,3,gen_20251127_091606,transactions_header.csv
T00018476,2024-08-31,2024-08-31 00:52:11,S012,,Card,57.51,2.88,2,gen_20251127_091607,transactions_header.csv
T00003586,09/08/24,2024-09-08 12:50:01,S018,C001979,Online,69.24,10.39,2,gen_20251127_091606,transactions_header.csv
T00009148,2024-01-14,2024-01-14 16:41:51,S030,C000054,Online,77.09,11.56,7,gen_20251127_091606,transactions_header.csv
T00016834,2024-07-08,2024-07-08 22:38:26,S022,C002052,Online,45.86,6.88,3,gen_20251127_091607,transactions_header.csv
T00005752,03/15/24,2024-03-15 10:22:33,S003,C002808,Cash,50.1,0.0,1,gen_20251127_091606,transactions_header.csv
T00011626,12/12/24,2024-12-12 20:39:49,S002,C004263,Card,48.7,7.3,4,gen_20251127_091606,transactions_header.csv
T00016951,02/27/24,2024-02-27 16:38:24,S007,C003360,Online,36.96,0.0,1,gen_20251127_091607,transactions_header.csv
T00002248,08/22/24,2024-08-22 15:01:07,S007,C004934,Online,8.88,0.44,2,gen_20251127_091605,transactions_header.csv
T00014904,12/08/24,2024-12-08 05:21:54,S026,,Card,39.66,3.97,5,gen_20251127_091607,transactions_header.csv
T00001643,2024-07-06,2024-07-06 00:19:27,S028,C004838,Card,121.83,12.18,1,gen_20251127_091605,transactions_header.csv
T00004635,01/13/24,2024-01-13 12:02:06,S004,C001568,Card,0,0.0,1,gen_20251127_091606,transactions_header.csv
T00006507,12/07/24,2024-12-07 22:04:52,S018,C001220,Cash,72.47,0.0,1,gen_20251127_091606,transactions_header.csv
T00004597,2024-08-14,2024-08-14 08:25:39,S012,C001420,card,80.84,4.04,5,gen_20251127_091606,transactions_header.csv
T00005060,12/10/24,2024-12-10 03:22:19,S013,C004373,Cash,96.86,4.84,1,gen_20251127_091606,transactions_header.csv
T00008029,08/12/24,2024-08-12 11:24:44,S007,,Cash,4.29,0.43,1,gen_20251127_091606,transactions_header.csv
T00007714,2024-06-11,2024-06-11 22:59:46,S013,C000489,Online,29.64,2.96,2,gen_20251127_091606,transactions_header.csv
T00001273,01/13/24,2024-01-13 10:55:35,S023,C001607,Online,7.95,1.19,2,gen_20251127_091605,transactions_header.csv
T00017636,2024-08-31,2024-08-31 12:44:59,S020,C004370,Online,63.81,,1,gen_20251127_091607,transactions_header.csv
T00012402,04/18/24,2024-04-18 22:19:06,S028,C002814,Online,21.69,0.0,1,gen_20251127_091607,transactions_header.csv
T00009192,09/24/24,2024-09-24 22:43:06,S030,NA,Online,87.04,8.7,2,gen_20251127_091606,transactions_header.csv
T00006356,06/19/24,2024-06-19 10:16:56,S018,C004498,Online,68.04,10.21,2,gen_20251127_091606,transactions_header.csv
T00003861,2024-04-12,2024-04-12 05:08:22,S005,C001043,card,54.7,5.47,1,gen_20251127_091606,transactions_header.csv
T00003387,2024-11-28,2024-11-28 03:33:10,S012,C001016,Card,82.3,4.12,1,gen_20251127_091606,transactions_header.csv
T00000972,2024-09-25,2024-09-25 06:17:47,S016,C000105,Online,25.87,1.29,1,gen_20251127_091605,transactions_header.csv
T00013486,05/07/24,2024-05-07 20:00:59,S006,,Online,81.45,4.07,3,gen_20251127_091607,transactions_header.csv
T00006495,2024-09-10,2024-09-10 16:32:36,S023,C002285,Online,$16.79,,3,gen_20251127_091606,transactions_header.csv
T00018818,07/06/24,2024-07-06 11:38:20,S023,C001871,Online,62.64,9.4,1,gen_20251127_091607,transactions_header.csv
T00006367,2024-09-30,2024-09-30 12:17:25,S007,C000230,Card,66.09,0.0,1,gen_20251127_091606,transactions_header.csv
T00018827,02/20/24,2024-02-20 17:25:36,S012,C001324,Cash,0,0.0,3,gen_20251127_091607,transactions_header.csv
T00007418,08/01/24,2024-08-01 12:15:37,S020,C003236,Cash,51.88,2.59,4,gen_20251127_091606,transactions_header.csv
T00015868,2024-01-11,2024-01-11 02:38:58,S008,C000105,Card,0,0.0,1,gen_20251127_091607,transactions_header.csv
T00007376,04/05/24,2024-04-05 14:32:59,S022,C002525,Cash,31.47,,1,gen_20251127_091606,transactions_header.csv
T00008179,07/09/24,2024-07-09 23:37:06,S016,C004990,Online,55.47,8.32,1,gen_20251127_091606,transactions_header.csv
T00005909,11/23/24,2024-11-23 19:29:10,S001,C002369,Card,40.98,6.15,1,gen_20251127_091606,transactions_header.csv
T00003756,02/29/24,2024-02-29 06:06:51,S006,,Online,0,0.0,2,gen_20251127_091606,transactions_header.csv
T00016154,12/10/24,2024-12-10 14:43:02,S008,C002290,Online,37.91,5.69,4,gen_20251127_091607,transactions_header.csv
T00013905,2024-06-14,2024-06-14 23:39:30,S009,C000896,Cash,66.18,,1,gen_20251127_091607,transactions_header.csv
T00007500,06/02/24,2024-06-02 09:40:49,S012,NA,Online,53.52,8.03,6,gen_20251127_091606,transactions_header.csv
T00017842,03/05/24,2024-03-05 21:39:29,S021,C003909,Card,25.02,2.5,2,gen_20251127_091607,transactions_header.csv
T00003975,12/06/24,2024-12-06 10:14:54,S007,C004817,Cash,21.23,1.06,3,gen_20251127_091606,transactions_header.csv
T00015022,03/16/24,2024-03-16 14:41:25,S023,,Online,46.8,NA,1,gen_20251127_091607,transactions_header.csv
T00008617,2024-12-07,2024-12-07 22:00:20,S012,C000809,Cash,82.39,12.36,6,gen_20251127_091606,transactions_header.csv
T00006293,2024-11-04,2024-11-04 23:03:44,S012,C000489,Cash,41.98,2.1,1,gen_20251127_091606,transactions_header.csv
T00018609,08/06/24,2024-08-06 19:14:51,S026,C002711,Card,31.09,0.0,1,gen_20251127_091607,transactions_header.csv
T00009467,2024-06-03,2024-06-03 18:08:42,S013,C001669,Online,88.45,4.42,1,gen_20251127_091606,transactions_header.csv
T00004615,08/24/24,2024-08-24 08:28:43,S027,C001250,Online,33.09,1.65,4,gen_20251127_091606,transactions_header.csv
T00001454,2024-11-08,2024-11-08 18:27:20,S020,C002295,Card,48.02,2.4,4,gen_20251127_091605,transactions_header.csv
T00010416,2024-04-27,2024-04-27 08:25:47,S018,C000039,Cash,$49.70,0.0,1,gen_20251127_091606,transactions_header.csv
T00012861,2024-11-18,2024-11-18 13:28:21,S013,,cash,82.67,12.4,1,gen_20251127_091607,transactions_header.csv
T00004739,2024-09-11,2024-09-11 11:26:37,S012,C000394,Online,52.1,0.0,4,gen_20251127_091606,transactions_header.csv
T00003353,12/17/24,2024-12-17 16:24:22,S013,C004913,Cash,11.29,1.13,5,gen_20251127_091606,transactions_header.csv
T00016988,08/20/24,2024-08-20 15:37:39,S012,C001037,Card,89.58,8.96,1,gen_20251127_091607,transactions_header.csv
T00012752,2024-10-07,2024-10-07 14:18:31,S023,C000451,Online,67.33,10.1,1,gen_20251127_091607,transactions_header.csv
T00019842,2024-09-18,2024-09-18 19:17:41,S016,,Cash,100.83,15.12,4,gen_20251127_091607,transactions_header.csv
T00014135,2024-08-22,2024-08-22 23:31:02,S020,,online,45.95,,1,gen_20251127_091607,transactions_header.csv
T00006030,2024-01-29,2024-01-29 16:28:41,S008,C002337,Online,96.09,4.8,2,gen_20251127_091606,transactions_header.csv
T00003416,2024-01-27,2024-01-27 12:09:20,S012,C000168,Cash,79.58,0.0,3,gen_20251127_091606,transactions_header.csv
T00003335,2024-07-03,2024-07-03 23:00:31,S019,C003736,Cash,75.95,11.39,3,gen_20251127_091606,transactions_header.csv
T00004443,2024-02-25,2024-02-25 04:46:27,S022,C000500,Online,59.77,0.0,2,gen_20251127_091606,transactions_header.csv
T00000222,04/29/24,2024-04-29 02:53:28,S025,C000305,Cash,73.21,3.66,2,gen_20251127_091605,transactions_header.csv
T00002504,02/24/24,2024-02-24 02:15:05,S004,C004808,Cash,67.25,0.0,1,gen_20251127_091605,transactions_header.csv
T00005228,2024-08-16,2024-08-16 01:07:32,S012,,Online,39.64,1.98,4,gen_20251127_091606,transactions_header.csv
T00010796,2024-06-12,2024-06-12 05:29:14,S025,C003313,Online,106.62,0.0,8,gen_20251127_091606,transactions_header.csv
T00005934,2024-05-31,2024-05-31 00:24:06,S008,C003528,Cash,21.16,1.06,2,gen_20251127_091606,transactions_header.csv
T00000500,04/19/24,2024-04-19 06:38:06,S014,C004747,Cash,65.46,9.82,1,gen_20251127_091605,transactions_header.csv
T00013139,02/02/24,2024-02-02 04:02:18,S026,C003804,Online,79.93,7.99,2,gen_20251127_091607,transactions_header.csv
T00017889,04/24/24,2024-04-24 09:37:04,S028,C003658,Online,79.24,7.92,1,gen_20251127_091607,transactions_header.csv
T00019968,2024-07-12,2024-07-12 09:49:49,S016,,Cash,70.41,0.0,2,gen_20251127_091607,transactions_header.csv
T00002320,07/23/24,2024-07-23 10:03:04,S009,C004087,Cash,32.29,3.23,1,gen_20251127_091605,transactions_header.csv
T00008779,08/02/24,2024-08-02 23:50:36,S021,NA,Cash,0,0.0,1,gen_20251127_091606,transactions_header.csv
T00005793,2024-11-27,2024-11-27 03:40:57,S003,C003694,Card,34.03,0.0,2,gen_20251127_091606,transactions_header.csv
T00018282,2024-08-03,2024-08-03 02:25:09,S009,C002630,Card,22.29,1.11,1,gen_20251127_091607,transactions_header.csv
T00006423,07/06/24,2024-07-06 13:15:26,S002,C004962,Card,42.94,6.44,1,gen_20251127_091606,transactions_header.csv
T00019800,2024-12-13,2024-12-13 05:33:46,S026,C000975,Cash,87.54,13.13,1,gen_20251127_091607,transactions_header.csv
T00011666,2024-06-10,2024-06-10 11:47:08,S005,,Card,64.86,9.73,1,gen_20251127_091607,transactions_header.csv
T00013089,2024-04-17,2024-04-17 15:05:02,S019,C000587,Card,56.86,2.84,2,gen_20251127_091607,transactions_header.csv
T00007362,2024-07-10,2024-07-10 02:57:22,S004,C003949,Online,54.92,5.49,1,gen_20251127_091606,transactions_header.csv
T00000467,10/02/24,2024-10-02 20:46:50,S019,,Card,88.94,NA,3,gen_20251127_091605,transactions_header.csv
T00000060,2024-01-17,2024-01-17 23:47:18,S015,C003842,Card,$21.78,1.09,2,gen_20251127_091605,transactions_header.csv
T00017614,07/17/24,2024-07-17 00:21:23,S009,,cash,23.15,3.47,2,gen_20251127_091607,transactions_header.csv
T00007183,09/21/24,2024-09-21 15:28:52,S008,C004666,Cash,41.21,2.06,1,gen_20251127_091606,transactions_header.csv
T00019912,06/05/24,2024-06-05 01:31:49,S021,C004177,Card,58.13,8.72,1,gen_20251127_091607,transactions_header.csv
T00007749,2024-01-01,2024-01-01 00:24:57,S022,C001766,Cash,39.13,NA,2,gen_20251127_091606,transactions_header.csv
T00003311,11/19/24,2024-11-19 23:48:42,S002,C000571,Cash,52.4,7.86,1,gen_20251127_091606,transactions_header.csv
T00019870,03/18/24,2024-03-18 14:45:00,S001,C002846,Online,58.88,0.0,2,gen_20251127_091607,transactions_header.csv
T00004070,2024-02-22,2024-02-22 09:51:28,S013,C002205,Cash,24.9,1.25,5,gen_20251127_091606,transactions_header.csv
T00010301,2024-01-24,2024-01-24 16:47:49,S006,C003554,Card,65.96,6.6,1,gen_20251127_091606,transactions_header.csv
T00016925,01/04/24,2024-01-04 07:53:10,S002,C002994,Cash,60.25,3.01,5,gen_20251127_091607,transactions_header.csv
T00013492,05/28/24,2024-05-28 09:08:26,S018,C004857,Cash,43.06,2.15,2,gen_20251127_091607,transactions_header.csv
T00019559,2024-05-23,2024-05-23 15:32:15,S003,C000120,Online,51.86,2.59,1,gen_20251127_091607,transactions_header.csv
T00015956,04/30/24,2024-04-30 10:05:20,S003,C004890,Online,21.48,0.0,3,gen_20251127_091607,transactions_header.csv
T00012418,2024-09-15,2024-09-15 08:29:43,S006,,Card,42.49,,1,gen_20251127_091607,transactions_header.csv
T00007098,2024-07-30,2024-07-30 22:14:03,S030,C004838,Online,54.36,0.0,2,gen_20251127_091606,transactions_header.csv
T00000879,2024-10-22,2024-10-22 16:37:19,S020,C002546,Online,41.44,2.07,5,gen_20251127_091605,transactions_header.csv
T00006849,2024-07-05,2024-07-05 22:55:20,S013,C001798,Online,59.96,6.0,3,gen_20251127_091606,transactions_header.csv
T00017024,06/12/24,2024-06-12 14:24:44,S002,C004449,Cash,77.97,7.8,3,gen_20251127_091607,transactions_header.csv
T00017476,07/27/24,2024-07-27 13:11:54,S003,C001633,Online,49.65,4.96,7,gen_20251127_091607,transactions_header.csv
T00010929,02/26/24,2024-02-26 19:24:27,S007,C000549,Card,34.75,5.21,1,gen_20251127_091606,transactions_header.csv
T00013031,12/29/24,2024-12-29 05:11:54,S025,C000581,Cash,51.88,7.78,1,gen_20251127_091607,transactions_header.csv
T00004822,06/06/24,2024-06-06 04:25:56,S029,C002754,Card,64.41,0.0,1,gen_20251127_091606,transactions_header.csv
T00005599,06/29/24,2024-06-29 07:23:39,S022,C000970,Online,90.64,9.06,5,gen_20251127_091606,transactions_header.csv
T00009641,2024-01-10,2024-01-10 00:21:16,S026,C004827,online,76.97,7.7,1,gen_20251127_091606,transactions_header.csv
T00010754,2024-01-23,2024-01-23 13:08:20,S017,C001838,Card,54.6,8.19,1,gen_20251127_091606,transactions_header.csv
T00002042,2024-11-08,2024-11-08 18:53:26,S003,C002594,Cash,90.66,9.07,7,gen_20251127_091605,transactions_header.csv
T00004141,2024-03-13,2024-03-13 20:32:09,S002,C001307,Cash,$26.24,3.94,2,gen_20251127_091606,transactions_header.csv
T00012138,2024-05-29,2024-05-29 18:48:41,S016,C000239,Cash,74.85,3.74,1,gen_20251127_091607,transactions_header.csv
T00009967,08/11/24,2024-08-11 18:38:03,S003,C000741,online,45.43,2.27,6,gen_20251127_091606,transactions_header.csv
T00017870,08/15/24,2024-08-15 18:41:42,S004,,Card,67.66,6.77,7,gen_20251127_091607,transactions_header.csv
T00000201,09/03/24,2024-09-03 02:26:14,S015,,Cash,55.62,5.56,1,gen_20251127_091605,transactions_header.csv
T00003487,12/10/24,2024-12-10 06:53:22,S013,C002577,Cash,45.2,,5,gen_20251127_091606,transactions_header.csv
T00016133,05/11/24,2024-05-11 14:38:51,S004,C002238,Online,74.18,7.42,2,gen_20251127_091607,transactions_header.csv
T00017592,2024-02-01,2024-02-01 11:04:39,S013,C003283,Card,36.5,3.65,2,gen_20251127_091607,transactions_header.csv
T00008215,2024-10-09,2024-10-09 13:19:03,S002,C003201,Online,33.1,0.0,1,gen_20251127_091606,transactions_header.csv
T00002481,01/26/24,2024-01-26 09:13:31,S010,C002812,Card,71.84,0.0,2,gen_20251127_091605,transactions_header.csv
T00015758,09/09/24,2024-09-09 19:51:30,S016,C001439,Card,42.34,6.35,8,gen_20251127_091607,transactions_header.csv
T00011483,03/31/24,2024-03-31 19:27:38,S014,C000042,Online,8.84,0.44,1,gen_20251127_091606,transactions_header.csv
T00015137,07/06/24,2024-07-06 15:07:56,S017,C004430,Online,38.86,5.83,1,gen_20251127_091607,transactions_header.csv
T00005460,10/01/24,2024-10-01 10:26:03,S007,C000119,Cash,68.46,6.85,3,gen_20251127_091606,transactions_header.csv
T00011799,2024-09-26,2024-09-26 11:10:12,S015,C004834,Cash,54.56,8.18,3,gen_20251127_091607,transactions_header.csv
T00006518,2024-09-14,2024-09-14 20:13:46,S001,C000601,Card,1.34,NA,2,gen_20251127_091606,transactions_header.csv
T00003116,01/31/24,2024-01-31 22:33:12,S020,C002621,Card,$82.84,4.14,1,gen_20251127_091606,transactions_header.csv
T00014496,2024-11-18,2024-11-18 16:21:02,S006,C004421,Cash,33.24,3.32,1,gen_20251127_091607,transactions_header.csv
T00019620,06/11/24,2024-06-11 12:46:10,S010,C000617,Card,37.16,,1,gen_20251127_091607,transactions_header.csv
T00006673,08/13/24,2024-08-13 10:11:59,S008,C000625,Online,25.28,2.53,2,gen_20251127_091606,transactions_header.csv
T00015045,09/29/24,2024-09-29 05:13:34,S011,C000164,Cash,$45.98,0.0,2,gen_20251127_091607,transactions_header.csv
T00001093,2024-06-22,2024-06-22 09:26:03,S021,,cash,62.09,0.0,2,gen_20251127_091605,transactions_header.csv
T00005810,2024-04-29,2024-04-29 23:04:11,S003,C003805,Online,110.17,11.02,3,gen_20251127_091606,transactions_header.csv
T00003411,12/01/24,2024-12-01 20:10:34,S005,C003057,Cash,14.91,,7,gen_20251127_091606,transactions_header.csv
T00003019,09/15/24,2024-09-15 21:40:11,S012,C003311,Cash,77.91,0.0,3,gen_20251127_091606,transactions_header.csv
T00005006,2024-12-20,2024-12-20 23:47:25,S029,C004735,Cash,46.77,7.02,6,gen_20251127_091606,transactions_header.csv
T00014286,2024-05-29,2024-05-29 16:35:54,S004,C002177,Online,112.3,5.62,2,gen_20251127_091607,transactions_header.csv
T00003920,2024-06-22,2024-06-22 16:55:19,S001,C002489,Online,47.74,7.16,2,gen_20251127_091606,transactions_header.csv
T00004154,2024-09-19,2024-09-19 11:53:33,S007,,Cash,50.33,0.0,1,gen_20251127_091606,transactions_header.csv
T00012816,2024-08-04,2024-08-04 13:49:50,S012,C000512,Cash,18.2,2.73,2,gen_20251127_091607,transactions_header.csv
T00008836,04/30/24,2024-04-30 15:12:13,S016,C001412,Online,2.23,0.33,1,gen_20251127_091606,transactions_header.csv
T00005187,08/03/24,2024-08-03 10:14:18,S030,C000380,Online,45.81,6.87,1,gen_20251127_091606,transactions_header.csv
T00008189,08/10/24,2024-08-10 18:27:57,S021,,Online,100.57,5.03,1,gen_20251127_091606,transactions_header.csv
T00003172,07/11/24,2024-07-11 09:52:47,S015,NA,Online,66.12,3.31,1,gen_20251127_091606,transactions_header.csv
T00011477,2024-01-15,2024-01-15 12:27:48,S006,C004474,Card,24.64,2.46,1,gen_20251127_091606,transactions_header.csv
T00016395,2024-04-19,2024-04-19 01:56:20,S007,,Card,67.68,10.15,2,gen_20251127_091607,transactions_header.csv
T00018199,02/07/24,2024-02-07 23:22:58,S021,C004324,Cash,92.49,4.62,1,gen_20251127_091607,transactions_header.csv
T00015205,2024-04-07,2024-04-07 15:25:31,S008,C004957,Online,48.72,0.0,4,gen_20251127_091607,transactions_header.csv
T00016311,2024-10-05,2024-10-05 19:43:17,S010,C002408,Online,19.61,1.96,1,gen_20251127_091607,transactions_header.csv
T00004049,2024-06-08,2024-06-08 11:59:18,S001,C002819,Cash,67.06,10.06,1,gen_20251127_091606,transactions_header.csv
T00001183,2024-04-26,2024-04-26 06:57:24,S028,C002893,Cash,52.34,7.85,3,gen_20251127_091605,transactions_header.csv
T00013953,2024-03-11,2024-03-11 09:54:33,S007,C003653,Card,121.85,12.19,3,gen_20251127_091607,transactions_header.csv
T00003634,02/06/24,2024-02-06 22:20:17,S015,C003505,Card,27.7,1.39,3,gen_20251127_091606,transactions_header.csv
T00003243,2024-07-25,2024-07-25 07:04:54,S025,C003992,Card,11.53,0.58,2,gen_20251127_091606,transactions_header.csv
T00009623,11/04/24,2024-11-04 04:24:40,S013,C002889,Online,73.91,7.39,2,gen_20251127_091606,transactions_header.csv
T00019640,02/18/24,2024-02-18 00:11:09,S006,C003130,Online,30.28,3.03,2,gen_20251127_091607,transactions_header.csv
T00005606,04/19/24,2024-04-19 01:24:46,S006,C004673,Card,74.52,3.73,2,gen_20251127_091606,transactions_header.csv
T00004266,2024-08-14,2024-08-14 07:06:53,S001,C004692,Online,32.6,3.26,1,gen_20251127_091606,transactions_header.csv
T00010393,04/02/24,2024-04-02 13:40:33,S018,C001562,Card,48.76,0.0,1,gen_20251127_091606,transactions_header.csv
T00002266,2024-09-08,2024-09-08 10:29:41,S028,NA,Cash,67.7,3.39,3,gen_20251127_091605,transactions_header.csv
T00018448,2024-09-13,2024-09-13 19:22:43,S013,C003483,Cash,10.23,1.02,1,gen_20251127_091607,transactions_header.csv
T00010014,03/10/24,2024-03-10 13:10:54,S019,C000472,Cash,79.75,,6,gen_20251127_091606,transactions_header.csv
T00018516,2024-04-14,2024-04-14 01:10:35,S027,C003943,Card,0,0.0,3,gen_20251127_091607,transactions_header.csv
T00002586,2024-01-10,2024-01-10 06:42:59,S026,NA,Card,16.3,2.44,1,gen_20251127_091605,transactions_header.csv
T00013643,2024-01-02,2024-01-02 23:47:37,S024,C004671,Online,8.79,1.32,1,gen_20251127_091607,transactions_header.csv
T00002989,2024-10-05,2024-10-05 10:36:48,S021,C002430,Online,54.22,5.42,1,gen_20251127_091606,transactions_header.csv
T00012060,2024-09-12,2024-09-12 20:24:03,S015,,Online,35.52,NA,4,gen_20251127_091607,transactions_header.csv
T00018507,2024-05-04,2024-05-04 23:27:12,S027,C004589,Online,37.32,3.73,1,gen_20251127_091607,transactions_header.csv
T00013524,2024-01-20,2024-01-20 12:54:47,S017,C001050,Card,51.43,5.14,6,gen_20251127_091607,transactions_header.csv
T00013770,2024-12-21,2024-12-21 06:11:43,S022,NA,Online,2.74,,4,gen_20251127_091607,transactions_header.csv
T00019411,2024-03-27,2024-03-27 23:11:53,S022,C000460,Online,0,NA,1,gen_20251127_091607,transactions_header.csv
T00008797,2024-01-18,2024-01-18 16:40:45,S007,C003462,Online,79.06,7.91,2,gen_20251127_091606,transactions_header.csv
T00006000,2024-02-16,2024-02-16 09:01:21,S010,C003475,Card,39.97,2.0,1,gen_20251127_091606,transactions_header.csv
T00009595,2024-01-15,2024-01-15 01:41:35,S006,C004326,Online,24.46,3.67,5,gen_20251127_091606,transactions_header.csv
T00011956,07/20/24,2024-07-20 08:35:41,S027,C000527,Online,42.14,2.11,1,gen_20251127_091607,transactions_header.csv
T00013450,2024-08-09,2024-08-09 13:16:31,S025,C003108,Cash,86.16,NA,2,gen_20251127_091607,transactions_header.csv
T00016519,2024-08-11,2024-08-11 23:32:02,S006,NA,Cash,64.97,0.0,1,gen_20251127_091607,transactions_header.csv
T00018347,04/02/24,2024-04-02 03:14:40,S009,C002434,cash,121.9,6.1,1,gen_20251127_091607,transactions_header.csv
T00009657,2024-02-29,2024-02-29 17:35:19,S014,C001603,Online,68.11,0.0,2,gen_20251127_091606,transactions_header.csv
T00010106,2024-05-01,2024-05-01 07:37:11,S016,C004702,Cash,$57.39,5.74,7,gen_20251127_091606,transactions_header.csv
T00018815,2024-04-28,2024-04-28 11:47:56,S005,,Online,52.27,2.61,2,gen_20251127_091607,transactions_header.csv
T00018576,04/01/24,2024-04-01 17:36:14,S001,,online,2.75,0.28,1,gen_20251127_091607,transactions_header.csv
T00002513,2024-08-13,2024-08-13 13:44:01,S018,C004773,Online,15.41,1.54,7,gen_20251127_091605,transactions_header.csv
T00004989,10/08/24,2024-10-08 07:52:02,S006,C004507,Cash,79.29,7.93,1,gen_20251127_091606,transactions_header.csv
T00001115,2024-09-29,2024-09-29 05:17:58,S020,C000897,Online,104.73,5.24,3,gen_20251127_091605,transactions_header.csv
T00007616,05/18/24,2024-05-18 08:03:49,S022,C003288,Cash,51.64,2.58,3,gen_20251127_091606,transactions_header.csv
T00004692,2024-07-01,2024-07-01 23:55:16,S018,C002461,Online,85.6,0.0,1,gen_20251127_091606,transactions_header.csv
T00008030,01/28/24,2024-01-28 00:35:44,S016,C003294,online,32.9,3.29,1,gen_20251127_091606,transactions_header.csv
T00014178,03/29/24,2024-03-29 04:38:37,S011,,Online,53.29,0.0,1,gen_20251127_091607,transactions_header.csv
T00019596,03/24/24,2024-03-24 05:11:20,S028,C001844,Card,78.55,11.78,2,gen_20251127_091607,transactions_header.csv
T00015603,11/24/24,2024-11-24 15:52:04,S020,C000602,Online,$50.37,2.52,1,gen_20251127_091607,transactions_header.csv
T00018886,01/18/24,2024-01-18 08:33:44,S004,C002157,Online,74.23,11.13,2,gen_20251127_091607,transactions_header.csv
T00005107,2024-02-13,2024-02-13 00:07:04,S017,C003462,Online,77.13,11.57,6,gen_20251127_091606,transactions_header.csv
T00014670,01/14/24,2024-01-14 19:15:47,S020,C003749,Card,28.94,0.0,2,gen_20251127_091607,transactions_header.csv
T00002880,2024-03-19,2024-03-19 05:23:22,S009,C002071,Cash,74.15,3.71,1,gen_20251127_091606,transactions_header.csv
T00006069,02/04/24,2024-02-04 16:04:56,S017,NA,Card,33.94,0.0,1,gen_20251127_091606,transactions_header.csv
T00015627,11/06/24,2024-11-06 14:13:43,S001,C003291,Card,68.14,0.0,4,gen_20251127_091607,transactions_header.csv
T00009232,10/25/24,2024-10-25 01:41:08,S008,C000770,Card,31.31,0.0,2,gen_20251127_091606,transactions_header.csv
T00003740,05/12/24,2024-05-12 22:20:23,S012,C000676,Cash,37.93,0.0,7,gen_20251127_091606,transactions_header.csv
T00001259,2024-04-21,2024-04-21 00:21:54,S025,C000174,Card,99.0,4.95,7,gen_20251127_091605,transactions_header.csv
T00014401,2024-04-02,2024-04-02 23:15:02,S028,C001818,Cash,0,0.0,1,gen_20251127_091607,transactions_header.csv
T00014500,07/29/24,2024-07-29 15:44:40,S016,C001108,Cash,48.25,4.83,2,gen_20251127_091607,transactions_header.csv
T00007970,10/16/24,2024-10-16 13:23:21,S008,C001568,Online,35.38,5.31,1,gen_20251127_091606,transactions_header.csv
T00018938,2024-07-05,2024-07-05 03:59:36,S022,C002490,Cash,112.95,11.3,2,gen_20251127_091607,transactions_header.csv
T00003533,2024-02-01,2024-02-01 10:12:35,S007,C004791,Cash,58.78,8.82,1,gen_20251127_091606,transactions_header.csv
T00017072,01/13/24,2024-01-13 04:08:58,S001,C001749,cash,63.55,6.36,2,gen_20251127_091607,transactions_header.csv
T00017346,2024-02-17,2024-02-17 19:22:57,S022,C003812,card,10.96,NA,2,gen_20251127_091607,transactions_header.csv
T00018261,2024-08-17,2024-08-17 20:53:56,S011,C001532,Card,75.91,3.8,1,gen_20251127_091607,transactions_header.csv
T00008490,01/11/24,2024-01-11 03:54:02,S003,C002600,Online,33.56,NA,1,gen_20251127_091606,transactions_header.csv
T00011370,07/04/24,2024-07-04 06:05:41,S001,C000819,Cash,-21.69,0.0,2,gen_20251127_091606,transactions_header.csv
T00002894,11/22/24,2024-11-22 07:23:21,S030,C003445,Online,$22.81,1.14,2,gen_20251127_091606,transactions_header.csv
T00000274,2024-07-14,2024-07-14 18:38:29,S030,C000878,Cash,11.24,1.69,1,gen_20251127_091605,transactions_header.csv
T00014526,2024-08-02,2024-08-02 23:13:59,S001,,Cash,0.68,0.0,1,gen_20251127_091607,transactions_header.csv
T00012562,11/17/24,2024-11-17 20:00:33,S020,C004218,online,17.75,2.66,2,gen_20251127_091607,transactions_header.csv
T00002387,2024-12-21,2024-12-21 10:42:05,S009,C000477,Online,42.18,0.0,1,gen_20251127_091605,transactions_header.csv
T00007842,2024-08-04,2024-08-04 03:36:23,S004,C001583,Cash,39.69,1.98,1,gen_20251127_091606,transactions_header.csv
T00007454,2024-10-23,2024-10-23 19:22:02,S015,C004040,Card,103.09,NA,2,gen_20251127_091606,transactions_header.csv
T00009787,2024-03-23,2024-03-23 12:49:32,S005,C004606,Online,22.13,2.21,4,gen_20251127_091606,transactions_header.csv
T00005666,2024-08-25,2024-08-25 05:29:38,S020,,Card,$10.19,0.0,2,gen_20251127_091606,transactions_header.csv
T00019927,11/03/24,2024-11-03 07:15:38,S028,C002549,cash,64.18,0.0,2,gen_20251127_091607,transactions_header.csv
T00009559,2024-03-23,2024-03-23 09:23:00,S017,C001773,Card,66.28,6.63,1,gen_20251127_091606,transactions_header.csv
T00013514,07/04/24,2024-07-04 05:01:28,S030,C003505,Cash,62.88,0.0,1,gen_20251127_091607,transactions_header.csv
T00003351,2024-08-30,2024-08-30 03:08:23,S024,C001144,Online,21.31,0.0,2,gen_20251127_091606,transactions_header.csv
T00007754,06/02/24,2024-06-02 12:00:26,S028,C002408,Card,42.11,4.21,1,gen_20251127_091606,transactions_header.csv
T00008627,2024-09-02,2024-09-02 11:12:06,S029,C004078,Online,40.79,4.08,2,gen_20251127_091606,transactions_header.csv
T00015438,2024-10-30,2024-10-30 07:19:39,S012,C003452,Cash,68.11,6.81,6,gen_20251127_091607,transactions_header.csv
T00006509,2024-08-10,2024-08-10 11:29:09,S008,C004049,Online,71.35,3.57,3,gen_20251127_091606,transactions_header.csv
T00016593,2024-12-28,2024-12-28 04:06:24,S028,C002836,Card,85.84,4.29,4,gen_20251127_091607,transactions_header.csv
T00016169,02/12/24,2024-02-12 18:22:42,S024,C004253,Cash,14.15,0.0,1,gen_20251127_091607,transactions_header.csv
T00011305,2024-09-16,2024-09-16 17:06:02,S016,NA,Card,29.54,4.43,2,gen_20251127_091606,transactions_header.csv
T00018134,2024-04-01,2024-04-01 05:21:36,S021,C003252,Online,103.63,5.18,4,gen_20251127_091607,transactions_header.csv
T00002865,07/13/24,2024-07-13 21:21:44,S017,,Cash,77.28,7.73,1,gen_20251127_091606,transactions_header.csv
T00008869,06/24/24,2024-06-24 02:39:03,S021,C004345,Cash,29.21,4.38,2,gen_20251127_091606,transactions_header.csv
T00011153,2024-09-09,2024-09-09 00:43:04,S027,C003584,Online,38.09,0.0,3,gen_20251127_091606,transactions_header.csv
T00003703,04/14/24,2024-04-14 07:06:43,S012,C003636,Cash,21.57,0.0,1,gen_20251127_091606,transactions_header.csv
T00014034,2024-10-26,2024-10-26 18:31:14,S014,C004686,Cash,64.98,3.25,1,gen_20251127_091607,transactions_header.csv
T00006830,2024-02-23,2024-02-23 06:30:53,S007,NA,Online,42.89,4.29,4,gen_20251127_091606,transactions_header.csv
T00003618,02/01/24,2024-02-01 01:23:56,S028,C004297,Card,$80.10,,2,gen_20251127_091606,transactions_header.csv
T00019752,03/13/24,2024-03-13 06:37:04,S023,C003527,Online,82.09,4.1,1,gen_20251127_091607,transactions_header.csv
T00009277,06/03/24,2024-06-03 06:42:35,S002,C001254,Card,96.42,14.46,2,gen_20251127_091606,transactions_header.csv
T00009013,04/04/24,2024-04-04 21:45:59,S026,C001541,Cash,52.01,7.8,1,gen_20251127_091606,transactions_header.csv
T00013936,04/05/24,2024-04-05 16:45:42,S006,C002335,Card,83.4,0.0,2,gen_20251127_091607,transactions_header.csv
T00004442,2024-09-28,2024-09-28 12:04:42,S004,C001434,Card,41.22,0.0,2,gen_20251127_091606,transactions_header.csv
T00011814,04/01/24,2024-04-01 17:07:22,S023,C003516,Online,26.94,0.0,2,gen_20251127_091607,transactions_header.csv
T00007480,08/01/24,2024-08-01 00:22:43,S019,C002891,Cash,26.74,0.0,4,gen_20251127_091606,transactions_header.csv
T00004942,10/27/24,2024-10-27 05:00:57,S010,C000641,card,87.56,8.76,1,gen_20251127_091606,transactions_header.csv
T00003270,04/09/24,2024-04-09 12:11:29,S024,C002401,Cash,60.67,,2,gen_20251127_091606,transactions_header.csv
T00002021,2024-06-26,2024-06-26 16:32:13,S002,C000842,Card,44.7,2.24,2,gen_20251127_091605,transactions_header.csv
T00004581,2024-11-12,2024-11-12 15:25:33,S003,C002903,Online,$37.10,0.0,1,gen_20251127_091606,transactions_header.csv
T00012879,2024-12-12,2024-12-12 10:08:56,S011,,Card,0,,2,gen_20251127_091607,transactions_header.csv
T00003644,03/02/24,2024-03-02 09:16:15,S012,C000595,Card,75.57,7.56,1,gen_20251127_091606,transactions_header.csv
T00004833,08/05/24,2024-08-05 05:30:47,S022,C001160,Card,24.6,,2,gen_20251127_091606,transactions_header.csv
T00007878,2024-05-26,2024-05-26 01:56:05,S025,C001790,Card,72.0,3.6,1,gen_20251127_091606,transactions_header.csv
T00007840,07/21/24,2024-07-21 13:49:37,S019,C000754,Cash,8.15,1.22,4,gen_20251127_091606,transactions_header.csv
T00015382,10/14/24,2024-10-14 21:40:58,S005,C004814,Cash,102.86,0.0,1,gen_20251127_091607,transactions_header.csv
T00010461,01/07/24,2024-01-07 11:14:36,S026,,Online,33.93,1.7,1,gen_20251127_091606,transactions_header.csv
T00017767,04/21/24,2024-04-21 20:37:01,S016,C001497,Card,39.36,NA,2,gen_20251127_091607,transactions_header.csv
T00017795,2024-11-08,2024-11-08 21:35:44,S029,C003455,cash,95.2,14.28,2,gen_20251127_091607,transactions_header.csv
T00006064,2024-03-27,2024-03-27 14:56:34,S005,C002014,Cash,0,,3,gen_20251127_091606,transactions_header.csv
T00000258,2024-05-29,2024-05-29 17:58:55,S009,,online,20.72,,6,gen_20251127_091605,transactions_header.csv
T00006249,10/21/24,2024-10-21 13:27:46,S008,C002938,card,62.67,3.13,1,gen_20251127_091606,transactions_header.csv
T00001902,2024-11-05,2024-11-05 17:21:34,S003,C004983,Online,58.25,8.74,1,gen_20251127_091605,transactions_header.csv
T00011720,2024-12-19,2024-12-19 18:11:54,S003,C003039,Cash,-35.77,3.58,3,gen_20251127_091607,transactions_header.csv
T00019746,2024-03-23,2024-03-23 09:27:52,S006,C001283,Online,25.45,1.27,1,gen_20251127_091607,transactions_header.csv
T00015081,09/20/24,2024-09-20 03:36:12,S003,C002872,Card,38.75,5.81,1,gen_20251127_091607,transactions_header.csv
T00001457,2024-03-10,2024-03-10 13:57:29,S008,C002348,Cash,81.02,4.05,1,gen_20251127_091605,transactions_header.csv
T00006291,06/23/24,2024-06-23 17:34:03,S004,C003845,Cash,82.01,4.1,1,gen_20251127_091606,transactions_header.csv
T00002860,01/13/24,2024-01-13 17:46:56,S014,C002341,Cash,$55.87,8.38,6,gen_20251127_091606,transactions_header.csv
T00005917,06/06/24,2024-06-06 05:21:45,S009,C000513,Card,37.47,1.87,3,gen_20251127_091606,transactions_header.csv
T00006003,03/01/24,2024-03-01 22:25:06,S011,C001320,Cash,43.74,2.19,5,gen_20251127_091606,transactions_header.csv
T00006718,2024-01-14,2024-01-14 11:32:51,S030,C004998,Online,60.1,0.0,2,gen_20251127_091606,transactions_header.csv
T00003959,2024-11-09,2024-11-09 17:41:34,S027,C002689,online,31.77,1.59,1,gen_20251127_091606,transactions_header.csv
T00005355,2024-09-18,2024-09-18 04:49:14,S027,C001827,Online,$76.08,11.41,4,gen_20251127_091606,transactions_header.csv
T00015777,2024-09-21,2024-09-21 17:28:42,S006,C003552,Card,59.66,8.95,5,gen_20251127_091607,transactions_header.csv
T00018864,2024-03-12,2024-03-12 22:41:11,S008,C001022,Cash,58.5,2.93,1,gen_20251127_091607,transactions_header.csv
T00017325,2024-01-31,2024-01-31 06:51:27,S030,,Card,21.29,0.0,1,gen_20251127_091607,transactions_header.csv
T00000347,02/03/24,2024-02-03 11:10:42,S029,C001549,Online,19.48,0.97,1,gen_20251127_091605,transactions_header.csv
T00018661,01/11/24,2024-01-11 23:43:11,S016,C003256,Online,13.6,2.04,1,gen_20251127_091607,transactions_header.csv
T00002347,05/31/24,2024-05-31 15:24:44,S030,C004902,Card,$95.15,4.76,1,gen_20251127_091605,transactions_header.csv
T00003722,08/20/24,2024-08-20 20:54:08,S005,C000731,Online,53.96,2.7,2,gen_20251127_091606,transactions_header.csv
T00014976,2024-01-25,2024-01-25 14:01:52,S012,C002607,Online,55.38,0.0,1,gen_20251127_091607,transactions_header.csv
T00001581,2024-02-05,2024-02-05 16:17:32,S023,C000397,Cash,51.81,2.59,2,gen_20251127_091605,transactions_header.csv
T00002623,2024-06-10,2024-06-10 16:47:32,S019,C003097,Cash,27.79,1.39,7,gen_20251127_091605,transactions_header.csv
T00003185,08/17/24,2024-08-17 02:07:21,S013,C004592,Cash,63.67,6.37,6,gen_20251127_091606,transactions_header.csv
T00017428,05/03/24,2024-05-03 08:14:41,S028,C002209,Cash,75.18,7.52,2,gen_20251127_091607,transactions_header.csv
T00015706,2024-12-25,2024-12-25 16:22:51,S010,C000678,Online,$87.87,,3,gen_20251127_091607,transactions_header.csv
T00005504,2024-12-27,2024-12-27 18:12:28,S020,C000595,Card,36.89,1.84,5,gen_20251127_091606,transactions_header.csv
T00010779,2024-01-05,2024-01-05 05:33:25,S029,C000083,Online,72.21,,3,gen_20251127_091606,transactions_header.csv
T00005204,05/04/24,2024-05-04 05:20:06,S011,NA,Card,37.73,0.0,2,gen_20251127_091606,transactions_header.csv
T00011083,2024-06-21,2024-06-21 12:47:28,S028,C003682,Card,24.86,3.73,7,gen_20251127_091606,transactions_header.csv
T00014236,08/24/24,2024-08-24 02:31:33,S030,,Cash,12.85,1.29,8,gen_20251127_091607,transactions_header.csv
T00009239,12/06/24,2024-12-06 09:16:54,S013,,Cash,$34.77,1.74,1,gen_20251127_091606,transactions_header.csv
T00002938,2024-04-11,2024-04-11 18:51:46,S010,C003829,Card,22.74,0.0,2,gen_20251127_091606,transactions_header.csv
T00018622,09/11/24,2024-09-11 19:25:53,S017,C002814,Cash,60.73,3.04,1,gen_20251127_091607,transactions_header.csv
T00001490,2024-02-27,2024-02-27 00:25:31,S004,C003420,Card,65.94,0.0,6,gen_20251127_091605,transactions_header.csv
T00002251,09/13/24,2024-09-13 18:37:00,S008,C004161,Card,44.76,6.71,1,gen_20251127_091605,transactions_header.csv
T00012957,01/16/24,2024-01-16 01:33:11,S026,C002630,Online,59.25,8.89,3,gen_20251127_091607,transactions_header.csv
T00017050,2024-06-03,2024-06-03 08:59:08,S016,,Online,16.38,0.0,1,gen_20251127_091607,transactions_header.csv
T00017361,2024-08-10,2024-08-10 21:24:00,S016,C003023,Card,57.3,5.73,1,gen_20251127_091607,transactions_header.csv
T00013531,11/21/24,2024-11-21 06:08:06,S004,C004451,Cash,11.23,1.68,5,gen_20251127_091607,transactions_header.csv
T00002413,2024-05-23,2024-05-23 01:39:17,S019,C004678,Card,77.88,3.89,1,gen_20251127_091605,transactions_header.csv
T00015725,2024-08-18,2024-08-18 13:32:58,S027,C002689,Cash,$60.51,0.0,3,gen_20251127_091607,transactions_header.csv
T00004668,07/31/24,2024-07-31 06:37:58,S018,C004904,Card,36.64,0.0,1,gen_20251127_091606,transactions_header.csv
T00000104,2024-06-08,2024-06-08 02:18:38,S023,C002291,Cash,23.43,3.51,2,gen_20251127_091605,transactions_header.csv
T00012260,2024-04-29,2024-04-29 13:24:49,S017,C003832,Cash,109.21,10.92,2,gen_20251127_091607,transactions_header.csv
T00005598,2024-12-11,2024-12-11 01:50:41,S012,C003839,Card,13.87,2.08,1,gen_20251127_091606,transactions_header.csv
T00015528,2024-01-26,2024-01-26 01:19:46,S001,C000915,Cash,50.5,0.0,2,gen_20251127_091607,transactions_header.csv
T00014187,2024-10-13,2024-10-13 02:37:06,S024,C001305,Online,81.86,8.19,7,gen_20251127_091607,transactions_header.csv
T00004985,2024-06-03,2024-06-03 07:56:17,S025,C000864,Cash,30.58,3.06,1,gen_20251127_091606,transactions_header.csv
T00017158,2024-11-05,2024-11-05 03:06:42,S007,NA,Card,0,0.0,3,gen_20251127_091607,transactions_header.csv
T00009240,07/22/24,2024-07-22 15:50:00,S005,C003495,Online,0,0.0,2,gen_20251127_091606,transactions_header.csv
T00016826,2024-10-28,2024-10-28 21:01:24,S028,C001269,Cash,125.82,18.87,5,gen_20251127_091607,transactions_header.csv
T00014845,02/23/24,2024-02-23 23:45:55,S016,C001177,Online,49.03,7.35,1,gen_20251127_091607,transactions_header.csv
T00017649,06/24/24,2024-06-24 22:15:16,S003,C003792,Card,12.64,,2,gen_20251127_091607,transactions_header.csv
T00017196,05/11/24,2024-05-11 13:58:00,S015,C000204,Cash,84.87,12.73,6,gen_20251127_091607,transactions_header.csv
T00008892,2024-03-08,2024-03-08 14:36:43,S001,C003333,Online,77.52,7.75,2,gen_20251127_091606,transactions_header.csv
T00007998,2024-11-28,2024-11-28 22:57:12,S026,C002800,Card,$50.79,7.62,2,gen_20251127_091606,transactions_header.csv
T00002744,2024-07-12,2024-07-12 06:59:49,S021,C000351,Online,29.61,1.48,2,gen_20251127_091605,transactions_header.csv
T00017977,12/17/24,2024-12-17 04:26:59,S007,C002488,Online,77.51,11.63,1,gen_20251127_091607,transactions_header.csv
T00009914,03/26/24,2024-03-26 20:02:48,S011,C002388,Card,28.27,,3,gen_20251127_091606,transactions_header.csv
T00009377,11/24/24,2024-11-24 17:54:24,S020,,Cash,18.35,0.0,2,gen_20251127_091606,transactions_header.csv
T00012481,06/26/24,2024-06-26 02:41:12,S002,,Card,0,0,1,gen_20251127_091607,transactions_header.csv
T00011779,2024-12-12,2024-12-12 20:42:11,S024,C003952,Cash,69.18,NA,4,gen_20251127_091607,transactions_header.csv
T00015366,2024-11-30,2024-11-30 05:36:13,S027,,Online,60.34,9.05,1,gen_20251127_091607,transactions_header.csv
T00009023,09/05/24,2024-09-05 00:58:45,S004,C004559,Card,61.76,3.09,4,gen_20251127_091606,transactions_header.csv
T00011617,01/22/24,2024-01-22 14:13:58,S023,C001523,Card,35.99,3.6,2,gen_20251127_091606,transactions_header.csv
T00015292,2024-01-06,2024-01-06 15:07:29,S030,C001378,Card,53.88,8.08,2,gen_20251127_091607,transactions_header.csv
T00014391,2024-12-03,2024-12-03 21:48:00,S024,C003160,Card,88.85,4.44,1,gen_20251127_091607,transactions_header.csv
T00005171,2024-10-02,2024-10-02 18:39:53,S020,C003770,Cash,74.99,7.5,1,gen_20251127_091606,transactions_header.csv
T00002208,2024-05-14,2024-05-14 07:34:13,S021,C000225,Card,31.1,3.11,4,gen_20251127_091605,transactions_header.csv
T00003503,2024-04-08,2024-04-08 16:41:14,S014,C001659,Card,69.39,6.94,3,gen_20251127_091606,transactions_header.csv
T00007773,11/29/24,2024-11-29 11:17:23,S019,C003393,Card,1.49,0.0,7,gen_20251127_091606,transactions_header.csv
T00002118,05/13/24,2024-05-13 07:38:59,S023,C002251,Cash,80.44,8.04,1,gen_20251127_091605,transactions_header.csv
T00000058,08/06/24,2024-08-06 17:11:55,S013,C003518,Card,50.17,0.0,7,gen_20251127_091605,transactions_header.csv
T00013331,2024-02-13,2024-02-13 13:37:19,S001,,Cash,66.8,3.34,3,gen_20251127_091607,transactions_header.csv
T00005501,2024-02-18,2024-02-18 16:16:48,S002,C004969,Card,35.64,1.78,1,gen_20251127_091606,transactions_header.csv
T00019014,2024-08-28,2024-08-28 05:06:58,S023,C004885,Card,22.26,3.34,5,gen_20251127_091607,transactions_header.csv
T00015512,06/03/24,2024-06-03 13:25:27,S007,C000680,Card,24.42,2.44,1,gen_20251127_091607,transactions_header.csv
T00004035,03/18/24,2024-03-18 17:38:22,S001,C002686,Online,48.37,0.0,2,gen_20251127_091606,transactions_header.csv
T00012915,2024-09-10,2024-09-10 06:00:12,S001,C001929,Card,7.17,,1,gen_20251127_091607,transactions_header.csv
T00000460,10/24/24,2024-10-24 19:34:21,S025,C002504,Online,21.37,0.0,2,gen_20251127_091605,transactions_header.csv
T00002519,08/12/24,2024-08-12 20:54:43,S004,C004228,Cash,99.48,,1,gen_20251127_091605,transactions_header.csv
T00013053,2024-08-23,2024-08-23 13:00:52,S013,NA,Cash,53.31,5.33,1,gen_20251127_091607,transactions_header.csv
T00019782,07/19/24,2024-07-19 10:15:43,S029,C004669,Online,61.58,0.0,1,gen_20251127_091607,transactions_header.csv
T00012622,2024-11-27,2024-11-27 18:34:43,S014,C004312,card,66.7,,2,gen_20251127_091607,transactions_header.csv
T00009932,2024-10-29,2024-10-29 02:01:05,S025,,Online,44.67,0.0,3,gen_20251127_091606,transactions_header.csv
T00018167,2024-01-05,2024-01-05 15:51:02,S007,C002266,Card,33.84,,7,gen_20251127_091607,transactions_header.csv
T00019709,2024-10-20,2024-10-20 07:44:35,S022,C003865,Card,48.26,4.83,1,gen_20251127_091607,transactions_header.csv
T00018230,05/03/24,2024-05-03 00:46:37,S025,C004052,Cash,63.09,0.0,1,gen_20251127_091607,transactions_header.csv
T00007709,2024-10-14,2024-10-14 21:16:37,S005,C004886,Card,52.73,0.0,1,gen_20251127_091606,transactions_header.csv
T00012551,10/24/24,2024-10-24 19:21:21,S009,C004031,Online,6.26,0.31,1,gen_20251127_091607,transactions_header.csv
T00018738,05/22/24,2024-05-22 08:26:39,S020,C004550,Cash,67.27,3.36,1,gen_20251127_091607,transactions_header.csv
T00018760,2024-03-14,2024-03-14 01:42:06,S029,C002191,Online,35.47,3.55,1,gen_20251127_091607,transactions_header.csv
T00012527,2024-07-23,2024-07-23 06:52:07,S027,C001241,Online,79.06,11.86,1,gen_20251127_091607,transactions_header.csv
T00007223,07/18/24,2024-07-18 06:25:50,S002,C002892,Cash,80.88,12.13,1,gen_20251127_091606,transactions_header.csv
T00012093,08/03/24,2024-08-03 01:24:29,S029,C002968,Online,55.31,5.53,2,gen_20251127_091607,transactions_header.csv
T00014861,2024-12-02,2024-12-02 00:23:43,S014,C002257,Card,80.2,8.02,7,gen_20251127_091607,transactions_header.csv
T00014865,12/20/24,2024-12-20 21:22:31,S005,C004193,Cash,16.84,0.84,3,gen_20251127_091607,transactions_header.csv
T00019214,2024-10-13,2024-10-13 22:08:05,S015,C002606,Cash,61.71,3.09,2,gen_20251127_091607,transactions_header.csv
T00016587,2024-08-12,2024-08-12 11:42:12,S005,C003605,Card,112.05,0.0,3,gen_20251127_091607,transactions_header.csv
T00016458,08/27/24,2024-08-27 21:32:10,S008,C003766,Card,0,0,1,gen_20251127_091607,transactions_header.csv
T00014881,2024-10-09,2024-10-09 16:36:10,S006,C003623,Online,23.7,0.0,1,gen_20251127_091607,transactions_header.csv
T00000380,2024-03-07,2024-03-07 20:29:47,S003,C003041,Cash,74.2,0.0,7,gen_20251127_091605,transactions_header.csv
T00006219,02/29/24,2024-02-29 14:56:12,S002,,Card,38.09,0.0,1,gen_20251127_091606,transactions_header.csv
T00018140,01/11/24,2024-01-11 16:59:12,S028,C001278,Online,58.22,8.73,1,gen_20251127_091607,transactions_header.csv
T00018713,2024-06-20,2024-06-20 07:01:38,S018,,Online,69.1,6.91,3,gen_20251127_091607,transactions_header.csv
T00002381,2024-01-12,2024-01-12 17:09:51,S010,C000484,Cash,57.47,5.75,2,gen_20251127_091605,transactions_header.csv
T00005684,2024-12-25,2024-12-25 05:13:08,S006,C001777,Online,54.88,0.0,1,gen_20251127_091606,transactions_header.csv
T00009660,2024-04-15,2024-04-15 12:40:55,S028,C001919,Card,63.8,9.57,3,gen_20251127_091606,transactions_header.csv
T00008958,11/09/24,2024-11-09 02:47:06,S029,C002020,online,51.95,7.79,2,gen_20251127_091606,transactions_header.csv
T00009326,11/22/24,2024-11-22 21:29:48,S001,C002260,Cash,0,0,3,gen_20251127_091606,transactions_header.csv
T00014564,06/20/24,2024-06-20 02:05:45,S027,C002154,Card,57.83,8.67,3,gen_20251127_091607,transactions_header.csv
T00006483,08/08/24,2024-08-08 17:57:07,S028,C000831,Online,20.36,2.04,1,gen_20251127_091606,transactions_header.csv
T00013846,2024-09-03,2024-09-03 10:37:31,S021,C002095,Cash,111.38,,5,gen_20251127_091607,transactions_header.csv
T00007277,2024-08-21,2024-08-21 23:26:44,S022,C000443,Cash,57.97,5.8,2,gen_20251127_091606,transactions_header.csv
T00015766,04/03/24,2024-04-03 20:35:51,S007,C001285,Online,48.15,7.22,2,gen_20251127_091607,transactions_header.csv
T00016235,04/29/24,2024-04-29 19:47:44,S009,C001163,Card,70.93,3.55,1,gen_20251127_091607,transactions_header.csv
T00013771,03/07/24,2024-03-07 03:19:45,S003,C003338,Cash,0,NA,2,gen_20251127_091607,transactions_header.csv
T00010506,09/13/24,2024-09-13 08:49:27,S002,C002110,Card,-53.54,5.35,3,gen_20251127_091606,transactions_header.csv
T00008014,2024-02-16,2024-02-16 12:37:00,S022,C004935,online,20.1,1.01,5,gen_20251127_091606,transactions_header.csv
T00017093,2024-10-08,2024-10-08 21:55:45,S030,C004618,Online,0,0.0,2,gen_20251127_091607,transactions_header.csv
T00004982,08/16/24,2024-08-16 21:37:03,S006,C001920,online,30.18,,2,gen_20251127_091606,transactions_header.csv
T00012106,10/04/24,2024-10-04 01:29:54,S018,C001036,Cash,40.84,2.04,1,gen_20251127_091607,transactions_header.csv
T00000912,08/29/24,2024-08-29 05:10:50,S026,C000469,Card,70.99,3.55,1,gen_20251127_091605,transactions_header.csv
T00005027,2024-08-07,2024-08-07 13:12:11,S020,C000117,Card,76.72,7.67,1,gen_20251127_091606,transactions_header.csv
T00010207,03/20/24,2024-03-20 01:11:49,S024,C002846,Online,41.63,6.24,1,gen_20251127_091606,transactions_header.csv
T00009214,04/07/24,2024-04-07 08:34:47,S020,NA,Card,71.32,10.7,2,gen_20251127_091606,transactions_header.csv
T00018184,2024-10-11,2024-10-11 04:41:34,S008,C002282,Card,64.16,0.0,2,gen_20251127_091607,transactions_header.csv
T00006308,2024-02-22,2024-02-22 09:48:32,S003,NA,Online,23.79,3.57,2,gen_20251127_091606,transactions_header.csv
T00005287,09/18/24,2024-09-18 14:39:27,S024,C001209,Card,63.69,3.18,1,gen_20251127_091606,transactions_header.csv
T00003459,09/17/24,2024-09-17 12:22:13,S026,C003946,Online,45.24,4.52,1,gen_20251127_091606,transactions_header.csv
T00008444,02/05/24,2024-02-05 09:40:12,S028,C004315,Card,66.3,9.94,1,gen_20251127_091606,transactions_header.csv
T00010088,03/05/24,2024-03-05 08:31:31,S020,C000961,Card,25.67,1.28,3,gen_20251127_091606,transactions_header.csv
T00016342,2024-03-19,2024-03-19 04:49:36,S009,C001953,cash,23.11,0.0,2,gen_20251127_091607,transactions_header.csv
T00018474,2024-07-05,2024-07-05 02:27:03,S021,C003422,Card,96.53,14.48,4,gen_20251127_091607,transactions_header.csv
T00014992,2024-06-10,2024-06-10 21:03:44,S030,,Card,36.28,3.63,1,gen_20251127_091607,transactions_header.csv
T00017458,01/14/24,2024-01-14 13:15:31,S008,C002754,Online,37.29,0.0,1,gen_20251127_091607,transactions_header.csv
T00007290,11/02/24,2024-11-02 19:26:14,S023,C002993,Cash,4.25,0.0,1,gen_20251127_091606,transactions_header.csv
T00018463,09/07/24,2024-09-07 08:48:51,S012,C004218,Online,67.33,,1,gen_20251127_091607,transactions_header.csv
T00008804,2024-06-25,2024-06-25 18:47:11,S023,C004815,Cash,53.8,NA,2,gen_20251127_091606,transactions_header.csv
T00010811,2024-06-25,2024-06-25 23:21:32,S017,C001290,Online,45.53,0.0,1,gen_20251127_091606,transactions_header.csv
T00002085,01/20/24,2024-01-20 00:22:54,S005,C000945,Online,109.4,10.94,1,gen_20251127_091605,transactions_header.csv
T00002091,01/18/24,2024-01-18 06:21:37,S010,C001126,Online,56.07,0.0,1,gen_20251127_091605,transactions_header.csv
T00002142,2024-02-12,2024-02-12 23:21:07,S019,C004734,Cash,107.37,10.74,1,gen_20251127_091605,transactions_header.csv
T00011568,2024-10-10,2024-10-10 23:40:39,S009,C001869,Cash,45.64,6.85,3,gen_20251127_091606,transactions_header.csv
T00008863,2024-09-05,2024-09-05 07:28:58,S002,C000703,Cash,54.16,0.0,2,gen_20251127_091606,transactions_header.csv
T00008148,2024-10-06,2024-10-06 04:02:41,S029,C001143,Cash,29.52,1.48,8,gen_20251127_091606,transactions_header.csv
T00015290,07/15/24,2024-07-15 22:50:24,S007,C000651,Online,51.69,7.75,3,gen_20251127_091607,transactions_header.csv
T00011813,2024-04-07,2024-04-07 08:20:31,S021,C003778,Cash,41.32,4.13,2,gen_20251127_091607,transactions_header.csv
T00005721,11/16/24,2024-11-16 01:49:15,S014,C001275,Online,64.51,6.45,4,gen_20251127_091606,transactions_header.csv
T00010568,10/06/24,2024-10-06 22:43:28,S028,C004307,Online,82.14,0.0,3,gen_20251127_091606,transactions_header.csv
T00007841,2024-10-29,2024-10-29 21:08:32,S012,C001327,Card,$0.00,,1,gen_20251127_091606,transactions_header.csv
T00001730,2024-10-24,2024-10-24 06:35:35,S007,C001513,Cash,22.29,,1,gen_20251127_091605,transactions_header.csv
T00001769,03/26/24,2024-03-26 20:57:09,S010,C001222,online,37.05,5.56,3,gen_20251127_091605,transactions_header.csv
T00006004,04/18/24,2024-04-18 12:34:10,S014,C001302,Cash,56.46,0.0,1,gen_20251127_091606,transactions_header.csv
T00008304,2024-11-01,2024-11-01 08:33:53,S003,C004036,Card,32.04,0.0,1,gen_20251127_091606,transactions_header.csv
T00002886,10/04/24,2024-10-04 21:00:36,S029,C000366,Card,44.19,2.21,2,gen_20251127_091606,transactions_header.csv
T00010109,2024-08-07,2024-08-07 09:07:26,S007,C000587,Online,45.32,0.0,1,gen_20251127_091606,transactions_header.csv
T00010960,07/12/24,2024-07-12 11:26:19,S024,C003870,Card,48.54,0.0,2,gen_20251127_091606,transactions_header.csv
T00018591,04/16/24,2024-04-16 18:27:01,S027,C003003,Cash,82.91,4.15,2,gen_20251127_091607,transactions_header.csv
T00012312,08/11/24,2024-08-11 13:03:12,S015,C002903,Card,84.89,8.49,2,gen_20251127_091607,transactions_header.csv
T00017810,2024-12-01,2024-12-01 22:08:54,S006,C003116,Cash,53.4,2.67,5,gen_20251127_091607,transactions_header.csv
T00008923,2024-10-13,2024-10-13 19:41:08,S028,C001665,cash,0,0.0,1,gen_20251127_091606,transactions_header.csv
T00003650,2024-10-03,2024-10-03 05:43:25,S025,C001614,Cash,96.86,14.53,3,gen_20251127_091606,transactions_header.csv
T00017143,08/26/24,2024-08-26 07:11:43,S010,,Card,92.22,4.61,1,gen_20251127_091607,transactions_header.csv
T00015532,05/12/24,2024-05-12 00:07:29,S011,C003585,Card,57.02,0.0,1,gen_20251127_091607,transactions_header.csv
T00009021,2024-04-20,2024-04-20 06:03:59,S017,,Cash,73.54,11.03,1,gen_20251127_091606,transactions_header.csv
T00012341,04/18/24,2024-04-18 22:08:38,S001,C004573,Cash,63.33,6.33,1,gen_20251127_091607,transactions_header.csv
T00003036,12/20/24,2024-12-20 17:49:52,S006,C002254,Cash,95.13,,1,gen_20251127_091606,transactions_header.csv
T00018797,2024-01-02,2024-01-02 05:51:09,S014,C002989,Card,54.7,8.21,6,gen_20251127_091607,transactions_header.csv
T00013469,2024-05-21,2024-05-21 14:37:25,S016,C004388,Online,61.77,9.27,1,gen_20251127_091607,transactions_header.csv
T00018425,2024-08-25,2024-08-25 14:22:30,S017,C004650,Cash,65.46,NA,3,gen_20251127_091607,transactions_header.csv
T00005974,2024-01-02,2024-01-02 14:24:14,S029,C002497,Cash,29.0,1.45,2,gen_20251127_091606,transactions_header.csv
T00006199,03/14/24,2024-03-14 07:48:26,S015,C002769,Online,58.95,2.95,1,gen_20251127_091606,transactions_header.csv
T00009410,01/15/24,2024-01-15 02:59:24,S028,C003925,Card,42.33,4.23,1,gen_20251127_091606,transactions_header.csv
T00011846,10/17/24,2024-10-17 18:08:50,S003,C004055,Online,0,0.0,2,gen_20251127_091607,transactions_header.csv
T00014742,07/03/24,2024-07-03 22:46:10,S028,C002322,Card,53.69,2.68,1,gen_20251127_091607,transactions_header.csv
T00005528,2024-05-22,2024-05-22 06:35:21,S017,,Card,21.13,NA,1,gen_20251127_091606,transactions_header.csv
T00000004,06/24/24,2024-06-24 17:35:02,S007,C004318,Online,48.45,7.27,2,gen_20251127_091605,transactions_header.csv
T00017998,05/06/24,2024-05-06 13:13:47,S008,C001301,Cash,27.98,,2,gen_20251127_091607,transactions_header.csv
T00012592,01/04/24,2024-01-04 04:26:55,S009,,Card,55.29,0.0,1,gen_20251127_091607,transactions_header.csv
T00009359,2024-11-11,2024-11-11 08:02:44,S017,C001399,Online,100.97,0.0,1,gen_20251127_091606,transactions_header.csv
T00003482,04/10/24,2024-04-10 06:43:04,S018,C000172,Online,54.1,5.41,7,gen_20251127_091606,transactions_header.csv
T00010330,2024-11-26,2024-11-26 01:10:23,S006,C001529,Card,107.5,5.38,2,gen_20251127_091606,transactions_header.csv
T00017368,2024-06-20,2024-06-20 04:46:16,S004,C000082,Online,44.57,6.69,2,gen_20251127_091607,transactions_header.csv
T00001863,12/15/24,2024-12-15 10:55:48,S023,C004844,Online,52.97,0.0,5,gen_20251127_091605,transactions_header.csv
T00000345,11/23/24,2024-11-23 16:56:48,S018,C000260,Card,58.1,5.81,1,gen_20251127_091605,transactions_header.csv
T00013572,11/26/24,2024-11-26 14:55:51,S013,C000991,Cash,102.47,15.37,3,gen_20251127_091607,transactions_header.csv
T00018477,2024-12-13,2024-12-13 05:28:12,S004,C004631,Online,31.24,3.12,1,gen_20251127_091607,transactions_header.csv
T00003208,2024-05-11,2024-05-11 03:13:13,S016,C003316,Cash,56.92,5.69,1,gen_20251127_091606,transactions_header.csv
T00006886,2024-10-24,2024-10-24 12:03:19,S002,C004153,Online,26.32,1.32,2,gen_20251127_091606,transactions_header.csv
T00014251,02/09/24,2024-02-09 07:33:29,S008,C004206,Online,53.9,0.0,1,gen_20251127_091607,transactions_header.csv
T00017672,2024-07-27,2024-07-27 07:58:48,S022,C002659,Online,36.67,5.5,3,gen_20251127_091607,transactions_header.csv
T00019582,2024-11-10,2024-11-10 19:56:48,S003,C004047,Card,67.5,6.75,3,gen_20251127_091607,transactions_header.csv
T00009026,09/03/24,2024-09-03 15:34:16,S029,C004646,Card,43.73,6.56,1,gen_20251127_091606,transactions_header.csv
T00014671,2024-08-14,2024-08-14 02:26:28,S013,C001335,Cash,50.77,7.62,1,gen_20251127_091607,transactions_header.csv
T00010248,05/23/24,2024-05-23 12:42:04,S023,C002202,Card,30.53,1.53,1,gen_20251127_091606,transactions_header.csv
T00000043,08/13/24,2024-08-13 13:03:44,S022,C001084,card,48.0,7.2,1,gen_20251127_091605,transactions_header.csv
T00017063,2024-09-17,2024-09-17 17:46:31,S014,C000372,online,43.54,2.18,1,gen_20251127_091607,transactions_header.csv
T00007837,2024-09-25,2024-09-25 21:25:05,S003,C000260,Online,15.84,0.0,1,gen_20251127_091606,transactions_header.csv
T00003469,2024-08-12,2024-08-12 10:15:04,S014,C000788,online,23.81,0.0,1,gen_20251127_091606,transactions_header.csv
T00008574,2024-12-22,2024-12-22 06:00:22,S030,C003055,Cash,30.48,0.0,3,gen_20251127_091606,transactions_header.csv
T00000796,07/13/24,2024-07-13 05:55:11,S023,C002606,Card,92.64,13.9,1,gen_20251127_091605,transactions_header.csv
T00014607,2024-10-12,2024-10-12 10:52:43,S014,C001521,Card,51.55,5.16,2,gen_20251127_091607,transactions_header.csv
T00009983,2024-09-07,2024-09-07 03:07:54,S015,C001933,Online,32.36,0.0,3,gen_20251127_091606,transactions_header.csv
T00016622,08/06/24,2024-08-06 01:16:05,S024,C003517,Cash,63.64,0.0,7,gen_20251127_091607,transactions_header.csv
T00019883,2024-04-09,2024-04-09 08:45:58,S028,C003808,card,$86.93,,3,gen_20251127_091607,transactions_header.csv
T00014920,2024-01-31,2024-01-31 17:00:24,S013,,Card,45.64,2.28,1,gen_20251127_091607,transactions_header.csv
T00004345,2024-11-03,2024-11-03 08:19:19,S008,C000043,Online,10.42,0.52,1,gen_20251127_091606,transactions_header.csv
T00005332,01/06/24,2024-01-06 17:01:46,S002,C001568,Online,44.08,6.61,1,gen_20251127_091606,transactions_header.csv
T00004772,2024-06-11,2024-06-11 11:05:53,S025,C002371,Online,51.77,2.59,2,gen_20251127_091606,transactions_header.csv
T00009741,06/12/24,2024-06-12 11:58:04,S011,C003011,Cash,28.57,2.86,2,gen_20251127_091606,transactions_header.csv
T00010360,03/28/24,2024-03-28 21:16:48,S006,C001867,Card,14.53,1.45,2,gen_20251127_091606,transactions_header.csv
T00009004,11/28/24,2024-11-28 12:08:35,S023,C003154,Online,8.89,1.33,1,gen_20251127_091606,transactions_header.csv
T00018567,2024-05-20,2024-05-20 22:00:14,S016,NA,Online,88.75,8.88,2,gen_20251127_091607,transactions_header.csv
T00011829,2024-10-08,2024-10-08 09:42:16,S009,C003307,Online,87.83,4.39,1,gen_20251127_091607,transactions_header.csv
T00000047,2024-10-08,2024-10-08 02:17:02,S015,C001556,Card,7.2,0.72,1,gen_20251127_091605,transactions_header.csv
T00014034,2024-10-26,2024-10-26 18:31:14,S014,C004686,Cash,64.98,3.25,1,gen_20251127_091607,transactions_header.csv
T00014690,10/10/24,2024-10-10 08:04:03,S024,C000265,Online,79.44,3.97,7,gen_20251127_091607,transactions_header.csv
T00013912,2024-04-18,2024-04-18 09:27:45,S004,C000334,Online,5.29,0.79,2,gen_20251127_091607,transactions_header.csv
T00015875,08/23/24,2024-08-23 04:56:43,S005,,Card,48.69,4.87,2,gen_20251127_091607,transactions_header.csv
T00012863,2024-08-29,2024-08-29 18:29:12,S025,C000814,Card,52.03,5.2,2,gen_20251127_091607,transactions_header.csv
T00011122,07/14/24,2024-07-14 02:48:01,S017,C003062,Card,57.24,0.0,2,gen_20251127_091606,transactions_header.csv
T00009712,2024-09-25,2024-09-25 17:29:07,S009,C002829,Online,40.14,0.0,2,gen_20251127_091606,transactions_header.csv
T00012700,02/21/24,2024-02-21 08:06:12,S007,C003368,Online,71.42,NA,3,gen_20251127_091607,transactions_header.csv
T00013206,2024-02-05,2024-02-05 06:55:22,S011,C003827,Online,59.84,,1,gen_20251127_091607,transactions_header.csv
T00012607,01/05/24,2024-01-05 12:48:47,S026,C004171,cash,102.52,,7,gen_20251127_091607,transactions_header.csv
T00011220,2024-09-29,2024-09-29 13:06:01,S006,C004011,Card,17.01,0.85,1,gen_20251127_091606,transactions_header.csv
T00017197,2024-09-16,2024-09-16 22:08:01,S008,,Online,33.7,3.37,1,gen_20251127_091607,transactions_header.csv
T00006668,2024-01-20,2024-01-20 18:38:53,S028,C003245,Online,60.5,3.03,2,gen_20251127_091606,transactions_header.csv
T00002603,05/01/24,2024-05-01 13:59:36,S029,C004028,Online,103.96,5.2,3,gen_20251127_091605,transactions_header.csv
T00013074,2024-05-05,2024-05-05 03:49:48,S030,C004195,Online,69.0,6.9,1,gen_20251127_091607,transactions_header.csv
T00016367,04/20/24,2024-04-20 20:54:16,S017,C001778,Online,52.68,0.0,3,gen_20251127_091607,transactions_header.csv
T00017598,10/10/24,2024-10-10 07:38:42,S030,C003069,Card,45.66,2.28,1,gen_20251127_091607,transactions_header.csv
T00018110,2024-07-17,2024-07-17 15:22:59,S025,C001409,Online,87.43,13.11,1,gen_20251127_091607,transactions_header.csv
T00011784,2024-04-08,2024-04-08 07:21:27,S020,C002543,Card,44.58,0.0,4,gen_20251127_091607,transactions_header.csv
T00002128,2024-08-06,2024-08-06 13:47:20,S017,C000330,Cash,36.72,1.84,1,gen_20251127_091605,transactions_header.csv
T00007593,01/14/24,2024-01-14 14:37:07,S025,C002909,Online,73.59,NA,2,gen_20251127_091606,transactions_header.csv
T00003822,10/09/24,2024-10-09 15:59:59,S026,C003833,Cash,146.94,14.69,1,gen_20251127_091606,transactions_header.csv
T00019433,2024-01-13,2024-01-13 13:50:26,S009,C000959,Card,43.74,0.0,1,gen_20251127_091607,transactions_header.csv
T00006585,01/28/24,2024-01-28 17:37:50,S010,C002799,Cash,40.27,4.03,3,gen_20251127_091606,transactions_header.csv
T00010126,2024-04-23,2024-04-23 20:30:18,S018,,Online,63.64,0.0,4,gen_20251127_091606,transactions_header.csv
T00006276,12/01/24,2024-12-01 20:12:51,S017,C001843,Cash,61.81,3.09,1,gen_20251127_091606,transactions_header.csv
T00015000,05/10/24,2024-05-10 13:33:32,S028,C002960,Card,73.49,7.35,2,gen_20251127_091607,transactions_header.csv
T00010348,2024-08-10,2024-08-10 10:37:05,S008,C004371,Card,35.81,0.0,5,gen_20251127_091606,transactions_header.csv
T00006073,08/11/24,2024-08-11 23:12:52,S028,C000129,Online,43.0,6.45,2,gen_20251127_091606,transactions_header.csv
T00010980,2024-02-22,2024-02-22 11:31:58,S002,C000809,online,34.68,,8,gen_20251127_091606,transactions_header.csv
T00016271,2024-02-08,2024-02-08 00:29:10,S015,C001855,Online,77.67,3.88,1,gen_20251127_091607,transactions_header.csv
T00014803,06/23/24,2024-06-23 10:23:26,S005,C001519,Cash,59.73,0.0,2,gen_20251127_091607,transactions_header.csv
T00006312,03/12/24,2024-03-12 10:53:18,S014,NA,Card,49.0,2.45,7,gen_20251127_091606,transactions_header.csv
T00011106,06/26/24,2024-06-26 09:31:08,S019,C000816,Cash,40.22,0.0,1,gen_20251127_091606,transactions_header.csv
T00004784,04/23/24,2024-04-23 01:27:12,S026,C004035,Online,18.16,0.0,1,gen_20251127_091606,transactions_header.csv
T00017228,08/09/24,2024-08-09 03:44:47,S019,C001604,Cash,63.32,0.0,3,gen_20251127_091607,transactions_header.csv
T00004025,2024-11-15,2024-11-15 10:40:03,S017,C004236,Online,43.09,4.31,1,gen_20251127_091606,transactions_header.csv
T00018398,08/17/24,2024-08-17 15:38:01,S011,C003893,Online,29.23,,1,gen_20251127_091607,transactions_header.csv
T00009235,2024-09-09,2024-09-09 21:32:51,S012,C001517,Cash,79.54,0.0,1,gen_20251127_091606,transactions_header.csv
T00008193,02/27/24,2024-02-27 03:53:36,S012,C002406,Online,41.12,2.06,1,gen_20251127_091606,transactions_header.csv
T00007458,12/11/24,2024-12-11 10:17:47,S025,C000698,Cash,113.48,0.0,6,gen_20251127_091606,transactions_header.csv
T00002393,10/08/24,2024-10-08 16:07:40,S006,C003016,Online,10.37,1.56,1,gen_20251127_091605,transactions_header.csv
T00008009,2024-03-30,2024-03-30 09:13:26,S008,C004653,Card,62.94,9.44,3,gen_20251127_091606,transactions_header.csv
T00010018,09/03/24,2024-09-03 08:14:44,S018,C001892,Card,43.07,2.15,5,gen_20251127_091606,transactions_header.csv
T00014504,2024-07-31,2024-07-31 16:50:06,S015,,Cash,45.98,2.3,2,gen_20251127_091607,transactions_header.csv
T00002713,2024-05-30,2024-05-30 02:37:19,S009,C000194,Online,61.28,3.06,1,gen_20251127_091605,transactions_header.csv
T00016475,2024-08-06,2024-08-06 18:17:59,S016,C003583,Cash,63.35,9.5,5,gen_20251127_091607,transactions_header.csv
T00012865,2024-10-25,2024-10-25 21:48:19,S027,,Cash,0,0.0,1,gen_20251127_091607,transactions_header.csv
T00011969,09/11/24,2024-09-11 10:01:13,S014,NA,Card,45.35,4.54,2,gen_20251127_091607,transactions_header.csv
T00015164,2024-12-06,2024-12-06 21:25:22,S016,C001761,Cash,50.05,7.51,6,gen_20251127_091607,transactions_header.csv
T00009819,2024-08-17,2024-08-17 20:02:32,S009,C003653,Card,46.47,6.97,3,gen_20251127_091606,transactions_header.csv
T00009930,04/18/24,2024-04-18 17:52:27,S022,C003027,Cash,103.29,10.33,1,gen_20251127_091606,transactions_header.csv
T00013006,07/19/24,2024-07-19 13:49:30,S029,C000122,Card,26.77,0.0,3,gen_20251127_091607,transactions_header.csv
T00006736,2024-10-19,2024-10-19 14:54:05,S014,C004217,Online,13.28,1.33,4,gen_20251127_091606,transactions_header.csv
T00006408,06/17/24,2024-06-17 07:50:44,S015,C000937,online,57.33,8.6,2,gen_20251127_091606,transactions_header.csv
T00003269,2024-02-07,2024-02-07 08:11:23,S005,C002604,Online,81.5,8.15,3,gen_20251127_091606,transactions_header.csv
T00006109,2024-06-05,2024-06-05 08:37:09,S030,C003676,Card,45.93,2.3,6,gen_20251127_091606,transactions_header.csv
T00019338,01/14/24,2024-01-14 16:05:27,S008,C002800,Online,116.69,0.0,2,gen_20251127_091607,transactions_header.csv
T00013979,2024-07-18,2024-07-18 19:52:51,S012,C002940,Online,0,0.0,1,gen_20251127_091607,transactions_header.csv
T00015608,11/18/24,2024-11-18 12:14:12,S023,C001191,Online,1.22,NA,3,gen_20251127_091607,transactions_header.csv
T00000709,2024-10-15,2024-10-15 11:01:18,S008,,Card,40.99,,2,gen_20251127_091605,transactions_header.csv
T00014329,09/16/24,2024-09-16 08:29:52,S018,C000448,Online,$64.99,6.5,1,gen_20251127_091607,transactions_header.csv
T00017189,2024-01-17,2024-01-17 08:25:18,S013,C004772,Online,20.63,3.09,7,gen_20251127_091607,transactions_header.csv
T00012884,2024-08-11,2024-08-11 04:02:06,S004,NA,online,$42.46,6.37,1,gen_20251127_091607,transactions_header.csv
T00009749,2024-03-11,2024-03-11 06:49:32,S016,C002735,Card,10.88,0.0,2,gen_20251127_091606,transactions_header.csv
T00002767,07/03/24,2024-07-03 03:12:50,S024,,Card,21.16,,1,gen_20251127_091605,transactions_header.csv
T00000689,12/24/24,2024-12-24 00:15:14,S005,C001504,Card,15.21,0.0,2,gen_20251127_091605,transactions_header.csv
T00002699,2024-04-18,2024-04-18 07:42:58,S003,C000849,Cash,0,0.0,4,gen_20251127_091605,transactions_header.csv
T00004022,2024-03-30,2024-03-30 08:35:41,S028,C001890,Online,96.13,4.81,5,gen_20251127_091606,transactions_header.csv
T00003464,2024-08-04,2024-08-04 22:21:35,S025,C002662,online,49.65,7.45,1,gen_20251127_091606,transactions_header.csv
T00007692,2024-06-21,2024-06-21 00:53:57,S016,C004636,Card,97.34,4.87,2,gen_20251127_091606,transactions_header.csv
T00003275,2024-12-17,2024-12-17 12:14:52,S007,C003423,Card,67.83,10.17,1,gen_20251127_091606,transactions_header.csv
T00010039,2024-08-26,2024-08-26 17:25:25,S025,C002644,Card,74.87,3.74,2,gen_20251127_091606,transactions_header.csv
T00001535,2024-06-22,2024-06-22 16:57:17,S026,C001719,Cash,45.27,2.26,2,gen_20251127_091605,transactions_header.csv
T00002930,2024-02-06,2024-02-06 21:10:14,S012,C000992,Online,48.63,2.43,4,gen_20251127_091606,transactions_header.csv
T00008800,2024-01-05,2024-01-05 17:01:53,S003,C004478,Card,41.31,4.13,1,gen_20251127_091606,transactions_header.csv
T00004011,10/14/24,2024-10-14 09:43:52,S014,C001014,Online,36.26,0.0,1,gen_20251127_091606,transactions_header.csv
T00003754,05/22/24,2024-05-22 04:17:34,S022,C003223,Online,54.81,2.74,2,gen_20251127_091606,transactions_header.csv
T00004654,10/22/24,2024-10-22 12:55:01,S027,C004404,Cash,40.59,0.0,1,gen_20251127_091606,transactions_header.csv
T00007554,06/30/24,2024-06-30 19:32:00,S018,C001056,Cash,94.58,9.46,1,gen_20251127_091606,transactions_header.csv
T00019979,07/27/24,2024-07-27 21:05:31,S004,C002358,online,34.08,0.0,2,gen_20251127_091608,transactions_header.csv
T00019807,11/11/24,2024-11-11 21:58:05,S016,C002304,Cash,73.91,11.09,4,gen_20251127_091607,transactions_header.csv
T00008058,2024-11-14,2024-11-14 23:41:21,S022,C004480,Card,62.37,0.0,1,gen_20251127_091606,transactions_header.csv
T00016099,12/04/24,2024-12-04 10:54:05,S010,C003016,Card,60.57,6.06,3,gen_20251127_091607,transactions_header.csv
T00000645,2024-02-16,2024-02-16 00:31:03,S018,C002604,Cash,38.99,3.9,1,gen_20251127_091605,transactions_header.csv
T00015261,11/06/24,2024-11-06 22:15:37,S006,C000847,Cash,63.59,9.54,1,gen_20251127_091607,transactions_header.csv
T00008248,2024-12-09,2024-12-09 19:27:40,S022,C003681,Cash,32.29,4.84,6,gen_20251127_091606,transactions_header.csv
T00013039,09/01/24,2024-09-01 05:47:43,S002,C002625,Online,110.83,0.0,4,gen_20251127_091607,transactions_header.csv
T00009752,02/23/24,2024-02-23 18:55:21,S011,C002736,Online,87.53,,2,gen_20251127_091606,transactions_header.csv
T00011633,2024-11-04,2024-11-04 02:11:59,S006,,Cash,63.35,0.0,1,gen_20251127_091606,transactions_header.csv
T00009832,08/17/24,2024-08-17 21:03:27,S010,C004404,Card,53.07,7.96,3,gen_20251127_091606,transactions_header.csv
T00014219,03/04/24,2024-03-04 15:16:43,S016,C002883,Card,0,0,2,gen_20251127_091607,transactions_header.csv
T00012567,2024-03-09,2024-03-09 19:24:38,S030,C000698,Online,8.09,0.4,1,gen_20251127_091607,transactions_header.csv
T00016687,2024-09-14,2024-09-14 10:45:56,S015,C003927,Cash,81.42,0.0,1,gen_20251127_091607,transactions_header.csv
T00011110,04/12/24,2024-04-12 10:41:02,S003,C003217,Cash,58.68,5.87,2,gen_20251127_091606,transactions_header.csv
T00007516,05/12/24,2024-05-12 07:49:37,S004,C001879,Card,$53.47,,5,gen_20251127_091606,transactions_header.csv
T00006422,2024-09-25,2024-09-25 06:22:24,S010,C004386,Cash,17.47,1.75,2,gen_20251127_091606,transactions_header.csv
T00010723,05/16/24,2024-05-16 04:26:58,S021,C004364,Card,73.93,0.0,1,gen_20251127_091606,transactions_header.csv
T00004986,2024-01-17,2024-01-17 00:45:06,S010,C003675,Cash,2.64,0.13,1,gen_20251127_091606,transactions_header.csv
T00004881,2024-04-17,2024-04-17 21:16:35,S013,C001874,Card,42.8,4.28,1,gen_20251127_091606,transactions_header.csv
T00012387,02/11/24,2024-02-11 02:09:36,S011,C003496,Cash,36.59,5.49,1,gen_20251127_091607,transactions_header.csv
T00001607,04/12/24,2024-04-12 01:41:08,S011,C000161,Online,50.3,7.54,6,gen_20251127_091605,transactions_header.csv
T00009535,2024-05-04,2024-05-04 03:25:53,S018,C000661,Cash,68.83,6.88,3,gen_20251127_091606,transactions_header.csv
T00012900,2024-10-07,2024-10-07 07:19:48,S001,C001360,Card,37.2,0.0,3,gen_20251127_091607,transactions_header.csv
T00003060,10/20/24,2024-10-20 15:23:30,S024,C001610,Online,51.21,5.12,5,gen_20251127_091606,transactions_header.csv
T00005611,10/23/24,2024-10-23 21:09:52,S007,,Card,6.96,,2,gen_20251127_091606,transactions_header.csv
T00011154,11/29/24,2024-11-29 11:02:38,S014,C004075,Cash,76.29,7.63,1,gen_20251127_091606,transactions_header.csv
T00002949,2024-02-28,2024-02-28 20:34:15,S011,C004579,Cash,44.48,4.45,1,gen_20251127_091606,transactions_header.csv
T00001431,2024-09-04,2024-09-04 14:30:21,S014,C000885,Online,99.12,9.91,1,gen_20251127_091605,transactions_header.csv
T00012215,2024-07-19,2024-07-19 08:35:20,S011,C002404,Card,$62.25,9.34,2,gen_20251127_091607,transactions_header.csv
T00015927,10/29/24,2024-10-29 16:34:40,S026,C002295,Online,12.36,0.0,1,gen_20251127_091607,transactions_header.csv
T00015114,2024-12-17,2024-12-17 03:28:46,S004,C001697,Cash,71.08,3.55,1,gen_20251127_091607,transactions_header.csv
T00014642,2024-10-13,2024-10-13 17:04:20,S008,C001554,Cash,52.08,,1,gen_20251127_091607,transactions_header.csv
T00010691,08/15/24,2024-08-15 20:13:52,S028,C002300,Cash,2.0,0.2,1,gen_20251127_091606,transactions_header.csv
T00018538,2024-10-03,2024-10-03 12:38:25,S001,C003756,Cash,80.97,8.1,1,gen_20251127_091607,transactions_header.csv
T00005916,2024-05-02,2024-05-02 18:31:32,S027,C003931,Card,41.56,4.16,2,gen_20251127_091606,transactions_header.csv
T00010446,08/04/24,2024-08-04 17:23:29,S021,C001191,Cash,68.71,0.0,7,gen_20251127_091606,transactions_header.csv
T00011688,2024-05-30,2024-05-30 08:58:28,S014,C000177,Card,75.48,,1,gen_20251127_091607,transactions_header.csv
T00015322,04/15/24,2024-04-15 17:59:18,S027,C003053,Online,29.74,4.46,1,gen_20251127_091607,transactions_header.csv
T00018882,2024-11-03,2024-11-03 23:14:37,S015,C001382,Online,56.56,,2,gen_20251127_091607,transactions_header.csv
T00003777,08/16/24,2024-08-16 16:09:24,S010,C004168,Online,34.69,5.2,2,gen_20251127_091606,transactions_header.csv
T00011434,02/17/24,2024-02-17 07:26:48,S018,C002591,Cash,9.64,0.96,1,gen_20251127_091606,transactions_header.csv
T00008455,12/03/24,2024-12-03 03:14:19,S004,C004402,Online,15.8,0.79,3,gen_20251127_091606,transactions_header.csv
T00019867,2024-03-08,2024-03-08 19:59:34,S026,C001150,Online,72.39,3.62,2,gen_20251127_091607,transactions_header.csv
T00005827,2024-04-15,2024-04-15 03:33:46,S019,C004063,Cash,64.2,3.21,2,gen_20251127_091606,transactions_header.csv
T00001711,2024-05-10,2024-05-10 10:18:27,S029,NA,Cash,53.74,0.0,4,gen_20251127_091605,transactions_header.csv
T00017294,05/05/24,2024-05-05 18:34:12,S026,C004468,Cash,0,,1,gen_20251127_091607,transactions_header.csv
T00012579,03/29/24,2024-03-29 09:05:28,S028,,Cash,71.07,3.55,5,gen_20251127_091607,transactions_header.csv
T00015185,2024-01-11,2024-01-11 17:14:20,S008,C004906,Cash,38.13,5.72,2,gen_20251127_091607,transactions_header.csv
T00013112,2024-02-02,2024-02-02 22:20:50,S014,C000879,Card,$84.03,8.4,1,gen_20251127_091607,transactions_header.csv
T00016072,05/09/24,2024-05-09 22:21:29,S005,C001305,Online,83.16,4.16,2,gen_20251127_091607,transactions_header.csv
T00010920,2024-08-18,2024-08-18 22:08:13,S014,C002528,Online,37.48,0.0,3,gen_20251127_091606,transactions_header.csv
T00018523,2024-11-16,2024-11-16 15:24:57,S023,C001600,Online,45.44,2.27,8,gen_20251127_091607,transactions_header.csv
T00007202,01/25/24,2024-01-25 22:19:40,S015,C001725,Card,87.11,13.07,1,gen_20251127_091606,transactions_header.csv
T00018602,2024-05-10,2024-05-10 18:29:06,S024,C000151,Online,22.39,,1,gen_20251127_091607,transactions_header.csv
T00008292,2024-03-31,2024-03-31 07:00:13,S019,C003937,online,41.78,2.09,1,gen_20251127_091606,transactions_header.csv
T00006336,11/10/24,2024-11-10 23:38:11,S020,C000020,Cash,-33.98,0.0,2,gen_20251127_091606,transactions_header.csv
T00016277,09/19/24,2024-09-19 09:22:42,S021,,Online,27.87,,8,gen_20251127_091607,transactions_header.csv
T00013534,2024-03-29,2024-03-29 14:15:30,S013,C001797,Cash,20.03,NA,4,gen_20251127_091607,transactions_header.csv
T00009870,04/04/24,2024-04-04 04:46:17,S004,NA,cash,112.93,0.0,3,gen_20251127_091606,transactions_header.csv
T00014559,2024-07-07,2024-07-07 03:12:35,S029,C003209,Online,21.62,0.0,3,gen_20251127_091607,transactions_header.csv
T00011946,10/03/24,2024-10-03 07:28:21,S013,C002171,Card,21.18,1.06,1,gen_20251127_091607,transactions_header.csv
T00010020,11/05/24,2024-11-05 11:05:34,S027,C002027,Cash,56.07,8.41,1,gen_20251127_091606,transactions_header.csv
T00002362,2024-10-25,2024-10-25 14:32:56,S016,NA,Online,44.74,0.0,1,gen_20251127_091605,transactions_header.csv
T00016677,01/16/24,2024-01-16 04:14:28,S007,C000696,Online,87.05,4.35,1,gen_20251127_091607,transactions_header.csv
T00006881,09/05/24,2024-09-05 12:23:55,S021,C002216,Cash,37.88,1.89,1,gen_20251127_091606,transactions_header.csv
T00009069,04/29/24,2024-04-29 13:21:36,S007,,Online,62.88,6.29,2,gen_20251127_091606,transactions_header.csv
T00002627,12/22/24,2024-12-22 23:09:10,S015,C003552,Card,40.59,0.0,2,gen_20251127_091605,transactions_header.csv
T00012789,08/19/24,2024-08-19 13:52:17,S011,C003016,Cash,43.44,NA,1,gen_20251127_091607,transactions_header.csv
T00003483,04/18/24,2024-04-18 03:57:06,S016,C000444,online,103.31,10.33,2,gen_20251127_091606,transactions_header.csv
T00011513,2024-03-13,2024-03-13 05:41:41,S030,C002177,Card,15.66,2.35,2,gen_20251127_091606,transactions_header.csv
T00012628,09/05/24,2024-09-05 02:11:26,S025,C000485,Card,33.97,3.4,5,gen_20251127_091607,transactions_header.csv
T00017065,09/04/24,2024-09-04 22:13:54,S008,,Online,93.7,9.37,1,gen_20251127_091607,transactions_header.csv
T00006226,2024-01-22,2024-01-22 19:31:22,S021,C002887,Cash,60.22,9.03,2,gen_20251127_091606,transactions_header.csv
T00001163,12/10/24,2024-12-10 05:38:44,S001,C001193,Cash,$81.26,12.19,1,gen_20251127_091605,transactions_header.csv
T00017811,02/07/24,2024-02-07 06:51:58,S014,C001954,Online,45.03,4.5,8,gen_20251127_091607,transactions_header.csv
T00008591,2024-11-26,2024-11-26 16:35:41,S018,,Cash,$67.22,6.72,1,gen_20251127_091606,transactions_header.csv
T00005439,2024-04-10,2024-04-10 22:26:09,S020,C002258,Card,85.31,,4,gen_20251127_091606,transactions_header.csv
T00009417,04/16/24,2024-04-16 08:15:34,S011,C003107,Online,56.21,,1,gen_20251127_091606,transactions_header.csv
T00006441,02/12/24,2024-02-12 13:39:16,S025,C001416,Online,33.58,1.68,2,gen_20251127_091606,transactions_header.csv
T00010546,11/25/24,2024-11-25 10:20:36,S020,C003105,Cash,$48.57,2.43,1,gen_20251127_091606,transactions_header.csv
T00012520,12/05/24,2024-12-05 22:20:34,S003,C000125,Online,6.63,0.0,5,gen_20251127_091607,transactions_header.csv
T00003966,08/30/24,2024-08-30 14:31:46,S005,C000149,Cash,49.9,0.0,1,gen_20251127_091606,transactions_header.csv
T00016861,11/18/24,2024-11-18 23:30:03,S020,C001825,Online,56.11,5.61,3,gen_20251127_091607,transactions_header.csv
T00018942,2024-02-22,2024-02-22 18:46:01,S022,C001519,Card,29.86,,1,gen_20251127_091607,transactions_header.csv
T00004374,08/14/24,2024-08-14 15:45:05,S002,C001031,Cash,83.52,8.35,1,gen_20251127_091606,transactions_header.csv
T00007173,07/30/24,2024-07-30 13:59:58,S001,C001016,Cash,100.12,10.01,1,gen_20251127_091606,transactions_header.csv
T00016333,2024-02-04,2024-02-04 03:58:56,S012,C004829,Cash,30.08,NA,2,gen_20251127_091607,transactions_header.csv
T00011623,09/07/24,2024-09-07 02:48:17,S011,,cash,62.3,0.0,1,gen_20251127_091606,transactions_header.csv
T00007308,07/01/24,2024-07-01 04:01:25,S002,C000470,Cash,34.98,3.5,2,gen_20251127_091606,transactions_header.csv
T00001356,2024-10-12,2024-10-12 21:18:50,S015,C002871,Card,87.49,13.12,1,gen_20251127_091605,transactions_header.csv
T00019685,2024-10-22,2024-10-22 23:48:57,S026,C000977,Online,17.76,1.78,1,gen_20251127_091607,transactions_header.csv
T00013165,10/04/24,2024-10-04 22:13:51,S026,C004544,Card,76.39,11.46,1,gen_20251127_091607,transactions_header.csv
T00007921,09/09/24,2024-09-09 22:18:21,S012,C004866,Card,28.85,4.33,1,gen_20251127_091606,transactions_header.csv
T00009445,08/11/24,2024-08-11 15:07:20,S021,C003342,Card,49.15,2.46,2,gen_20251127_091606,transactions_header.csv
T00012895,01/08/24,2024-01-08 14:27:36,S007,C002283,Card,100.23,15.03,1,gen_20251127_091607,transactions_header.csv
T00016703,2024-03-27,2024-03-27 02:07:18,S015,C002773,Card,33.21,1.66,1,gen_20251127_091607,transactions_header.csv
T00015032,2024-10-01,2024-10-01 00:27:26,S005,C004803,Online,10.79,1.08,6,gen_20251127_091607,transactions_header.csv
T00012549,2024-07-07,2024-07-07 08:36:18,S020,C002858,Cash,47.73,7.16,2,gen_20251127_091607,transactions_header.csv
T00009609,05/20/24,2024-05-20 18:56:32,S012,C003141,Card,89.52,4.48,1,gen_20251127_091606,transactions_header.csv
T00016203,2024-04-18,2024-04-18 12:40:24,S026,C000905,Online,70.25,3.51,3,gen_20251127_091607,transactions_header.csv
T00010978,2024-11-11,2024-11-11 11:15:34,S026,C000311,Cash,1.12,0.06,1,gen_20251127_091606,transactions_header.csv
T00015413,09/07/24,2024-09-07 11:37:11,S009,,Online,53.15,0.0,2,gen_20251127_091607,transactions_header.csv
T00016757,2024-06-10,2024-06-10 03:13:42,S016,C004167,Online,92.11,9.21,5,gen_20251127_091607,transactions_header.csv
T00005763,05/14/24,2024-05-14 09:12:35,S026,C000573,Online,67.18,0.0,1,gen_20251127_091606,transactions_header.csv
T00010102,2024-02-05,2024-02-05 20:52:26,S015,C001326,Online,3.75,0.56,2,gen_20251127_091606,transactions_header.csv
T00000564,2024-08-19,2024-08-19 04:58:54,S018,C001988,Cash,60.2,3.01,8,gen_20251127_091605,transactions_header.csv
T00007585,10/18/24,2024-10-18 16:47:34,S012,C003820,Online,68.9,,2,gen_20251127_091606,transactions_header.csv
T00011907,06/03/24,2024-06-03 03:11:03,S030,C001806,Card,77.75,0.0,1,gen_20251127_091607,transactions_header.csv
T00018692,06/01/24,2024-06-01 07:45:17,S022,C004550,Card,-30.49,4.57,1,gen_20251127_091607,transactions_header.csv
T00003209,2024-02-07,2024-02-07 11:44:18,S010,C001400,Online,39.74,NA,2,gen_20251127_091606,transactions_header.csv
T00017959,08/03/24,2024-08-03 00:50:29,S030,C001823,Cash,89.92,8.99,1,gen_20251127_091607,transactions_header.csv
T00001420,2024-08-13,2024-08-13 20:09:25,S003,C001079,Card,76.9,0.0,4,gen_20251127_091605,transactions_header.csv
T00013586,2024-05-22,2024-05-22 07:25:21,S009,C004828,Cash,92.53,4.63,3,gen_20251127_091607,transactions_header.csv
T00017180,07/29/24,2024-07-29 22:15:50,S023,C000270,Cash,69.46,,1,gen_20251127_091607,transactions_header.csv
T00015202,08/05/24,2024-08-05 04:37:46,S029,,Card,55.92,2.8,7,gen_20251127_091607,transactions_header.csv
T00000827,2024-03-31,2024-03-31 01:20:00,S016,C004477,Cash,44.37,,1,gen_20251127_091605,transactions_header.csv
T00009225,2024-03-18,2024-03-18 04:14:26,S028,C001374,Cash,0,0.0,1,gen_20251127_091606,transactions_header.csv
T00012471,11/29/24,2024-11-29 02:59:45,S002,C000619,Online,40.87,4.09,2,gen_20251127_091607,transactions_header.csv
T00010426,2024-05-18,2024-05-18 03:12:46,S024,C002479,Online,87.86,8.79,1,gen_20251127_091606,transactions_header.csv
T00002044,01/07/24,2024-01-07 02:58:21,S002,C000179,Online,25.94,0.0,1,gen_20251127_091605,transactions_header.csv
T00013631,09/04/24,2024-09-04 10:10:49,S016,,Cash,57.48,2.87,1,gen_20251127_091607,transactions_header.csv
T00000291,06/22/24,2024-06-22 01:11:54,S027,C001751,Cash,36.55,0.0,1,gen_20251127_091605,transactions_header.csv
T00002035,09/10/24,2024-09-10 00:47:36,S015,C004690,Card,36.43,0.0,1,gen_20251127_091605,transactions_header.csv
T00011847,01/07/24,2024-01-07 21:33:16,S017,C000407,cash,24.07,3.61,5,gen_20251127_091607,transactions_header.csv
T00003063,2024-05-24,2024-05-24 12:23:36,S005,C002687,Online,26.84,1.34,2,gen_20251127_091606,transactions_header.csv
T00003705,2024-07-01,2024-07-01 20:19:56,S020,C000958,Cash,10.91,0.55,1,gen_20251127_091606,transactions_header.csv
T00002625,2024-12-02,2024-12-02 19:05:25,S005,C003727,Online,21.46,3.22,4,gen_20251127_091605,transactions_header.csv
T00013701,11/23/24,2024-11-23 02:28:27,S005,C000680,Online,77.88,3.89,4,gen_20251127_091607,transactions_header.csv
T00003512,2024-06-08,2024-06-08 20:00:00,S018,C001829,online,53.36,5.34,6,gen_20251127_091606,transactions_header.csv
T00015856,2024-08-06,2024-08-06 11:49:38,S015,C002653,Online,102.85,0.0,1,gen_20251127_091607,transactions_header.csv
T00005169,2024-10-09,2024-10-09 14:43:13,S005,C001383,Online,32.79,1.64,1,gen_20251127_091606,transactions_header.csv
T00016594,09/05/24,2024-09-05 11:59:02,S028,C003471,Cash,95.9,9.59,1,gen_20251127_091607,transactions_header.csv
T00002715,2024-09-23,2024-09-23 02:51:57,S018,C002984,Card,17.26,,7,gen_20251127_091605,transactions_header.csv
T00005993,03/07/24,2024-03-07 03:19:06,S008,,Cash,71.51,10.73,1,gen_20251127_091606,transactions_header.csv
T00009290,2024-09-17,2024-09-17 18:45:40,S002,C000215,cash,27.06,2.71,1,gen_20251127_091606,transactions_header.csv
T00012511,2024-04-04,2024-04-04 00:33:47,S029,C004814,Card,61.12,0.0,1,gen_20251127_091607,transactions_header.csv
T00000641,02/16/24,2024-02-16 16:30:00,S015,C003595,Cash,74.23,3.71,1,gen_20251127_091605,transactions_header.csv
T00007439,02/29/24,2024-02-29 02:48:55,S003,C001110,Card,42.47,6.37,3,gen_20251127_091606,transactions_header.csv
T00005181,03/11/24,2024-03-11 00:09:47,S030,,Cash,45.45,NA,1,gen_20251127_091606,transactions_header.csv
T00005859,03/06/24,2024-03-06 14:21:03,S029,C002850,card,$71.77,0.0,1,gen_20251127_091606,transactions_header.csv
T00004626,06/23/24,2024-06-23 09:01:21,S023,C002052,Online,46.75,0.0,3,gen_20251127_091606,transactions_header.csv
T00009261,03/01/24,2024-03-01 00:31:51,S030,NA,Online,8.44,1.27,1,gen_20251127_091606,transactions_header.csv
T00016838,01/09/24,2024-01-09 08:41:49,S007,NA,Cash,55.27,5.53,1,gen_20251127_091607,transactions_header.csv
T00000483,2024-01-01,2024-01-01 20:25:54,S007,C004713,Online,$17.78,2.67,1,gen_20251127_091605,transactions_header.csv
T00013678,12/24/24,2024-12-24 22:31:49,S011,C002308,Cash,86.75,0.0,1,gen_20251127_091607,transactions_header.csv
T00004936,2024-01-03,2024-01-03 11:45:39,S024,C001751,Cash,134.36,20.15,1,gen_20251127_091606,transactions_header.csv
T00013153,08/15/24,2024-08-15 00:46:25,S007,NA,Cash,53.95,0.0,1,gen_20251127_091607,transactions_header.csv
T00009339,06/14/24,2024-06-14 07:29:59,S014,C000464,online,$34.28,5.14,3,gen_20251127_091606,transactions_header.csv
T00013264,2024-06-09,2024-06-09 14:00:37,S009,C003982,Card,0,0.0,1,gen_20251127_091607,transactions_header.csv
T00013230,2024-11-14,2024-11-14 14:41:59,S004,C001564,Card,40.63,0.0,2,gen_20251127_091607,transactions_header.csv
T00008390,11/04/24,2024-11-04 15:15:04,S008,C002342,Online,52.42,2.62,3,gen_20251127_091606,transactions_header.csv
T00002636,07/21/24,2024-07-21 18:15:55,S005,C003099,Cash,32.31,3.23,1,gen_20251127_091605,transactions_header.csv
T00005199,2024-09-13,2024-09-13 19:38:41,S015,C002282,Online,$6.77,,1,gen_20251127_091606,transactions_header.csv
T00006280,03/07/24,2024-03-07 18:17:06,S028,C001955,Online,85.98,4.3,2,gen_20251127_091606,transactions_header.csv
T00019206,2024-02-16,2024-02-16 04:28:00,S026,C004942,cash,36.39,0.0,1,gen_20251127_091607,transactions_header.csv
T00016278,2024-03-05,2024-03-05 07:39:53,S012,C003587,Card,21.2,1.06,1,gen_20251127_091607,transactions_header.csv
T00004978,2024-09-29,2024-09-29 17:30:40,S007,C000204,online,84.53,0.0,2,gen_20251127_091606,transactions_header.csv
T00006353,2024-09-26,2024-09-26 21:43:44,S012,C001982,Online,34.3,0.0,2,gen_20251127_091606,transactions_header.csv
T00006425,01/23/24,2024-01-23 22:05:46,S030,C001743,Online,6.33,0.95,1,gen_20251127_091606,transactions_header.csv
T00006142,2024-12-23,2024-12-23 23:33:19,S029,C002190,Card,67.63,3.38,3,gen_20251127_091606,transactions_header.csv
T00003288,10/23/24,2024-10-23 12:29:18,S026,C002570,Card,1.64,0.08,1,gen_20251127_091606,transactions_header.csv
T00017355,2024-01-06,2024-01-06 01:34:10,S024,C001576,Card,63.91,0.0,1,gen_20251127_091607,transactions_header.csv
T00007041,2024-11-27,2024-11-27 08:45:22,S013,C000063,Online,46.27,NA,1,gen_20251127_091606,transactions_header.csv
T00014797,01/21/24,2024-01-21 11:36:06,S027,C000684,Online,31.83,1.59,1,gen_20251127_091607,transactions_header.csv
T00015054,2024-06-08,2024-06-08 19:23:05,S005,C000657,Card,103.57,10.36,4,gen_20251127_091607,transactions_header.csv
T00000978,02/05/24,2024-02-05 16:19:57,S004,C002557,Online,27.91,1.4,3,gen_20251127_091605,transactions_header.csv
T00017221,2024-03-14,2024-03-14 14:03:50,S023,C002512,Online,2.72,0.41,5,gen_20251127_091607,transactions_header.csv
T00015160,2024-02-06,2024-02-06 06:02:52,S024,C001321,Online,54.71,,4,gen_20251127_091607,transactions_header.csv
T00017394,08/07/24,2024-08-07 03:21:18,S018,C003186,Online,31.5,0.0,3,gen_20251127_091607,transactions_header.csv
T00001816,04/03/24,2024-04-03 17:10:41,S021,C004675,Card,50.08,,1,gen_20251127_091605,transactions_header.csv
T00007311,12/05/24,2024-12-05 23:40:14,S013,C000702,Cash,36.55,3.65,2,gen_20251127_091606,transactions_header.csv
T00018123,2024-09-06,2024-09-06 02:20:54,S029,C002629,Cash,13.21,0.0,1,gen_20251127_091607,transactions_header.csv
T00014153,2024-07-06,2024-07-06 00:20:26,S026,C004851,Online,36.79,NA,6,gen_20251127_091607,transactions_header.csv
T00012529,2024-02-12,2024-02-12 15:31:25,S005,C003800,Card,46.82,0.0,2,gen_20251127_091607,transactions_header.csv
T00002879,2024-03-29,2024-03-29 00:04:24,S002,C004166,Cash,61.32,3.07,1,gen_20251127_091606,transactions_header.csv
T00001154,06/15/24,2024-06-15 02:35:56,S024,C001411,Cash,78.82,3.94,1,gen_20251127_091605,transactions_header.csv
T00002677,01/01/24,2024-01-01 16:57:12,S022,C003954,Online,81.21,12.18,2,gen_20251127_091605,transactions_header.csv
T00004611,2024-06-03,2024-06-03 15:57:36,S030,C001795,Online,16.29,2.44,1,gen_20251127_091606,transactions_header.csv
T00017578,02/12/24,2024-02-12 03:41:22,S026,C001519,Card,62.03,6.2,1,gen_20251127_091607,transactions_header.csv
T00008884,2024-07-07,2024-07-07 05:59:38,S020,C000647,Online,49.59,4.96,1,gen_20251127_091606,transactions_header.csv
T00016999,2024-03-10,2024-03-10 21:29:16,S029,C004503,Online,115.68,0.0,4,gen_20251127_091607,transactions_header.csv
T00003887,03/26/24,2024-03-26 18:24:43,S001,C003810,Card,133.72,0.0,1,gen_20251127_091606,transactions_header.csv
T00000656,05/09/24,2024-05-09 08:08:29,S001,C004146,Card,17.06,2.56,2,gen_20251127_091605,transactions_header.csv
T00016288,2024-01-23,2024-01-23 13:51:35,S024,C001024,Card,86.92,8.69,1,gen_20251127_091607,transactions_header.csv
T00009806,2024-10-15,2024-10-15 21:52:55,S020,C001696,Online,0,0.0,3,gen_20251127_091606,transactions_header.csv
T00018174,09/22/24,2024-09-22 23:19:43,S022,,cash,45.81,0.0,1,gen_20251127_091607,transactions_header.csv
T00005084,09/19/24,2024-09-19 13:32:42,S001,,Cash,41.37,0.0,3,gen_20251127_091606,transactions_header.csv
T00010323,05/14/24,2024-05-14 15:21:39,S011,C000179,Card,41.34,6.2,6,gen_20251127_091606,transactions_header.csv
T00016303,2024-02-04,2024-02-04 03:17:27,S025,C000720,Cash,65.65,6.57,1,gen_20251127_091607,transactions_header.csv
T00016343,2024-08-11,2024-08-11 23:29:30,S011,C000065,Card,44.83,4.48,2,gen_20251127_091607,transactions_header.csv
T00010183,04/24/24,2024-04-24 16:04:42,S005,C001620,Online,48.86,7.33,5,gen_20251127_091606,transactions_header.csv
T00003336,2024-01-01,2024-01-01 12:32:36,S027,C003288,Online,$37.91,,1,gen_20251127_091606,transactions_header.csv
T00002172,03/18/24,2024-03-18 02:25:42,S019,C002899,Cash,53.45,2.67,1,gen_20251127_091605,transactions_header.csv
T00005953,2024-03-18,2024-03-18 12:21:57,S019,C000387,Cash,81.78,8.18,1,gen_20251127_091606,transactions_header.csv
T00010263,2024-06-15,2024-06-15 08:12:00,S010,,Cash,71.27,7.13,2,gen_20251127_091606,transactions_header.csv
T00004401,03/17/24,2024-03-17 16:30:16,S016,,Online,45.98,2.3,5,gen_20251127_091606,transactions_header.csv
T00017354,2024-12-01,2024-12-01 02:37:36,S022,C003262,Card,63.79,3.19,2,gen_20251127_091607,transactions_header.csv
T00018979,09/22/24,2024-09-22 04:10:11,S008,C000522,online,39.48,1.97,2,gen_20251127_091607,transactions_header.csv
T00019855,2024-01-13,2024-01-13 06:42:27,S001,,Cash,$41.00,0.0,1,gen_20251127_091607,transactions_header.csv
T00008300,2024-12-22,2024-12-22 01:53:40,S030,C002191,Online,24.48,3.67,1,gen_20251127_091606,transactions_header.csv
T00000853,2024-11-03,2024-11-03 02:27:26,S008,,Card,68.01,,1,gen_20251127_091605,transactions_header.csv
T00000468,05/08/24,2024-05-08 04:22:59,S016,C004338,Cash,27.12,1.36,1,gen_20251127_091605,transactions_header.csv
T00004489,08/27/24,2024-08-27 04:37:08,S008,C000573,Cash,75.69,0.0,6,gen_20251127_091606,transactions_header.csv
T00005032,2024-05-06,2024-05-06 03:38:07,S007,C001718,Cash,63.5,9.53,2,gen_20251127_091606,transactions_header.csv
T00017505,09/10/24,2024-09-10 02:31:48,S002,,Card,25.13,0.0,5,gen_20251127_091607,transactions_header.csv
T00009398,2024-12-26,2024-12-26 22:27:54,S015,C002612,Cash,59.05,0.0,1,gen_20251127_091606,transactions_header.csv
T00014196,09/14/24,2024-09-14 08:18:21,S028,C000081,Cash,29.67,2.97,3,gen_20251127_091607,transactions_header.csv
T00018115,11/21/24,2024-11-21 11:13:08,S030,C002818,Online,53.3,2.67,3,gen_20251127_091607,transactions_header.csv
T00011728,10/19/24,2024-10-19 05:33:58,S010,C002895,Card,19.35,2.9,1,gen_20251127_091607,transactions_header.csv
T00007540,2024-01-02,2024-01-02 11:59:57,S006,C000843,Online,28.23,2.82,1,gen_20251127_091606,transactions_header.csv
T00004463,2024-10-16,2024-10-16 03:24:37,S018,C003056,Cash,58.05,5.8,3,gen_20251127_091606,transactions_header.csv
T00012325,07/04/24,2024-07-04 17:15:36,S019,C004107,online,46.5,0.0,1,gen_20251127_091607,transactions_header.csv
T00000737,12/26/24,2024-12-26 05:29:53,S010,,Card,34.15,5.12,1,gen_20251127_091605,transactions_header.csv
T00007657,07/04/24,2024-07-04 15:34:03,S004,C004800,Cash,20.06,3.01,5,gen_20251127_091606,transactions_header.csv
T00018001,12/06/24,2024-12-06 19:44:23,S019,C000606,Online,18.3,1.83,1,gen_20251127_091607,transactions_header.csv
T00008859,10/04/24,2024-10-04 20:35:13,S026,C002862,Online,41.16,4.12,2,gen_20251127_091606,transactions_header.csv
T00008758,2024-06-04,2024-06-04 18:46:08,S024,C004253,Online,42.62,4.26,1,gen_20251127_091606,transactions_header.csv
T00012263,06/23/24,2024-06-23 07:04:15,S012,C003611,Online,46.08,4.61,1,gen_20251127_091607,transactions_header.csv
T00005419,2024-11-05,2024-11-05 00:37:27,S023,C001810,Online,$64.77,0.0,1,gen_20251127_091606,transactions_header.csv
T00000451,2024-01-01,2024-01-01 10:40:16,S008,C004108,Card,55.67,5.57,1,gen_20251127_091605,transactions_header.csv
T00015845,09/03/24,2024-09-03 22:20:52,S013,C000912,Cash,8.98,0.9,3,gen_20251127_091607,transactions_header.csv
T00017604,2024-05-12,2024-05-12 07:55:05,S019,C002061,Online,97.77,0.0,3,gen_20251127_091607,transactions_header.csv
T00019916,2024-01-06,2024-01-06 18:59:45,S023,C000041,Online,0,0.0,1,gen_20251127_091607,transactions_header.csv
T00007069,2024-05-02,2024-05-02 06:30:39,S030,NA,Online,61.03,9.15,4,gen_20251127_091606,transactions_header.csv
T00019462,2024-02-21,2024-02-21 22:50:10,S025,C000270,Cash,29.21,0.0,2,gen_20251127_091607,transactions_header.csv
T00014112,05/09/24,2024-05-09 15:45:53,S017,C002984,Online,$41.97,0.0,1,gen_20251127_091607,transactions_header.csv
T00010092,01/08/24,2024-01-08 08:27:52,S009,C003882,Cash,59.55,0.0,3,gen_20251127_091606,transactions_header.csv
T00009864,05/23/24,2024-05-23 05:46:34,S011,C003957,Card,58.32,2.92,3,gen_20251127_091606,transactions_header.csv
T00004521,03/26/24,2024-03-26 22:46:19,S013,,Online,58.03,0.0,2,gen_20251127_091606,transactions_header.csv
T00002484,04/01/24,2024-04-01 01:56:59,S010,C002051,Card,25.13,0.0,1,gen_20251127_091605,transactions_header.csv
T00013819,2024-02-02,2024-02-02 16:09:51,S023,,Cash,94.08,9.41,3,gen_20251127_091607,transactions_header.csv
T00015061,09/18/24,2024-09-18 13:27:05,S030,C000909,Card,69.71,6.97,4,gen_20251127_091607,transactions_header.csv
T00008162,08/13/24,2024-08-13 10:09:35,S015,C002642,Online,108.57,16.29,1,gen_20251127_091606,transactions_header.csv
T00001145,2024-03-12,2024-03-12 12:20:36,S013,C003840,Card,73.33,11.0,1,gen_20251127_091605,transactions_header.csv
T00016747,11/25/24,2024-11-25 06:43:01,S010,NA,Cash,61.85,NA,2,gen_20251127_091607,transactions_header.csv
T00019123,2024-11-06,2024-11-06 09:13:00,S011,C000158,Card,79.51,,1,gen_20251127_091607,transactions_header.csv
T00019601,2024-11-01,2024-11-01 07:49:58,S008,C003143,Card,0,0,2,gen_20251127_091607,transactions_header.csv
T00012815,2024-07-02,2024-07-02 22:25:44,S026,C001557,Cash,13.44,0.0,1,gen_20251127_091607,transactions_header.csv
T00015328,02/18/24,2024-02-18 22:51:24,S002,C000508,Card,32.89,0.0,2,gen_20251127_091607,transactions_header.csv
T00003190,2024-10-04,2024-10-04 06:42:20,S018,,Online,27.01,,2,gen_20251127_091606,transactions_header.csv
T00010816,04/10/24,2024-04-10 04:17:02,S025,C003752,Card,48.84,2.44,1,gen_20251127_091606,transactions_header.csv
T00017758,2024-12-25,2024-12-25 06:26:16,S004,C000858,Online,31.28,4.69,1,gen_20251127_091607,transactions_header.csv
T00011192,09/30/24,2024-09-30 22:11:14,S026,C003616,Online,47.65,2.38,1,gen_20251127_091606,transactions_header.csv
T00000042,03/02/24,2024-03-02 12:00:26,S010,C002527,Card,$44.55,0.0,3,gen_20251127_091605,transactions_header.csv
T00018506,2024-12-18,2024-12-18 04:46:37,S017,C001599,Cash,40.66,6.1,1,gen_20251127_091607,transactions_header.csv
T00008230,11/01/24,2024-11-01 15:20:38,S008,C004945,Cash,82.65,,1,gen_20251127_091606,transactions_header.csv
T00019101,2024-11-30,2024-11-30 22:54:25,S028,C002881,Cash,23.86,0.0,7,gen_20251127_091607,transactions_header.csv
T00017668,02/14/24,2024-02-14 14:34:37,S027,C003195,Cash,79.16,3.96,1,gen_20251127_091607,transactions_header.csv
T00010040,10/02/24,2024-10-02 04:45:56,S023,C000301,Cash,20.64,0.0,1,gen_20251127_091606,transactions_header.csv
T00014203,06/14/24,2024-06-14 05:52:26,S019,,Online,31.38,4.71,2,gen_20251127_091607,transactions_header.csv
T00011656,2024-01-27,2024-01-27 08:47:22,S030,C001049,Online,78.49,,1,gen_20251127_091607,transactions_header.csv
T00011332,11/18/24,2024-11-18 22:47:38,S011,C002956,Card,2.12,0.21,3,gen_20251127_091606,transactions_header.csv
T00016211,2024-03-21,2024-03-21 11:00:53,S007,C001190,Cash,55.04,2.75,1,gen_20251127_091607,transactions_header.csv
T00017140,03/05/24,2024-03-05 09:42:12,S018,C001690,Card,38.61,0.0,2,gen_20251127_091607,transactions_header.csv
T00017308,2024-11-17,2024-11-17 01:06:34,S009,C003025,Card,40.14,2.01,3,gen_20251127_091607,transactions_header.csv
T00011983,03/14/24,2024-03-14 03:19:44,S016,,Online,141.15,14.12,1,gen_20251127_091607,transactions_header.csv
T00016847,03/11/24,2024-03-11 15:41:48,S004,C002336,Online,43.67,0.0,1,gen_20251127_091607,transactions_header.csv
T00001124,12/20/24,2024-12-20 13:57:59,S007,,Cash,117.32,17.6,1,gen_20251127_091605,transactions_header.csv
T00001808,03/08/24,2024-03-08 20:05:21,S025,C004844,Cash,97.13,4.86,1,gen_20251127_091605,transactions_header.csv
T00010494,09/22/24,2024-09-22 09:47:31,S004,,Cash,81.48,0.0,2,gen_20251127_091606,transactions_header.csv
T00014984,2024-11-22,2024-11-22 00:12:58,S005,C003083,Card,63.38,9.51,1,gen_20251127_091607,transactions_header.csv
T00011854,01/05/24,2024-01-05 14:27:15,S024,C000615,Cash,42.19,4.22,1,gen_20251127_091607,transactions_header.csv
T00018135,2024-01-21,2024-01-21 21:57:36,S002,C002800,Cash,-81.59,8.16,2,gen_20251127_091607,transactions_header.csv
T00009723,2024-06-04,2024-06-04 12:22:30,S016,NA,Online,74.49,3.72,2,gen_20251127_091606,transactions_header.csv
T00012488,2024-07-28,2024-07-28 04:29:58,S002,C001586,Cash,100.32,15.05,2,gen_20251127_091607,transactions_header.csv
T00019840,2024-09-26,2024-09-26 14:33:46,S016,C001748,Online,16.88,0.0,1,gen_20251127_091607,transactions_header.csv
T00007855,12/09/24,2024-12-09 09:33:45,S010,NA,Cash,0,0.0,7,gen_20251127_091606,transactions_header.csv
T00011283,2024-11-22,2024-11-22 16:58:09,S001,C003751,Cash,15.58,2.34,1,gen_20251127_091606,transactions_header.csv
T00001348,10/16/24,2024-10-16 16:34:37,S027,C004003,Online,$52.51,2.63,1,gen_20251127_091605,transactions_header.csv
T00001600,09/28/24,2024-09-28 23:31:23,S025,C000812,Online,58.75,NA,1,gen_20251127_091605,transactions_header.csv
T00006166,2024-12-16,2024-12-16 00:41:11,S021,C001545,Online,16.78,0.84,4,gen_20251127_091606,transactions_header.csv
T00008524,01/18/24,2024-01-18 13:24:45,S023,C002139,Cash,95.59,9.56,1,gen_20251127_091606,transactions_header.csv
T00007335,05/03/24,2024-05-03 04:03:22,S015,C002633,Card,20.84,2.08,1,gen_20251127_091606,transactions_header.csv
T00003044,2024-11-28,2024-11-28 11:54:49,S028,C001814,card,67.44,0.0,2,gen_20251127_091606,transactions_header.csv
T00002004,02/08/24,2024-02-08 05:53:56,S019,C002008,Card,112.62,11.26,3,gen_20251127_091605,transactions_header.csv
T00003144,2024-07-14,2024-07-14 00:12:08,S008,C003003,Online,96.62,9.66,2,gen_20251127_091606,transactions_header.csv
T00005548,2024-08-01,2024-08-01 23:40:52,S013,C004402,Cash,93.39,9.34,3,gen_20251127_091606,transactions_header.csv
T00004280,07/09/24,2024-07-09 04:38:49,S027,C000675,Card,33.38,1.67,5,gen_20251127_091606,transactions_header.csv
T00001748,2024-04-29,2024-04-29 15:25:15,S022,C004901,Cash,58.76,5.88,1,gen_20251127_091605,transactions_header.csv
T00019670,10/01/24,2024-10-01 07:25:05,S024,C004606,Online,96.1,9.61,1,gen_20251127_091607,transactions_header.csv
T00008981,2024-07-02,2024-07-02 12:36:56,S028,C004269,Cash,0,0.0,3,gen_20251127_091606,transactions_header.csv
T00007519,11/02/24,2024-11-02 00:19:22,S008,C000261,Online,46.94,2.35,3,gen_20251127_091606,transactions_header.csv
T00000036,06/25/24,2024-06-25 02:12:59,S002,C000904,Cash,76.03,7.6,2,gen_20251127_091605,transactions_header.csv
T00006701,2024-08-12,2024-08-12 03:16:01,S019,C004093,Online,80.6,12.09,2,gen_20251127_091606,transactions_header.csv
T00012604,07/08/24,2024-07-08 02:22:59,S021,C003727,Card,8.47,1.27,2,gen_20251127_091607,transactions_header.csv
T00009385,2024-03-24,2024-03-24 23:55:41,S004,C004975,Online,12.38,1.86,1,gen_20251127_091606,transactions_header.csv
T00010405,07/02/24,2024-07-02 21:36:30,S002,C003172,Card,58.72,2.94,1,gen_20251127_091606,transactions_header.csv
T00002415,2024-11-06,2024-11-06 00:59:48,S008,C004841,Card,32.82,3.28,2,gen_20251127_091605,transactions_header.csv
T00011215,2024-10-20,2024-10-20 16:56:36,S017,,Card,52.87,2.64,1,gen_20251127_091606,transactions_header.csv
T00006600,2024-04-11,2024-04-11 15:15:27,S019,C000146,Cash,53.65,,1,gen_20251127_091606,transactions_header.csv
T00010155,12/02/24,2024-12-02 08:00:38,S021,,Card,69.92,10.49,2,gen_20251127_091606,transactions_header.csv
T00018837,2024-09-15,2024-09-15 19:43:29,S008,C000059,cash,48.83,7.32,3,gen_20251127_091607,transactions_header.csv
T00008118,2024-09-22,2024-09-22 15:53:53,S021,C002429,Cash,22.4,1.12,1,gen_20251127_091606,transactions_header.csv
T00000622,2024-06-04,2024-06-04 09:28:31,S023,C000819,Online,86.86,,2,gen_20251127_091605,transactions_header.csv
T00000706,2024-01-20,2024-01-20 13:08:57,S007,NA,Card,4.94,0.49,1,gen_20251127_091605,transactions_header.csv
T00006584,2024-01-22,2024-01-22 07:58:00,S004,C003167,Online,17.46,1.75,1,gen_20251127_091606,transactions_header.csv
T00000324,08/28/24,2024-08-28 09:30:54,S009,C001938,Card,26.8,0.0,2,gen_20251127_091605,transactions_header.csv
T00005991,05/04/24,2024-05-04 20:16:43,S015,C002212,Card,37.82,3.78,3,gen_20251127_091606,transactions_header.csv
T00005175,2024-03-09,2024-03-09 18:31:38,S002,C004945,Online,33.54,5.03,3,gen_20251127_091606,transactions_header.csv
T00006127,07/29/24,2024-07-29 06:26:19,S002,C002196,Online,-108.3,0.0,4,gen_20251127_091606,transactions_header.csv
T00002389,2024-03-04,2024-03-04 02:16:27,S002,,Online,61.56,6.16,5,gen_20251127_091605,transactions_header.csv
T00007684,12/06/24,2024-12-06 22:53:23,S017,C003793,Online,16.46,,1,gen_20251127_091606,transactions_header.csv
T00005225,2024-04-09,2024-04-09 08:59:03,S001,C004808,Card,20.18,3.03,1,gen_20251127_091606,transactions_header.csv
T00005333,2024-08-10,2024-08-10 19:56:49,S030,C003862,Card,37.97,,1,gen_20251127_091606,transactions_header.csv
T00015577,2024-04-13,2024-04-13 09:10:52,S020,C003786,card,45.65,4.57,4,gen_20251127_091607,transactions_header.csv
T00015690,03/27/24,2024-03-27 05:46:58,S015,,Online,0,0,3,gen_20251127_091607,transactions_header.csv
T00001228,06/10/24,2024-06-10 15:14:40,S028,C002834,Cash,0,0.0,1,gen_20251127_091605,transactions_header.csv
T00014157,2024-03-21,2024-03-21 14:15:43,S025,C003604,Cash,88.3,8.83,1,gen_20251127_091607,transactions_header.csv
T00006809,2024-11-12,2024-11-12 14:01:32,S027,NA,Card,$32.05,4.81,5,gen_20251127_091606,transactions_header.csv
T00008252,03/09/24,2024-03-09 17:00:16,S011,C002900,Online,91.55,4.58,1,gen_20251127_091606,transactions_header.csv
T00016592,08/27/24,2024-08-27 20:46:17,S006,C004814,Card,0,,3,gen_20251127_091607,transactions_header.csv
T00013875,2024-02-10,2024-02-10 11:13:45,S028,C004528,Card,61.07,6.11,1,gen_20251127_091607,transactions_header.csv
T00004339,2024-10-10,2024-10-10 17:10:30,S030,,Online,74.7,3.74,2,gen_20251127_091606,transactions_header.csv
T00015594,05/07/24,2024-05-07 06:22:44,S029,C002344,Cash,0,0.0,1,gen_20251127_091607,transactions_header.csv
T00004150,2024-02-15,2024-02-15 14:54:05,S027,,Cash,68.29,0.0,1,gen_20251127_091606,transactions_header.csv
T00006236,11/18/24,2024-11-18 11:37:33,S011,C002997,Card,7.09,0.71,1,gen_20251127_091606,transactions_header.csv
T00003394,2024-10-17,2024-10-17 12:30:30,S026,C004802,Card,76.34,11.45,1,gen_20251127_091606,transactions_header.csv
T00007560,2024-02-10,2024-02-10 05:52:08,S007,C002336,Cash,74.38,11.16,1,gen_20251127_091606,transactions_header.csv
T00004528,2024-02-22,2024-02-22 10:45:22,S020,C002564,Card,79.3,7.93,1,gen_20251127_091606,transactions_header.csv
T00008876,2024-02-18,2024-02-18 19:18:42,S029,C000483,Cash,38.33,5.75,6,gen_20251127_091606,transactions_header.csv
T00003473,03/22/24,2024-03-22 03:46:43,S019,C003226,Cash,58.39,8.76,1,gen_20251127_091606,transactions_header.csv
T00018911,02/19/24,2024-02-19 18:34:17,S025,C000025,Cash,8.63,1.29,1,gen_20251127_091607,transactions_header.csv
T00002856,09/19/24,2024-09-19 17:05:40,S002,C002248,Online,$39.98,2.0,1,gen_20251127_091606,transactions_header.csv
T00019434,2024-12-17,2024-12-17 01:09:06,S015,C004786,Online,55.87,0.0,2,gen_20251127_091607,transactions_header.csv
T00019710,04/12/24,2024-04-12 03:59:27,S017,NA,Cash,59.43,5.94,1,gen_20251127_091607,transactions_header.csv
T00005467,01/31/24,2024-01-31 21:09:55,S029,C000006,Online,58.31,,3,gen_20251127_091606,transactions_header.csv
T00017402,12/29/24,2024-12-29 08:54:00,S019,C004477,Card,34.63,,1,gen_20251127_091607,transactions_header.csv
T00007121,05/30/24,2024-05-30 16:04:12,S022,C000480,Online,40.29,NA,2,gen_20251127_091606,transactions_header.csv
T00004679,2024-05-09,2024-05-09 01:23:09,S026,C002967,Online,60.83,3.04,1,gen_20251127_091606,transactions_header.csv
T00002679,08/13/24,2024-08-13 13:45:54,S006,C001481,Online,0,0.0,7,gen_20251127_091605,transactions_header.csv
T00006690,2024-02-12,2024-02-12 22:21:39,S017,C000475,Cash,100.7,NA,1,gen_20251127_091606,transactions_header.csv
T00011209,2024-05-04,2024-05-04 23:09:48,S028,C004653,Online,27.37,1.37,1,gen_20251127_091606,transactions_header.csv
T00017306,2024-01-29,2024-01-29 12:50:17,S028,C001961,Online,42.61,0.0,3,gen_20251127_091607,transactions_header.csv
T00002517,12/16/24,2024-12-16 21:57:37,S015,C004991,Card,$6.25,0.31,2,gen_20251127_091605,transactions_header.csv
T00008226,2024-08-11,2024-08-11 21:45:30,S026,C004999,Cash,21.04,1.05,1,gen_20251127_091606,transactions_header.csv
T00018082,2024-03-05,2024-03-05 14:53:15,S029,C002572,Cash,18.22,0.0,2,gen_20251127_091607,transactions_header.csv
T00019105,08/14/24,2024-08-14 06:47:37,S013,C004616,Card,72.54,10.88,1,gen_20251127_091607,transactions_header.csv
T00001262,06/18/24,2024-06-18 15:46:06,S004,C003212,Online,81.78,,2,gen_20251127_091605,transactions_header.csv
T00003687,05/13/24,2024-05-13 08:46:56,S010,,Online,23.15,1.16,1,gen_20251127_091606,transactions_header.csv
T00006259,05/07/24,2024-05-07 02:09:23,S007,C002980,Card,0,0.0,1,gen_20251127_091606,transactions_header.csv
T00016600,2024-03-24,2024-03-24 15:11:58,S019,C001873,Card,$55.45,8.32,1,gen_20251127_091607,transactions_header.csv
T00002449,2024-12-11,2024-12-11 09:39:24,S020,C000851,Card,$0.00,0,3,gen_20251127_091605,transactions_header.csv
T00018266,2024-06-11,2024-06-11 13:21:54,S030,C001016,Cash,43.0,2.15,1,gen_20251127_091607,transactions_header.csv
T00011629,12/23/24,2024-12-23 08:31:43,S006,C003657,Cash,127.46,0.0,1,gen_20251127_091606,transactions_header.csv
T00019852,2024-05-13,2024-05-13 06:58:50,S020,,card,82.18,4.11,2,gen_20251127_091607,transactions_header.csv
T00012191,12/15/24,2024-12-15 22:46:04,S009,C004937,Online,59.93,0.0,1,gen_20251127_091607,transactions_header.csv
T00013424,2024-09-26,2024-09-26 21:15:53,S029,C000856,Card,57.46,2.87,2,gen_20251127_091607,transactions_header.csv
T00002151,2024-05-30,2024-05-30 12:09:01,S026,C003072,Online,38.88,3.89,3,gen_20251127_091605,transactions_header.csv
T00004179,12/06/24,2024-12-06 20:43:56,S030,C001900,Card,18.29,0.0,1,gen_20251127_091606,transactions_header.csv
T00007787,11/02/24,2024-11-02 07:34:20,S011,C002472,Card,64.83,,2,gen_20251127_091606,transactions_header.csv
T00010171,12/07/24,2024-12-07 15:07:21,S002,C001846,Online,60.74,,3,gen_20251127_091606,transactions_header.csv
T00006955,02/22/24,2024-02-22 04:54:19,S001,C003494,Card,42.59,4.26,1,gen_20251127_091606,transactions_header.csv
T00007338,02/03/24,2024-02-03 10:21:29,S022,C003202,Online,40.2,6.03,3,gen_20251127_091606,transactions_header.csv
T00016131,2024-09-12,2024-09-12 06:42:06,S028,C001977,Card,51.9,7.78,3,gen_20251127_091607,transactions_header.csv
T00001867,06/17/24,2024-06-17 17:46:26,S019,C000065,Card,71.74,7.17,3,gen_20251127_091605,transactions_header.csv
T00014855,2024-01-27,2024-01-27 10:01:31,S015,C000234,Cash,$28.11,0.0,2,gen_20251127_091607,transactions_header.csv
T00002406,02/25/24,2024-02-25 07:24:48,S012,NA,Online,81.95,4.1,2,gen_20251127_091605,transactions_header.csv
T00013406,2024-01-24,2024-01-24 02:34:41,S024,C002994,Online,64.78,6.48,1,gen_20251127_091607,transactions_header.csv
T00012421,10/18/24,2024-10-18 13:52:59,S028,C002161,Online,34.22,5.13,1,gen_20251127_091607,transactions_header.csv
T00011447,07/04/24,2024-07-04 23:24:40,S016,C004738,Online,63.0,9.45,4,gen_20251127_091606,transactions_header.csv
T00012390,10/31/24,2024-10-31 21:27:48,S019,C003633,Card,44.81,NA,3,gen_20251127_091607,transactions_header.csv
T00000652,2024-08-29,2024-08-29 13:11:10,S020,,Card,59.16,8.87,1,gen_20251127_091605,transactions_header.csv
T00019152,07/13/24,2024-07-13 01:57:35,S021,C004227,Cash,32.98,3.3,1,gen_20251127_091607,transactions_header.csv
T00005569,04/02/24,2024-04-02 18:58:06,S010,C002264,Card,67.76,0.0,1,gen_20251127_091606,transactions_header.csv
T00016355,02/03/24,2024-02-03 22:31:07,S009,C002672,Online,50.73,,8,gen_20251127_091607,transactions_header.csv
T00010873,2024-12-09,2024-12-09 01:20:57,S008,,Online,43.6,0.0,2,gen_20251127_091606,transactions_header.csv
T00002795,2024-12-23,2024-12-23 08:55:08,S012,C001095,Card,58.95,2.95,3,gen_20251127_091605,transactions_header.csv
T00015312,09/19/24,2024-09-19 11:29:15,S005,,Card,21.3,3.19,1,gen_20251127_091607,transactions_header.csv
T00004111,07/25/24,2024-07-25 10:28:41,S021,C004981,Cash,51.7,0.0,1,gen_20251127_091606,transactions_header.csv
T00004231,07/10/24,2024-07-10 13:00:05,S009,,Cash,88.35,8.83,1,gen_20251127_091606,transactions_header.csv
T00014059,2024-07-31,2024-07-31 01:32:01,S020,C004170,Cash,0,0.0,1,gen_20251127_091607,transactions_header.csv
T00016000,2024-10-30,2024-10-30 05:31:26,S022,C001631,Card,63.99,,2,gen_20251127_091607,transactions_header.csv
T00002754,07/11/24,2024-07-11 11:49:13,S009,C002105,Online,92.18,13.83,1,gen_20251127_091605,transactions_header.csv
T00010856,03/08/24,2024-03-08 05:50:04,S003,C001582,Cash,29.58,1.48,1,gen_20251127_091606,transactions_header.csv
T00011249,2024-09-09,2024-09-09 13:39:05,S011,C004457,Online,5.12,0.51,2,gen_20251127_091606,transactions_header.csv
T00013967,09/30/24,2024-09-30 23:09:34,S018,C004322,Cash,86.51,8.65,3,gen_20251127_091607,transactions_header.csv
T00000424,2024-03-26,2024-03-26 04:18:52,S029,C002942,Card,12.16,0.0,2,gen_20251127_091605,transactions_header.csv
T00004771,2024-02-21,2024-02-21 06:19:34,S018,C004486,Online,111.37,11.14,1,gen_20251127_091606,transactions_header.csv
T00009691,10/02/24,2024-10-02 15:14:13,S029,C003135,Online,54.44,0.0,3,gen_20251127_091606,transactions_header.csv
T00003572,2024-04-22,2024-04-22 16:09:45,S002,,Cash,36.24,0.0,1,gen_20251127_091606,transactions_header.csv
T00010084,05/01/24,2024-05-01 14:45:23,S002,C004840,Online,44.33,6.65,3,gen_20251127_091606,transactions_header.csv
T00012917,2024-09-01,2024-09-01 01:07:17,S013,C001924,Card,30.23,0.0,3,gen_20251127_091607,transactions_header.csv
T00014599,03/28/24,2024-03-28 07:03:14,S010,NA,Card,21.55,1.08,2,gen_20251127_091607,transactions_header.csv
T00010585,2024-01-07,2024-01-07 14:50:31,S023,C000038,Card,15.94,2.39,5,gen_20251127_091606,transactions_header.csv
T00006613,2024-04-06,2024-04-06 08:18:58,S003,C001654,Online,52.6,2.63,1,gen_20251127_091606,transactions_header.csv
T00000018,04/24/24,2024-04-24 04:35:28,S020,C004926,Online,42.98,0.0,1,gen_20251127_091605,transactions_header.csv
T00013874,10/29/24,2024-10-29 17:50:15,S027,C003378,Cash,37.95,5.69,8,gen_20251127_091607,transactions_header.csv
T00003610,2024-02-02,2024-02-02 12:29:35,S003,C002807,Cash,51.87,0.0,1,gen_20251127_091606,transactions_header.csv
T00017271,2024-07-18,2024-07-18 17:03:45,S015,C002634,Cash,55.12,5.51,1,gen_20251127_091607,transactions_header.csv
T00012232,2024-07-02,2024-07-02 08:58:51,S017,C004509,Card,105.93,10.59,1,gen_20251127_091607,transactions_header.csv
T00013272,2024-06-01,2024-06-01 12:28:36,S029,C001182,Cash,8.53,1.28,2,gen_20251127_091607,transactions_header.csv
T00010586,09/28/24,2024-09-28 17:08:31,S011,C004285,Online,54.53,5.45,1,gen_20251127_091606,transactions_header.csv
T00006174,05/15/24,2024-05-15 02:57:34,S021,C004749,Card,55.06,0.0,2,gen_20251127_091606,transactions_header.csv
T00006751,2024-03-28,2024-03-28 13:36:05,S022,C002212,Online,4.14,,1,gen_20251127_091606,transactions_header.csv
T00000032,06/29/24,2024-06-29 00:38:03,S015,C002366,Card,63.99,,1,gen_20251127_091605,transactions_header.csv
T00019480,2024-09-15,2024-09-15 04:44:48,S009,C002648,Card,96.65,14.5,2,gen_20251127_091607,transactions_header.csv
T00009925,09/16/24,2024-09-16 09:01:10,S027,C001136,Card,64.98,,1,gen_20251127_091606,transactions_header.csv
T00001434,2024-04-30,2024-04-30 01:00:38,S028,C004804,Cash,$21.37,NA,2,gen_20251127_091605,transactions_header.csv
T00004167,06/17/24,2024-06-17 03:28:12,S023,C002333,Card,59.4,8.91,3,gen_20251127_091606,transactions_header.csv
T00012236,12/23/24,2024-12-23 14:42:25,S025,C004656,Card,118.65,17.8,1,gen_20251127_091607,transactions_header.csv
T00003112,04/19/24,2024-04-19 19:45:55,S021,C002595,Online,104.16,10.42,2,gen_20251127_091606,transactions_header.csv
T00018638,2024-10-14,2024-10-14 22:58:16,S007,C001288,Cash,45.12,6.77,1,gen_20251127_091607,transactions_header.csv
T00005801,11/18/24,2024-11-18 19:01:15,S027,C003791,Cash,89.81,,4,gen_20251127_091606,transactions_header.csv
T00010286,2024-01-26,2024-01-26 16:42:41,S008,C000600,Card,55.53,0.0,2,gen_20251127_091606,transactions_header.csv
T00002899,2024-04-05,2024-04-05 00:51:02,S003,NA,Online,44.56,2.23,1,gen_20251127_091606,transactions_header.csv
T00000648,11/13/24,2024-11-13 09:30:00,S018,C000453,Online,21.81,0.0,8,gen_20251127_091605,transactions_header.csv
T00017928,09/15/24,2024-09-15 21:47:21,S026,C000880,Cash,97.23,0.0,3,gen_20251127_091607,transactions_header.csv
T00017595,2024-07-08,2024-07-08 02:42:20,S019,,Online,54.11,2.71,2,gen_20251127_091607,transactions_header.csv
T00004931,12/18/24,2024-12-18 09:21:12,S014,C001291,Cash,70.62,0.0,1,gen_20251127_091606,transactions_header.csv
T00009203,2024-04-02,2024-04-02 18:25:16,S030,C002273,Cash,75.03,3.75,2,gen_20251127_091606,transactions_header.csv
T00008765,2024-03-16,2024-03-16 21:05:19,S028,C001202,Cash,41.64,0.0,1,gen_20251127_091606,transactions_header.csv
T00008488,07/06/24,2024-07-06 22:53:34,S003,C002392,Card,37.05,1.85,1,gen_20251127_091606,transactions_header.csv
T00001322,11/06/24,2024-11-06 17:24:56,S029,C000199,Card,79.56,0.0,7,gen_20251127_091605,transactions_header.csv
T00012199,10/30/24,2024-10-30 13:26:38,S027,C004309,Cash,62.68,6.27,1,gen_20251127_091607,transactions_header.csv
T00018504,2024-08-18,2024-08-18 04:25:51,S022,C003430,Cash,76.42,7.64,1,gen_20251127_091607,transactions_header.csv
T00002725,04/24/24,2024-04-24 20:05:15,S022,C003386,card,30.82,1.54,1,gen_20251127_091605,transactions_header.csv
T00014846,02/16/24,2024-02-16 06:39:59,S001,C001254,Cash,10.94,NA,1,gen_20251127_091607,transactions_header.csv
T00015047,2024-02-09,2024-02-09 13:36:08,S030,C002222,Cash,13.07,0.0,3,gen_20251127_091607,transactions_header.csv
T00009210,2024-06-14,2024-06-14 15:31:38,S016,C004157,online,94.26,14.14,1,gen_20251127_091606,transactions_header.csv
T00001906,2024-03-22,2024-03-22 05:33:21,S013,C002520,Online,7.74,1.16,8,gen_20251127_091605,transactions_header.csv
T00016529,09/18/24,2024-09-18 05:35:35,S028,C003464,Cash,30.41,,1,gen_20251127_091607,transactions_header.csv
T00018955,2024-08-28,2024-08-28 16:32:28,S021,C004961,Card,44.82,2.24,1,gen_20251127_091607,transactions_header.csv
T00015853,2024-10-20,2024-10-20 16:30:49,S006,C003798,Card,103.04,5.15,1,gen_20251127_091607,transactions_header.csv
T00015195,2024-09-23,2024-09-23 00:49:29,S013,C002966,Card,48.19,4.82,3,gen_20251127_091607,transactions_header.csv
T00016385,03/28/24,2024-03-28 19:39:51,S010,C000545,Cash,60.61,9.09,1,gen_20251127_091607,transactions_header.csv
T00001995,04/12/24,2024-04-12 17:10:20,S016,,Online,61.92,9.29,1,gen_20251127_091605,transactions_header.csv
T00016675,02/13/24,2024-02-13 12:03:14,S023,C002928,Online,8.05,0.4,6,gen_20251127_091607,transactions_header.csv
T00007052,2024-08-27,2024-08-27 14:00:56,S029,C003771,cash,0,0.0,1,gen_20251127_091606,transactions_header.csv
T00017183,2024-04-26,2024-04-26 10:04:44,S002,C001803,Cash,55.28,0.0,2,gen_20251127_091607,transactions_header.csv
T00006463,2024-07-24,2024-07-24 15:03:25,S028,C000830,Card,70.87,3.54,6,gen_20251127_091606,transactions_header.csv
T00001625,01/28/24,2024-01-28 13:24:46,S023,C003919,Online,47.94,2.4,2,gen_20251127_091605,transactions_header.csv
T00019756,2024-12-13,2024-12-13 05:14:15,S018,C003051,Card,51.83,,1,gen_20251127_091607,transactions_header.csv
T00001430,2024-05-09,2024-05-09 06:22:13,S024,C004533,Cash,66.14,9.92,4,gen_20251127_091605,transactions_header.csv
T00007525,2024-03-27,2024-03-27 16:43:06,S030,,Card,46.98,4.7,1,gen_20251127_091606,transactions_header.csv
T00010160,2024-11-30,2024-11-30 21:28:26,S014,C002212,Card,103.49,0.0,2,gen_20251127_091606,transactions_header.csv
T00011507,01/18/24,2024-01-18 21:58:29,S014,C001735,Online,60.76,,6,gen_20251127_091606,transactions_header.csv
T00017178,10/21/24,2024-10-21 00:22:15,S015,,Card,0,,3,gen_20251127_091607,transactions_header.csv
T00000218,2024-05-22,2024-05-22 05:05:29,S003,C003467,Card,54.22,5.42,1,gen_20251127_091605,transactions_header.csv
T00017246,12/26/24,2024-12-26 07:18:33,S021,C001586,Card,44.92,2.25,2,gen_20251127_091607,transactions_header.csv
T00014417,09/16/24,2024-09-16 01:13:46,S028,C000046,Cash,68.42,0.0,1,gen_20251127_091607,transactions_header.csv
T00005978,05/10/24,2024-05-10 12:56:36,S017,C000574,Online,64.87,9.73,7,gen_20251127_091606,transactions_header.csv
T00000266,2024-09-16,2024-09-16 10:04:04,S022,C003421,Cash,52.41,5.24,1,gen_20251127_091605,transactions_header.csv
T00001397,2024-11-22,2024-11-22 02:08:30,S010,C004968,Cash,97.29,14.59,1,gen_20251127_091605,transactions_header.csv
T00019936,2024-02-01,2024-02-01 15:13:37,S026,C000299,Online,9.09,0.91,7,gen_20251127_091607,transactions_header.csv
T00017881,11/23/24,2024-11-23 08:12:58,S029,NA,Card,43.36,,2,gen_20251127_091607,transactions_header.csv
T00014055,02/01/24,2024-02-01 21:27:59,S010,C000028,Online,13.33,0.0,2,gen_20251127_091607,transactions_header.csv
T00013175,04/20/24,2024-04-20 14:47:25,S009,C002372,Card,40.95,4.1,3,gen_20251127_091607,transactions_header.csv
T00012939,2024-03-22,2024-03-22 12:13:44,S020,C002713,Online,31.1,0.0,1,gen_20251127_091607,transactions_header.csv
T00007896,10/25/24,2024-10-25 18:20:27,S008,C003756,Online,40.74,4.07,1,gen_20251127_091606,transactions_header.csv
T00019877,01/31/24,2024-01-31 12:06:47,S019,C000403,Cash,72.59,3.63,1,gen_20251127_091607,transactions_header.csv
T00001740,2024-01-05,2024-01-05 13:23:05,S024,C001466,Online,$79.30,0.0,1,gen_20251127_091605,transactions_header.csv
T00010868,02/02/24,2024-02-02 14:02:01,S006,,Card,47.05,2.35,2,gen_20251127_091606,transactions_header.csv
T00008350,07/11/24,2024-07-11 15:13:29,S029,C002829,Online,39.23,3.92,1,gen_20251127_091606,transactions_header.csv
T00006137,05/30/24,2024-05-30 16:46:43,S029,C001575,Card,56.45,2.82,1,gen_20251127_091606,transactions_header.csv
T00002731,2024-06-05,2024-06-05 15:03:11,S011,,Cash,57.67,5.77,1,gen_20251127_091605,transactions_header.csv
T00001705,2024-10-10,2024-10-10 16:52:38,S025,C000328,Cash,0,0.0,3,gen_20251127_091605,transactions_header.csv
T00009816,11/09/24,2024-11-09 07:20:30,S017,C002691,Cash,72.19,3.61,1,gen_20251127_091606,transactions_header.csv
T00014230,2024-06-17,2024-06-17 03:57:35,S030,C002400,Cash,57.91,5.79,1,gen_20251127_091607,transactions_header.csv
T00008159,2024-11-18,2024-11-18 23:59:22,S019,NA,Card,97.04,NA,1,gen_20251127_091606,transactions_header.csv
T00009227,2024-05-03,2024-05-03 15:46:02,S010,,Card,29.28,0.0,4,gen_20251127_091606,transactions_header.csv
T00009606,02/02/24,2024-02-02 21:12:40,S030,C001928,Card,61.4,9.21,4,gen_20251127_091606,transactions_header.csv
T00007271,2024-06-17,2024-06-17 14:26:45,S017,C002588,Card,85.12,,8,gen_20251127_091606,transactions_header.csv
T00006951,2024-04-23,2024-04-23 06:16:23,S029,C003968,Cash,53.3,7.99,2,gen_20251127_091606,transactions_header.csv
T00011521,2024-03-05,2024-03-05 20:26:15,S003,C002808,Online,43.86,0.0,2,gen_20251127_091606,transactions_header.csv
T00014407,09/01/24,2024-09-01 11:42:11,S012,C002980,Online,79.87,NA,1,gen_20251127_091607,transactions_header.csv
T00013388,11/15/24,2024-11-15 06:58:34,S020,,Card,0,0.0,2,gen_20251127_091607,transactions_header.csv
T00018470,01/16/24,2024-01-16 01:29:39,S008,NA,Cash,34.57,,7,gen_20251127_091607,transactions_header.csv
T00009877,2024-01-27,2024-01-27 23:56:52,S016,C004484,Card,76.71,11.51,2,gen_20251127_091606,transactions_header.csv
T00003486,11/08/24,2024-11-08 20:50:38,S018,C003098,Cash,37.1,1.86,2,gen_20251127_091606,transactions_header.csv
T00007370,2024-10-26,2024-10-26 18:36:15,S012,C002484,Online,58.49,5.85,1,gen_20251127_091606,transactions_header.csv
T00017742,2024-01-12,2024-01-12 05:52:38,S013,C002015,Online,27.65,2.77,2,gen_20251127_091607,transactions_header.csv
T00014792,06/12/24,2024-06-12 12:24:48,S029,C001415,Card,$22.78,0.0,6,gen_20251127_091607,transactions_header.csv
T00018654,11/23/24,2024-11-23 01:45:08,S023,C003592,Cash,89.21,NA,1,gen_20251127_091607,transactions_header.csv
T00008475,2024-06-17,2024-06-17 13:17:44,S011,C001717,Online,87.99,0.0,1,gen_20251127_091606,transactions_header.csv
T00001633,12/13/24,2024-12-13 22:11:32,S019,NA,Card,32.06,4.81,4,gen_20251127_091605,transactions_header.csv
T00018353,2024-10-02,2024-10-02 16:39:36,S014,C003393,cash,65.88,6.59,1,gen_20251127_091607,transactions_header.csv
T00006485,2024-04-27,2024-04-27 23:00:25,S010,C003056,Cash,2.19,0.0,1,gen_20251127_091606,transactions_header.csv
T00011213,2024-02-23,2024-02-23 02:14:39,S005,C002190,Card,68.72,6.87,1,gen_20251127_091606,transactions_header.csv
T00008474,2024-04-13,2024-04-13 19:32:52,S016,C000007,Card,62.54,0.0,1,gen_20251127_091606,transactions_header.csv
T00017612,2024-02-24,2024-02-24 05:27:04,S013,C004398,Online,65.03,,1,gen_20251127_091607,transactions_header.csv
T00001839,08/03/24,2024-08-03 15:53:27,S022,NA,Online,15.51,,2,gen_20251127_091605,transactions_header.csv
T00016267,2024-01-07,2024-01-07 18:03:15,S007,C001174,Cash,49.01,7.35,6,gen_20251127_091607,transactions_header.csv
T00019053,01/18/24,2024-01-18 22:29:29,S027,C003051,Online,63.24,0.0,1,gen_20251127_091607,transactions_header.csv
T00007859,2024-12-10,2024-12-10 23:54:34,S029,C001573,Cash,6.26,0.0,2,gen_20251127_091606,transactions_header.csv
T00015248,2024-05-24,2024-05-24 05:42:39,S011,C002597,Online,88.57,8.86,1,gen_20251127_091607,transactions_header.csv
T00010247,2024-08-14,2024-08-14 17:11:40,S025,C001335,Online,66.43,3.32,1,gen_20251127_091606,transactions_header.csv
T00003590,2024-09-12,2024-09-12 08:22:47,S018,C004439,Card,56.6,0.0,1,gen_20251127_091606,transactions_header.csv
T00000388,2024-03-08,2024-03-08 18:45:04,S028,,Card,73.91,0.0,2,gen_20251127_091605,transactions_header.csv
T00010550,09/12/24,2024-09-12 05:03:43,S030,C003364,Online,32.76,3.28,3,gen_20251127_091606,transactions_header.csv
T00019821,2024-08-29,2024-08-29 01:41:09,S004,C002249,Online,52.47,,1,gen_20251127_091607,transactions_header.csv
T00016287,2024-04-07,2024-04-07 21:44:43,S028,C003672,Cash,54.87,8.23,1,gen_20251127_091607,transactions_header.csv
T00002797,05/27/24,2024-05-27 13:49:44,S030,C004243,Card,44.18,,6,gen_20251127_091605,transactions_header.csv
T00001036,09/04/24,2024-09-04 01:14:14,S014,C001825,Card,35.41,1.77,1,gen_20251127_091605,transactions_header.csv
T00005395,10/13/24,2024-10-13 22:04:47,S020,,Cash,21.39,2.14,1,gen_20251127_091606,transactions_header.csv
T00006385,2024-11-28,2024-11-28 04:03:46,S024,C002747,cash,61.91,6.19,3,gen_20251127_091606,transactions_header.csv
T00004166,10/23/24,2024-10-23 18:11:14,S028,C004193,Online,13.74,1.37,3,gen_20251127_091606,transactions_header.csv
T00012031,09/06/24,2024-09-06 11:09:05,S002,C003473,Cash,2.95,0.15,2,gen_20251127_091607,transactions_header.csv
T00009011,2024-08-28,2024-08-28 22:47:23,S012,C000665,Cash,29.66,4.45,2,gen_20251127_091606,transactions_header.csv
T00002622,05/24/24,2024-05-24 08:06:56,S021,C004092,Card,31.71,3.17,3,gen_20251127_091605,transactions_header.csv
T00000842,05/06/24,2024-05-06 20:44:27,S014,C004236,Cash,26.8,1.34,6,gen_20251127_091605,transactions_header.csv
T00019535,2024-07-13,2024-07-13 00:12:27,S029,C002400,Online,38.21,,1,gen_20251127_091607,transactions_header.csv
T00001555,01/30/24,2024-01-30 05:04:28,S021,C002113,Cash,93.8,14.07,1,gen_20251127_091605,transactions_header.csv
T00001612,2024-07-01,2024-07-01 21:21:46,S021,C001045,Card,1.66,0.25,1,gen_20251127_091605,transactions_header.csv
T00012635,2024-03-17,2024-03-17 05:34:41,S026,C000622,Online,27.18,0.0,2,gen_20251127_091607,transactions_header.csv
T00001164,10/16/24,2024-10-16 09:58:40,S003,C000235,Card,36.97,NA,2,gen_20251127_091605,transactions_header.csv
T00014509,11/19/24,2024-11-19 03:25:09,S021,C000685,Cash,14.63,0.0,1,gen_20251127_091607,transactions_header.csv
T00007572,03/23/24,2024-03-23 14:47:23,S027,C003721,cash,63.95,9.59,1,gen_20251127_091606,transactions_header.csv
T00007095,12/12/24,2024-12-12 10:39:32,S027,NA,Cash,67.25,3.36,1,gen_20251127_091606,transactions_header.csv
T00008959,10/16/24,2024-10-16 17:44:49,S008,C000676,Online,47.79,7.17,1,gen_20251127_091606,transactions_header.csv
T00002302,2024-12-10,2024-12-10 21:40:16,S025,C000024,Online,72.66,3.63,1,gen_20251127_091605,transactions_header.csv
T00012670,04/18/24,2024-04-18 23:06:47,S010,C004676,Cash,$68.70,3.44,1,gen_20251127_091607,transactions_header.csv
T00013663,03/20/24,2024-03-20 21:34:49,S014,,Card,56.65,8.5,1,gen_20251127_091607,transactions_header.csv
T00002877,2024-07-08,2024-07-08 02:52:36,S003,C004517,Card,62.51,6.25,1,gen_20251127_091606,transactions_header.csv
T00007590,2024-11-01,2024-11-01 05:24:46,S010,C004098,Cash,$55.41,0.0,3,gen_20251127_091606,transactions_header.csv
T00002555,2024-02-01,2024-02-01 17:26:32,S010,C000584,Online,18.37,0.0,6,gen_20251127_091605,transactions_header.csv
T00008044,2024-01-01,2024-01-01 22:49:27,S001,C003426,Card,16.35,1.64,5,gen_20251127_091606,transactions_header.csv
T00002572,2024-04-02,2024-04-02 05:17:55,S005,C000717,Cash,67.73,6.77,1,gen_20251127_091605,transactions_header.csv
T00011841,03/31/24,2024-03-31 06:39:51,S010,C004854,Cash,35.59,5.34,3,gen_20251127_091607,transactions_header.csv
T00019412,08/19/24,2024-08-19 06:59:02,S016,NA,Online,0,0.0,2,gen_20251127_091607,transactions_header.csv
T00018172,10/29/24,2024-10-29 20:14:13,S004,C000490,Cash,3.47,0.17,4,gen_20251127_091607,transactions_header.csv
T00017269,12/20/24,2024-12-20 04:42:49,S002,C002082,Online,13.86,2.08,2,gen_20251127_091607,transactions_header.csv
T00014421,2024-03-19,2024-03-19 23:56:09,S017,C004305,Cash,66.65,0.0,2,gen_20251127_091607,transactions_header.csv
T00009937,2024-11-17,2024-11-17 16:58:27,S013,C000713,Online,19.51,0.98,1,gen_20251127_091606,transactions_header.csv
T00011742,2024-10-08,2024-10-08 22:38:00,S019,,Cash,0,0.0,3,gen_20251127_091607,transactions_header.csv
T00019117,2024-01-20,2024-01-20 06:52:56,S015,C000262,Cash,32.99,4.95,2,gen_20251127_091607,transactions_header.csv
T00012637,2024-11-13,2024-11-13 02:52:34,S030,C004154,Cash,47.87,2.39,2,gen_20251127_091607,transactions_header.csv
T00018646,10/26/24,2024-10-26 08:00:31,S013,C003979,Card,74.41,7.44,2,gen_20251127_091607,transactions_header.csv
T00012471,11/29/24,2024-11-29 02:59:45,S002,C000619,Online,40.87,4.09,2,gen_20251127_091607,transactions_header.csv
T00011445,01/04/24,2024-01-04 08:52:33,S007,C003710,Cash,7.33,0.73,1,gen_20251127_091606,transactions_header.csv
T00001445,2024-05-26,2024-05-26 21:37:06,S025,C000445,Card,61.08,6.11,1,gen_20251127_091605,transactions_header.csv
T00011774,08/01/24,2024-08-01 11:09:22,S015,C003872,Online,45.17,4.52,1,gen_20251127_091607,transactions_header.csv
T00008654,09/06/24,2024-09-06 15:49:07,S022,C003807,Online,58.62,2.93,1,gen_20251127_091606,transactions_header.csv
T00000279,2024-03-07,2024-03-07 09:59:06,S020,C002266,Cash,57.78,2.89,5,gen_20251127_091605,transactions_header.csv
T00002813,04/09/24,2024-04-09 10:31:21,S030,C004988,Cash,17.71,0.0,1,gen_20251127_091605,transactions_header.csv
T00015232,2024-07-09,2024-07-09 10:16:28,S004,C004280,Cash,30.82,3.08,1,gen_20251127_091607,transactions_header.csv
T00000514,02/01/24,2024-02-01 11:52:41,S030,C000541,Cash,85.44,4.27,4,gen_20251127_091605,transactions_header.csv
T00003510,11/02/24,2024-11-02 12:26:33,S009,C004307,Card,55.5,2.78,2,gen_20251127_091606,transactions_header.csv
T00002778,2024-03-02,2024-03-02 14:43:38,S029,C000339,Cash,21.0,0.0,1,gen_20251127_091605,transactions_header.csv
T00017212,2024-12-29,2024-12-29 16:03:43,S010,C002545,Cash,37.33,5.6,4,gen_20251127_091607,transactions_header.csv
T00012472,06/30/24,2024-06-30 02:52:29,S021,C004879,Online,58.58,5.86,1,gen_20251127_091607,transactions_header.csv
T00015938,2024-01-02,2024-01-02 04:21:57,S015,C003295,Cash,46.31,6.95,1,gen_20251127_091607,transactions_header.csv
T00015667,2024-12-17,2024-12-17 07:20:53,S009,C000465,Online,15.73,0.79,1,gen_20251127_091607,transactions_header.csv
T00012701,2024-12-26,2024-12-26 02:22:12,S025,C002515,online,78.76,0.0,4,gen_20251127_091607,transactions_header.csv
T00006299,2024-09-13,2024-09-13 07:01:47,S007,C002335,Card,49.33,7.4,1,gen_20251127_091606,transactions_header.csv
T00012807,11/24/24,2024-11-24 08:18:31,S007,,Online,59.89,2.99,7,gen_20251127_091607,transactions_header.csv
T00017109,2024-05-26,2024-05-26 07:43:18,S020,C001461,Online,42.65,6.4,1,gen_20251127_091607,transactions_header.csv
T00002828,04/22/24,2024-04-22 00:27:12,S003,C004631,Cash,0,0.0,5,gen_20251127_091605,transactions_header.csv
T00006683,05/26/24,2024-05-26 13:10:40,S004,C002908,Cash,83.36,NA,1,gen_20251127_091606,transactions_header.csv
T00010120,2024-09-28,2024-09-28 14:51:58,S005,C003966,Online,47.84,0.0,3,gen_20251127_091606,transactions_header.csv
T00010422,02/22/24,2024-02-22 13:58:48,S012,C001898,Online,38.07,3.81,1,gen_20251127_091606,transactions_header.csv
T00002222,2024-06-06,2024-06-06 02:19:05,S020,C001650,Online,3.79,0.19,1,gen_20251127_091605,transactions_header.csv
T00016382,2024-09-28,2024-09-28 11:42:13,S014,C000347,Card,64.55,,1,gen_20251127_091607,transactions_header.csv
T00008154,2024-10-28,2024-10-28 02:47:24,S019,C002790,Cash,$72.24,3.61,2,gen_20251127_091606,transactions_header.csv
T00017238,2024-07-10,2024-07-10 18:45:28,S030,C001116,Cash,33.56,3.36,1,gen_20251127_091607,transactions_header.csv
T00007946,2024-02-13,2024-02-13 12:18:25,S001,C004510,card,46.31,6.95,1,gen_20251127_091606,transactions_header.csv
T00010457,2024-08-02,2024-08-02 02:01:21,S006,C004150,Card,16.18,0.0,1,gen_20251127_091606,transactions_header.csv
T00015964,2024-01-20,2024-01-20 04:43:08,S001,C001094,Card,46.69,0.0,1,gen_20251127_091607,transactions_header.csv
T00017790,12/25/24,2024-12-25 21:33:20,S027,C000885,Online,64.13,3.21,1,gen_20251127_091607,transactions_header.csv
T00008658,01/29/24,2024-01-29 03:21:30,S007,C004393,Card,37.57,,2,gen_20251127_091606,transactions_header.csv
T00019208,2024-04-01,2024-04-01 15:27:22,S018,C003054,Online,27.32,1.37,1,gen_20251127_091607,transactions_header.csv
T00002196,2024-08-28,2024-08-28 19:43:51,S021,C004148,Online,83.26,8.33,5,gen_20251127_091605,transactions_header.csv
T00015220,2024-01-05,2024-01-05 15:14:22,S026,C003100,online,70.93,0.0,1,gen_20251127_091607,transactions_header.csv
T00005166,05/28/24,2024-05-28 22:56:33,S012,C000846,Cash,42.29,,3,gen_20251127_091606,transactions_header.csv
T00019397,03/12/24,2024-03-12 05:43:25,S007,C003666,Card,44.48,6.67,1,gen_20251127_091607,transactions_header.csv
T00006562,2024-01-23,2024-01-23 17:55:04,S009,C001470,Cash,53.47,0.0,6,gen_20251127_091606,transactions_header.csv
T00005364,03/23/24,2024-03-23 18:17:49,S005,C000668,Cash,56.7,5.67,1,gen_20251127_091606,transactions_header.csv
T00013749,2024-01-28,2024-01-28 08:34:18,S004,C000389,Cash,31.9,1.59,1,gen_20251127_091607,transactions_header.csv
T00001706,2024-03-29,2024-03-29 02:46:13,S014,C003878,Online,123.77,0.0,1,gen_20251127_091605,transactions_header.csv
T00002326,2024-08-29,2024-08-29 15:56:06,S022,C002178,Card,130.83,0.0,3,gen_20251127_091605,transactions_header.csv
T00002134,12/12/24,2024-12-12 22:24:01,S006,C002215,Online,40.71,4.07,1,gen_20251127_091605,transactions_header.csv
T00005226,01/15/24,2024-01-15 18:45:22,S015,C000934,Cash,$111.03,16.65,1,gen_20251127_091606,transactions_header.csv
T00000477,04/12/24,2024-04-12 07:32:03,S023,C004889,Online,47.47,2.37,2,gen_20251127_091605,transactions_header.csv
T00013567,06/17/24,2024-06-17 05:05:39,S001,C004676,Cash,19.69,2.95,1,gen_20251127_091607,transactions_header.csv
T00006138,04/03/24,2024-04-03 17:19:14,S014,,Card,68.96,0.0,3,gen_20251127_091606,transactions_header.csv
T00005450,2024-03-22,2024-03-22 07:56:53,S023,,Online,35.42,5.31,1,gen_20251127_091606,transactions_header.csv
T00004519,09/05/24,2024-09-05 11:28:46,S014,C001042,Cash,35.77,3.58,2,gen_20251127_091606,transactions_header.csv
T00017079,11/20/24,2024-11-20 20:24:43,S006,C004713,Online,16.85,0.84,2,gen_20251127_091607,transactions_header.csv
T00013628,01/22/24,2024-01-22 18:37:12,S024,C002571,Cash,57.46,8.62,1,gen_20251127_091607,transactions_header.csv
T00005863,08/25/24,2024-08-25 08:12:17,S021,C001093,Card,33.56,1.68,2,gen_20251127_091606,transactions_header.csv
T00004742,09/27/24,2024-09-27 06:39:24,S004,C002500,Card,1.41,0.0,1,gen_20251127_091606,transactions_header.csv
T00002175,08/22/24,2024-08-22 06:50:05,S017,C000896,Cash,58.88,5.89,1,gen_20251127_091605,transactions_header.csv
T00007862,2024-03-20,2024-03-20 14:08:35,S002,C003400,Cash,12.5,0.0,2,gen_20251127_091606,transactions_header.csv
T00016621,2024-09-17,2024-09-17 07:01:42,S024,C003704,Cash,88.92,13.34,1,gen_20251127_091607,transactions_header.csv
T00004473,04/21/24,2024-04-21 15:51:57,S003,C004456,Online,92.75,9.28,1,gen_20251127_091606,transactions_header.csv
T00004853,2024-11-07,2024-11-07 11:55:01,S017,,Cash,79.42,3.97,1,gen_20251127_091606,transactions_header.csv
T00000971,05/25/24,2024-05-25 11:16:28,S017,C003367,Cash,0,0,4,gen_20251127_091605,transactions_header.csv
T00012281,01/15/24,2024-01-15 15:58:49,S006,C001034,Card,56.9,8.54,1,gen_20251127_091607,transactions_header.csv
T00006053,2024-03-03,2024-03-03 21:32:11,S016,C003515,card,3.98,0.2,1,gen_20251127_091606,transactions_header.csv
T00010394,2024-11-16,2024-11-16 00:44:00,S008,C003583,Online,81.28,4.06,1,gen_20251127_091606,transactions_header.csv
T00008383,2024-03-22,2024-03-22 21:35:00,S003,C003791,Cash,118.05,11.8,4,gen_20251127_091606,transactions_header.csv
T00006770,09/20/24,2024-09-20 16:48:20,S004,C002295,Card,48.33,4.83,2,gen_20251127_091606,transactions_header.csv
T00010877,2024-01-12,2024-01-12 09:25:27,S026,C001938,Online,14.98,2.25,2,gen_20251127_091606,transactions_header.csv
T00005208,02/16/24,2024-02-16 18:36:54,S008,C001612,Cash,58.52,0.0,1,gen_20251127_091606,transactions_header.csv
T00005850,2024-07-08,2024-07-08 07:06:22,S022,C001651,Cash,54.82,,1,gen_20251127_091606,transactions_header.csv
T00012117,12/05/24,2024-12-05 11:06:14,S027,C000642,Online,25.11,,2,gen_20251127_091607,transactions_header.csv
T00013291,10/15/24,2024-10-15 13:45:49,S008,C000076,Online,66.65,0.0,2,gen_20251127_091607,transactions_header.csv
T00004102,03/05/24,2024-03-05 01:58:55,S028,C000055,Online,39.85,1.99,1,gen_20251127_091606,transactions_header.csv
T00016821,05/08/24,2024-05-08 05:07:39,S002,,Cash,41.96,4.2,2,gen_20251127_091607,transactions_header.csv
T00006818,10/24/24,2024-10-24 20:15:25,S022,,Cash,78.34,0.0,3,gen_20251127_091606,transactions_header.csv
T00003923,2024-12-25,2024-12-25 04:01:47,S018,NA,Cash,51.95,NA,6,gen_20251127_091606,transactions_header.csv
T00010610,2024-07-16,2024-07-16 15:35:52,S016,C003959,Card,40.14,NA,1,gen_20251127_091606,transactions_header.csv
T00000734,2024-01-06,2024-01-06 14:16:59,S026,C003765,Online,83.87,8.39,2,gen_20251127_091605,transactions_header.csv
T00014826,2024-04-19,2024-04-19 13:14:14,S027,C004995,Card,129.79,19.47,1,gen_20251127_091607,transactions_header.csv
T00009726,2024-02-13,2024-02-13 12:42:34,S029,C001865,Online,111.06,0.0,1,gen_20251127_091606,transactions_header.csv
T00009432,05/20/24,2024-05-20 07:19:41,S019,,Online,29.79,4.47,3,gen_20251127_091606,transactions_header.csv
T00011416,2024-05-08,2024-05-08 20:23:54,S019,C002283,Online,49.7,,2,gen_20251127_091606,transactions_header.csv
T00014915,2024-07-29,2024-07-29 08:56:57,S003,NA,Online,63.67,,3,gen_20251127_091607,transactions_header.csv
T00017561,2024-09-19,2024-09-19 00:37:02,S002,C001643,Card,29.55,4.43,6,gen_20251127_091607,transactions_header.csv
T00004412,01/22/24,2024-01-22 08:12:18,S022,C002578,Cash,74.44,7.44,1,gen_20251127_091606,transactions_header.csv
T00005659,2024-07-03,2024-07-03 10:19:46,S011,NA,Cash,58.07,2.9,1,gen_20251127_091606,transactions_header.csv
T00017095,06/25/24,2024-06-25 05:47:00,S013,,Online,70.12,3.51,1,gen_20251127_091607,transactions_header.csv
T00019958,2024-06-07,2024-06-07 11:27:59,S006,C002386,Online,94.07,9.41,1,gen_20251127_091607,transactions_header.csv
T00006527,07/11/24,2024-07-11 11:02:38,S030,C002368,Online,14.03,0.0,3,gen_20251127_091606,transactions_header.csv
T00015014,11/02/24,2024-11-02 08:06:43,S008,C004021,Cash,60.02,6.0,1,gen_20251127_091607,transactions_header.csv
T00006608,09/20/24,2024-09-20 20:50:36,S002,C003664,Cash,82.33,0.0,6,gen_20251127_091606,transactions_header.csv
T00008088,2024-04-27,2024-04-27 03:52:56,S022,C004265,Card,69.04,0.0,2,gen_20251127_091606,transactions_header.csv
T00010701,2024-12-27,2024-12-27 00:02:55,S008,C003136,Online,$42.94,2.15,5,gen_20251127_091606,transactions_header.csv
T00014833,2024-12-12,2024-12-12 07:32:12,S002,C001694,Cash,128.75,6.44,1,gen_20251127_091607,transactions_header.csv
T00003529,2024-12-06,2024-12-06 08:11:25,S020,C003754,Online,73.24,7.32,1,gen_20251127_091606,transactions_header.csv
T00016344,06/30/24,2024-06-30 22:55:55,S016,C004153,Online,55.43,2.77,1,gen_20251127_091607,transactions_header.csv
T00015790,2024-02-06,2024-02-06 22:12:43,S020,C003806,Card,$0.00,0.0,1,gen_20251127_091607,transactions_header.csv
T00011920,01/26/24,2024-01-26 16:39:34,S030,C003185,Online,44.53,0.0,1,gen_20251127_091607,transactions_header.csv
T00013814,2024-04-18,2024-04-18 12:33:40,S002,C000301,Online,61.86,0.0,1,gen_20251127_091607,transactions_header.csv
T00001442,2024-03-31,2024-03-31 19:55:34,S015,C003111,Cash,56.72,2.84,1,gen_20251127_091605,transactions_header.csv
T00011100,2024-03-30,2024-03-30 16:40:49,S020,C001134,Card,101.74,0.0,2,gen_20251127_091606,transactions_header.csv
T00005688,2024-04-18,2024-04-18 02:03:34,S026,C004698,Online,2.7,,1,gen_20251127_091606,transactions_header.csv
T00012251,2024-04-27,2024-04-27 16:59:15,S020,C001276,Card,71.16,10.67,1,gen_20251127_091607,transactions_header.csv
T00011288,03/17/24,2024-03-17 22:20:17,S014,C000056,Card,25.53,1.28,3,gen_20251127_091606,transactions_header.csv
T00019871,2024-07-07,2024-07-07 14:46:49,S002,,Cash,46.37,4.64,1,gen_20251127_091607,transactions_header.csv
T00004116,05/24/24,2024-05-24 03:41:44,S022,C004284,Cash,69.08,,3,gen_20251127_091606,transactions_header.csv
T00017234,2024-09-28,2024-09-28 23:15:36,S013,C004952,Card,0,0.0,4,gen_20251127_091607,transactions_header.csv
T00010227,06/04/24,2024-06-04 17:18:50,S028,C004085,Card,64.61,9.69,1,gen_20251127_091606,transactions_header.csv
T00012216,09/24/24,2024-09-24 16:34:59,S020,C003713,online,56.93,5.69,4,gen_20251127_091607,transactions_header.csv
T00018763,07/29/24,2024-07-29 02:13:50,S009,C003699,Online,74.4,0.0,1,gen_20251127_091607,transactions_header.csv
T00003579,01/24/24,2024-01-24 09:04:28,S028,C000196,Cash,63.45,9.52,1,gen_20251127_091606,transactions_header.csv
T00008080,2024-06-18,2024-06-18 19:38:56,S004,C002368,Online,15.39,0.0,1,gen_20251127_091606,transactions_header.csv
T00019099,05/13/24,2024-05-13 08:51:07,S017,C002538,Online,$36.42,5.46,1,gen_20251127_091607,transactions_header.csv
T00006445,07/28/24,2024-07-28 04:56:07,S004,C001751,Card,74.07,0.0,6,gen_20251127_091606,transactions_header.csv
T00002782,2024-04-18,2024-04-18 20:38:13,S003,C004520,Card,59.8,0.0,1,gen_20251127_091605,transactions_header.csv
T00019404,2024-02-05,2024-02-05 11:20:26,S002,C001603,Card,81.0,0.0,4,gen_20251127_091607,transactions_header.csv
T00004557,2024-05-26,2024-05-26 19:01:54,S026,,Cash,11.59,1.74,1,gen_20251127_091606,transactions_header.csv
T00012651,2024-03-15,2024-03-15 05:52:31,S008,C004445,Cash,35.42,1.77,2,gen_20251127_091607,transactions_header.csv
T00015432,2024-04-30,2024-04-30 12:20:46,S012,C004465,card,46.38,2.32,1,gen_20251127_091607,transactions_header.csv
T00000922,2024-10-26,2024-10-26 16:35:50,S027,C001409,Card,52.61,2.63,1,gen_20251127_091605,transactions_header.csv
T00001087,2024-04-08,2024-04-08 15:43:34,S021,C001896,Cash,11.78,,2,gen_20251127_091605,transactions_header.csv
T00005806,10/21/24,2024-10-21 12:56:33,S011,C003553,Card,24.86,,7,gen_20251127_091606,transactions_header.csv
T00008834,2024-11-10,2024-11-10 02:24:06,S028,C000468,Card,72.98,0.0,1,gen_20251127_091606,transactions_header.csv
T00010646,2024-11-02,2024-11-02 10:26:27,S023,NA,Cash,41.72,2.09,1,gen_20251127_091606,transactions_header.csv
T00005019,2024-09-07,2024-09-07 21:48:42,S010,C000005,Card,23.66,1.18,2,gen_20251127_091606,transactions_header.csv
T00010456,07/24/24,2024-07-24 08:04:56,S023,C001221,Card,35.11,,1,gen_20251127_091606,transactions_header.csv
T00012253,05/30/24,2024-05-30 08:13:26,S021,C003913,online,20.59,1.03,1,gen_20251127_091607,transactions_header.csv
T00001363,09/21/24,2024-09-21 19:54:04,S004,C000334,Cash,$39.75,1.99,2,gen_20251127_091605,transactions_header.csv
T00019407,2024-06-18,2024-06-18 01:52:24,S028,C003049,Card,0,0.0,1,gen_20251127_091607,transactions_header.csv
T00002849,2024-10-22,2024-10-22 21:55:07,S017,C003492,Cash,54.04,2.7,1,gen_20251127_091606,transactions_header.csv
T00014788,09/26/24,2024-09-26 15:07:58,S019,C000042,Online,66.18,0.0,2,gen_20251127_091607,transactions_header.csv
T00007285,2024-03-10,2024-03-10 04:24:07,S027,,Online,51.8,7.77,1,gen_20251127_091606,transactions_header.csv
T00008452,2024-10-08,2024-10-08 11:58:22,S018,C000560,Cash,$77.46,11.62,1,gen_20251127_091606,transactions_header.csv
T00010432,10/22/24,2024-10-22 21:09:22,S007,C000290,Cash,0,,3,gen_20251127_091606,transactions_header.csv
T00014694,2024-06-04,2024-06-04 18:07:43,S010,,Online,7.09,0.35,2,gen_20251127_091607,transactions_header.csv
T00004619,03/19/24,2024-03-19 22:13:46,S022,C001870,Cash,$73.60,,2,gen_20251127_091606,transactions_header.csv
T00019868,2024-10-04,2024-10-04 22:09:33,S016,C003581,Online,86.37,8.64,2,gen_20251127_091607,transactions_header.csv
T00005815,04/16/24,2024-04-16 18:12:15,S021,C001808,Card,71.13,3.56,6,gen_20251127_091606,transactions_header.csv
T00014086,2024-06-23,2024-06-23 16:34:39,S020,C004100,Cash,26.2,2.62,3,gen_20251127_091607,transactions_header.csv
T00012526,12/25/24,2024-12-25 06:46:44,S028,C001591,Cash,67.46,10.12,1,gen_20251127_091607,transactions_header.csv
T00016667,2024-10-27,2024-10-27 22:31:29,S005,C004380,Online,0,0.0,3,gen_20251127_091607,transactions_header.csv
T00002130,2024-01-23,2024-01-23 18:16:46,S011,C003979,Card,59.42,2.97,1,gen_20251127_091605,transactions_header.csv
T00003471,2024-09-10,2024-09-10 02:32:51,S002,C000803,Cash,61.0,9.15,1,gen_20251127_091606,transactions_header.csv
T00016224,2024-05-12,2024-05-12 23:58:04,S001,C000729,Card,96.72,9.67,2,gen_20251127_091607,transactions_header.csv
T00012378,04/17/24,2024-04-17 02:29:46,S002,C002103,Online,27.56,4.13,1,gen_20251127_091607,transactions_header.csv
T00011151,04/20/24,2024-04-20 14:42:50,S015,C001105,Cash,27.25,1.36,2,gen_20251127_091606,transactions_header.csv
T00005000,03/02/24,2024-03-02 16:29:19,S029,C000996,Online,41.15,0.0,4,gen_20251127_091606,transactions_header.csv
T00003979,12/05/24,2024-12-05 01:07:26,S027,C000549,Online,42.25,6.34,1,gen_20251127_091606,transactions_header.csv
T00013166,07/21/24,2024-07-21 01:23:52,S025,C002025,Card,30.21,0.0,2,gen_20251127_091607,transactions_header.csv
T00001384,01/22/24,2024-01-22 14:10:44,S016,C000761,Card,35.66,1.78,1,gen_20251127_091605,transactions_header.csv
T00006341,08/22/24,2024-08-22 00:30:36,S020,C004536,Card,$57.45,8.62,1,gen_20251127_091606,transactions_header.csv
T00005486,2024-01-02,2024-01-02 01:41:05,S028,C003633,Online,68.15,6.82,1,gen_20251127_091606,transactions_header.csv
T00015345,08/04/24,2024-08-04 01:49:50,S005,,Card,56.54,2.83,1,gen_20251127_091607,transactions_header.csv
T00011859,05/06/24,2024-05-06 01:53:27,S007,C002457,Cash,43.71,0.0,2,gen_20251127_091607,transactions_header.csv
T00007828,2024-03-18,2024-03-18 15:23:33,S013,C002949,Online,65.28,6.53,2,gen_20251127_091606,transactions_header.csv
T00016244,2024-07-01,2024-07-01 11:29:19,S011,C004609,Online,25.62,0.0,1,gen_20251127_091607,transactions_header.csv
T00000170,09/09/24,2024-09-09 15:32:05,S027,C002977,Card,44.35,2.22,1,gen_20251127_091605,transactions_header.csv
T00011425,2024-10-15,2024-10-15 14:19:17,S027,C003523,Card,29.33,2.93,1,gen_20251127_091606,transactions_header.csv
T00016623,2024-03-06,2024-03-06 18:34:23,S011,C002556,Cash,65.21,6.52,1,gen_20251127_091607,transactions_header.csv
T00015500,2024-01-07,2024-01-07 23:55:45,S030,C002602,Cash,38.49,3.85,4,gen_20251127_091607,transactions_header.csv
T00008601,05/08/24,2024-05-08 11:22:18,S026,C004579,Cash,86.69,8.67,1,gen_20251127_091606,transactions_header.csv
T00003367,2024-04-10,2024-04-10 07:58:18,S029,,Card,0,0.0,2,gen_20251127_091606,transactions_header.csv
T00004120,08/09/24,2024-08-09 13:49:31,S011,C001534,Card,49.46,7.42,4,gen_20251127_091606,transactions_header.csv
T00003012,07/05/24,2024-07-05 20:02:56,S017,C003343,Card,97.58,9.76,1,gen_20251127_091606,transactions_header.csv
T00015657,2024-10-26,2024-10-26 17:42:57,S016,C004915,cash,51.75,7.76,1,gen_20251127_091607,transactions_header.csv
T00014333,01/10/24,2024-01-10 06:37:44,S006,C003418,Cash,66.28,,1,gen_20251127_091607,transactions_header.csv
T00002316,01/27/24,2024-01-27 18:02:32,S013,C001539,Cash,39.01,0.0,2,gen_20251127_091605,transactions_header.csv
T00005478,2024-09-19,2024-09-19 22:46:46,S008,C003149,Online,6.28,NA,1,gen_20251127_091606,transactions_header.csv
T00007732,2024-07-16,2024-07-16 15:08:49,S024,C000907,Cash,42.69,2.13,3,gen_20251127_091606,transactions_header.csv
T00015246,08/25/24,2024-08-25 04:39:06,S019,C003884,Cash,19.63,0.98,4,gen_20251127_091607,transactions_header.csv
T00000138,2024-05-05,2024-05-05 19:33:50,S024,C001927,Card,80.43,4.02,1,gen_20251127_091605,transactions_header.csv
T00007305,2024-05-09,2024-05-09 10:11:16,S029,C001050,Online,103.24,5.16,1,gen_20251127_091606,transactions_header.csv
T00005408,07/28/24,2024-07-28 23:49:41,S025,C000509,Card,26.34,0.0,1,gen_20251127_091606,transactions_header.csv
T00003107,07/12/24,2024-07-12 16:41:49,S008,NA,Online,0,0.0,3,gen_20251127_091606,transactions_header.csv
T00006957,01/19/24,2024-01-19 17:30:03,S021,C001481,Online,13.15,0.0,2,gen_20251127_091606,transactions_header.csv
T00015962,07/23/24,2024-07-23 16:17:46,S002,C004299,Online,-56.51,5.65,6,gen_20251127_091607,transactions_header.csv
T00017934,2024-08-05,2024-08-05 13:23:55,S013,C002599,Cash,77.44,7.74,1,gen_20251127_091607,transactions_header.csv
T00007478,08/08/24,2024-08-08 02:51:52,S021,C002924,Card,59.44,8.92,2,gen_20251127_091606,transactions_header.csv
T00008286,2024-10-14,2024-10-14 01:05:49,S007,C001242,Online,43.49,4.35,2,gen_20251127_091606,transactions_header.csv
T00004253,01/13/24,2024-01-13 02:38:19,S011,C000142,Card,42.88,4.29,1,gen_20251127_091606,transactions_header.csv
T00003257,10/14/24,2024-10-14 22:36:04,S029,C002560,online,34.77,NA,3,gen_20251127_091606,transactions_header.csv
T00015818,2024-03-31,2024-03-31 12:25:30,S019,C001843,Card,9.72,0.49,2,gen_20251127_091607,transactions_header.csv
T00011319,03/10/24,2024-03-10 13:07:50,S030,C001257,Card,0,,2,gen_20251127_091606,transactions_header.csv
T00008228,10/02/24,2024-10-02 14:31:09,S027,C002785,Cash,45.07,4.51,1,gen_20251127_091606,transactions_header.csv
T00006887,11/17/24,2024-11-17 03:17:12,S017,C004662,Card,85.65,12.85,3,gen_20251127_091606,transactions_header.csv
T00007982,2024-07-16,2024-07-16 12:06:25,S009,C002087,Card,90.1,4.5,5,gen_20251127_091606,transactions_header.csv
T00006648,2024-06-10,2024-06-10 15:17:56,S018,C002275,Card,55.88,0.0,5,gen_20251127_091606,transactions_header.csv
T00013834,2024-07-26,2024-07-26 17:04:27,S017,,Cash,64.89,9.73,2,gen_20251127_091607,transactions_header.csv
T00014771,01/06/24,2024-01-06 08:28:06,S009,C003252,Online,69.49,0.0,2,gen_20251127_091607,transactions_header.csv
T00002753,07/14/24,2024-07-14 05:41:51,S016,C003842,Cash,$38.59,0.0,2,gen_20251127_091605,transactions_header.csv
T00001398,06/19/24,2024-06-19 15:39:08,S010,C004645,Card,60.95,6.1,2,gen_20251127_091605,transactions_header.csv
T00014193,01/16/24,2024-01-16 16:11:51,S009,C000221,Cash,45.8,0.0,1,gen_20251127_091607,transactions_header.csv
T00017115,07/18/24,2024-07-18 23:08:01,S010,C004554,Online,0,0.0,1,gen_20251127_091607,transactions_header.csv
T00006931,2024-03-04,2024-03-04 00:55:36,S002,C002178,Online,59.43,2.97,1,gen_20251127_091606,transactions_header.csv
T00008255,09/24/24,2024-09-24 13:24:25,S018,C000055,online,55.33,5.53,2,gen_20251127_091606,transactions_header.csv
T00014863,2024-11-23,2024-11-23 21:54:16,S010,C001389,cash,60.61,3.03,2,gen_20251127_091607,transactions_header.csv
T00016306,2024-04-29,2024-04-29 16:58:11,S026,C001087,Card,63.44,3.17,3,gen_20251127_091607,transactions_header.csv
T00015641,10/08/24,2024-10-08 22:05:57,S014,C001343,Online,85.95,4.3,2,gen_20251127_091607,transactions_header.csv
T00008973,2024-07-19,2024-07-19 22:49:08,S004,C004732,Card,73.78,7.38,3,gen_20251127_091606,transactions_header.csv
T00006076,03/18/24,2024-03-18 05:15:25,S015,C001152,Card,87.75,0.0,6,gen_20251127_091606,transactions_header.csv
T00019524,06/18/24,2024-06-18 15:16:00,S028,C004167,Card,58.17,0.0,1,gen_20251127_091607,transactions_header.csv
T00017268,07/02/24,2024-07-02 00:31:47,S026,C003108,Online,73.32,3.67,1,gen_20251127_091607,transactions_header.csv
T00016810,01/09/24,2024-01-09 18:48:15,S022,C002225,Card,54.31,2.72,3,gen_20251127_091607,transactions_header.csv
T00012763,08/13/24,2024-08-13 18:38:28,S007,C000017,Cash,1.34,0.0,2,gen_20251127_091607,transactions_header.csv
T00014353,11/09/24,2024-11-09 05:23:14,S023,C003214,Cash,99.48,9.95,1,gen_20251127_091607,transactions_header.csv
T00018891,09/10/24,2024-09-10 21:59:19,S018,C000729,Online,52.17,0.0,2,gen_20251127_091607,transactions_header.csv
T00011849,2024-10-01,2024-10-01 15:19:06,S018,C003717,Online,64.09,6.41,6,gen_20251127_091607,transactions_header.csv
T00002086,2024-02-12,2024-02-12 21:11:24,S010,C002086,Cash,47.48,2.37,1,gen_20251127_091605,transactions_header.csv
T00012605,08/13/24,2024-08-13 05:47:05,S027,C003308,Online,57.64,5.76,3,gen_20251127_091607,transactions_header.csv
T00017670,2024-07-23,2024-07-23 05:16:50,S005,C004544,Card,52.62,7.89,3,gen_20251127_091607,transactions_header.csv
T00004878,10/18/24,2024-10-18 09:04:18,S005,C000942,Cash,37.86,0.0,1,gen_20251127_091606,transactions_header.csv
T00004050,10/02/24,2024-10-02 08:08:03,S009,C000428,Online,$57.10,0.0,1,gen_20251127_091606,transactions_header.csv
T00014492,12/31/24,2024-12-31 17:41:04,S029,C002456,Card,$1.10,0.11,1,gen_20251127_091607,transactions_header.csv
T00005590,2024-11-24,2024-11-24 01:35:59,S020,C000944,Cash,43.38,0.0,6,gen_20251127_091606,transactions_header.csv
T00007805,07/12/24,2024-07-12 05:37:08,S001,C004662,Card,63.45,0.0,2,gen_20251127_091606,transactions_header.csv
T00005413,2024-05-06,2024-05-06 00:14:31,S001,NA,Cash,53.53,5.35,2,gen_20251127_091606,transactions_header.csv
T00003393,09/04/24,2024-09-04 00:09:07,S001,C002981,Online,62.43,,1,gen_20251127_091606,transactions_header.csv
T00005981,2024-06-11,2024-06-11 20:58:45,S020,C001207,Card,98.78,14.82,1,gen_20251127_091606,transactions_header.csv
T00015364,09/29/24,2024-09-29 14:36:20,S010,,Cash,92.28,4.61,2,gen_20251127_091607,transactions_header.csv
T00004843,2024-03-29,2024-03-29 10:44:52,S001,C001015,Cash,72.01,3.6,2,gen_20251127_091606,transactions_header.csv
T00004578,2024-02-05,2024-02-05 21:47:14,S017,C002076,Online,20.29,1.01,1,gen_20251127_091606,transactions_header.csv
T00011166,07/01/24,2024-07-01 13:36:35,S012,C003744,Card,48.16,7.22,2,gen_20251127_091606,transactions_header.csv
T00008551,09/04/24,2024-09-04 09:33:56,S023,C000917,Card,0,0.0,3,gen_20251127_091606,transactions_header.csv
T00016090,03/03/24,2024-03-03 08:22:36,S016,C001698,Cash,27.68,,1,gen_20251127_091607,transactions_header.csv
T00006014,06/18/24,2024-06-18 22:41:27,S012,C002678,Card,18.61,0.93,1,gen_20251127_091606,transactions_header.csv
T00017007,2024-08-03,2024-08-03 04:34:28,S008,C004121,Online,86.62,8.66,1,gen_20251127_091607,transactions_header.csv
T00016568,01/10/24,2024-01-10 02:51:04,S010,,Card,18.39,,2,gen_20251127_091607,transactions_header.csv
T00002394,09/29/24,2024-09-29 22:13:06,S010,C001909,Card,45.2,2.26,2,gen_20251127_091605,transactions_header.csv
T00018829,2024-10-02,2024-10-02 07:16:53,S021,C001911,Cash,85.02,0.0,1,gen_20251127_091607,transactions_header.csv
T00018213,12/30/24,2024-12-30 20:16:25,S028,C004890,Card,109.52,0.0,2,gen_20251127_091607,transactions_header.csv
T00000715,03/14/24,2024-03-14 18:47:07,S027,C002252,Cash,1.08,0.05,1,gen_20251127_091605,transactions_header.csv
T00011322,2024-10-07,2024-10-07 11:30:45,S012,C003650,Cash,79.83,0.0,4,gen_20251127_091606,transactions_header.csv
T00009621,2024-09-25,2024-09-25 05:09:02,S004,C001764,Online,95.85,14.38,4,gen_20251127_091606,transactions_header.csv
T00012782,03/22/24,2024-03-22 08:04:57,S026,C001330,Online,65.76,9.86,1,gen_20251127_091607,transactions_header.csv
T00014427,02/18/24,2024-02-18 08:05:41,S029,C002334,Cash,51.56,2.58,1,gen_20251127_091607,transactions_header.csv
T00007723,08/23/24,2024-08-23 00:58:39,S011,C003532,cash,69.09,0.0,3,gen_20251127_091606,transactions_header.csv
T00006182,2024-12-19,2024-12-19 15:24:49,S024,C002863,Online,66.92,3.35,1,gen_20251127_091606,transactions_header.csv
T00011231,06/07/24,2024-06-07 00:24:12,S027,C003861,Online,46.74,2.34,1,gen_20251127_091606,transactions_header.csv
T00014279,2024-10-01,2024-10-01 00:08:00,S027,C004190,Card,62.27,0.0,1,gen_20251127_091607,transactions_header.csv
T00000007,2024-10-27,2024-10-27 22:52:34,S012,,Cash,45.7,0.0,1,gen_20251127_091605,transactions_header.csv
T00014265,12/12/24,2024-12-12 06:06:23,S022,C003587,Cash,92.45,4.62,1,gen_20251127_091607,transactions_header.csv
T00013005,07/10/24,2024-07-10 15:00:43,S027,C002370,Cash,38.89,1.94,6,gen_20251127_091607,transactions_header.csv
T00016848,02/25/24,2024-02-25 07:13:17,S029,C004921,Online,95.72,14.36,1,gen_20251127_091607,transactions_header.csv
T00013083,02/24/24,2024-02-24 15:56:10,S011,C002008,online,55.16,5.52,2,gen_20251127_091607,transactions_header.csv
T00010640,09/24/24,2024-09-24 20:33:51,S020,C000355,Cash,$43.86,2.19,1,gen_20251127_091606,transactions_header.csv
T00012342,2024-02-23,2024-02-23 13:43:50,S006,C003372,Card,$41.06,2.05,3,gen_20251127_091607,transactions_header.csv
T00015591,2024-09-08,2024-09-08 14:23:04,S017,,Online,25.54,0.0,1,gen_20251127_091607,transactions_header.csv
T00007797,2024-03-13,2024-03-13 13:32:33,S027,C000368,Online,24.86,3.73,3,gen_20251127_091606,transactions_header.csv
T00013764,05/01/24,2024-05-01 07:36:17,S020,C004093,Online,33.73,0.0,1,gen_20251127_091607,transactions_header.csv
T00007583,2024-11-06,2024-11-06 10:03:09,S003,C003828,Card,6.3,,1,gen_20251127_091606,transactions_header.csv
T00010098,2024-10-31,2024-10-31 07:01:50,S012,C002035,Card,60.27,6.03,2,gen_20251127_091606,transactions_header.csv
T00003617,01/08/24,2024-01-08 16:36:03,S006,C003847,Online,61.67,0.0,2,gen_20251127_091606,transactions_header.csv
T00004411,2024-04-13,2024-04-13 04:57:43,S003,C003936,Online,30.0,0.0,1,gen_20251127_091606,transactions_header.csv
T00014905,12/24/24,2024-12-24 07:51:21,S012,C000285,Card,54.04,5.4,1,gen_20251127_091607,transactions_header.csv
T00012171,2024-03-11,2024-03-11 21:25:23,S002,C004066,Cash,55.04,5.5,1,gen_20251127_091607,transactions_header.csv
T00010994,2024-01-12,2024-01-12 22:23:33,S026,C000494,Online,$68.09,10.21,1,gen_20251127_091606,transactions_header.csv
T00001024,2024-06-15,2024-06-15 09:03:38,S020,C000029,Cash,56.5,0.0,2,gen_20251127_091605,transactions_header.csv
T00010604,2024-02-09,2024-02-09 05:14:20,S011,C000435,Cash,69.44,0.0,1,gen_20251127_091606,transactions_header.csv
T00015787,2024-11-19,2024-11-19 07:16:58,S021,C000434,Cash,37.1,3.71,1,gen_20251127_091607,transactions_header.csv
T00013845,2024-05-30,2024-05-30 10:19:41,S007,C003630,Card,17.88,2.68,1,gen_20251127_091607,transactions_header.csv
T00011980,2024-04-02,2024-04-02 09:23:51,S029,C004445,Cash,57.21,5.72,2,gen_20251127_091607,transactions_header.csv
T00007807,2024-04-26,2024-04-26 13:49:50,S007,C003158,Cash,77.72,3.89,1,gen_20251127_091606,transactions_header.csv
T00007248,04/15/24,2024-04-15 21:07:57,S002,C004512,Cash,92.38,0.0,1,gen_20251127_091606,transactions_header.csv
T00006704,01/29/24,2024-01-29 01:14:32,S013,C001693,Card,23.29,0.0,1,gen_20251127_091606,transactions_header.csv
T00012645,2024-04-08,2024-04-08 13:41:24,S011,C004153,Cash,60.91,3.05,2,gen_20251127_091607,transactions_header.csv
T00008240,12/19/24,2024-12-19 13:13:17,S028,C002400,Card,0,0.0,3,gen_20251127_091606,transactions_header.csv
T00019919,2024-02-14,2024-02-14 14:21:57,S028,C003227,Card,46.6,6.99,1,gen_20251127_091607,transactions_header.csv
T00019835,08/01/24,2024-08-01 02:16:04,S011,C004050,Online,100.34,15.05,3,gen_20251127_091607,transactions_header.csv
T00005577,2024-08-22,2024-08-22 10:11:00,S027,C003952,Online,21.94,3.29,1,gen_20251127_091606,transactions_header.csv
T00013106,01/17/24,2024-01-17 23:21:24,S011,C000207,Online,38.33,0.0,3,gen_20251127_091607,transactions_header.csv
T00016563,2024-01-20,2024-01-20 19:46:26,S003,C004893,Cash,73.95,0.0,6,gen_20251127_091607,transactions_header.csv
T00011597,05/09/24,2024-05-09 22:30:43,S009,C004270,Online,34.16,1.71,2,gen_20251127_091606,transactions_header.csv
T00008933,02/27/24,2024-02-27 11:57:28,S002,C002353,Card,22.79,2.28,1,gen_20251127_091606,transactions_header.csv
T00007746,2024-02-18,2024-02-18 12:43:57,S023,C001821,Card,92.41,13.86,1,gen_20251127_091606,transactions_header.csv
T00017990,11/25/24,2024-11-25 23:30:50,S007,C000934,card,76.71,11.51,1,gen_20251127_091607,transactions_header.csv
T00009963,2024-04-13,2024-04-13 09:47:12,S027,,Card,92.76,0.0,2,gen_20251127_091606,transactions_header.csv
T00002112,2024-01-03,2024-01-03 19:51:06,S025,,online,63.62,6.36,3,gen_20251127_091605,transactions_header.csv
T00019121,2024-07-13,2024-07-13 19:36:37,S017,C001377,Online,63.13,6.31,1,gen_20251127_091607,transactions_header.csv
T00002752,05/30/24,2024-05-30 12:47:09,S029,C004525,Card,63.19,,2,gen_20251127_091605,transactions_header.csv
T00016684,2024-04-23,2024-04-23 04:02:32,S004,C003581,Online,0,0.0,1,gen_20251127_091607,transactions_header.csv
T00003249,11/18/24,2024-11-18 09:09:37,S014,C002769,Online,16.46,1.65,1,gen_20251127_091606,transactions_header.csv
T00015727,2024-11-21,2024-11-21 11:30:27,S015,C002456,cash,106.71,5.34,1,gen_20251127_091607,transactions_header.csv
T00005145,2024-09-22,2024-09-22 14:14:37,S025,C000801,Card,102.07,10.21,4,gen_20251127_091606,transactions_header.csv
T00014397,2024-11-16,2024-11-16 10:11:30,S022,C001928,Cash,40.3,4.03,1,gen_20251127_091607,transactions_header.csv
T00018429,12/23/24,2024-12-23 15:22:40,S010,C000898,online,85.38,8.54,1,gen_20251127_091607,transactions_header.csv
T00017195,2024-04-26,2024-04-26 15:40:12,S009,,Cash,60.62,,2,gen_20251127_091607,transactions_header.csv
T00000559,04/30/24,2024-04-30 15:20:38,S030,C004529,Cash,4.26,0.43,7,gen_20251127_091605,transactions_header.csv
T00010403,12/29/24,2024-12-29 22:29:25,S026,C003625,Online,$11.75,0.59,5,gen_20251127_091606,transactions_header.csv
T00008127,05/25/24,2024-05-25 04:54:41,S023,C001151,Online,46.98,4.7,1,gen_20251127_091606,transactions_header.csv
T00005550,2024-05-27,2024-05-27 16:57:45,S001,C001825,Online,54.03,5.4,1,gen_20251127_091606,transactions_header.csv
T00015674,11/26/24,2024-11-26 19:24:26,S029,,Cash,0,0.0,1,gen_20251127_091607,transactions_header.csv
T00003932,10/03/24,2024-10-03 17:56:31,S013,C003772,Cash,54.08,2.7,4,gen_20251127_091606,transactions_header.csv
T00014675,07/08/24,2024-07-08 08:59:57,S003,,Online,106.35,15.95,2,gen_20251127_091607,transactions_header.csv
T00012907,06/14/24,2024-06-14 00:57:47,S025,C003204,Card,10.71,,1,gen_20251127_091607,transactions_header.csv
T00009274,2024-01-14,2024-01-14 13:51:07,S007,,Cash,45.75,2.29,2,gen_20251127_091606,transactions_header.csv
T00013682,01/12/24,2024-01-12 10:33:11,S016,C003937,Cash,25.04,1.25,2,gen_20251127_091607,transactions_header.csv
T00010841,2024-09-03,2024-09-03 03:08:24,S024,C000761,Cash,82.63,8.26,1,gen_20251127_091606,transactions_header.csv
T00010477,08/04/24,2024-08-04 11:44:51,S025,C002821,Card,73.14,3.66,2,gen_20251127_091606,transactions_header.csv
T00006888,12/14/24,2024-12-14 18:16:36,S023,C004394,Cash,29.09,1.45,2,gen_20251127_091606,transactions_header.csv
T00003024,2024-12-31,2024-12-31 02:47:57,S015,C001542,Cash,60.15,3.01,1,gen_20251127_091606,transactions_header.csv
T00014447,08/01/24,2024-08-01 07:13:23,S021,C003866,Card,11.28,0.0,3,gen_20251127_091607,transactions_header.csv
T00018999,2024-07-10,2024-07-10 23:33:43,S025,C004798,Card,$67.62,3.38,3,gen_20251127_091607,transactions_header.csv
T00003902,2024-08-27,2024-08-27 16:19:49,S025,C001269,Online,66.03,6.6,3,gen_20251127_091606,transactions_header.csv
T00016588,02/19/24,2024-02-19 12:05:13,S011,C002426,Card,84.34,0.0,1,gen_20251127_091607,transactions_header.csv
T00017660,06/17/24,2024-06-17 20:22:32,S018,C001875,Online,28.98,0.0,2,gen_20251127_091607,transactions_header.csv
T00004329,05/04/24,2024-05-04 17:20:14,S030,C000346,Cash,31.23,4.68,2,gen_20251127_091606,transactions_header.csv
T00015940,2024-10-14,2024-10-14 00:20:21,S025,C002607,Card,35.35,3.54,6,gen_20251127_091607,transactions_header.csv
T00017003,2024-02-19,2024-02-19 05:29:59,S007,C000677,Cash,12.69,0.0,1,gen_20251127_091607,transactions_header.csv
T00008280,08/08/24,2024-08-08 03:32:49,S011,C001733,Cash,94.9,0.0,2,gen_20251127_091606,transactions_header.csv
T00002421,01/08/24,2024-01-08 16:59:44,S029,C004995,Cash,40.36,,3,gen_20251127_091605,transactions_header.csv
T00017920,2024-07-15,2024-07-15 23:45:08,S016,NA,Card,21.51,1.08,2,gen_20251127_091607,transactions_header.csv
T00011418,2024-11-29,2024-11-29 01:53:46,S007,C002831,Cash,0,0,2,gen_20251127_091606,transactions_header.csv
T00008486,05/19/24,2024-05-19 09:35:06,S006,NA,Cash,26.77,0.0,6,gen_20251127_091606,transactions_header.csv
T00009961,06/16/24,2024-06-16 10:30:33,S007,C004255,Cash,$50.12,NA,3,gen_20251127_091606,transactions_header.csv
T00004541,2024-07-10,2024-07-10 11:36:13,S030,C003777,Card,20.63,0.0,2,gen_20251127_091606,transactions_header.csv
T00004895,2024-12-05,2024-12-05 11:31:19,S017,,Card,34.36,0.0,4,gen_20251127_091606,transactions_header.csv
T00005554,06/16/24,2024-06-16 08:37:26,S009,,Card,28.61,4.29,2,gen_20251127_091606,transactions_header.csv
T00014079,10/17/24,2024-10-17 03:26:30,S018,C002340,Cash,72.21,3.61,2,gen_20251127_091607,transactions_header.csv
T00004414,2024-11-06,2024-11-06 21:34:38,S006,C004339,Cash,21.17,3.18,8,gen_20251127_091606,transactions_header.csv
T00019394,2024-08-05,2024-08-05 18:10:27,S015,C002718,Card,44.99,NA,1,gen_20251127_091607,transactions_header.csv
T00002253,05/30/24,2024-05-30 21:20:33,S018,,Online,17.38,1.74,3,gen_20251127_091605,transactions_header.csv
T00007931,05/23/24,2024-05-23 04:25:55,S030,,Card,79.56,11.93,2,gen_20251127_091606,transactions_header.csv
T00007511,11/14/24,2024-11-14 12:17:36,S015,,Card,35.19,NA,6,gen_20251127_091606,transactions_header.csv
T00001870,2024-09-05,2024-09-05 07:12:21,S010,C002239,Online,18.17,,3,gen_20251127_091605,transactions_header.csv
T00002916,2024-07-09,2024-07-09 14:32:12,S025,C004226,Card,47.07,2.35,2,gen_20251127_091606,transactions_header.csv
T00009438,2024-12-18,2024-12-18 17:10:54,S002,C000542,Cash,59.92,,1,gen_20251127_091606,transactions_header.csv
T00012702,05/12/24,2024-05-12 19:00:16,S002,NA,online,-145.47,14.55,2,gen_20251127_091607,transactions_header.csv
T00006391,01/01/24,2024-01-01 06:19:56,S022,,Online,0.02,0.0,2,gen_20251127_091606,transactions_header.csv
T00010275,12/29/24,2024-12-29 21:37:38,S007,,Online,81.23,12.18,3,gen_20251127_091606,transactions_header.csv
T00015848,2024-04-28,2024-04-28 20:55:27,S004,C003981,Card,49.56,2.48,2,gen_20251127_091607,transactions_header.csv
T00001200,06/15/24,2024-06-15 06:37:40,S030,C003575,Cash,80.51,12.08,1,gen_20251127_091605,transactions_header.csv
T00007316,12/23/24,2024-12-23 06:07:16,S007,C000962,Online,43.37,0.0,1,gen_20251127_091606,transactions_header.csv
T00013996,2024-10-01,2024-10-01 14:31:05,S004,C003801,cash,72.96,7.3,1,gen_20251127_091607,transactions_header.csv
T00008019,2024-07-11,2024-07-11 05:58:39,S022,C004522,Cash,55.77,5.58,1,gen_20251127_091606,transactions_header.csv
T00014272,11/21/24,2024-11-21 19:12:47,S010,C000133,Cash,27.54,4.13,2,gen_20251127_091607,transactions_header.csv
T00007783,2024-10-12,2024-10-12 01:46:21,S018,C001246,Card,46.63,6.99,1,gen_20251127_091606,transactions_header.csv
T00018372,01/19/24,2024-01-19 01:50:32,S027,C000507,Cash,87.88,13.18,1,gen_20251127_091607,transactions_header.csv
T00000716,2024-05-26,2024-05-26 15:52:09,S005,,Cash,68.72,10.31,1,gen_20251127_091605,transactions_header.csv
T00007536,2024-04-18,2024-04-18 23:39:16,S010,C000826,Cash,82.27,4.11,4,gen_20251127_091606,transactions_header.csv
T00017479,2024-11-12,2024-11-12 09:10:00,S003,C004237,Cash,27.26,0.0,1,gen_20251127_091607,transactions_header.csv
T00004837,2024-03-26,2024-03-26 20:05:43,S010,C000300,Cash,28.22,2.82,1,gen_20251127_091606,transactions_header.csv
T00015006,2024-05-27,2024-05-27 23:36:30,S011,C002430,Cash,36.48,3.65,1,gen_20251127_091607,transactions_header.csv
T00006493,2024-03-05,2024-03-05 20:04:31,S026,C003384,Card,7.29,0.0,2,gen_20251127_091606,transactions_header.csv
T00000362,2024-02-25,2024-02-25 02:34:12,S012,C003525,Card,47.57,4.76,1,gen_20251127_091605,transactions_header.csv
T00009615,05/25/24,2024-05-25 15:21:01,S019,C003589,Cash,36.68,3.67,1,gen_20251127_091606,transactions_header.csv
T00016723,03/12/24,2024-03-12 14:49:30,S030,C000728,Online,11.39,1.71,2,gen_20251127_091607,transactions_header.csv
T00005352,05/17/24,2024-05-17 11:15:09,S022,C001060,Card,75.66,0.0,1,gen_20251127_091606,transactions_header.csv
T00014316,2024-02-29,2024-02-29 10:14:36,S020,C001667,Cash,3.65,0.0,1,gen_20251127_091607,transactions_header.csv
T00009234,2024-02-26,2024-02-26 18:27:42,S015,C004896,Card,42.22,4.22,3,gen_20251127_091606,transactions_header.csv
T00003799,01/02/24,2024-01-02 04:23:28,S003,C001900,Cash,18.31,0.92,3,gen_20251127_091606,transactions_header.csv
T00012759,06/22/24,2024-06-22 02:06:27,S008,C002046,Cash,79.12,,1,gen_20251127_091607,transactions_header.csv
T00010869,2024-02-16,2024-02-16 19:51:57,S016,C003637,Cash,51.15,2.56,4,gen_20251127_091606,transactions_header.csv
T00019047,2024-01-10,2024-01-10 05:16:19,S027,C004814,Cash,54.28,2.71,2,gen_20251127_091607,transactions_header.csv
T00002863,2024-03-03,2024-03-03 03:43:25,S006,C003570,Card,70.86,,4,gen_20251127_091606,transactions_header.csv
T00017266,2024-12-19,2024-12-19 16:24:28,S024,C004397,Cash,59.18,2.96,2,gen_20251127_091607,transactions_header.csv
T00006418,05/26/24,2024-05-26 10:24:35,S029,C000712,Card,82.87,4.14,1,gen_20251127_091606,transactions_header.csv
T00017320,08/15/24,2024-08-15 05:05:38,S020,C004452,Online,0,0.0,1,gen_20251127_091607,transactions_header.csv
T00001158,2024-03-23,2024-03-23 20:39:11,S021,C001937,Card,98.24,9.82,1,gen_20251127_091605,transactions_header.csv
T00017907,05/26/24,2024-05-26 07:25:38,S018,C002227,Online,52.57,7.89,2,gen_20251127_091607,transactions_header.csv
T00011569,06/14/24,2024-06-14 18:00:50,S015,C004171,Cash,82.26,0.0,1,gen_20251127_091606,transactions_header.csv
T00003001,07/22/24,2024-07-22 21:23:43,S025,C002740,Card,20.17,2.02,6,gen_20251127_091606,transactions_header.csv
T00000461,2024-09-23,2024-09-23 21:18:57,S016,NA,online,32.77,0.0,2,gen_20251127_091605,transactions_header.csv
T00014256,2024-01-06,2024-01-06 04:35:21,S012,C003524,Card,84.83,12.72,8,gen_20251127_091607,transactions_header.csv
T00019930,07/26/24,2024-07-26 13:16:18,S021,C000577,Card,94.63,,1,gen_20251127_091607,transactions_header.csv
T00009393,2024-06-08,2024-06-08 18:42:14,S008,C000138,Cash,52.45,7.87,2,gen_20251127_091606,transactions_header.csv
T00000292,2024-06-06,2024-06-06 15:33:14,S001,C002139,Card,34.61,1.73,2,gen_20251127_091605,transactions_header.csv
T00004606,2024-04-15,2024-04-15 01:17:51,S018,C003036,Card,34.67,5.2,1,gen_20251127_091606,transactions_header.csv
T00018573,01/04/24,2024-01-04 03:51:45,S026,C003609,Card,114.42,,1,gen_20251127_091607,transactions_header.csv
T00017941,01/26/24,2024-01-26 06:45:19,S004,,Cash,27.53,1.38,3,gen_20251127_091607,transactions_header.csv
T00014246,2024-07-23,2024-07-23 00:02:27,S007,C000675,Cash,36.68,5.5,3,gen_20251127_091607,transactions_header.csv
T00013525,01/19/24,2024-01-19 11:43:29,S020,C003239,Online,36.83,5.52,6,gen_20251127_091607,transactions_header.csv
T00003069,01/28/24,2024-01-28 14:53:44,S026,C000693,Cash,31.99,3.2,1,gen_20251127_091606,transactions_header.csv
T00004829,03/03/24,2024-03-03 16:23:33,S014,C002192,Cash,70.89,0.0,1,gen_20251127_091606,transactions_header.csv
T00006135,2024-12-07,2024-12-07 15:56:23,S028,,Card,103.84,5.19,2,gen_20251127_091606,transactions_header.csv
T00017751,07/22/24,2024-07-22 16:52:44,S029,C004495,Cash,91.08,9.11,1,gen_20251127_091607,transactions_header.csv
T00015426,11/30/24,2024-11-30 20:34:21,S015,C001380,Card,90.01,9.0,1,gen_20251127_091607,transactions_header.csv
T00019472,2024-06-13,2024-06-13 08:14:06,S012,C001546,Online,70.13,7.01,5,gen_20251127_091607,transactions_header.csv
T00010803,02/19/24,2024-02-19 16:14:58,S022,C003117,Cash,19.54,2.93,2,gen_20251127_091606,transactions_header.csv
T00011821,2024-06-27,2024-06-27 09:38:54,S002,C003218,card,79.34,7.93,1,gen_20251127_091607,transactions_header.csv
T00018745,05/16/24,2024-05-16 04:35:22,S020,C003948,Online,39.9,0.0,4,gen_20251127_091607,transactions_header.csv
T00007989,2024-11-13,2024-11-13 07:32:28,S006,C002950,online,87.45,4.37,2,gen_20251127_091606,transactions_header.csv
T00017258,10/09/24,2024-10-09 11:47:05,S006,C003774,Online,30.01,3.0,1,gen_20251127_091607,transactions_header.csv
T00006979,2024-10-16,2024-10-16 04:17:41,S007,C001245,Cash,77.46,11.62,1,gen_20251127_091606,transactions_header.csv
T00017754,2024-05-20,2024-05-20 12:50:26,S017,C001028,Online,1.97,NA,3,gen_20251127_091607,transactions_header.csv
T00004032,2024-07-09,2024-07-09 16:40:53,S002,C002804,Card,28.74,4.31,1,gen_20251127_091606,transactions_header.csv
T00002280,02/09/24,2024-02-09 07:36:52,S008,C000123,Online,113.04,16.96,1,gen_20251127_091605,transactions_header.csv
T00002468,06/15/24,2024-06-15 22:26:00,S022,C000295,Card,50.15,7.52,1,gen_20251127_091605,transactions_header.csv
T00008232,2024-01-18,2024-01-18 14:09:26,S022,C003374,Cash,28.2,0.0,1,gen_20251127_091606,transactions_header.csv
T00018111,2024-05-17,2024-05-17 01:48:00,S014,C003920,Cash,86.38,12.96,5,gen_20251127_091607,transactions_header.csv
T00016017,01/21/24,2024-01-21 00:29:09,S009,C003134,card,0,0.0,3,gen_20251127_091607,transactions_header.csv
T00019933,2024-10-01,2024-10-01 16:34:36,S017,C002557,Cash,21.09,2.11,1,gen_20251127_091607,transactions_header.csv
T00000260,2024-10-09,2024-10-09 07:35:12,S010,,Cash,74.69,0.0,4,gen_20251127_091605,transactions_header.csv
T00010981,01/23/24,2024-01-23 11:50:55,S002,C000391,Card,49.14,4.91,2,gen_20251127_091606,transactions_header.csv
T00019594,10/13/24,2024-10-13 22:31:54,S019,C003952,online,12.59,1.26,2,gen_20251127_091607,transactions_header.csv
T00007984,07/09/24,2024-07-09 07:18:56,S030,C003861,Online,44.85,2.24,1,gen_20251127_091606,transactions_header.csv
T00010513,05/30/24,2024-05-30 23:04:56,S017,C001245,Card,84.57,8.46,5,gen_20251127_091606,transactions_header.csv
T00019861,2024-08-02,2024-08-02 13:36:53,S019,C002296,Cash,35.62,1.78,1,gen_20251127_091607,transactions_header.csv
T00000231,12/24/24,2024-12-24 14:54:26,S013,C004918,Online,$45.27,0.0,1,gen_20251127_091605,transactions_header.csv
T00019467,2024-07-18,2024-07-18 15:57:48,S005,C001221,cash,27.03,4.05,2,gen_20251127_091607,transactions_header.csv
T00007901,2024-01-05,2024-01-05 23:29:32,S026,C001173,Online,45.53,4.55,3,gen_20251127_091606,transactions_header.csv
T00018825,01/28/24,2024-01-28 19:53:28,S003,C004785,Card,75.72,3.79,1,gen_20251127_091607,transactions_header.csv
T00013554,2024-12-29,2024-12-29 10:05:47,S001,C001648,Card,71.89,10.78,1,gen_20251127_091607,transactions_header.csv
T00010979,01/29/24,2024-01-29 17:54:23,S013,C001872,Online,86.43,4.32,1,gen_20251127_091606,transactions_header.csv
T00005231,2024-04-13,2024-04-13 08:50:55,S013,C000511,Online,31.18,0.0,1,gen_20251127_091606,transactions_header.csv
T00018667,11/09/24,2024-11-09 02:30:44,S021,C004995,Online,26.49,0.0,1,gen_20251127_091607,transactions_header.csv
T00003426,10/29/24,2024-10-29 18:53:53,S022,C001853,Cash,8.71,1.31,1,gen_20251127_091606,transactions_header.csv
T00018325,03/09/24,2024-03-09 12:57:54,S025,C001641,Online,$6.36,0.64,1,gen_20251127_091607,transactions_header.csv
T00004886,05/22/24,2024-05-22 04:34:22,S027,C000399,Cash,63.64,9.55,2,gen_20251127_091606,transactions_header.csv
T00002831,08/14/24,2024-08-14 16:45:13,S030,C004527,Cash,8.28,0.83,1,gen_20251127_091605,transactions_header.csv
T00017677,2024-01-01,2024-01-01 10:11:53,S028,C000668,card,$18.94,,6,gen_20251127_091607,transactions_header.csv
T00014347,2024-04-05,2024-04-05 05:06:32,S030,C002654,Online,44.01,2.2,1,gen_20251127_091607,transactions_header.csv
T00015829,2024-03-03,2024-03-03 08:19:39,S007,C004640,Online,57.52,2.88,2,gen_20251127_091607,transactions_header.csv
T00004937,06/10/24,2024-06-10 22:31:19,S015,C000965,Card,53.52,5.35,2,gen_20251127_091606,transactions_header.csv
T00007218,2024-11-03,2024-11-03 18:19:35,S029,C002638,Online,101.17,5.06,7,gen_20251127_091606,transactions_header.csv
T00009053,08/24/24,2024-08-24 20:50:38,S025,C002275,Online,60.28,0.0,3,gen_20251127_091606,transactions_header.csv
T00008035,09/21/24,2024-09-21 07:12:08,S022,C004597,Card,0,0.0,1,gen_20251127_091606,transactions_header.csv
T00004529,2024-02-08,2024-02-08 15:45:24,S016,C003154,Cash,42.23,0.0,1,gen_20251127_091606,transactions_header.csv
T00019669,09/19/24,2024-09-19 09:24:02,S004,NA,Online,7.32,,1,gen_20251127_091607,transactions_header.csv
T00009296,07/04/24,2024-07-04 15:52:13,S025,C004177,Cash,51.31,2.57,1,gen_20251127_091606,transactions_header.csv
T00007015,03/05/24,2024-03-05 13:02:21,S028,C003941,Card,74.59,3.73,1,gen_20251127_091606,transactions_header.csv
T00015656,2024-11-28,2024-11-28 03:24:58,S024,C000974,Card,56.22,2.81,1,gen_20251127_091607,transactions_header.csv
T00010503,2024-02-19,2024-02-19 17:48:29,S029,C002702,Cash,51.59,7.74,3,gen_20251127_091606,transactions_header.csv
T00004033,2024-10-26,2024-10-26 22:50:15,S030,C004571,Card,49.51,7.43,3,gen_20251127_091606,transactions_header.csv
T00014207,09/18/24,2024-09-18 20:31:07,S020,,Cash,$14.02,,3,gen_20251127_091607,transactions_header.csv
T00015497,04/17/24,2024-04-17 20:42:32,S024,C002380,card,45.78,0.0,2,gen_20251127_091607,transactions_header.csv
T00015308,2024-06-21,2024-06-21 18:53:12,S024,C000412,Online,49.88,0.0,1,gen_20251127_091607,transactions_header.csv
T00018233,2024-11-21,2024-11-21 16:22:17,S015,C002732,Cash,49.3,2.46,6,gen_20251127_091607,transactions_header.csv
T00003504,11/14/24,2024-11-14 19:35:22,S029,C003209,Cash,32.81,0.0,2,gen_20251127_091606,transactions_header.csv
T00005737,09/07/24,2024-09-07 13:46:56,S025,NA,Online,46.41,0.0,2,gen_20251127_091606,transactions_header.csv
T00006691,02/06/24,2024-02-06 21:43:12,S012,C001009,Online,13.77,0.0,2,gen_20251127_091606,transactions_header.csv
T00013523,08/15/24,2024-08-15 08:05:02,S009,C004575,Cash,59.13,8.87,2,gen_20251127_091607,transactions_header.csv
T00014171,05/11/24,2024-05-11 20:35:59,S030,C000346,Online,71.71,3.59,8,gen_20251127_091607,transactions_header.csv
T00016855,2024-08-22,2024-08-22 04:26:08,S012,C003308,Cash,$29.16,1.46,1,gen_20251127_091607,transactions_header.csv
T00016436,2024-06-29,2024-06-29 18:46:27,S020,,Card,46.32,2.32,1,gen_20251127_091607,transactions_header.csv
T00013607,2024-05-01,2024-05-01 20:59:52,S028,C004280,Online,18.33,0.0,2,gen_20251127_091607,transactions_header.csv
T00019935,03/18/24,2024-03-18 03:19:56,S004,,Card,$74.00,11.1,5,gen_20251127_091607,transactions_header.csv
T00018455,01/22/24,2024-01-22 11:22:07,S004,,Online,58.86,5.89,1,gen_20251127_091607,transactions_header.csv
T00014995,04/08/24,2024-04-08 09:32:54,S024,C000791,Cash,42.13,6.32,1,gen_20251127_091607,transactions_header.csv
T00011794,2024-10-31,2024-10-31 14:37:14,S024,NA,Online,77.3,NA,3,gen_20251127_091607,transactions_header.csv
T00011698,10/09/24,2024-10-09 20:17:55,S020,C003843,Card,0,0.0,2,gen_20251127_091607,transactions_header.csv
T00014274,2024-11-18,2024-11-18 22:41:38,S021,NA,Card,105.53,15.83,2,gen_20251127_091607,transactions_header.csv
T00018451,03/02/24,2024-03-02 16:29:21,S022,C002317,Cash,66.39,9.96,1,gen_20251127_091607,transactions_header.csv
T00016993,2024-04-29,2024-04-29 01:35:36,S024,C002320,Card,64.42,3.22,1,gen_20251127_091607,transactions_header.csv
T00008271,2024-07-11,2024-07-11 14:18:13,S007,C000391,Cash,11.34,1.13,6,gen_20251127_091606,transactions_header.csv
T00018593,05/09/24,2024-05-09 03:17:52,S020,C002636,Cash,52.11,5.21,1,gen_20251127_091607,transactions_header.csv
T00014658,01/26/24,2024-01-26 17:41:06,S016,,Cash,87.53,8.75,5,gen_20251127_091607,transactions_header.csv
T00006620,11/03/24,2024-11-03 17:33:40,S013,C003783,Online,55.78,2.79,1,gen_20251127_091606,transactions_header.csv
T00019544,06/16/24,2024-06-16 05:20:25,S002,C004031,Online,84.98,,4,gen_20251127_091607,transactions_header.csv
T00019046,05/16/24,2024-05-16 07:38:52,S016,C003893,Cash,18.47,,2,gen_20251127_091607,transactions_header.csv
T00012256,09/22/24,2024-09-22 14:52:51,S024,C002017,Online,63.74,NA,3,gen_20251127_091607,transactions_header.csv
T00007727,2024-04-13,2024-04-13 20:32:06,S012,,Cash,50.81,2.54,7,gen_20251127_091606,transactions_header.csv
T00013767,12/27/24,2024-12-27 05:47:19,S016,C003677,Card,6.97,1.05,1,gen_20251127_091607,transactions_header.csv
T00001958,2024-08-01,2024-08-01 03:57:36,S030,C000335,Online,$0.00,0.0,1,gen_20251127_091605,transactions_header.csv
T00000488,2024-10-21,2024-10-21 08:30:06,S006,C004347,Card,32.09,1.6,2,gen_20251127_091605,transactions_header.csv
T00010508,2024-08-18,2024-08-18 08:09:38,S023,C002521,Cash,89.71,8.97,2,gen_20251127_091606,transactions_header.csv
T00008872,2024-11-19,2024-11-19 01:58:45,S013,C004477,online,$76.40,0.0,1,gen_20251127_091606,transactions_header.csv
T00005117,10/03/24,2024-10-03 02:33:49,S024,C000487,Online,25.89,0.0,3,gen_20251127_091606,transactions_header.csv
T00019068,02/08/24,2024-02-08 00:33:09,S004,C004240,Card,51.57,NA,1,gen_20251127_091607,transactions_header.csv
T00009982,2024-06-12,2024-06-12 05:13:08,S006,C003486,Card,57.19,8.58,3,gen_20251127_091606,transactions_header.csv
T00016927,05/25/24,2024-05-25 10:41:26,S011,C004433,Online,44.57,NA,3,gen_20251127_091607,transactions_header.csv
T00012124,2024-06-22,2024-06-22 04:15:20,S022,C001886,Online,0,0.0,3,gen_20251127_091607,transactions_header.csv
T00015631,2024-04-05,2024-04-05 19:45:11,S009,,Card,34.96,0.0,1,gen_20251127_091607,transactions_header.csv
T00012617,2024-08-16,2024-08-16 06:37:10,S029,C002406,Online,81.74,8.17,1,gen_20251127_091607,transactions_header.csv
T00014046,07/11/24,2024-07-11 23:17:16,S006,C001022,Cash,72.49,3.62,1,gen_20251127_091607,transactions_header.csv
T00018939,2024-03-15,2024-03-15 00:37:49,S004,C001787,Online,15.88,0.79,1,gen_20251127_091607,transactions_header.csv
T00009979,01/17/24,2024-01-17 13:48:53,S015,C000232,Online,59.75,8.96,1,gen_20251127_091606,transactions_header.csv
T00010605,02/03/24,2024-02-03 08:05:05,S026,C001028,Online,34.69,5.2,5,gen_20251127_091606,transactions_header.csv
T00018376,2024-03-11,2024-03-11 09:21:27,S029,C000772,Card,39.99,2.0,1,gen_20251127_091607,transactions_header.csv
T00004450,2024-03-13,2024-03-13 08:44:40,S024,C002791,Card,61.19,6.12,3,gen_20251127_091606,transactions_header.csv
T00003827,08/28/24,2024-08-28 09:34:07,S020,C003830,Online,53.42,NA,2,gen_20251127_091606,transactions_header.csv
T00019658,04/16/24,2024-04-16 14:21:01,S002,NA,Cash,26.97,NA,7,gen_20251127_091607,transactions_header.csv
T00001021,06/12/24,2024-06-12 03:05:18,S016,C002608,Card,74.79,11.22,1,gen_20251127_091605,transactions_header.csv
T00016037,2024-12-05,2024-12-05 16:11:33,S020,C000599,cash,77.96,3.9,1,gen_20251127_091607,transactions_header.csv
T00019934,2024-03-01,2024-03-01 09:12:40,S026,C000598,Cash,75.62,NA,1,gen_20251127_091607,transactions_header.csv
T00019060,2024-03-19,2024-03-19 08:20:02,S018,,Cash,3.64,0.18,2,gen_20251127_091607,transactions_header.csv
T00013229,05/23/24,2024-05-23 04:42:47,S026,C001505,Online,62.62,6.26,2,gen_20251127_091607,transactions_header.csv
T00015299,07/25/24,2024-07-25 12:38:12,S024,C004978,Cash,7.67,1.15,1,gen_20251127_091607,transactions_header.csv
T00009989,2024-04-27,2024-04-27 23:04:01,S020,C002299,Cash,106.23,15.93,1,gen_20251127_091606,transactions_header.csv
T00014577,09/06/24,2024-09-06 00:16:57,S026,C002874,Card,78.84,,2,gen_20251127_091607,transactions_header.csv
T00006757,2024-06-19,2024-06-19 05:42:30,S008,C003349,Cash,38.93,,1,gen_20251127_091606,transactions_header.csv
T00007597,10/30/24,2024-10-30 15:28:40,S013,C002174,Cash,20.52,0.0,3,gen_20251127_091606,transactions_header.csv
T00015643,09/01/24,2024-09-01 13:22:02,S024,,Online,31.01,3.1,3,gen_20251127_091607,transactions_header.csv
T00006872,2024-08-19,2024-08-19 06:33:12,S019,C004050,Cash,85.5,4.28,1,gen_20251127_091606,transactions_header.csv
T00000135,09/29/24,2024-09-29 17:58:23,S003,C000966,Cash,120.3,12.03,1,gen_20251127_091605,transactions_header.csv
T00012134,2024-05-27,2024-05-27 10:31:12,S013,C003458,Cash,10.76,1.61,2,gen_20251127_091607,transactions_header.csv
T00010118,2024-11-11,2024-11-11 12:49:02,S011,C002948,Cash,82.39,8.24,1,gen_20251127_091606,transactions_header.csv
T00006815,2024-09-15,2024-09-15 04:40:17,S001,C001161,Card,0,0,3,gen_20251127_091606,transactions_header.csv
T00018175,2024-04-22,2024-04-22 07:54:46,S003,C001033,Cash,41.03,6.15,1,gen_20251127_091607,transactions_header.csv
T00007745,04/27/24,2024-04-27 12:04:33,S003,C001255,Cash,38.28,NA,3,gen_20251127_091606,transactions_header.csv
T00016608,2024-07-17,2024-07-17 01:15:36,S028,C004506,Cash,38.49,0.0,5,gen_20251127_091607,transactions_header.csv
T00014144,12/11/24,2024-12-11 18:07:42,S002,C002201,Online,11.85,0.0,5,gen_20251127_091607,transactions_header.csv
T00003670,2024-05-28,2024-05-28 12:53:14,S005,C004776,Cash,21.98,0.0,1,gen_20251127_091606,transactions_header.csv
T00005972,2024-03-17,2024-03-17 11:22:33,S024,C002303,Online,0,0.0,1,gen_20251127_091606,transactions_header.csv
T00019153,2024-01-11,2024-01-11 17:48:45,S020,C001791,Card,86.05,8.61,2,gen_20251127_091607,transactions_header.csv
T00008518,07/02/24,2024-07-02 20:33:52,S022,C000096,Card,35.49,0.0,6,gen_20251127_091606,transactions_header.csv
T00010639,2024-04-28,2024-04-28 19:36:38,S030,C000928,Card,26.89,2.69,1,gen_20251127_091606,transactions_header.csv
T00011769,07/11/24,2024-07-11 04:05:43,S006,C002289,Online,1.72,0.17,1,gen_20251127_091607,transactions_header.csv
T00010578,2024-12-22,2024-12-22 19:34:28,S015,C002197,Cash,45.88,6.88,1,gen_20251127_091606,transactions_header.csv
T00009059,07/11/24,2024-07-11 22:26:46,S016,C001954,Cash,52.44,2.62,1,gen_20251127_091606,transactions_header.csv
T00019760,2024-12-29,2024-12-29 09:26:36,S029,C004204,Cash,15.9,,1,gen_20251127_091607,transactions_header.csv
T00000486,2024-10-08,2024-10-08 23:29:00,S015,,Cash,40.66,6.1,1,gen_20251127_091605,transactions_header.csv
T00016530,03/15/24,2024-03-15 13:08:50,S026,C004362,Cash,7.55,1.13,6,gen_20251127_091607,transactions_header.csv
T00000968,08/08/24,2024-08-08 22:23:10,S008,C001654,Card,90.03,13.5,2,gen_20251127_091605,transactions_header.csv
T00009758,06/08/24,2024-06-08 01:19:18,S004,C002007,Online,-8.37,0.84,1,gen_20251127_091606,transactions_header.csv
T00010243,02/09/24,2024-02-09 07:28:41,S005,C000976,Card,0,0.0,2,gen_20251127_091606,transactions_header.csv
T00010158,10/14/24,2024-10-14 21:17:19,S018,C002694,Online,98.13,,1,gen_20251127_091606,transactions_header.csv
T00016102,05/16/24,2024-05-16 02:40:12,S027,C004846,Card,84.53,8.45,3,gen_20251127_091607,transactions_header.csv
T00007627,07/11/24,2024-07-11 22:40:45,S010,C000386,Cash,66.61,3.33,2,gen_20251127_091606,transactions_header.csv
T00006389,2024-04-20,2024-04-20 01:45:08,S004,,Card,60.18,6.02,1,gen_20251127_091606,transactions_header.csv
T00002226,02/05/24,2024-02-05 22:46:33,S016,C000749,Card,18.79,0.94,1,gen_20251127_091605,transactions_header.csv
T00016424,08/11/24,2024-08-11 16:17:12,S016,C004348,card,75.49,11.32,1,gen_20251127_091607,transactions_header.csv
T00005750,07/14/24,2024-07-14 07:58:30,S017,C001631,Card,18.73,1.87,1,gen_20251127_091606,transactions_header.csv
T00012835,12/26/24,2024-12-26 16:21:57,S005,C002908,Card,38.19,,1,gen_20251127_091607,transactions_header.csv
T00002931,04/15/24,2024-04-15 18:14:02,S012,C000279,Cash,22.44,1.12,2,gen_20251127_091606,transactions_header.csv
T00019949,07/09/24,2024-07-09 17:17:53,S018,C004798,Card,69.68,10.45,3,gen_20251127_091607,transactions_header.csv
T00009189,2024-08-07,2024-08-07 02:53:08,S004,C001881,Cash,54.84,8.23,3,gen_20251127_091606,transactions_header.csv
T00006302,04/21/24,2024-04-21 19:57:16,S026,C000779,Online,50.83,2.54,3,gen_20251127_091606,transactions_header.csv
T00003342,2024-08-30,2024-08-30 20:03:16,S022,C003980,Online,57.28,2.86,2,gen_20251127_091606,transactions_header.csv
T00014931,2024-06-27,2024-06-27 02:01:55,S007,C002336,Card,36.4,5.46,6,gen_20251127_091607,transactions_header.csv
T00015017,2024-12-12,2024-12-12 03:42:13,S025,C003162,Card,$34.43,5.16,2,gen_20251127_091607,transactions_header.csv
T00008583,2024-05-26,2024-05-26 22:33:48,S020,C003836,Card,47.38,2.37,4,gen_20251127_091606,transactions_header.csv
T00005567,01/27/24,2024-01-27 07:40:47,S003,NA,Card,0,NA,1,gen_20251127_091606,transactions_header.csv
T00006649,05/09/24,2024-05-09 12:08:02,S007,C000773,Cash,41.29,0.0,1,gen_20251127_091606,transactions_header.csv
T00006960,09/06/24,2024-09-06 18:34:38,S012,C004706,Online,33.5,,2,gen_20251127_091606,transactions_header.csv
T00003596,2024-08-05,2024-08-05 20:43:26,S012,C002708,Card,55.51,0.0,3,gen_20251127_091606,transactions_header.csv
T00002550,2024-10-26,2024-10-26 13:18:50,S009,C004835,Card,27.88,2.79,1,gen_20251127_091605,transactions_header.csv
T00018061,12/26/24,2024-12-26 00:53:31,S007,C002446,Cash,8.27,1.24,1,gen_20251127_091607,transactions_header.csv
T00012533,08/29/24,2024-08-29 21:52:46,S004,C001763,Card,92.23,9.22,2,gen_20251127_091607,transactions_header.csv
T00013116,11/19/24,2024-11-19 03:38:49,S019,C001795,Cash,74.67,3.73,3,gen_20251127_091607,transactions_header.csv
T00015191,2024-05-14,2024-05-14 08:17:49,S016,C001923,Card,63.13,3.16,2,gen_20251127_091607,transactions_header.csv
T00003795,2024-04-21,2024-04-21 12:10:53,S006,C004044,Card,41.48,2.07,1,gen_20251127_091606,transactions_header.csv
T00017698,2024-01-16,2024-01-16 03:01:11,S027,C004243,Online,59.2,0.0,1,gen_20251127_091607,transactions_header.csv
T00016373,09/02/24,2024-09-02 21:10:48,S023,C003114,Online,87.62,13.14,7,gen_20251127_091607,transactions_header.csv
T00014769,2024-06-17,2024-06-17 06:58:57,S028,C002815,Online,62.76,6.28,1,gen_20251127_091607,transactions_header.csv
T00003078,08/02/24,2024-08-02 22:15:54,S004,C003837,Cash,44.21,6.63,1,gen_20251127_091606,transactions_header.csv
T00005749,2024-03-26,2024-03-26 11:40:21,S006,NA,Online,69.12,3.46,6,gen_20251127_091606,transactions_header.csv
T00019625,2024-01-03,2024-01-03 19:05:28,S027,C002141,Card,10.05,1.01,3,gen_20251127_091607,transactions_header.csv
T00004451,01/19/24,2024-01-19 11:47:22,S006,C003117,Cash,8.37,0.84,2,gen_20251127_091606,transactions_header.csv
T00000602,08/18/24,2024-08-18 15:32:45,S016,C000924,Online,31.17,1.56,5,gen_20251127_091605,transactions_header.csv
T00017865,2024-08-10,2024-08-10 19:01:17,S013,C003478,Cash,$16.61,0.0,1,gen_20251127_091607,transactions_header.csv
T00002755,2024-10-14,2024-10-14 18:33:32,S027,C002067,Online,105.86,10.59,1,gen_20251127_091605,transactions_header.csv
T00007785,2024-06-19,2024-06-19 16:24:16,S007,C001797,Online,$76.39,0.0,1,gen_20251127_091606,transactions_header.csv
T00009073,2024-02-29,2024-02-29 04:38:21,S017,C001762,Card,81.22,0.0,3,gen_20251127_091606,transactions_header.csv
T00010908,12/15/24,2024-12-15 09:24:58,S007,C000326,Card,8.89,1.33,1,gen_20251127_091606,transactions_header.csv
T00018690,2024-03-22,2024-03-22 03:11:25,S005,C001904,Card,35.88,,1,gen_20251127_091607,transactions_header.csv
T00004008,2024-05-12,2024-05-12 04:01:36,S014,C004593,Online,50.27,7.54,2,gen_20251127_091606,transactions_header.csv
T00002168,2024-04-16,2024-04-16 11:25:00,S019,C002054,Card,89.01,8.9,3,gen_20251127_091605,transactions_header.csv
T00002704,08/17/24,2024-08-17 17:48:44,S015,C001966,Cash,116.99,17.55,1,gen_20251127_091605,transactions_header.csv
T00013105,2024-07-18,2024-07-18 00:19:16,S019,C000704,Card,93.89,9.39,1,gen_20251127_091607,transactions_header.csv
T00018010,2024-02-08,2024-02-08 06:39:38,S008,C004432,Card,$60.64,0.0,1,gen_20251127_091607,transactions_header.csv
T00009681,12/19/24,2024-12-19 21:29:54,S015,C004999,Cash,69.72,,1,gen_20251127_091606,transactions_header.csv
T00005349,12/29/24,2024-12-29 06:55:59,S006,C003787,Card,88.98,4.45,1,gen_20251127_091606,transactions_header.csv
T00016359,09/16/24,2024-09-16 16:37:33,S010,C003166,Cash,62.35,3.12,3,gen_20251127_091607,transactions_header.csv
T00012104,2024-10-29,2024-10-29 09:08:58,S002,C002184,Online,80.16,NA,3,gen_20251127_091607,transactions_header.csv
T00012327,09/10/24,2024-09-10 06:10:03,S017,C003947,Card,110.42,5.52,2,gen_20251127_091607,transactions_header.csv
T00012903,08/20/24,2024-08-20 16:14:47,S009,C000848,Online,31.9,4.78,2,gen_20251127_091607,transactions_header.csv
T00002546,2024-01-06,2024-01-06 02:34:29,S001,C000916,card,78.43,11.76,1,gen_20251127_091605,transactions_header.csv
T00000742,2024-04-17,2024-04-17 01:22:36,S030,C001430,Card,0,0.0,5,gen_20251127_091605,transactions_header.csv
T00000412,2024-04-06,2024-04-06 21:13:27,S017,C000180,Card,$5.15,0.52,1,gen_20251127_091605,transactions_header.csv
T00018499,09/01/24,2024-09-01 01:13:42,S021,C004636,cash,44.99,2.25,2,gen_20251127_091607,transactions_header.csv
T00016863,2024-05-28,2024-05-28 00:48:00,S018,C002689,Cash,78.83,11.82,1,gen_20251127_091607,transactions_header.csv
T00017089,05/16/24,2024-05-16 00:44:43,S002,C000365,Online,35.04,3.5,1,gen_20251127_091607,transactions_header.csv
T00019809,2024-12-24,2024-12-24 18:41:27,S001,C004269,Online,75.02,7.5,5,gen_20251127_091607,transactions_header.csv
T00009531,2024-02-25,2024-02-25 02:06:46,S008,C000143,Card,39.79,0.0,2,gen_20251127_091606,transactions_header.csv
T00012656,2024-07-20,2024-07-20 20:20:41,S021,C002596,Cash,26.36,1.32,2,gen_20251127_091607,transactions_header.csv
T00010326,10/10/24,2024-10-10 18:35:33,S020,C003603,Online,10.1,0.0,3,gen_20251127_091606,transactions_header.csv
T00003376,2024-12-29,2024-12-29 05:55:03,S017,C002699,Online,42.65,4.26,1,gen_20251127_091606,transactions_header.csv
T00003490,11/20/24,2024-11-20 04:11:29,S030,NA,Online,-5.45,0.55,1,gen_20251127_091606,transactions_header.csv
T00002076,2024-11-27,2024-11-27 16:32:48,S011,C002793,Online,46.79,NA,1,gen_20251127_091605,transactions_header.csv
T00014712,09/16/24,2024-09-16 10:15:45,S018,C003890,Online,45.61,4.56,1,gen_20251127_091607,transactions_header.csv
T00005021,2024-02-24,2024-02-24 15:33:47,S016,C001905,Cash,$55.11,0.0,4,gen_20251127_091606,transactions_header.csv
T00018987,2024-10-01,2024-10-01 05:17:22,S024,C001099,Card,22.84,2.28,2,gen_20251127_091607,transactions_header.csv
T00008375,2024-11-23,2024-11-23 14:43:46,S022,,Cash,74.58,0.0,1,gen_20251127_091606,transactions_header.csv
T00010372,09/30/24,2024-09-30 04:17:34,S023,C001956,Cash,79.43,0.0,2,gen_20251127_091606,transactions_header.csv
T00013239,05/04/24,2024-05-04 02:42:27,S004,C002090,Card,24.96,2.5,1,gen_20251127_091607,transactions_header.csv
T00004681,2024-06-05,2024-06-05 22:43:16,S023,C001441,Online,69.37,0.0,3,gen_20251127_091606,transactions_header.csv
T00013288,11/24/24,2024-11-24 05:45:27,S011,C000602,cash,62.71,9.41,7,gen_20251127_091607,transactions_header.csv
T00010712,2024-03-19,2024-03-19 20:44:43,S013,,Cash,12.05,0.6,1,gen_20251127_091606,transactions_header.csv
T00000287,2024-04-17,2024-04-17 00:22:50,S004,C000530,Cash,46.33,6.95,1,gen_20251127_091605,transactions_header.csv
T00001324,2024-05-31,2024-05-31 05:41:19,S001,,Card,63.29,6.33,1,gen_20251127_091605,transactions_header.csv
T00008622,08/18/24,2024-08-18 07:49:48,S007,C004880,Cash,$66.62,3.33,7,gen_20251127_091606,transactions_header.csv
T00011359,04/29/24,2024-04-29 06:51:28,S029,C003782,Cash,22.49,,2,gen_20251127_091606,transactions_header.csv
T00005884,2024-05-14,2024-05-14 17:23:25,S017,C003273,Online,61.13,NA,3,gen_20251127_091606,transactions_header.csv
T00011207,02/20/24,2024-02-20 05:34:24,S007,C002705,Card,41.33,NA,3,gen_20251127_091606,transactions_header.csv
T00000073,2024-02-21,2024-02-21 12:38:58,S007,,Card,28.57,1.43,1,gen_20251127_091605,transactions_header.csv
T00015721,2024-09-10,2024-09-10 22:24:22,S027,C001480,Online,$51.37,7.71,1,gen_20251127_091607,transactions_header.csv
T00000411,2024-04-01,2024-04-01 22:09:43,S021,C004866,Online,6.62,0.0,7,gen_20251127_091605,transactions_header.csv
T00010724,2024-09-21,2024-09-21 08:03:50,S010,C004060,Card,$75.01,0.0,4,gen_20251127_091606,transactions_header.csv
T00019226,2024-06-12,2024-06-12 05:58:44,S024,C003294,Card,112.63,,3,gen_20251127_091607,transactions_header.csv
T00010677,04/23/24,2024-04-23 00:34:34,S015,,Card,38.53,1.93,2,gen_20251127_091606,transactions_header.csv
T00017202,03/04/24,2024-03-04 05:05:41,S008,,Online,64.19,0.0,1,gen_20251127_091607,transactions_header.csv
T00005733,12/17/24,2024-12-17 17:44:14,S006,NA,Card,$61.99,6.2,1,gen_20251127_091606,transactions_header.csv
T00015117,2024-09-16,2024-09-16 12:36:27,S025,C000727,Online,66.07,0.0,1,gen_20251127_091607,transactions_header.csv
T00010664,08/29/24,2024-08-29 03:38:46,S028,C003200,Online,26.51,2.65,1,gen_20251127_091606,transactions_header.csv
T00002523,03/15/24,2024-03-15 23:29:58,S024,C001689,Online,83.74,NA,1,gen_20251127_091605,transactions_header.csv
T00003530,04/17/24,2024-04-17 10:52:55,S003,C004740,Cash,48.1,2.41,1,gen_20251127_091606,transactions_header.csv
T00019049,2024-05-25,2024-05-25 06:41:02,S007,C003520,Online,52.59,5.26,2,gen_20251127_091607,transactions_header.csv
T00005549,07/29/24,2024-07-29 10:53:07,S026,C004733,Online,14.26,2.14,2,gen_20251127_091606,transactions_header.csv
T00008843,2024-03-07,2024-03-07 10:54:59,S007,C003948,Card,50.23,7.53,1,gen_20251127_091606,transactions_header.csv
T00009694,2024-08-17,2024-08-17 11:03:15,S008,C000382,Online,71.45,10.72,1,gen_20251127_091606,transactions_header.csv
T00011574,02/22/24,2024-02-22 23:37:37,S030,C001937,Cash,52.73,NA,1,gen_20251127_091606,transactions_header.csv
T00007517,2024-05-12,2024-05-12 00:21:30,S007,C004660,Online,9.95,0.5,2,gen_20251127_091606,transactions_header.csv
T00006096,03/12/24,2024-03-12 01:28:31,S010,C001218,Online,32.18,,2,gen_20251127_091606,transactions_header.csv
T00019178,2024-12-27,2024-12-27 20:20:37,S010,C004663,Online,27.47,1.37,1,gen_20251127_091607,transactions_header.csv
T00006533,07/11/24,2024-07-11 14:10:19,S001,C001679,Card,38.96,0.0,2,gen_20251127_091606,transactions_header.csv
T00018203,2024-04-03,2024-04-03 10:58:06,S003,NA,Card,47.78,2.39,2,gen_20251127_091607,transactions_header.csv
T00007153,2024-03-28,2024-03-28 03:12:28,S025,C002969,Cash,76.39,7.64,1,gen_20251127_091606,transactions_header.csv
T00006374,11/24/24,2024-11-24 21:34:38,S030,C002347,Cash,28.05,0.0,1,gen_20251127_091606,transactions_header.csv
T00002299,04/27/24,2024-04-27 17:45:25,S030,,Online,63.05,9.46,3,gen_20251127_091605,transactions_header.csv
T00007477,01/01/24,2024-01-01 09:26:41,S014,C000564,Card,95.13,9.51,2,gen_20251127_091606,transactions_header.csv
T00012148,02/07/24,2024-02-07 07:32:03,S023,C000617,Cash,76.98,,1,gen_20251127_091607,transactions_header.csv
T00018096,2024-07-26,2024-07-26 08:20:09,S003,NA,Online,25.05,1.25,1,gen_20251127_091607,transactions_header.csv
T00018410,03/24/24,2024-03-24 23:27:00,S022,C000317,Card,112.57,0.0,1,gen_20251127_091607,transactions_header.csv
T00010824,2024-04-06,2024-04-06 17:04:19,S025,C003697,Online,75.58,3.78,1,gen_20251127_091606,transactions_header.csv
T00002798,2024-10-14,2024-10-14 02:47:59,S027,C001401,Card,62.78,6.28,1,gen_20251127_091605,transactions_header.csv
T00012563,11/04/24,2024-11-04 05:05:39,S001,C001350,Online,0,0.0,4,gen_20251127_091607,transactions_header.csv
T00016849,2024-12-30,2024-12-30 05:07:54,S028,NA,Cash,$9.65,0.97,1,gen_20251127_091607,transactions_header.csv
T00002969,2024-02-09,2024-02-09 13:13:09,S005,C001401,Online,87.18,0.0,2,gen_20251127_091606,transactions_header.csv
T00001072,10/20/24,2024-10-20 16:46:39,S017,NA,Card,0,0.0,2,gen_20251127_091605,transactions_header.csv
T00019576,2024-10-17,2024-10-17 18:01:38,S025,NA,Cash,36.98,5.55,1,gen_20251127_091607,transactions_header.csv
T00017931,2024-12-06,2024-12-06 21:59:07,S017,C001975,Cash,50.73,2.54,1,gen_20251127_091607,transactions_header.csv
T00011809,2024-08-23,2024-08-23 22:59:24,S013,C000341,Cash,14.76,2.21,2,gen_20251127_091607,transactions_header.csv
T00018937,03/31/24,2024-03-31 17:39:59,S008,C001491,cash,23.77,0.0,6,gen_20251127_091607,transactions_header.csv
T00015742,2024-11-23,2024-11-23 18:15:59,S022,C004260,Online,97.7,4.89,4,gen_20251127_091607,transactions_header.csv
T00013838,01/31/24,2024-01-31 05:55:37,S007,C000511,Card,86.81,4.34,1,gen_20251127_091607,transactions_header.csv
T00012322,02/17/24,2024-02-17 06:05:52,S004,C001770,Online,43.72,6.56,1,gen_20251127_091607,transactions_header.csv
T00004951,2024-01-04,2024-01-04 06:37:17,S026,,Cash,50.49,7.57,2,gen_20251127_091606,transactions_header.csv
T00019360,02/15/24,2024-02-15 22:54:16,S019,C001046,Card,68.16,0.0,6,gen_20251127_091607,transactions_header.csv
T00009579,2024-10-15,2024-10-15 09:43:43,S018,C000051,Cash,72.6,3.63,1,gen_20251127_091606,transactions_header.csv
T00003949,2024-03-28,2024-03-28 11:40:45,S011,C003033,Online,57.84,5.78,2,gen_20251127_091606,transactions_header.csv
T00003935,2024-05-02,2024-05-02 06:34:34,S021,C001788,Cash,33.19,1.66,1,gen_20251127_091606,transactions_header.csv
T00004630,09/02/24,2024-09-02 16:14:10,S005,C004581,Card,86.0,4.3,1,gen_20251127_091606,transactions_header.csv
T00007656,2024-01-06,2024-01-06 02:27:17,S006,C000902,Card,51.8,2.59,2,gen_20251127_091606,transactions_header.csv
T00018381,2024-08-25,2024-08-25 05:28:56,S004,C001034,Online,48.4,0.0,3,gen_20251127_091607,transactions_header.csv
T00012860,04/10/24,2024-04-10 15:26:30,S015,C002318,Cash,42.4,4.24,1,gen_20251127_091607,transactions_header.csv
T00006537,03/22/24,2024-03-22 04:03:31,S015,C003132,Cash,110.67,5.53,1,gen_20251127_091606,transactions_header.csv
T00016118,2024-11-02,2024-11-02 05:24:56,S027,C000008,Online,112.28,16.84,1,gen_20251127_091607,transactions_header.csv
T00002678,08/10/24,2024-08-10 16:05:36,S028,C001086,Online,67.25,3.36,1,gen_20251127_091605,transactions_header.csv
T00016689,01/18/24,2024-01-18 08:06:27,S021,,online,21.06,2.11,1,gen_20251127_091607,transactions_header.csv
T00011762,2024-06-23,2024-06-23 21:05:01,S011,C001754,Card,52.4,5.24,1,gen_20251127_091607,transactions_header.csv
T00016777,2024-07-26,2024-07-26 09:46:29,S005,C002817,Card,53.58,5.36,1,gen_20251127_091607,transactions_header.csv
T00013925,2024-08-29,2024-08-29 13:39:33,S021,C000632,Card,56.61,5.66,1,gen_20251127_091607,transactions_header.csv
T00001732,2024-12-25,2024-12-25 21:59:54,S013,C001725,Online,17.21,0.86,7,gen_20251127_091605,transactions_header.csv
T00012063,2024-11-23,2024-11-23 00:17:46,S010,C003090,Cash,81.7,0.0,1,gen_20251127_091607,transactions_header.csv
T00004897,2024-05-23,2024-05-23 18:48:51,S018,C001978,Card,12.81,0.0,1,gen_20251127_091606,transactions_header.csv
T00000698,2024-09-05,2024-09-05 04:59:35,S006,,Online,93.16,NA,4,gen_20251127_091605,transactions_header.csv
T00001006,12/09/24,2024-12-09 22:45:55,S018,C004545,Online,56.79,,1,gen_20251127_091605,transactions_header.csv
T00011736,2024-12-01,2024-12-01 12:13:23,S021,C000128,Cash,$54.36,0.0,3,gen_20251127_091607,transactions_header.csv
T00013776,11/13/24,2024-11-13 15:06:12,S021,C000322,Cash,52.06,2.6,2,gen_20251127_091607,transactions_header.csv
T00010990,2024-01-06,2024-01-06 09:34:58,S007,C001038,Card,53.9,,1,gen_20251127_091606,transactions_header.csv
T00013755,2024-09-20,2024-09-20 15:10:20,S003,NA,Online,68.19,10.23,2,gen_20251127_091607,transactions_header.csv
T00004700,05/11/24,2024-05-11 05:54:11,S016,C001899,Card,37.72,3.77,2,gen_20251127_091606,transactions_header.csv
T00005503,2024-02-07,2024-02-07 01:38:57,S023,C000854,Online,59.5,8.92,3,gen_20251127_091606,transactions_header.csv
T00012706,2024-03-26,2024-03-26 07:48:16,S010,NA,Online,23.54,2.35,3,gen_20251127_091607,transactions_header.csv
T00016005,2024-11-22,2024-11-22 09:19:29,S029,C003661,Card,132.58,NA,2,gen_20251127_091607,transactions_header.csv
T00001030,2024-02-13,2024-02-13 20:14:26,S004,C003084,Online,$72.43,3.62,4,gen_20251127_091605,transactions_header.csv
T00010237,2024-08-31,2024-08-31 16:18:03,S011,C002115,Card,19.64,0.0,1,gen_20251127_091606,transactions_header.csv
T00012572,2024-01-15,2024-01-15 18:01:40,S018,C002753,Card,$36.81,0.0,1,gen_20251127_091607,transactions_header.csv
T00013187,04/25/24,2024-04-25 16:59:29,S014,C002543,Cash,4.86,0.0,1,gen_20251127_091607,transactions_header.csv
T00006880,01/07/24,2024-01-07 10:34:36,S021,C000448,Cash,40.16,4.02,1,gen_20251127_091606,transactions_header.csv
T00009394,01/13/24,2024-01-13 11:00:48,S005,C002781,Card,104.79,,8,gen_20251127_091606,transactions_header.csv
T00016366,10/11/24,2024-10-11 18:00:06,S023,C003004,Cash,$63.02,6.3,1,gen_20251127_091607,transactions_header.csv
T00016095,2024-05-28,2024-05-28 19:00:32,S030,C001868,Cash,49.48,4.95,1,gen_20251127_091607,transactions_header.csv
T00005223,2024-09-18,2024-09-18 00:19:24,S013,C004746,cash,12.64,0.63,1,gen_20251127_091606,transactions_header.csv
T00004418,2024-09-23,2024-09-23 03:39:44,S024,C002104,cash,$14.39,1.44,1,gen_20251127_091606,transactions_header.csv
T00008938,2024-02-05,2024-02-05 04:53:34,S006,C000307,Online,46.64,2.33,1,gen_20251127_091606,transactions_header.csv
T00007717,10/23/24,2024-10-23 17:27:30,S023,,Online,58.84,0.0,6,gen_20251127_091606,transactions_header.csv
T00005377,2024-12-23,2024-12-23 03:28:44,S008,C001127,Cash,23.54,,5,gen_20251127_091606,transactions_header.csv
T00018711,2024-05-07,2024-05-07 09:04:14,S002,C003565,Card,69.99,0.0,6,gen_20251127_091607,transactions_header.csv
T00015858,2024-01-13,2024-01-13 05:01:47,S025,C002478,Card,9.05,0.0,4,gen_20251127_091607,transactions_header.csv
T00002102,09/25/24,2024-09-25 04:44:13,S012,C004454,Cash,$22.55,0.0,3,gen_20251127_091605,transactions_header.csv
T00012599,2024-11-09,2024-11-09 00:00:05,S012,C000024,Cash,59.08,,1,gen_20251127_091607,transactions_header.csv
T00000102,12/03/24,2024-12-03 02:37:52,S005,C004788,Online,11.77,0.59,7,gen_20251127_091605,transactions_header.csv
T00011074,2024-09-01,2024-09-01 11:00:17,S004,C001677,Cash,15.21,1.52,1,gen_20251127_091606,transactions_header.csv
T00005512,2024-02-23,2024-02-23 20:25:15,S008,C004407,Online,41.72,0.0,2,gen_20251127_091606,transactions_header.csv
T00012559,2024-03-15,2024-03-15 22:33:27,S026,C002026,Cash,145.57,14.56,7,gen_20251127_091607,transactions_header.csv
T00010886,2024-12-24,2024-12-24 05:03:32,S022,C002133,Cash,56.22,8.43,1,gen_20251127_091606,transactions_header.csv
T00017395,2024-08-19,2024-08-19 04:43:20,S026,C002646,Cash,31.64,4.75,2,gen_20251127_091607,transactions_header.csv
T00003106,12/26/24,2024-12-26 04:34:01,S012,C001031,Card,0.49,0.07,1,gen_20251127_091606,transactions_header.csv
T00007802,11/25/24,2024-11-25 17:30:29,S025,C001550,Card,26.7,1.33,1,gen_20251127_091606,transactions_header.csv
T00006443,2024-10-03,2024-10-03 00:51:16,S026,C004258,Card,$57.10,8.56,2,gen_20251127_091606,transactions_header.csv
T00007733,06/24/24,2024-06-24 12:12:10,S018,C002589,Online,45.77,4.58,2,gen_20251127_091606,transactions_header.csv
T00000397,08/25/24,2024-08-25 07:45:05,S026,C002897,Online,28.01,1.4,4,gen_20251127_091605,transactions_header.csv
T00001665,07/18/24,2024-07-18 15:16:17,S009,C002564,Online,32.75,NA,2,gen_20251127_091605,transactions_header.csv
T00004725,2024-07-20,2024-07-20 06:34:17,S022,C003307,Cash,23.44,1.17,1,gen_20251127_091606,transactions_header.csv
T00004047,2024-11-27,2024-11-27 06:06:46,S018,C004235,Online,25.12,NA,4,gen_20251127_091606,transactions_header.csv
T00001477,09/17/24,2024-09-17 12:44:17,S015,C000645,Cash,59.53,2.98,4,gen_20251127_091605,transactions_header.csv
T00010514,2024-12-23,2024-12-23 21:02:40,S024,C000709,Card,21.6,2.16,1,gen_20251127_091606,transactions_header.csv
T00016004,10/08/24,2024-10-08 02:53:44,S005,C000115,Card,23.71,1.19,7,gen_20251127_091607,transactions_header.csv
T00017107,2024-08-13,2024-08-13 11:46:36,S003,C002134,Online,89.18,0.0,2,gen_20251127_091607,transactions_header.csv
T00000636,2024-02-15,2024-02-15 23:06:37,S015,,Cash,81.04,4.05,4,gen_20251127_091605,transactions_header.csv
T00000818,2024-05-27,2024-05-27 04:46:03,S013,C001425,Card,44.85,0.0,1,gen_20251127_091605,transactions_header.csv
T00005515,05/02/24,2024-05-02 22:48:06,S019,C004664,Card,30.44,0.0,1,gen_20251127_091606,transactions_header.csv
T00015568,12/27/24,2024-12-27 10:58:24,S006,C000945,Online,21.16,3.17,1,gen_20251127_091607,transactions_header.csv
T00003911,2024-11-28,2024-11-28 10:24:53,S007,NA,Online,26.48,2.65,1,gen_20251127_091606,transactions_header.csv
T00019475,2024-06-22,2024-06-22 19:16:57,S004,,Cash,73.03,7.3,1,gen_20251127_091607,transactions_header.csv
T00008345,02/07/24,2024-02-07 07:40:21,S011,C002491,Card,36.55,0.0,1,gen_20251127_091606,transactions_header.csv
T00008408,03/23/24,2024-03-23 10:51:37,S027,C000504,Card,18.89,1.89,2,gen_20251127_091606,transactions_header.csv
T00004203,03/21/24,2024-03-21 08:22:58,S029,C001536,Online,102.83,0.0,7,gen_20251127_091606,transactions_header.csv
T00000708,01/14/24,2024-01-14 15:13:39,S027,C002191,Card,22.39,1.12,1,gen_20251127_091605,transactions_header.csv
T00001687,05/06/24,2024-05-06 04:09:37,S017,NA,Cash,$49.36,7.4,2,gen_20251127_091605,transactions_header.csv
T00006416,2024-06-18,2024-06-18 18:34:35,S030,C004924,Card,94.25,4.71,1,gen_20251127_091606,transactions_header.csv
T00018750,10/01/24,2024-10-01 09:45:34,S020,C003800,Card,37.42,5.61,5,gen_20251127_091607,transactions_header.csv
T00004623,2024-02-02,2024-02-02 06:11:06,S007,C001827,Online,15.39,0.0,3,gen_20251127_091606,transactions_header.csv
T00000725,2024-09-21,2024-09-21 16:55:23,S030,C000249,Online,100.74,0.0,3,gen_20251127_091605,transactions_header.csv
T00004601,2024-09-27,2024-09-27 22:33:06,S021,,Cash,21.41,3.21,2,gen_20251127_091606,transactions_header.csv
T00017447,03/04/24,2024-03-04 12:55:26,S030,C004779,Cash,54.45,0.0,2,gen_20251127_091607,transactions_header.csv
T00000837,2024-12-22,2024-12-22 07:22:41,S030,C004580,Card,80.47,0.0,2,gen_20251127_091605,transactions_header.csv
T00008095,2024-08-24,2024-08-24 11:49:27,S018,C003424,Card,110.13,16.52,1,gen_20251127_091606,transactions_header.csv
T00012760,10/29/24,2024-10-29 14:29:10,S002,C003800,Online,33.1,0.0,3,gen_20251127_091607,transactions_header.csv
T00005690,2024-10-11,2024-10-11 17:41:58,S017,C000868,Online,77.61,7.76,1,gen_20251127_091606,transactions_header.csv
T00012737,12/06/24,2024-12-06 20:04:24,S021,C000612,Cash,50.29,2.51,1,gen_20251127_091607,transactions_header.csv
T00013437,04/01/24,2024-04-01 09:02:04,S003,,Card,$48.69,7.3,3,gen_20251127_091607,transactions_header.csv
T00015669,2024-12-15,2024-12-15 17:20:31,S013,C002951,Online,86.28,12.94,1,gen_20251127_091607,transactions_header.csv
T00015542,2024-08-04,2024-08-04 12:47:33,S011,C004125,Online,25.92,2.59,1,gen_20251127_091607,transactions_header.csv
T00013807,2024-05-01,2024-05-01 15:34:40,S016,C001589,Cash,94.77,14.22,3,gen_20251127_091607,transactions_header.csv
T00018706,03/29/24,2024-03-29 16:12:39,S029,C002725,online,52.18,7.83,5,gen_20251127_091607,transactions_header.csv
T00013361,2024-06-04,2024-06-04 00:48:09,S014,C004750,Card,37.49,5.62,1,gen_20251127_091607,transactions_header.csv
T00011921,2024-01-31,2024-01-31 05:18:45,S021,C002046,Cash,55.1,8.27,1,gen_20251127_091607,transactions_header.csv
T00003520,10/25/24,2024-10-25 00:11:05,S024,NA,Online,46.48,4.65,1,gen_20251127_091606,transactions_header.csv
T00013570,03/09/24,2024-03-09 01:56:11,S002,C004906,Cash,27.02,0.0,1,gen_20251127_091607,transactions_header.csv
T00001159,02/17/24,2024-02-17 01:30:27,S022,C001652,Online,73.23,3.66,1,gen_20251127_091605,transactions_header.csv
T00007126,2024-08-03,2024-08-03 17:13:41,S028,,Cash,41.45,0.0,4,gen_20251127_091606,transactions_header.csv
T00009900,2024-12-22,2024-12-22 04:12:38,S002,C002937,Online,$16.53,0.83,1,gen_20251127_091606,transactions_header.csv
T00003126,2024-07-23,2024-07-23 11:54:04,S027,C001293,Card,51.73,2.59,7,gen_20251127_091606,transactions_header.csv
T00018157,2024-12-26,2024-12-26 07:31:40,S005,C003843,Cash,63.37,0.0,1,gen_20251127_091607,transactions_header.csv
T00004326,05/07/24,2024-05-07 13:56:38,S023,C003881,Card,8.88,0.89,1,gen_20251127_091606,transactions_header.csv
T00000124,2024-11-30,2024-11-30 01:36:15,S008,C004350,Online,0,0.0,1,gen_20251127_091605,transactions_header.csv
T00001248,2024-08-22,2024-08-22 20:05:45,S016,C002381,Card,62.62,NA,1,gen_20251127_091605,transactions_header.csv
T00000821,01/10/24,2024-01-10 21:02:13,S028,C000441,Card,66.32,0.0,1,gen_20251127_091605,transactions_header.csv
T00013890,2024-06-03,2024-06-03 18:32:16,S020,C004721,Card,50.7,0.0,1,gen_20251127_091607,transactions_header.csv
T00006761,2024-01-16,2024-01-16 06:38:47,S004,C003641,Cash,56.12,,1,gen_20251127_091606,transactions_header.csv
T00006473,2024-03-18,2024-03-18 06:07:12,S012,C001281,Online,85.44,12.82,1,gen_20251127_091606,transactions_header.csv
T00015475,03/12/24,2024-03-12 22:29:44,S002,,Cash,$2.28,0.11,2,gen_20251127_091607,transactions_header.csv
T00005955,2024-06-30,2024-06-30 23:39:34,S024,C003197,Cash,89.66,4.48,1,gen_20251127_091606,transactions_header.csv
T00012070,2024-05-13,2024-05-13 03:54:40,S021,C004256,Online,75.45,0.0,5,gen_20251127_091607,transactions_header.csv
T00019403,2024-12-03,2024-12-03 18:59:32,S008,C003202,Card,69.63,0.0,1,gen_20251127_091607,transactions_header.csv
T00017240,2024-04-06,2024-04-06 20:54:42,S009,C002531,Card,8.73,0.87,2,gen_20251127_091607,transactions_header.csv
T00014047,01/27/24,2024-01-27 02:17:24,S013,C002615,Cash,11.3,0.0,1,gen_20251127_091607,transactions_header.csv
T00009163,2024-07-16,2024-07-16 18:17:04,S020,C001788,Cash,77.69,3.88,3,gen_20251127_091606,transactions_header.csv
T00008878,2024-12-03,2024-12-03 14:34:38,S008,C001231,Cash,33.38,NA,3,gen_20251127_091606,transactions_header.csv
T00002331,2024-11-20,2024-11-20 23:25:21,S013,C000389,Online,42.81,,5,gen_20251127_091605,transactions_header.csv
T00014986,2024-08-18,2024-08-18 16:54:30,S018,C002133,Card,69.05,0.0,3,gen_20251127_091607,transactions_header.csv
T00008666,2024-09-25,2024-09-25 06:03:00,S013,C004713,Cash,56.78,8.52,1,gen_20251127_091606,transactions_header.csv
T00007584,03/10/24,2024-03-10 12:04:54,S019,C003294,Card,76.76,0.0,1,gen_20251127_091606,transactions_header.csv
T00008526,05/08/24,2024-05-08 17:46:05,S012,C002336,Cash,65.79,9.87,1,gen_20251127_091606,transactions_header.csv
T00003389,07/07/24,2024-07-07 15:00:51,S005,C001304,Online,52.79,7.92,8,gen_20251127_091606,transactions_header.csv
T00008608,2024-12-05,2024-12-05 16:31:45,S003,C001106,Cash,21.79,1.09,1,gen_20251127_091606,transactions_header.csv
T00004743,2024-05-23,2024-05-23 07:52:24,S007,C002588,Online,31.86,3.19,1,gen_20251127_091606,transactions_header.csv
T00006917,06/29/24,2024-06-29 23:44:53,S006,C000774,Card,84.03,0.0,4,gen_20251127_091606,transactions_header.csv
T00005269,03/01/24,2024-03-01 08:14:21,S011,C004691,Card,79.51,,1,gen_20251127_091606,transactions_header.csv
T00007318,2024-06-20,2024-06-20 19:09:19,S021,C001097,Cash,105.05,15.76,2,gen_20251127_091606,transactions_header.csv
T00000964,2024-03-11,2024-03-11 01:14:54,S024,C000100,Online,33.83,0.0,3,gen_20251127_091605,transactions_header.csv
T00017844,04/06/24,2024-04-06 14:09:42,S020,C000657,Online,55.31,0.0,1,gen_20251127_091607,transactions_header.csv
T00001960,2024-11-20,2024-11-20 11:45:29,S007,NA,Online,38.2,0.0,6,gen_20251127_091605,transactions_header.csv
T00013245,2024-09-22,2024-09-22 02:40:06,S016,C003855,Online,48.32,7.25,1,gen_20251127_091607,transactions_header.csv
T00008757,2024-06-27,2024-06-27 22:49:24,S023,C002327,Online,32.68,3.27,8,gen_20251127_091606,transactions_header.csv
T00004817,04/06/24,2024-04-06 02:20:08,S001,C002341,Cash,124.2,0.0,3,gen_20251127_091606,transactions_header.csv
T00010429,2024-12-11,2024-12-11 06:55:51,S022,C003502,Cash,61.73,0.0,1,gen_20251127_091606,transactions_header.csv
T00019326,2024-05-02,2024-05-02 03:24:40,S004,C001158,Card,51.62,,3,gen_20251127_091607,transactions_header.csv
T00018248,11/26/24,2024-11-26 18:28:11,S021,C001412,Online,80.9,8.09,1,gen_20251127_091607,transactions_header.csv
T00003475,04/10/24,2024-04-10 04:20:22,S001,C004815,Online,53.11,0.0,1,gen_20251127_091606,transactions_header.csv
T00018124,02/01/24,2024-02-01 22:47:54,S018,C004987,cash,57.13,2.86,3,gen_20251127_091607,transactions_header.csv
T00016541,01/15/24,2024-01-15 19:19:38,S021,C002535,Online,42.48,6.37,1,gen_20251127_091607,transactions_header.csv
T00000931,2024-05-22,2024-05-22 01:04:03,S027,C004253,Card,44.59,4.46,1,gen_20251127_091605,transactions_header.csv
T00003003,09/28/24,2024-09-28 21:11:19,S014,C001494,Cash,0,0.0,2,gen_20251127_091606,transactions_header.csv
T00018376,2024-03-11,2024-03-11 09:21:27,S029,C000772,Card,39.99,2.0,1,gen_20251127_091607,transactions_header.csv
T00003573,2024-01-21,2024-01-21 01:45:19,S009,C001840,Cash,54.55,0.0,1,gen_20251127_091606,transactions_header.csv
T00019967,06/18/24,2024-06-18 07:31:53,S001,C001524,Card,73.59,7.36,1,gen_20251127_091607,transactions_header.csv
T00006242,2024-03-25,2024-03-25 02:25:16,S003,C000145,Card,48.66,2.43,1,gen_20251127_091606,transactions_header.csv
T00002153,2024-04-05,2024-04-05 20:10:41,S005,C001914,Card,-41.17,6.18,3,gen_20251127_091605,transactions_header.csv
T00011766,2024-07-05,2024-07-05 19:38:01,S017,C002695,Card,30.78,0.0,7,gen_20251127_091607,transactions_header.csv
T00019009,2024-02-26,2024-02-26 11:44:16,S020,C001259,Online,83.65,NA,6,gen_20251127_091607,transactions_header.csv
T00000928,09/24/24,2024-09-24 01:05:03,S003,,Card,14.42,0.0,1,gen_20251127_091605,transactions_header.csv
T00019589,2024-09-29,2024-09-29 17:17:43,S021,C002473,Cash,57.36,5.74,1,gen_20251127_091607,transactions_header.csv
T00016604,2024-03-03,2024-03-03 14:25:47,S021,C002130,Cash,17.39,0.87,1,gen_20251127_091607,transactions_header.csv
T00010050,2024-03-25,2024-03-25 19:12:01,S027,C003748,Card,67.91,10.19,1,gen_20251127_091606,transactions_header.csv
T00007062,2024-04-05,2024-04-05 05:09:17,S026,,Online,68.97,0.0,2,gen_20251127_091606,transactions_header.csv
T00007672,04/29/24,2024-04-29 09:55:36,S026,,Card,60.74,3.04,1,gen_20251127_091606,transactions_header.csv
T00013313,04/09/24,2024-04-09 10:37:04,S001,C000740,Card,50.95,2.55,1,gen_20251127_091607,transactions_header.csv
T00016669,08/31/24,2024-08-31 19:41:44,S004,C001593,Card,64.49,,4,gen_20251127_091607,transactions_header.csv
T00016511,01/20/24,2024-01-20 05:39:07,S030,,Online,$21.17,3.18,3,gen_20251127_091607,transactions_header.csv
T00019126,2024-01-15,2024-01-15 07:11:26,S019,C000906,Online,87.59,0.0,3,gen_20251127_091607,transactions_header.csv
T00007154,2024-10-25,2024-10-25 08:14:52,S026,C004637,Card,90.91,0.0,1,gen_20251127_091606,transactions_header.csv
T00002911,08/02/24,2024-08-02 19:49:30,S005,C003359,Online,0,0,1,gen_20251127_091606,transactions_header.csv
T00018191,01/15/24,2024-01-15 12:21:41,S012,C000820,Card,85.63,0.0,6,gen_20251127_091607,transactions_header.csv
T00007673,2024-12-07,2024-12-07 03:54:22,S005,C004739,Cash,52.24,5.22,5,gen_20251127_091606,transactions_header.csv
T00015411,03/13/24,2024-03-13 15:52:03,S004,C000576,Card,17.27,0.0,3,gen_20251127_091607,transactions_header.csv
T00003669,11/18/24,2024-11-18 09:04:43,S023,C004637,Online,41.67,,1,gen_20251127_091606,transactions_header.csv
T00015682,09/12/24,2024-09-12 19:27:25,S007,NA,Online,67.67,6.77,2,gen_20251127_091607,transactions_header.csv
T00013590,12/16/24,2024-12-16 08:39:22,S020,,Cash,$75.98,3.8,3,gen_20251127_091607,transactions_header.csv
T00019112,2024-04-01,2024-04-01 10:16:36,S017,C003902,Online,49.38,7.41,1,gen_20251127_091607,transactions_header.csv
T00004029,05/15/24,2024-05-15 11:37:04,S022,C000667,Cash,75.78,7.58,4,gen_20251127_091606,transactions_header.csv
T00004789,2024-01-22,2024-01-22 12:07:42,S023,C001255,Card,23.98,2.4,1,gen_20251127_091606,transactions_header.csv
T00009000,10/27/24,2024-10-27 04:42:48,S003,C004169,Online,85.41,4.27,8,gen_20251127_091606,transactions_header.csv
T00008586,2024-01-15,2024-01-15 14:03:06,S016,C004711,Online,59.78,8.97,1,gen_20251127_091606,transactions_header.csv
T00008841,2024-07-04,2024-07-04 14:24:42,S014,C001646,Cash,25.68,0.0,1,gen_20251127_091606,transactions_header.csv
T00007403,07/15/24,2024-07-15 15:04:17,S029,C001254,Card,8.58,0.0,8,gen_20251127_091606,transactions_header.csv
T00009772,2024-11-20,2024-11-20 19:55:23,S025,C003793,Cash,23.11,0.0,1,gen_20251127_091606,transactions_header.csv
T00002806,03/28/24,2024-03-28 18:07:41,S011,C003349,Card,$69.81,0.0,2,gen_20251127_091605,transactions_header.csv
T00003278,03/23/24,2024-03-23 08:13:10,S004,C002966,Cash,62.55,6.25,2,gen_20251127_091606,transactions_header.csv
T00017247,2024-03-01,2024-03-01 09:29:26,S007,NA,cash,81.98,,2,gen_20251127_091607,transactions_header.csv
T00004974,2024-08-13,2024-08-13 14:24:58,S024,C000553,Cash,90.7,13.61,1,gen_20251127_091606,transactions_header.csv
T00008130,09/20/24,2024-09-20 07:24:04,S009,C004087,Cash,68.87,10.33,4,gen_20251127_091606,transactions_header.csv
T00004194,11/02/24,2024-11-02 15:16:05,S004,C004941,Online,44.34,2.22,2,gen_20251127_091606,transactions_header.csv
T00007947,2024-10-19,2024-10-19 01:40:45,S008,C003369,Online,0,0.0,2,gen_20251127_091606,transactions_header.csv
T00007459,11/07/24,2024-11-07 12:34:35,S027,C000446,Card,39.55,1.98,1,gen_20251127_091606,transactions_header.csv
T00008589,12/21/24,2024-12-21 00:33:45,S025,C004971,cash,50.53,5.05,2,gen_20251127_091606,transactions_header.csv
T00016041,2024-01-11,2024-01-11 07:31:50,S015,,card,46.19,2.31,1,gen_20251127_091607,transactions_header.csv
T00016456,2024-05-13,2024-05-13 17:37:49,S003,C004225,Cash,$0.00,0.0,1,gen_20251127_091607,transactions_header.csv
T00006696,10/06/24,2024-10-06 19:23:43,S019,C004071,Card,67.16,3.36,1,gen_20251127_091606,transactions_header.csv
T00018664,08/14/24,2024-08-14 13:41:28,S005,C003417,Cash,0,,1,gen_20251127_091607,transactions_header.csv
T00018333,2024-07-11,2024-07-11 13:31:04,S001,C004791,Online,42.03,4.2,2,gen_20251127_091607,transactions_header.csv
T00007192,01/21/24,2024-01-21 21:04:14,S025,C003024,Cash,63.47,3.17,1,gen_20251127_091606,transactions_header.csv
T00004689,2024-08-19,2024-08-19 18:20:31,S022,C003256,Online,32.96,3.3,1,gen_20251127_091606,transactions_header.csv
T00007229,09/12/24,2024-09-12 21:51:14,S009,C004202,Cash,81.25,4.06,2,gen_20251127_091606,transactions_header.csv
T00014185,2024-07-21,2024-07-21 09:01:06,S017,C002138,Online,0,,1,gen_20251127_091607,transactions_header.csv
T00013135,2024-07-08,2024-07-08 22:19:38,S009,C001798,online,79.0,7.9,2,gen_20251127_091607,transactions_header.csv
T00015269,2024-01-05,2024-01-05 05:48:55,S027,C003548,Online,23.35,,1,gen_20251127_091607,transactions_header.csv
T00004437,12/15/24,2024-12-15 13:28:49,S020,C002920,Card,61.22,NA,1,gen_20251127_091606,transactions_header.csv
T00017730,2024-09-07,2024-09-07 21:14:50,S022,C004073,Card,16.27,2.44,1,gen_20251127_091607,transactions_header.csv
T00019558,2024-08-27,2024-08-27 21:46:40,S001,C002193,Card,49.75,0.0,4,gen_20251127_091607,transactions_header.csv
T00015122,2024-05-02,2024-05-02 21:17:51,S018,C003058,Online,39.56,NA,1,gen_20251127_091607,transactions_header.csv
T00014131,2024-01-23,2024-01-23 07:15:15,S009,C000991,Online,48.49,0.0,1,gen_20251127_091607,transactions_header.csv
T00014947,2024-04-20,2024-04-20 21:19:36,S016,NA,Online,5.02,0.5,4,gen_20251127_091607,transactions_header.csv
T00010736,08/04/24,2024-08-04 19:04:39,S006,C003602,Cash,14.56,1.46,2,gen_20251127_091606,transactions_header.csv
T00007915,2024-02-14,2024-02-14 11:12:14,S006,C003017,Online,66.35,3.32,2,gen_20251127_091606,transactions_header.csv
T00016216,01/04/24,2024-01-04 03:20:30,S029,C001541,Cash,-47.07,7.06,1,gen_20251127_091607,transactions_header.csv
T00018292,11/24/24,2024-11-24 16:49:41,S014,C000853,Online,18.73,1.87,2,gen_20251127_091607,transactions_header.csv
T00014790,10/02/24,2024-10-02 06:33:25,S004,C003064,Online,50.54,2.53,1,gen_20251127_091607,transactions_header.csv
T00019502,04/10/24,2024-04-10 22:52:42,S004,C004340,Card,38.01,3.8,4,gen_20251127_091607,transactions_header.csv
T00003942,04/17/24,2024-04-17 00:30:50,S002,C002185,Card,95.76,4.79,4,gen_20251127_091606,transactions_header.csv
T00013815,09/12/24,2024-09-12 18:39:51,S025,,Cash,60.91,9.14,8,gen_20251127_091607,transactions_header.csv
T00012365,2024-09-10,2024-09-10 17:51:55,S017,C004802,Online,3.24,0.32,2,gen_20251127_091607,transactions_header.csv
T00010710,2024-09-15,2024-09-15 16:17:11,S009,,Online,65.24,3.26,1,gen_20251127_091606,transactions_header.csv
T00012463,2024-10-07,2024-10-07 04:36:38,S007,,Online,0,0.0,1,gen_20251127_091607,transactions_header.csv
T00003994,2024-05-11,2024-05-11 13:49:43,S013,C004371,Card,28.93,1.45,2,gen_20251127_091606,transactions_header.csv
T00001558,2024-04-04,2024-04-04 03:11:21,S019,C002588,Cash,$36.11,3.61,2,gen_20251127_091605,transactions_header.csv
T00004746,2024-03-27,2024-03-27 00:26:08,S008,C002818,Card,107.37,5.37,1,gen_20251127_091606,transactions_header.csv
T00012457,2024-08-30,2024-08-30 10:30:04,S026,C004739,Online,66.57,0.0,1,gen_20251127_091607,transactions_header.csv
T00009211,2024-12-18,2024-12-18 20:05:30,S004,C003144,Cash,74.24,7.42,4,gen_20251127_091606,transactions_header.csv
T00011199,01/23/24,2024-01-23 05:55:25,S005,,Cash,21.49,3.22,1,gen_20251127_091606,transactions_header.csv
T00017235,2024-06-15,2024-06-15 14:38:03,S004,C003489,Cash,64.86,9.73,2,gen_20251127_091607,transactions_header.csv
T00017978,2024-05-03,2024-05-03 11:41:27,S023,,Cash,80.54,0.0,2,gen_20251127_091607,transactions_header.csv
T00008141,2024-08-29,2024-08-29 00:44:21,S029,C001441,Cash,19.29,0.0,2,gen_20251127_091606,transactions_header.csv
T00013161,03/11/24,2024-03-11 23:36:32,S013,C001229,Card,100.44,0.0,3,gen_20251127_091607,transactions_header.csv
T00007721,02/04/24,2024-02-04 19:54:50,S005,C001765,Online,0,0,2,gen_20251127_091606,transactions_header.csv
T00003729,2024-08-30,2024-08-30 20:41:50,S020,C004877,Online,21.71,1.09,1,gen_20251127_091606,transactions_header.csv
T00010332,2024-08-09,2024-08-09 20:03:56,S011,C001639,Cash,69.56,0.0,1,gen_20251127_091606,transactions_header.csv
T00015059,08/24/24,2024-08-24 11:31:16,S015,C004208,Cash,35.6,3.56,2,gen_20251127_091607,transactions_header.csv
T00009873,2024-11-22,2024-11-22 12:39:20,S014,C003107,card,$21.91,,1,gen_20251127_091606,transactions_header.csv
T00002158,04/07/24,2024-04-07 21:17:51,S008,C001214,cash,0,0.0,2,gen_20251127_091605,transactions_header.csv
T00013333,2024-02-06,2024-02-06 13:46:27,S019,C002209,Cash,135.49,6.77,1,gen_20251127_091607,transactions_header.csv
T00017955,12/27/24,2024-12-27 02:09:55,S007,C001149,Card,6.59,0.0,3,gen_20251127_091607,transactions_header.csv
T00007610,2024-12-29,2024-12-29 07:42:38,S005,C000763,Cash,0,0,7,gen_20251127_091606,transactions_header.csv
T00013571,12/07/24,2024-12-07 11:26:22,S029,NA,online,69.84,NA,2,gen_20251127_091607,transactions_header.csv
T00012350,2024-06-14,2024-06-14 11:37:55,S009,C004941,Cash,83.76,8.38,6,gen_20251127_091607,transactions_header.csv
T00015739,2024-12-08,2024-12-08 05:10:38,S011,C004613,Cash,0.59,0.03,1,gen_20251127_091607,transactions_header.csv
T00013812,2024-01-10,2024-01-10 14:59:35,S024,C000964,Card,77.28,11.59,5,gen_20251127_091607,transactions_header.csv
T00011260,10/09/24,2024-10-09 10:04:25,S010,C002485,Cash,28.38,0.0,1,gen_20251127_091606,transactions_header.csv
T00002815,11/06/24,2024-11-06 18:10:42,S012,C001301,Online,84.13,0.0,1,gen_20251127_091605,transactions_header.csv
T00004992,2024-05-17,2024-05-17 10:16:56,S004,C002166,Card,73.12,7.31,1,gen_20251127_091606,transactions_header.csv
T00001698,02/19/24,2024-02-19 04:29:17,S027,C002436,Cash,48.58,7.29,3,gen_20251127_091605,transactions_header.csv
T00002741,07/04/24,2024-07-04 22:41:31,S029,C002732,Cash,41.45,,1,gen_20251127_091605,transactions_header.csv
T00009896,02/09/24,2024-02-09 22:17:32,S001,,Cash,72.96,7.3,4,gen_20251127_091606,transactions_header.csv
T00011025,2024-11-13,2024-11-13 11:44:57,S002,C001635,cash,6.83,1.02,1,gen_20251127_091606,transactions_header.csv
T00007795,07/27/24,2024-07-27 09:17:44,S028,C004474,Online,56.56,0.0,1,gen_20251127_091606,transactions_header.csv
T00006384,2024-10-12,2024-10-12 08:18:55,S011,C004616,Cash,72.2,10.83,2,gen_20251127_091606,transactions_header.csv
T00011237,2024-10-11,2024-10-11 11:20:54,S010,C004833,Online,16.99,0.85,2,gen_20251127_091606,transactions_header.csv
T00018683,04/13/24,2024-04-13 19:08:22,S014,C000885,Card,7.88,0.79,1,gen_20251127_091607,transactions_header.csv
T00001067,2024-06-16,2024-06-16 01:00:07,S002,C004472,Cash,19.47,2.92,2,gen_20251127_091605,transactions_header.csv
T00017571,03/05/24,2024-03-05 16:54:26,S014,C003189,Cash,46.98,2.35,1,gen_20251127_091607,transactions_header.csv
T00007342,2024-06-19,2024-06-19 11:23:24,S017,,Cash,30.76,,1,gen_20251127_091606,transactions_header.csv
T00013178,2024-03-31,2024-03-31 04:52:22,S001,C001866,Card,50.22,7.53,2,gen_20251127_091607,transactions_header.csv
T00013718,2024-05-25,2024-05-25 20:30:36,S007,,Card,75.06,0.0,1,gen_20251127_091607,transactions_header.csv
T00018637,2024-09-25,2024-09-25 23:24:59,S024,C004737,Card,45.93,0.0,2,gen_20251127_091607,transactions_header.csv
T00000736,02/20/24,2024-02-20 21:02:00,S014,C002674,Cash,15.81,2.37,1,gen_20251127_091605,transactions_header.csv
T00002440,2024-04-09,2024-04-09 01:15:23,S016,C000660,Online,89.16,13.37,3,gen_20251127_091605,transactions_header.csv
T00016910,09/05/24,2024-09-05 15:08:50,S029,C001265,Online,30.97,0.0,1,gen_20251127_091607,transactions_header.csv
T00002499,03/19/24,2024-03-19 11:18:21,S030,C002111,Cash,24.57,0.0,4,gen_20251127_091605,transactions_header.csv
T00011989,10/10/24,2024-10-10 17:08:36,S011,C004280,Cash,13.68,1.37,5,gen_20251127_091607,transactions_header.csv
T00017944,2024-05-24,2024-05-24 17:47:17,S023,C001441,Card,60.56,0.0,6,gen_20251127_091607,transactions_header.csv
T00010753,2024-03-22,2024-03-22 10:02:25,S010,C004697,Cash,12.07,1.21,8,gen_20251127_091606,transactions_header.csv
T00016188,2024-12-06,2024-12-06 08:41:18,S003,C003656,Online,18.88,,3,gen_20251127_091607,transactions_header.csv
T00002137,2024-05-15,2024-05-15 17:14:46,S014,C003074,Online,62.82,9.42,2,gen_20251127_091605,transactions_header.csv
T00007102,2024-12-05,2024-12-05 05:03:54,S019,,Cash,13.04,1.96,1,gen_20251127_091606,transactions_header.csv
T00001699,2024-05-08,2024-05-08 17:43:18,S030,C001236,Card,52.27,5.23,1,gen_20251127_091605,transactions_header.csv
T00004981,11/03/24,2024-11-03 22:57:44,S022,C003749,Cash,60.49,9.07,7,gen_20251127_091606,transactions_header.csv
T00017535,06/01/24,2024-06-01 16:30:27,S002,C000703,Card,24.16,3.62,2,gen_20251127_091607,transactions_header.csv
T00002040,09/19/24,2024-09-19 18:46:59,S022,C000744,Online,74.11,3.71,2,gen_20251127_091605,transactions_header.csv
T00009647,2024-11-17,2024-11-17 14:05:53,S024,C001601,Cash,29.51,1.48,3,gen_20251127_091606,transactions_header.csv
T00002361,05/24/24,2024-05-24 10:09:17,S020,C002132,Card,33.61,3.36,6,gen_20251127_091605,transactions_header.csv
T00011156,03/03/24,2024-03-03 15:12:41,S021,C002136,Card,108.36,10.84,2,gen_20251127_091606,transactions_header.csv
T00008166,2024-06-16,2024-06-16 20:44:04,S009,C000056,Cash,109.24,16.39,1,gen_20251127_091606,transactions_header.csv
T00011900,2024-12-04,2024-12-04 10:07:43,S025,C002458,Online,39.86,5.98,8,gen_20251127_091607,transactions_header.csv
T00011776,03/01/24,2024-03-01 19:17:10,S001,C000157,Online,50.7,0.0,1,gen_20251127_091607,transactions_header.csv
T00012142,2024-04-26,2024-04-26 01:06:48,S013,C004695,Card,$28.73,1.44,2,gen_20251127_091607,transactions_header.csv
T00014972,09/13/24,2024-09-13 04:06:11,S022,C003256,Online,9.81,,1,gen_20251127_091607,transactions_header.csv
T00006602,01/25/24,2024-01-25 12:35:54,S016,C001492,Online,69.04,6.9,1,gen_20251127_091606,transactions_header.csv
T00018209,2024-06-26,2024-06-26 05:14:01,S011,C003303,Online,1.57,0.08,1,gen_20251127_091607,transactions_header.csv
T00004246,09/19/24,2024-09-19 03:37:09,S010,C001386,Card,76.5,11.47,1,gen_20251127_091606,transactions_header.csv
T00011400,06/22/24,2024-06-22 03:50:40,S012,C003863,Cash,0,0.0,1,gen_20251127_091606,transactions_header.csv
T00017861,06/12/24,2024-06-12 03:38:46,S013,C000864,Cash,140.41,21.06,3,gen_20251127_091607,transactions_header.csv
T00019666,2024-10-04,2024-10-04 12:36:21,S011,C000634,Online,11.82,NA,3,gen_20251127_091607,transactions_header.csv
T00019037,07/04/24,2024-07-04 14:36:01,S006,C001036,Online,48.53,,1,gen_20251127_091607,transactions_header.csv
T00003234,02/04/24,2024-02-04 09:22:50,S001,NA,Online,99.0,9.9,1,gen_20251127_091606,transactions_header.csv
T00001220,04/19/24,2024-04-19 10:22:13,S015,C004667,Card,16.38,0.0,1,gen_20251127_091605,transactions_header.csv
T00017396,2024-10-11,2024-10-11 13:08:32,S029,C000046,Cash,24.99,3.75,5,gen_20251127_091607,transactions_header.csv
T00014220,02/26/24,2024-02-26 16:03:10,S029,C000944,Cash,3.16,0.32,2,gen_20251127_091607,transactions_header.csv
T00018649,11/13/24,2024-11-13 09:25:21,S022,C000099,Cash,50.08,7.51,2,gen_20251127_091607,transactions_header.csv
T00009396,2024-08-18,2024-08-18 04:28:06,S017,C004612,online,18.56,0.0,2,gen_20251127_091606,transactions_header.csv
T00014842,2024-06-27,2024-06-27 01:22:11,S020,C002991,Cash,19.93,2.99,1,gen_20251127_091607,transactions_header.csv
T00018317,10/09/24,2024-10-09 04:15:45,S013,C004592,Online,48.17,7.23,1,gen_20251127_091607,transactions_header.csv
T00007607,09/02/24,2024-09-02 19:50:25,S008,C002123,Card,5.51,0.0,2,gen_20251127_091606,transactions_header.csv
T00017042,2024-03-07,2024-03-07 13:08:08,S018,C002389,Card,84.9,12.74,3,gen_20251127_091607,transactions_header.csv
T00003845,02/06/24,2024-02-06 21:15:19,S027,C000306,Card,89.92,0.0,1,gen_20251127_091606,transactions_header.csv
T00016732,10/18/24,2024-10-18 19:41:14,S024,C002989,Card,80.52,,2,gen_20251127_091607,transactions_header.csv
T00005904,11/04/24,2024-11-04 12:29:43,S007,C003403,Cash,73.54,3.68,1,gen_20251127_091606,transactions_header.csv
T00013481,2024-06-29,2024-06-29 21:28:15,S005,C004697,Cash,29.13,4.37,1,gen_20251127_091607,transactions_header.csv
T00006378,03/01/24,2024-03-01 16:00:21,S025,C000102,Cash,104.29,10.43,7,gen_20251127_091606,transactions_header.csv
T00015416,10/02/24,2024-10-02 15:51:42,S014,C000227,Card,100.21,15.03,5,gen_20251127_091607,transactions_header.csv
T00014350,2024-03-23,2024-03-23 00:12:08,S001,C003697,Online,71.43,10.71,1,gen_20251127_091607,transactions_header.csv
T00009673,03/08/24,2024-03-08 05:42:45,S009,C000648,Cash,$26.73,0.0,1,gen_20251127_091606,transactions_header.csv
T00003211,03/14/24,2024-03-14 07:53:34,S001,C001200,Online,86.98,13.05,1,gen_20251127_091606,transactions_header.csv
T00006947,06/07/24,2024-06-07 11:47:02,S013,C002886,Card,49.35,4.94,1,gen_20251127_091606,transactions_header.csv
T00016039,2024-05-29,2024-05-29 14:48:11,S030,C004540,Cash,73.31,0.0,7,gen_20251127_091607,transactions_header.csv
T00008828,01/31/24,2024-01-31 18:17:16,S020,C001718,Card,90.49,0.0,5,gen_20251127_091606,transactions_header.csv
T00002047,11/05/24,2024-11-05 12:43:30,S024,C004863,Card,68.94,,2,gen_20251127_091605,transactions_header.csv
T00016888,2024-05-06,2024-05-06 07:57:29,S012,C003809,Cash,39.44,3.94,1,gen_20251127_091607,transactions_header.csv
T00005826,2024-03-09,2024-03-09 05:59:52,S015,C002555,Online,17.08,,2,gen_20251127_091606,transactions_header.csv
T00011475,11/27/24,2024-11-27 21:42:12,S025,C000997,Cash,53.17,0.0,1,gen_20251127_091606,transactions_header.csv
T00012206,2024-08-24,2024-08-24 09:19:54,S002,C004144,Card,12.79,1.28,3,gen_20251127_091607,transactions_header.csv
T00011001,2024-01-21,2024-01-21 12:01:21,S029,C000679,card,35.51,1.78,1,gen_20251127_091606,transactions_header.csv
T00009872,09/08/24,2024-09-08 19:26:54,S028,C003794,Cash,64.55,0.0,1,gen_20251127_091606,transactions_header.csv
T00017916,2024-01-08,2024-01-08 16:22:57,S003,NA,Cash,64.52,3.23,4,gen_20251127_091607,transactions_header.csv
T00006210,2024-02-18,2024-02-18 18:04:02,S004,C002875,Cash,31.98,NA,1,gen_20251127_091606,transactions_header.csv
T00010316,07/03/24,2024-07-03 10:36:15,S011,C000828,Online,48.7,7.3,1,gen_20251127_091606,transactions_header.csv
T00017472,10/20/24,2024-10-20 03:23:47,S001,C001173,Online,6.98,0.0,1,gen_20251127_091607,transactions_header.csv
T00004334,10/14/24,2024-10-14 15:00:13,S020,C003993,Cash,49.01,0.0,2,gen_20251127_091606,transactions_header.csv
T00008847,10/20/24,2024-10-20 15:25:41,S021,C002468,Card,26.82,2.68,1,gen_20251127_091606,transactions_header.csv
T00009335,03/06/24,2024-03-06 21:37:37,S021,C004025,Online,86.19,12.93,2,gen_20251127_091606,transactions_header.csv
T00016092,2024-03-20,2024-03-20 02:09:16,S024,C002356,Card,49.75,7.46,2,gen_20251127_091607,transactions_header.csv
T00003048,2024-04-14,2024-04-14 14:29:33,S016,C002529,Cash,64.77,NA,1,gen_20251127_091606,transactions_header.csv
T00006068,2024-12-04,2024-12-04 04:40:59,S014,C004151,Cash,50.88,NA,1,gen_20251127_091606,transactions_header.csv
T00018185,05/24/24,2024-05-24 16:04:35,S001,C004159,Online,43.25,4.33,1,gen_20251127_091607,transactions_header.csv
T00007889,2024-06-29,2024-06-29 19:03:32,S022,C002366,card,48.12,7.22,1,gen_20251127_091606,transactions_header.csv
T00017800,08/21/24,2024-08-21 01:21:48,S024,C003606,Online,52.4,2.62,1,gen_20251127_091607,transactions_header.csv
T00004979,06/04/24,2024-06-04 17:51:04,S029,C002694,Online,0,0,3,gen_20251127_091606,transactions_header.csv
T00014285,2024-10-18,2024-10-18 03:44:23,S002,C003055,Cash,50.63,0.0,1,gen_20251127_091607,transactions_header.csv
T00000655,10/23/24,2024-10-23 19:49:53,S015,C004603,Online,96.87,14.53,2,gen_20251127_091605,transactions_header.csv
T00014813,07/25/24,2024-07-25 05:11:56,S011,C002884,Cash,55.11,2.76,1,gen_20251127_091607,transactions_header.csv
T00005484,2024-05-13,2024-05-13 09:27:10,S026,,Card,59.91,0.0,7,gen_20251127_091606,transactions_header.csv
T00007667,2024-06-07,2024-06-07 14:03:34,S011,C002876,Cash,29.29,1.46,4,gen_20251127_091606,transactions_header.csv
T00001027,2024-06-20,2024-06-20 18:15:08,S030,C001590,Card,71.74,10.76,1,gen_20251127_091605,transactions_header.csv
T00005643,10/28/24,2024-10-28 08:44:56,S025,C002668,Online,$53.14,0.0,1,gen_20251127_091606,transactions_header.csv
T00008116,2024-11-20,2024-11-20 06:32:03,S018,C004804,Online,21.26,2.13,2,gen_20251127_091606,transactions_header.csv
T00005585,2024-02-05,2024-02-05 03:13:46,S024,C004492,Cash,67.59,,1,gen_20251127_091606,transactions_header.csv
T00014749,03/12/24,2024-03-12 18:35:03,S023,C003175,Online,0,0.0,1,gen_20251127_091607,transactions_header.csv
T00003985,2024-09-04,2024-09-04 17:55:02,S028,C002380,Card,54.61,2.73,1,gen_20251127_091606,transactions_header.csv
T00004161,02/27/24,2024-02-27 00:50:22,S017,C004727,Cash,91.53,9.15,1,gen_20251127_091606,transactions_header.csv
T00004074,10/11/24,2024-10-11 10:13:41,S022,C001440,Cash,45.94,4.59,3,gen_20251127_091606,transactions_header.csv
T00014354,2024-05-14,2024-05-14 21:41:45,S002,C000051,Online,45.39,,1,gen_20251127_091607,transactions_header.csv
T00016737,2024-08-30,2024-08-30 01:50:45,S027,C004695,Cash,25.82,3.87,3,gen_20251127_091607,transactions_header.csv
T00003283,2024-12-28,2024-12-28 11:01:06,S008,C004103,Online,71.03,NA,2,gen_20251127_091606,transactions_header.csv
T00006555,01/27/24,2024-01-27 02:10:21,S003,C004228,Card,48.76,7.31,1,gen_20251127_091606,transactions_header.csv
T00018152,2024-12-27,2024-12-27 03:36:09,S002,C001991,Card,58.57,8.79,1,gen_20251127_091607,transactions_header.csv
T00018415,01/26/24,2024-01-26 23:36:41,S003,C000997,Online,81.49,0.0,2,gen_20251127_091607,transactions_header.csv
T00018222,2024-08-12,2024-08-12 14:55:52,S005,C001354,Online,$59.46,5.95,2,gen_20251127_091607,transactions_header.csv
T00003976,05/29/24,2024-05-29 13:27:03,S028,C001332,Online,67.73,0.0,1,gen_20251127_091606,transactions_header.csv
T00008986,10/11/24,2024-10-11 17:35:05,S010,C002597,Card,46.35,4.64,4,gen_20251127_091606,transactions_header.csv
T00009949,2024-01-13,2024-01-13 11:26:47,S026,C003371,Online,85.14,12.77,2,gen_20251127_091606,transactions_header.csv
T00016616,2024-05-20,2024-05-20 22:17:55,S025,C000544,Card,0,0.0,2,gen_20251127_091607,transactions_header.csv
T00008055,2024-04-15,2024-04-15 07:07:58,S017,C003140,cash,31.16,3.12,2,gen_20251127_091606,transactions_header.csv
T00015078,2024-03-04,2024-03-04 18:39:33,S020,NA,Cash,78.18,3.91,2,gen_20251127_091607,transactions_header.csv
T00007286,03/30/24,2024-03-30 13:56:29,S002,C000361,Online,64.29,3.21,1,gen_20251127_091606,transactions_header.csv
T00010009,06/18/24,2024-06-18 08:48:48,S015,C003811,Cash,59.6,,1,gen_20251127_091606,transactions_header.csv
T00000632,2024-02-27,2024-02-27 10:39:07,S004,C004193,Card,82.17,0.0,2,gen_20251127_091605,transactions_header.csv
T00012439,03/19/24,2024-03-19 21:42:14,S008,C001282,Cash,114.75,11.48,1,gen_20251127_091607,transactions_header.csv
T00000197,04/19/24,2024-04-19 03:32:22,S001,C003034,Online,57.72,NA,1,gen_20251127_091605,transactions_header.csv
T00001120,02/13/24,2024-02-13 19:34:05,S001,C003554,Cash,52.09,5.21,1,gen_20251127_091605,transactions_header.csv
T00002291,02/10/24,2024-02-10 11:51:31,S003,C004950,Online,6.65,0.0,1,gen_20251127_091605,transactions_header.csv
T00013698,12/02/24,2024-12-02 18:56:23,S022,C001992,Online,107.76,0.0,1,gen_20251127_091607,transactions_header.csv
T00012873,07/29/24,2024-07-29 14:45:26,S007,,Card,19.85,1.99,2,gen_20251127_091607,transactions_header.csv
T00003508,2024-10-28,2024-10-28 23:43:33,S010,C000036,Online,71.35,0.0,3,gen_20251127_091606,transactions_header.csv
T00017633,2024-07-16,2024-07-16 12:54:08,S027,C002796,Card,92.79,0.0,1,gen_20251127_091607,transactions_header.csv
T00002185,06/07/24,2024-06-07 06:14:13,S026,C000121,Card,97.48,0.0,2,gen_20251127_091605,transactions_header.csv
T00014591,07/18/24,2024-07-18 02:29:11,S010,C001890,Online,24.19,0.0,3,gen_20251127_091607,transactions_header.csv
T00003074,2024-05-16,2024-05-16 23:36:41,S027,C002923,Card,32.34,0.0,6,gen_20251127_091606,transactions_header.csv
T00014531,01/19/24,2024-01-19 08:05:09,S002,C003643,Card,39.97,2.0,2,gen_20251127_091607,transactions_header.csv
T00007345,2024-03-11,2024-03-11 19:35:15,S025,NA,Cash,22.5,0.0,2,gen_20251127_091606,transactions_header.csv
T00000275,2024-09-08,2024-09-08 19:40:57,S030,C000439,Card,46.69,2.33,2,gen_20251127_091605,transactions_header.csv
T00003406,2024-09-15,2024-09-15 16:23:48,S007,C000765,Cash,82.33,12.35,1,gen_20251127_091606,transactions_header.csv
T00009399,2024-07-19,2024-07-19 22:24:06,S028,C002343,Card,45.53,0.0,2,gen_20251127_091606,transactions_header.csv
T00001805,2024-03-05,2024-03-05 09:29:23,S005,,Card,$109.98,11.0,1,gen_20251127_091605,transactions_header.csv
T00004220,08/07/24,2024-08-07 06:17:36,S004,C001585,Card,6.07,0.0,1,gen_20251127_091606,transactions_header.csv
T00005216,2024-01-11,2024-01-11 22:36:39,S018,C001694,Card,60.33,6.03,2,gen_20251127_091606,transactions_header.csv
T00005747,02/07/24,2024-02-07 00:21:15,S015,,Online,27.04,2.7,1,gen_20251127_091606,transactions_header.csv
T00005036,07/17/24,2024-07-17 09:12:26,S019,C004825,Cash,29.15,0.0,2,gen_20251127_091606,transactions_header.csv
T00003526,02/27/24,2024-02-27 13:13:20,S007,C003716,Cash,53.11,0.0,1,gen_20251127_091606,transactions_header.csv
T00014893,09/22/24,2024-09-22 11:17:57,S029,C000035,Card,45.09,6.76,3,gen_20251127_091607,transactions_header.csv
T00004707,2024-12-10,2024-12-10 19:29:45,S023,C004098,Cash,40.55,4.05,1,gen_20251127_091606,transactions_header.csv
T00007336,2024-02-25,2024-02-25 13:22:55,S016,C001010,Card,86.81,0.0,2,gen_20251127_091606,transactions_header.csv
T00001777,2024-11-18,2024-11-18 15:33:14,S003,C002914,Cash,85.11,0.0,3,gen_20251127_091605,transactions_header.csv
T00015277,08/23/24,2024-08-23 02:21:17,S022,,Online,73.59,0.0,5,gen_20251127_091607,transactions_header.csv
T00012295,2024-01-15,2024-01-15 21:06:52,S011,C001295,Online,83.59,8.36,1,gen_20251127_091607,transactions_header.csv
T00002702,2024-11-30,2024-11-30 09:59:35,S011,C001381,Cash,92.18,9.22,1,gen_20251127_091605,transactions_header.csv
T00009548,08/19/24,2024-08-19 12:53:20,S013,C001283,Online,59.02,2.95,2,gen_20251127_091606,transactions_header.csv
T00019134,11/19/24,2024-11-19 14:44:02,S007,C000139,Online,27.94,0.0,2,gen_20251127_091607,transactions_header.csv
T00002703,2024-08-05,2024-08-05 16:59:27,S006,C004543,Card,90.58,13.59,3,gen_20251127_091605,transactions_header.csv
T00011523,2024-01-29,2024-01-29 05:45:14,S021,C003630,Cash,83.47,8.35,8,gen_20251127_091606,transactions_header.csv
T00019483,2024-01-12,2024-01-12 23:29:10,S019,C000343,Online,72.93,7.29,2,gen_20251127_091607,transactions_header.csv
T00006731,2024-03-11,2024-03-11 20:43:09,S022,C002293,card,31.58,3.16,1,gen_20251127_091606,transactions_header.csv
T00000286,05/01/24,2024-05-01 13:49:56,S028,C001994,Card,68.19,3.41,2,gen_20251127_091605,transactions_header.csv
T00013338,03/05/24,2024-03-05 11:00:35,S003,C000766,Online,89.71,8.97,4,gen_20251127_091607,transactions_header.csv
T00015127,11/26/24,2024-11-26 13:38:56,S012,C002365,Cash,105.53,5.28,1,gen_20251127_091607,transactions_header.csv
T00016285,04/09/24,2024-04-09 04:34:21,S002,C000777,Online,44.2,0.0,1,gen_20251127_091607,transactions_header.csv
T00015703,2024-12-21,2024-12-21 02:42:45,S012,C001618,Card,95.22,4.76,3,gen_20251127_091607,transactions_header.csv
T00012614,09/29/24,2024-09-29 14:12:55,S009,C000141,Online,-57.38,5.74,2,gen_20251127_091607,transactions_header.csv
T00006099,2024-11-12,2024-11-12 14:29:18,S012,NA,Card,$31.72,4.76,1,gen_20251127_091606,transactions_header.csv
T00011200,2024-02-08,2024-02-08 07:16:13,S027,C004570,Online,75.53,NA,1,gen_20251127_091606,transactions_header.csv
T00000550,05/11/24,2024-05-11 08:57:26,S006,NA,Cash,105.12,,1,gen_20251127_091605,transactions_header.csv
T00017119,2024-12-01,2024-12-01 18:04:45,S009,C002977,Cash,34.98,1.75,1,gen_20251127_091607,transactions_header.csv
T00018044,11/01/24,2024-11-01 13:08:04,S002,NA,Cash,27.35,1.37,1,gen_20251127_091607,transactions_header.csv
T00002910,2024-05-09,2024-05-09 03:05:26,S010,NA,Card,13.83,1.38,1,gen_20251127_091606,transactions_header.csv
T00016098,04/15/24,2024-04-15 14:24:29,S004,,Card,52.42,0.0,2,gen_20251127_091607,transactions_header.csv
T00019830,2024-02-15,2024-02-15 08:22:55,S020,C001263,Cash,54.61,2.73,1,gen_20251127_091607,transactions_header.csv
T00003049,2024-12-28,2024-12-28 14:05:17,S015,C002079,Cash,74.29,7.43,2,gen_20251127_091606,transactions_header.csv
T00006952,2024-09-04,2024-09-04 15:05:28,S030,NA,cash,85.34,12.8,1,gen_20251127_091606,transactions_header.csv
T00010766,02/19/24,2024-02-19 22:32:58,S024,C003420,Online,0,NA,2,gen_20251127_091606,transactions_header.csv
T00005889,12/20/24,2024-12-20 04:49:13,S025,C001737,Card,42.91,0.0,2,gen_20251127_091606,transactions_header.csv
T00015166,03/15/24,2024-03-15 08:33:16,S025,C000728,Online,88.54,13.28,1,gen_20251127_091607,transactions_header.csv
T00006070,09/11/24,2024-09-11 05:46:20,S027,C004970,Card,96.68,4.83,3,gen_20251127_091606,transactions_header.csv
T00011457,02/11/24,2024-02-11 04:15:12,S019,C002231,Card,13.19,1.98,2,gen_20251127_091606,transactions_header.csv
T00004526,01/23/24,2024-01-23 12:31:52,S025,NA,Online,73.19,10.98,2,gen_20251127_091606,transactions_header.csv
T00004697,09/02/24,2024-09-02 09:13:11,S022,C004010,card,62.29,,1,gen_20251127_091606,transactions_header.csv
T00012282,2024-08-25,2024-08-25 16:17:19,S013,C002416,Card,49.27,,1,gen_20251127_091607,transactions_header.csv
T00011458,12/10/24,2024-12-10 21:06:47,S012,C000060,Card,25.82,2.58,1,gen_20251127_091606,transactions_header.csv
T00014308,2024-12-01,2024-12-01 19:40:20,S022,C001832,Cash,40.73,4.07,3,gen_20251127_091607,transactions_header.csv
T00011710,2024-04-22,2024-04-22 09:55:32,S016,C000761,Card,30.44,3.04,1,gen_20251127_091607,transactions_header.csv
T00006196,2024-06-10,2024-06-10 21:22:28,S011,C000066,Online,93.22,9.32,2,gen_20251127_091606,transactions_header.csv
T00002068,2024-04-05,2024-04-05 23:06:32,S026,C002029,Online,66.14,9.92,1,gen_20251127_091605,transactions_header.csv
T00014106,2024-04-01,2024-04-01 12:44:53,S008,,Online,99.88,4.99,1,gen_20251127_091607,transactions_header.csv
T00012386,2024-10-04,2024-10-04 08:23:43,S008,C002298,Card,72.76,3.64,1,gen_20251127_091607,transactions_header.csv
T00006688,2024-03-14,2024-03-14 00:33:58,S029,C002096,Cash,63.96,6.4,2,gen_20251127_091606,transactions_header.csv
T00009648,08/30/24,2024-08-30 14:23:14,S012,C004489,Cash,20.88,2.09,2,gen_20251127_091606,transactions_header.csv
T00015074,2024-02-22,2024-02-22 08:40:22,S009,C004143,Card,0,0,5,gen_20251127_091607,transactions_header.csv
T00015355,2024-05-18,2024-05-18 06:22:26,S030,C002722,Card,52.07,5.21,2,gen_20251127_091607,transactions_header.csv
T00004506,2024-12-07,2024-12-07 16:10:42,S002,C002527,card,78.23,3.91,1,gen_20251127_091606,transactions_header.csv
T00015828,2024-12-18,2024-12-18 16:41:24,S014,C001552,Online,41.0,,1,gen_20251127_091607,transactions_header.csv
T00011582,2024-03-06,2024-03-06 11:38:20,S016,C003383,Online,2.78,0.28,5,gen_20251127_091606,transactions_header.csv
T00016987,2024-04-09,2024-04-09 13:47:21,S028,C002970,Online,80.42,0.0,2,gen_20251127_091607,transactions_header.csv
T00011334,2024-09-05,2024-09-05 23:46:46,S007,C001351,Online,51.82,0.0,1,gen_20251127_091606,transactions_header.csv
T00018952,2024-08-24,2024-08-24 16:09:42,S025,C002344,Card,21.17,3.18,3,gen_20251127_091607,transactions_header.csv
T00019680,02/16/24,2024-02-16 14:55:54,S004,C001940,Card,45.71,6.86,1,gen_20251127_091607,transactions_header.csv
T00018246,2024-05-05,2024-05-05 05:58:23,S026,,Online,22.74,1.14,2,gen_20251127_091607,transactions_header.csv
T00001359,2024-05-03,2024-05-03 06:53:35,S005,C004238,Online,66.66,10.0,4,gen_20251127_091605,transactions_header.csv
T00003071,07/28/24,2024-07-28 21:03:53,S011,C001389,Card,0,0.0,2,gen_20251127_091606,transactions_header.csv
T00005949,08/06/24,2024-08-06 08:18:24,S021,NA,Online,38.74,1.94,3,gen_20251127_091606,transactions_header.csv
T00013024,03/28/24,2024-03-28 21:45:50,S011,C001082,Online,$59.86,2.99,1,gen_20251127_091607,transactions_header.csv
T00009626,2024-05-13,2024-05-13 06:47:22,S013,C000444,Cash,113.64,5.68,3,gen_20251127_091606,transactions_header.csv
T00019021,06/17/24,2024-06-17 16:42:23,S011,C000583,Online,32.89,0.0,2,gen_20251127_091607,transactions_header.csv
T00016177,09/07/24,2024-09-07 16:00:18,S004,C001347,Cash,45.96,6.89,2,gen_20251127_091607,transactions_header.csv
T00014109,2024-07-21,2024-07-21 13:41:45,S027,C001810,Card,36.28,5.44,6,gen_20251127_091607,transactions_header.csv
T00002256,06/17/24,2024-06-17 04:43:50,S030,,Online,41.09,2.05,2,gen_20251127_091605,transactions_header.csv
T00012848,2024-05-23,2024-05-23 08:17:17,S010,C004644,Online,18.09,1.81,2,gen_20251127_091607,transactions_header.csv
T00008356,2024-07-13,2024-07-13 10:57:18,S005,,Cash,32.57,4.89,2,gen_20251127_091606,transactions_header.csv
T00014729,2024-05-06,2024-05-06 08:13:36,S006,C000568,Card,15.02,1.5,1,gen_20251127_091607,transactions_header.csv
T00006910,01/30/24,2024-01-30 18:04:10,S026,C004301,Cash,58.38,0.0,2,gen_20251127_091606,transactions_header.csv
T00006550,03/20/24,2024-03-20 18:17:54,S007,C001457,Cash,0,0.0,1,gen_20251127_091606,transactions_header.csv
T00011194,2024-06-08,2024-06-08 22:37:15,S012,C001878,card,24.68,2.47,1,gen_20251127_091606,transactions_header.csv
T00009813,03/10/24,2024-03-10 00:49:13,S008,NA,Card,69.43,0.0,1,gen_20251127_091606,transactions_header.csv
T00016196,05/17/24,2024-05-17 17:30:32,S006,C004647,Cash,89.01,4.45,1,gen_20251127_091607,transactions_header.csv
T00018183,2024-08-11,2024-08-11 16:51:16,S012,C000658,Online,107.95,10.8,5,gen_20251127_091607,transactions_header.csv
T00011625,2024-07-19,2024-07-19 06:42:59,S021,,Card,71.05,3.55,1,gen_20251127_091606,transactions_header.csv
T00010342,2024-09-16,2024-09-16 15:43:12,S016,C004592,Card,14.81,2.22,2,gen_20251127_091606,transactions_header.csv
T00019957,2024-01-11,2024-01-11 20:35:44,S016,C004463,Cash,70.25,0.0,3,gen_20251127_091607,transactions_header.csv
T00011403,2024-02-26,2024-02-26 04:50:53,S019,C001572,Cash,67.65,6.77,4,gen_20251127_091606,transactions_header.csv
T00018626,2024-02-19,2024-02-19 08:55:19,S026,NA,Card,48.42,NA,5,gen_20251127_091607,transactions_header.csv
T00008441,06/28/24,2024-06-28 11:16:45,S007,C000795,Online,21.09,0.0,1,gen_20251127_091606,transactions_header.csv
T00015915,05/06/24,2024-05-06 04:37:18,S002,C002454,Cash,114.41,0.0,6,gen_20251127_091607,transactions_header.csv
T00013816,2024-10-13,2024-10-13 00:20:57,S001,C000714,Card,45.07,6.76,3,gen_20251127_091607,transactions_header.csv
T00005886,2024-01-05,2024-01-05 20:09:56,S014,C002625,Cash,68.21,10.23,3,gen_20251127_091606,transactions_header.csv
T00003316,06/08/24,2024-06-08 10:49:31,S018,C003332,Card,66.91,3.35,1,gen_20251127_091606,transactions_header.csv
T00003913,04/23/24,2024-04-23 00:36:39,S016,NA,Online,64.11,3.21,7,gen_20251127_091606,transactions_header.csv
T00017188,2024-06-23,2024-06-23 23:59:08,S012,C003774,Online,52.81,0.0,1,gen_20251127_091607,transactions_header.csv
T00005588,12/31/24,2024-12-31 10:12:36,S029,C004651,Card,$0.00,,1,gen_20251127_091606,transactions_header.csv
T00004505,12/06/24,2024-12-06 06:08:10,S010,C003021,Card,64.76,6.48,5,gen_20251127_091606,transactions_header.csv
T00000050,2024-04-20,2024-04-20 23:26:45,S005,C004782,Card,59.22,8.88,1,gen_20251127_091605,transactions_header.csv
T00009677,2024-07-31,2024-07-31 15:19:13,S002,C004274,Online,41.62,6.24,3,gen_20251127_091606,transactions_header.csv
T00002933,2024-08-05,2024-08-05 09:55:13,S028,,Card,70.81,7.08,1,gen_20251127_091606,transactions_header.csv
T00010091,06/28/24,2024-06-28 00:56:30,S025,C002122,Cash,72.83,7.28,2,gen_20251127_091606,transactions_header.csv
T00019588,03/12/24,2024-03-12 16:22:20,S024,C003359,Online,43.6,2.18,1,gen_20251127_091607,transactions_header.csv
T00010537,2024-09-10,2024-09-10 02:42:18,S008,C000872,Online,52.74,NA,2,gen_20251127_091606,transactions_header.csv
T00010264,2024-11-30,2024-11-30 23:05:35,S018,C003251,Card,68.13,10.22,1,gen_20251127_091606,transactions_header.csv
T00018102,2024-07-27,2024-07-27 12:53:50,S014,C000400,Card,40.46,6.07,1,gen_20251127_091607,transactions_header.csv
T00004338,2024-02-07,2024-02-07 02:25:07,S022,,Cash,74.17,,2,gen_20251127_091606,transactions_header.csv
T00011179,2024-01-16,2024-01-16 08:08:26,S023,C003149,Cash,105.08,15.76,4,gen_20251127_091606,transactions_header.csv
T00010874,09/27/24,2024-09-27 10:50:53,S007,C003472,Cash,87.83,0.0,1,gen_20251127_091606,transactions_header.csv
T00008994,2024-08-27,2024-08-27 00:14:18,S002,C004358,Card,72.34,3.62,1,gen_20251127_091606,transactions_header.csv
T00007651,2024-07-04,2024-07-04 03:36:27,S002,C001117,Online,0,0.0,3,gen_20251127_091606,transactions_header.csv
T00001304,08/11/24,2024-08-11 18:11:29,S005,C002663,Card,27.97,0.0,2,gen_20251127_091605,transactions_header.csv
T00019177,10/21/24,2024-10-21 11:58:08,S008,C002953,Online,35.64,0.0,2,gen_20251127_091607,transactions_header.csv
T00019529,04/01/24,2024-04-01 16:51:34,S016,C002984,Card,46.71,7.01,1,gen_20251127_091607,transactions_header.csv
T00010685,03/15/24,2024-03-15 13:10:10,S022,C004792,Card,31.97,1.6,1,gen_20251127_091606,transactions_header.csv
T00016444,2024-11-24,2024-11-24 20:52:54,S025,C000970,Cash,38.77,3.88,1,gen_20251127_091607,transactions_header.csv
T00011013,04/13/24,2024-04-13 11:44:34,S006,C000632,Card,$124.88,NA,1,gen_20251127_091606,transactions_header.csv
T00007999,04/06/24,2024-04-06 17:35:12,S011,C001933,Online,42.48,6.37,1,gen_20251127_091606,transactions_header.csv
T00001374,12/30/24,2024-12-30 08:17:29,S028,C003899,Card,76.92,11.54,1,gen_20251127_091605,transactions_header.csv
T00002999,2024-05-02,2024-05-02 06:58:16,S027,,Cash,12.92,1.29,2,gen_20251127_091606,transactions_header.csv
T00009365,01/04/24,2024-01-04 21:06:40,S026,C000900,Cash,27.9,0.0,5,gen_20251127_091606,transactions_header.csv
T00015285,02/18/24,2024-02-18 01:01:38,S005,C003182,Card,78.4,0.0,1,gen_20251127_091607,transactions_header.csv
T00017187,2024-07-28,2024-07-28 07:13:49,S011,C002011,Online,86.68,,4,gen_20251127_091607,transactions_header.csv
T00016928,06/19/24,2024-06-19 03:51:17,S001,C003910,Online,73.9,11.09,1,gen_20251127_091607,transactions_header.csv
T00003051,2024-01-29,2024-01-29 02:04:03,S008,C001835,Cash,109.5,16.43,5,gen_20251127_091606,transactions_header.csv
T00000427,2024-03-19,2024-03-19 09:42:13,S011,C003248,Card,$45.49,4.55,1,gen_20251127_091605,transactions_header.csv
T00017973,2024-03-24,2024-03-24 13:33:10,S022,C003871,Card,31.78,3.18,1,gen_20251127_091607,transactions_header.csv
T00013091,04/20/24,2024-04-20 11:49:45,S005,C004058,Card,43.21,6.48,2,gen_20251127_091607,transactions_header.csv
T00009484,2024-02-19,2024-02-19 05:45:09,S015,C004225,Online,42.06,4.21,1,gen_20251127_091606,transactions_header.csv
T00007712,09/10/24,2024-09-10 08:08:33,S016,C001800,Cash,58.25,5.83,1,gen_20251127_091606,transactions_header.csv
T00017186,03/05/24,2024-03-05 15:46:23,S024,C003657,Online,64.87,0.0,1,gen_20251127_091607,transactions_header.csv
T00000340,2024-06-29,2024-06-29 05:32:03,S005,C004739,Card,112.72,16.91,7,gen_20251127_091605,transactions_header.csv
T00005195,2024-09-04,2024-09-04 05:12:59,S027,C001503,online,52.76,NA,1,gen_20251127_091606,transactions_header.csv
T00013592,11/12/24,2024-11-12 19:40:45,S013,C004717,Online,33.15,0.0,1,gen_20251127_091607,transactions_header.csv
T00003699,2024-10-17,2024-10-17 22:10:16,S022,,Online,75.96,11.39,2,gen_20251127_091606,transactions_header.csv
T00018859,2024-12-26,2024-12-26 13:36:06,S025,C002949,Cash,19.21,0.0,2,gen_20251127_091607,transactions_header.csv
T00016768,2024-01-20,2024-01-20 13:49:53,S015,C003744,Card,57.35,0.0,1,gen_20251127_091607,transactions_header.csv
T00019899,2024-01-21,2024-01-21 10:58:50,S014,C000243,Cash,10.88,0.54,1,gen_20251127_091607,transactions_header.csv
T00010844,07/30/24,2024-07-30 12:20:02,S028,C000853,Cash,75.49,3.77,2,gen_20251127_091606,transactions_header.csv
T00009817,02/16/24,2024-02-16 09:31:42,S008,C001770,Online,47.21,4.72,2,gen_20251127_091606,transactions_header.csv
T00008816,05/05/24,2024-05-05 17:10:44,S005,NA,Online,95.17,9.52,1,gen_20251127_091606,transactions_header.csv
T00013226,2024-09-28,2024-09-28 04:06:19,S014,C002578,Online,87.27,4.36,2,gen_20251127_091607,transactions_header.csv
T00010270,05/12/24,2024-05-12 16:31:26,S029,C003560,Cash,58.23,8.73,3,gen_20251127_091606,transactions_header.csv
T00011652,2024-08-08,2024-08-08 15:48:07,S001,C001478,Cash,7.29,0.36,4,gen_20251127_091607,transactions_header.csv
T00016717,2024-04-02,2024-04-02 20:10:30,S019,C002179,Cash,76.37,3.82,1,gen_20251127_091607,transactions_header.csv
T00011264,09/04/24,2024-09-04 02:51:01,S011,C004661,Online,37.59,1.88,1,gen_20251127_091606,transactions_header.csv
T00007304,2024-05-19,2024-05-19 20:29:55,S008,C004457,Online,16.1,1.61,1,gen_20251127_091606,transactions_header.csv
T00000055,11/05/24,2024-11-05 15:09:19,S026,C002191,Card,35.28,NA,1,gen_20251127_091605,transactions_header.csv
T00002974,06/18/24,2024-06-18 14:34:51,S028,C003206,Cash,108.14,5.41,2,gen_20251127_091606,transactions_header.csv
T00014170,02/01/24,2024-02-01 03:37:03,S023,C004762,Card,42.26,6.34,4,gen_20251127_091607,transactions_header.csv
T00002960,2024-10-03,2024-10-03 17:58:41,S021,C001941,Card,0,0.0,1,gen_20251127_091606,transactions_header.csv
T00006505,2024-09-15,2024-09-15 14:55:02,S028,C001811,Card,60.65,6.07,6,gen_20251127_091606,transactions_header.csv
T00005353,2024-02-06,2024-02-06 10:56:30,S018,C001957,Card,104.74,10.47,1,gen_20251127_091606,transactions_header.csv
T00018736,09/07/24,2024-09-07 08:46:54,S004,C000570,Card,70.4,10.56,5,gen_20251127_091607,transactions_header.csv
T00000402,2024-05-11,2024-05-11 11:39:08,S030,,Cash,67.18,0.0,2,gen_20251127_091605,transactions_header.csv
T00005196,10/08/24,2024-10-08 21:33:31,S002,C001414,Card,18.21,1.82,3,gen_20251127_091606,transactions_header.csv
T00008305,01/14/24,2024-01-14 13:25:16,S001,C000296,Cash,122.3,18.34,1,gen_20251127_091606,transactions_header.csv
T00007564,2024-01-06,2024-01-06 11:43:03,S013,C001888,Online,101.82,5.09,1,gen_20251127_091606,transactions_header.csv
T00010889,2024-09-18,2024-09-18 10:10:24,S019,C003315,Cash,1.46,0.0,1,gen_20251127_091606,transactions_header.csv
T00007158,09/04/24,2024-09-04 17:42:45,S008,C003131,Cash,0,0.0,4,gen_20251127_091606,transactions_header.csv
T00011201,07/27/24,2024-07-27 05:44:24,S004,C000806,Cash,112.88,16.93,1,gen_20251127_091606,transactions_header.csv
T00010195,2024-01-21,2024-01-21 05:22:37,S017,C004643,Cash,77.85,11.68,2,gen_20251127_091606,transactions_header.csv
T00006875,11/14/24,2024-11-14 06:07:43,S003,C003584,Online,92.04,13.81,2,gen_20251127_091606,transactions_header.csv
T00012792,2024-10-12,2024-10-12 07:27:49,S010,C002837,Card,69.06,,1,gen_20251127_091607,transactions_header.csv
T00013399,11/26/24,2024-11-26 08:31:15,S027,,Cash,19.97,2.0,1,gen_20251127_091607,transactions_header.csv
T00012141,02/22/24,2024-02-22 22:51:54,S005,C000634,Online,59.88,8.98,1,gen_20251127_091607,transactions_header.csv
T00017719,2024-07-06,2024-07-06 19:29:13,S023,,Card,104.86,,1,gen_20251127_091607,transactions_header.csv
T00018780,2024-11-05,2024-11-05 00:28:14,S030,,Cash,1.17,0.12,2,gen_20251127_091607,transactions_header.csv
T00011310,2024-09-10,2024-09-10 23:25:55,S024,C001143,Card,83.93,0.0,1,gen_20251127_091606,transactions_header.csv
T00001723,2024-09-02,2024-09-02 14:58:52,S030,C004062,Card,68.65,0.0,3,gen_20251127_091605,transactions_header.csv
T00009661,05/28/24,2024-05-28 12:00:23,S015,C003367,Online,87.26,,1,gen_20251127_091606,transactions_header.csv
T00000665,2024-08-04,2024-08-04 03:08:38,S024,C001887,Online,$82.85,12.43,2,gen_20251127_091605,transactions_header.csv
T00017122,01/08/24,2024-01-08 15:22:23,S004,C003727,Online,38.79,5.82,1,gen_20251127_091607,transactions_header.csv
T00012493,01/07/24,2024-01-07 01:01:40,S021,C000774,Card,50.32,7.55,1,gen_20251127_091607,transactions_header.csv
T00009567,04/20/24,2024-04-20 01:50:16,S008,C003761,Cash,71.64,10.75,2,gen_20251127_091606,transactions_header.csv
T00015182,06/16/24,2024-06-16 16:03:06,S017,C001664,Online,42.32,6.35,1,gen_20251127_091607,transactions_header.csv
T00019527,2024-10-07,2024-10-07 19:10:24,S010,C004408,Card,43.87,2.19,7,gen_20251127_091607,transactions_header.csv
T00009139,08/13/24,2024-08-13 17:24:13,S027,C004661,Cash,66.55,9.98,1,gen_20251127_091606,transactions_header.csv
T00018546,11/20/24,2024-11-20 11:15:06,S018,C002213,Online,68.06,0.0,1,gen_20251127_091607,transactions_header.csv
T00006439,2024-04-15,2024-04-15 13:34:59,S001,C000595,Online,43.41,2.17,5,gen_20251127_091606,transactions_header.csv
T00006671,03/20/24,2024-03-20 10:23:50,S024,,Cash,113.62,0.0,8,gen_20251127_091606,transactions_header.csv
T00005703,07/13/24,2024-07-13 08:55:13,S001,C003981,Card,100.75,0.0,2,gen_20251127_091606,transactions_header.csv
T00003734,2024-02-19,2024-02-19 20:22:49,S019,,Online,76.07,3.8,2,gen_20251127_091606,transactions_header.csv
T00004744,01/18/24,2024-01-18 04:48:33,S006,C002408,Card,7.39,1.11,1,gen_20251127_091606,transactions_header.csv
T00009427,2024-01-31,2024-01-31 21:04:47,S025,C002984,Card,51.57,5.16,3,gen_20251127_091606,transactions_header.csv
T00009865,2024-03-10,2024-03-10 05:58:03,S005,C001887,Card,81.95,NA,1,gen_20251127_091606,transactions_header.csv
T00015781,11/23/24,2024-11-23 11:02:30,S009,C003814,Cash,68.57,3.43,1,gen_20251127_091607,transactions_header.csv
T00015584,11/10/24,2024-11-10 05:33:24,S019,C000425,Cash,86.33,4.32,5,gen_20251127_091607,transactions_header.csv
T00007426,2024-04-16,2024-04-16 06:17:23,S030,,Cash,36.06,5.41,1,gen_20251127_091606,transactions_header.csv
T00012363,10/15/24,2024-10-15 13:35:46,S013,C003089,Card,59.39,5.94,1,gen_20251127_091607,transactions_header.csv
T00010573,10/16/24,2024-10-16 18:18:26,S005,C001115,Cash,1.41,0.07,1,gen_20251127_091606,transactions_header.csv
T00011678,2024-11-18,2024-11-18 10:05:31,S029,C000601,Cash,84.22,0.0,5,gen_20251127_091607,transactions_header.csv
T00018458,06/14/24,2024-06-14 09:46:47,S014,C002238,cash,39.14,3.91,1,gen_20251127_091607,transactions_header.csv
T00000609,04/14/24,2024-04-14 07:06:15,S023,C000476,Cash,62.75,,4,gen_20251127_091605,transactions_header.csv
T00015984,2024-04-24,2024-04-24 02:42:26,S005,,Online,48.03,4.8,3,gen_20251127_091607,transactions_header.csv
T00008817,03/15/24,2024-03-15 21:41:23,S008,C003883,Card,87.98,13.2,1,gen_20251127_091606,transactions_header.csv
T00000020,02/01/24,2024-02-01 13:39:55,S017,C001433,Online,51.05,5.11,1,gen_20251127_091605,transactions_header.csv
T00001339,2024-02-27,2024-02-27 15:27:35,S004,C002107,Card,44.04,2.2,4,gen_20251127_091605,transactions_header.csv
T00008888,2024-10-09,2024-10-09 12:57:32,S027,,Card,43.58,,2,gen_20251127_091606,transactions_header.csv
T00011321,2024-03-04,2024-03-04 04:27:20,S021,NA,online,21.94,1.1,2,gen_20251127_091606,transactions_header.csv
T00004547,2024-10-05,2024-10-05 18:26:43,S003,C004781,Card,46.98,0.0,1,gen_20251127_091606,transactions_header.csv
T00013865,2024-09-25,2024-09-25 07:58:44,S008,C001170,Online,-30.64,4.6,1,gen_20251127_091607,transactions_header.csv
T00019383,2024-04-09,2024-04-09 10:47:03,S029,C002716,Online,14.35,2.15,5,gen_20251127_091607,transactions_header.csv
T00011682,2024-03-13,2024-03-13 22:53:52,S018,C001400,Card,71.35,,2,gen_20251127_091607,transactions_header.csv
T00015552,03/17/24,2024-03-17 12:15:24,S014,C000349,Card,52.13,5.21,6,gen_20251127_091607,transactions_header.csv
T00002488,10/20/24,2024-10-20 12:22:54,S030,C001510,Online,2.09,0.0,6,gen_20251127_091605,transactions_header.csv
T00008117,10/23/24,2024-10-23 07:09:15,S020,C003428,Card,93.38,0.0,1,gen_20251127_091606,transactions_header.csv
T00015799,2024-09-30,2024-09-30 15:58:18,S016,C004854,card,54.53,2.73,1,gen_20251127_091607,transactions_header.csv
T00013603,03/14/24,2024-03-14 07:49:21,S019,C000840,Cash,31.13,3.11,2,gen_20251127_091607,transactions_header.csv
T00011224,02/18/24,2024-02-18 09:29:58,S020,C002417,Card,78.35,7.83,1,gen_20251127_091606,transactions_header.csv
T00017997,05/10/24,2024-05-10 23:35:33,S008,C002407,Cash,47.54,7.13,1,gen_20251127_091607,transactions_header.csv
T00003315,2024-04-23,2024-04-23 11:21:04,S003,C000586,Online,31.75,4.76,1,gen_20251127_091606,transactions_header.csv
T00010498,07/12/24,2024-07-12 05:16:30,S025,C001544,online,56.16,0.0,6,gen_20251127_091606,transactions_header.csv
T00015466,11/08/24,2024-11-08 10:44:23,S025,C001818,Online,44.35,0.0,3,gen_20251127_091607,transactions_header.csv
T00007507,2024-02-10,2024-02-10 09:52:08,S017,C003076,Card,40.26,2.01,7,gen_20251127_091606,transactions_header.csv
T00002426,11/22/24,2024-11-22 12:20:00,S027,,Card,27.39,4.11,1,gen_20251127_091605,transactions_header.csv
T00010093,06/26/24,2024-06-26 03:52:15,S022,C004859,Online,46.52,6.98,5,gen_20251127_091606,transactions_header.csv
T00012400,12/25/24,2024-12-25 08:21:49,S022,C002901,Cash,89.16,,2,gen_20251127_091607,transactions_header.csv
T00004157,2024-11-20,2024-11-20 13:55:46,S018,,Card,0.9,0.05,1,gen_20251127_091606,transactions_header.csv
T00009505,05/16/24,2024-05-16 15:27:47,S028,C003949,Cash,51.85,0.0,7,gen_20251127_091606,transactions_header.csv
T00019704,05/14/24,2024-05-14 16:36:01,S024,,card,15.84,1.58,4,gen_20251127_091607,transactions_header.csv
T00009255,10/19/24,2024-10-19 12:01:04,S009,NA,Cash,56.95,2.85,1,gen_20251127_091606,transactions_header.csv
T00007101,2024-04-10,2024-04-10 16:21:40,S023,C001942,Online,23.98,1.2,2,gen_20251127_091606,transactions_header.csv
T00003704,06/12/24,2024-06-12 05:11:36,S018,C004720,cash,92.4,9.24,4,gen_20251127_091606,transactions_header.csv
T00002959,12/01/24,2024-12-01 23:07:03,S019,C003263,Online,40.87,6.13,1,gen_20251127_091606,transactions_header.csv
T00014922,03/06/24,2024-03-06 11:28:27,S010,C001276,Cash,34.42,1.72,1,gen_20251127_091607,transactions_header.csv
T00015681,2024-04-01,2024-04-01 15:55:08,S007,C004655,Cash,80.48,0.0,4,gen_20251127_091607,transactions_header.csv
T00005648,01/05/24,2024-01-05 12:09:22,S010,C001280,Card,59.32,0.0,2,gen_20251127_091606,transactions_header.csv
T00013537,03/19/24,2024-03-19 20:21:46,S011,C001475,Online,35.37,0.0,1,gen_20251127_091607,transactions_header.csv
T00017049,2024-02-25,2024-02-25 12:25:46,S017,,Cash,41.63,0.0,2,gen_20251127_091607,transactions_header.csv
T00009913,08/20/24,2024-08-20 04:15:38,S006,C000874,Online,42.24,6.34,1,gen_20251127_091606,transactions_header.csv
T00018666,2024-04-27,2024-04-27 02:57:34,S008,C000724,Online,52.86,2.64,2,gen_20251127_091607,transactions_header.csv
T00013392,2024-12-18,2024-12-18 02:31:02,S017,C004384,Cash,87.19,4.36,3,gen_20251127_091607,transactions_header.csv
T00009561,08/03/24,2024-08-03 19:09:27,S022,C004970,Online,71.07,3.55,1,gen_20251127_091606,transactions_header.csv
T00007639,07/28/24,2024-07-28 01:09:12,S008,,Cash,88.2,0.0,1,gen_20251127_091606,transactions_header.csv
T00015441,12/21/24,2024-12-21 07:58:26,S011,C001577,Cash,64.81,6.48,1,gen_20251127_091607,transactions_header.csv
T00008820,10/02/24,2024-10-02 00:27:06,S018,NA,Online,7.24,1.09,1,gen_20251127_091606,transactions_header.csv
T00016982,2024-06-14,2024-06-14 07:41:32,S002,C001004,Card,53.98,5.4,1,gen_20251127_091607,transactions_header.csv
T00008483,03/09/24,2024-03-09 02:19:18,S027,C003637,Cash,46.56,2.33,2,gen_20251127_091606,transactions_header.csv
T00017548,2024-08-21,2024-08-21 02:56:17,S010,C001196,cash,80.91,12.14,1,gen_20251127_091607,transactions_header.csv
T00013004,2024-01-25,2024-01-25 14:05:34,S023,NA,Cash,15.17,,3,gen_20251127_091607,transactions_header.csv
T00001984,2024-06-21,2024-06-21 22:19:23,S014,C003185,Card,16.21,2.43,1,gen_20251127_091605,transactions_header.csv
T00015389,09/12/24,2024-09-12 14:35:08,S028,C001726,Card,45.01,0.0,5,gen_20251127_091607,transactions_header.csv
T00018628,2024-10-19,2024-10-19 05:02:08,S023,C004348,Card,61.06,,6,gen_20251127_091607,transactions_header.csv
T00014704,02/10/24,2024-02-10 21:27:39,S006,C003668,Online,0,0.0,1,gen_20251127_091607,transactions_header.csv
T00004292,2024-10-04,2024-10-04 10:11:38,S026,,Card,56.02,5.6,1,gen_20251127_091606,transactions_header.csv
T00013598,2024-08-19,2024-08-19 10:30:32,S021,C000044,Online,92.7,9.27,3,gen_20251127_091607,transactions_header.csv
T00005632,2024-12-07,2024-12-07 09:45:39,S006,C003360,Cash,110.65,16.6,2,gen_20251127_091606,transactions_header.csv
T00004820,02/09/24,2024-02-09 13:34:27,S009,C003101,Cash,52.23,5.22,3,gen_20251127_091606,transactions_header.csv
T00013210,2024-06-22,2024-06-22 20:14:55,S023,C002471,Cash,48.36,2.42,1,gen_20251127_091607,transactions_header.csv
T00000658,07/04/24,2024-07-04 06:39:36,S004,C001556,Cash,0,0,1,gen_20251127_091605,transactions_header.csv
T00007665,2024-03-06,2024-03-06 18:26:23,S011,C002212,Cash,60.86,0.0,5,gen_20251127_091606,transactions_header.csv
T00000752,10/23/24,2024-10-23 23:53:10,S017,C000605,Online,32.77,3.28,2,gen_20251127_091605,transactions_header.csv
T00002082,2024-01-29,2024-01-29 16:17:37,S016,C004916,Online,23.63,1.18,2,gen_20251127_091605,transactions_header.csv
T00013724,12/31/24,2024-12-31 16:31:34,S029,C003829,Online,50.83,7.62,1,gen_20251127_091607,transactions_header.csv
T00015333,06/22/24,2024-06-22 12:31:06,S026,C004776,Cash,84.13,,2,gen_20251127_091607,transactions_header.csv
T00012674,2024-07-17,2024-07-17 07:26:22,S026,C002953,Card,0,0.0,2,gen_20251127_091607,transactions_header.csv
T00013293,2024-02-03,2024-02-03 20:22:38,S024,C000856,Card,37.41,0.0,1,gen_20251127_091607,transactions_header.csv
T00019336,09/13/24,2024-09-13 02:02:14,S015,NA,Card,24.53,0.0,3,gen_20251127_091607,transactions_header.csv
T00000844,11/24/24,2024-11-24 19:00:11,S005,C004438,Online,47.72,7.16,2,gen_20251127_091605,transactions_header.csv
T00004950,2024-11-29,2024-11-29 05:30:28,S028,C003701,Online,10.59,1.06,2,gen_20251127_091606,transactions_header.csv
T00019774,10/27/24,2024-10-27 12:47:54,S007,C002341,Online,12.74,1.27,1,gen_20251127_091607,transactions_header.csv
T00014164,2024-06-25,2024-06-25 05:34:29,S030,C000668,Cash,29.23,0.0,1,gen_20251127_091607,transactions_header.csv
T00016528,11/17/24,2024-11-17 08:38:31,S014,C001855,Card,53.46,,2,gen_20251127_091607,transactions_header.csv
T00009802,09/16/24,2024-09-16 09:29:22,S024,C004759,card,24.54,3.68,2,gen_20251127_091606,transactions_header.csv
T00013353,08/01/24,2024-08-01 22:06:27,S003,,Cash,42.02,0.0,6,gen_20251127_091607,transactions_header.csv
T00019018,02/03/24,2024-02-03 20:28:04,S029,C002749,Online,84.29,12.64,8,gen_20251127_091607,transactions_header.csv
T00003821,08/18/24,2024-08-18 03:21:47,S028,C002439,Card,102.23,5.11,1,gen_20251127_091606,transactions_header.csv
T00003523,2024-02-05,2024-02-05 07:49:47,S021,C001161,Card,50.17,5.02,7,gen_20251127_091606,transactions_header.csv
T00010954,2024-06-01,2024-06-01 02:26:30,S021,C000421,Online,0,0.0,4,gen_20251127_091606,transactions_header.csv
T00000554,2024-10-16,2024-10-16 21:30:44,S001,C001515,Cash,57.56,8.63,1,gen_20251127_091605,transactions_header.csv
T00003636,10/17/24,2024-10-17 01:41:52,S002,C001891,Cash,39.7,1.99,2,gen_20251127_091606,transactions_header.csv
T00003801,01/01/24,2024-01-01 15:00:32,S011,C004149,Online,39.11,1.96,3,gen_20251127_091606,transactions_header.csv
T00018047,2024-02-29,2024-02-29 18:04:41,S013,C000160,Cash,0,0.0,1,gen_20251127_091607,transactions_header.csv
T00003888,06/22/24,2024-06-22 10:54:50,S030,C001606,Card,54.43,,2,gen_20251127_091606,transactions_header.csv
T00011314,07/12/24,2024-07-12 00:33:22,S008,C004212,Cash,22.87,2.29,2,gen_20251127_091606,transactions_header.csv
T00000577,01/19/24,2024-01-19 04:29:39,S012,C000546,Online,15.43,0.77,1,gen_20251127_091605,transactions_header.csv
T00008852,09/13/24,2024-09-13 00:11:45,S021,C001155,Cash,96.37,14.46,1,gen_20251127_091606,transactions_header.csv
T00014065,01/13/24,2024-01-13 22:19:16,S001,,Cash,89.34,13.4,2,gen_20251127_091607,transactions_header.csv
T00015415,12/09/24,2024-12-09 11:44:07,S018,C002966,Cash,44.13,4.41,1,gen_20251127_091607,transactions_header.csv
T00015082,12/25/24,2024-12-25 20:29:20,S002,C004185,Cash,14.88,2.23,1,gen_20251127_091607,transactions_header.csv
T00000048,2024-04-20,2024-04-20 01:33:20,S018,C000256,Cash,33.3,0.0,1,gen_20251127_091605,transactions_header.csv
T00010952,2024-03-15,2024-03-15 11:26:10,S017,C004616,Cash,101.82,0.0,2,gen_20251127_091606,transactions_header.csv
T00008831,2024-09-07,2024-09-07 08:56:16,S008,NA,Card,35.21,1.76,3,gen_20251127_091606,transactions_header.csv
T00008723,2024-12-27,2024-12-27 04:07:51,S027,C003169,Cash,26.73,1.34,1,gen_20251127_091606,transactions_header.csv
T00015602,2024-12-02,2024-12-02 21:16:25,S028,C004334,Online,56.52,0.0,1,gen_20251127_091607,transactions_header.csv
T00013310,2024-12-10,2024-12-10 08:49:43,S017,C000852,Online,68.38,NA,2,gen_20251127_091607,transactions_header.csv
T00010570,04/20/24,2024-04-20 08:03:29,S004,C002535,Online,55.05,5.5,3,gen_20251127_091606,transactions_header.csv
T00018966,12/08/24,2024-12-08 01:05:12,S022,C004109,Card,16.16,1.62,3,gen_20251127_091607,transactions_header.csv
T00001216,2024-12-03,2024-12-03 22:15:01,S015,C000559,Card,114.58,5.73,3,gen_20251127_091605,transactions_header.csv
T00018338,2024-03-05,2024-03-05 04:19:52,S027,C004494,Card,93.13,13.97,1,gen_20251127_091607,transactions_header.csv
T00005513,2024-12-03,2024-12-03 19:16:24,S023,C000674,Online,6.45,0.32,4,gen_20251127_091606,transactions_header.csv
T00001945,07/06/24,2024-07-06 05:33:26,S015,C003259,cash,30.64,0.0,1,gen_20251127_091605,transactions_header.csv
T00016598,2024-07-02,2024-07-02 13:32:43,S005,C001911,Online,0,0.0,1,gen_20251127_091607,transactions_header.csv
T00001451,2024-12-17,2024-12-17 09:33:57,S030,C002948,Online,31.56,0.0,1,gen_20251127_091605,transactions_header.csv
T00016918,2024-03-14,2024-03-14 20:01:06,S029,C004165,Card,35.37,1.77,1,gen_20251127_091607,transactions_header.csv
T00018236,07/30/24,2024-07-30 21:30:43,S017,C004083,Card,40.01,4.0,1,gen_20251127_091607,transactions_header.csv
T00016707,2024-04-08,2024-04-08 15:38:03,S016,C004182,Card,52.57,5.26,1,gen_20251127_091607,transactions_header.csv
T00018920,2024-05-17,2024-05-17 07:38:53,S001,C004079,Card,35.19,5.28,1,gen_20251127_091607,transactions_header.csv
T00016317,07/29/24,2024-07-29 13:23:06,S022,C001926,Online,61.29,9.19,1,gen_20251127_091607,transactions_header.csv
T00006075,2024-01-13,2024-01-13 00:31:45,S012,C001392,Card,64.32,NA,1,gen_20251127_091606,transactions_header.csv
T00002404,08/28/24,2024-08-28 05:04:00,S025,C001947,Card,104.37,15.66,2,gen_20251127_091605,transactions_header.csv
T00016376,2024-10-15,2024-10-15 22:11:38,S018,,Cash,-30.08,3.01,2,gen_20251127_091607,transactions_header.csv
T00007726,2024-07-13,2024-07-13 08:51:42,S002,C004576,Cash,62.85,0.0,7,gen_20251127_091606,transactions_header.csv
T00013917,2024-10-17,2024-10-17 19:32:24,S010,,Card,35.93,0.0,1,gen_20251127_091607,transactions_header.csv
T00014102,2024-11-18,2024-11-18 06:45:46,S013,C004644,online,37.36,5.6,2,gen_20251127_091607,transactions_header.csv
T00011959,02/12/24,2024-02-12 18:25:19,S009,C003306,Card,65.34,,3,gen_20251127_091607,transactions_header.csv
T00019156,2024-09-26,2024-09-26 09:39:42,S024,C002406,Online,115.32,5.77,5,gen_20251127_091607,transactions_header.csv
T00009580,2024-06-22,2024-06-22 13:20:26,S013,C002522,Online,5.31,0.27,1,gen_20251127_091606,transactions_header.csv
T00004825,2024-03-06,2024-03-06 13:38:04,S005,C003313,Online,80.53,,2,gen_20251127_091606,transactions_header.csv
T00002169,11/10/24,2024-11-10 09:26:15,S003,C002041,Card,50.71,2.54,2,gen_20251127_091605,transactions_header.csv
T00016575,04/18/24,2024-04-18 00:19:14,S029,C003721,Cash,56.53,0.0,2,gen_20251127_091607,transactions_header.csv
T00005001,2024-08-24,2024-08-24 15:20:20,S018,C003366,Online,38.33,1.92,1,gen_20251127_091606,transactions_header.csv
T00019440,12/28/24,2024-12-28 16:02:00,S028,C000235,online,1.96,0.2,1,gen_20251127_091607,transactions_header.csv
T00016874,07/02/24,2024-07-02 07:29:20,S014,C002375,Card,0,0.0,4,gen_20251127_091607,transactions_header.csv
T00014365,03/27/24,2024-03-27 07:48:04,S010,C004430,Cash,0,0.0,6,gen_20251127_091607,transactions_header.csv
T00010819,2024-10-01,2024-10-01 01:22:12,S021,C004020,Online,39.38,3.94,8,gen_20251127_091606,transactions_header.csv
T00019560,2024-09-12,2024-09-12 11:25:21,S003,C001146,Card,73.83,3.69,4,gen_20251127_091607,transactions_header.csv
T00012951,2024-10-12,2024-10-12 10:54:34,S015,C002649,Card,23.42,0.0,2,gen_20251127_091607,transactions_header.csv
T00015459,2024-04-08,2024-04-08 11:12:49,S007,C004917,Online,38.94,5.84,2,gen_20251127_091607,transactions_header.csv
T00001214,11/09/24,2024-11-09 15:23:11,S011,C004365,online,89.49,8.95,3,gen_20251127_091605,transactions_header.csv
T00015091,2024-08-06,2024-08-06 07:19:25,S026,,Cash,16.31,2.45,2,gen_20251127_091607,transactions_header.csv
T00013253,2024-06-26,2024-06-26 06:11:04,S019,C002658,Card,7.45,1.12,2,gen_20251127_091607,transactions_header.csv
T00010676,03/27/24,2024-03-27 17:25:05,S005,C002118,Card,32.08,1.6,1,gen_20251127_091606,transactions_header.csv
T00015233,2024-11-15,2024-11-15 12:45:02,S025,C003032,Card,65.96,,2,gen_20251127_091607,transactions_header.csv
T00013552,05/30/24,2024-05-30 08:48:40,S005,C003753,Card,74.61,11.19,1,gen_20251127_091607,transactions_header.csv
T00012528,2024-09-21,2024-09-21 07:16:42,S021,C003904,Cash,39.01,5.85,2,gen_20251127_091607,transactions_header.csv
T00013151,2024-07-10,2024-07-10 20:39:24,S019,,Cash,58.48,8.77,1,gen_20251127_091607,transactions_header.csv
T00018917,2024-08-20,2024-08-20 15:28:06,S025,C000585,Cash,0,0.0,1,gen_20251127_091607,transactions_header.csv
T00003489,2024-10-26,2024-10-26 06:25:01,S002,C003864,online,51.83,5.18,1,gen_20251127_091606,transactions_header.csv
T00005686,2024-11-22,2024-11-22 13:58:33,S025,NA,Card,82.08,0.0,2,gen_20251127_091606,transactions_header.csv
T00008197,08/26/24,2024-08-26 13:56:35,S014,C000497,Card,18.89,1.89,2,gen_20251127_091606,transactions_header.csv
T00000745,09/15/24,2024-09-15 11:25:18,S005,,Online,17.18,1.72,8,gen_20251127_091605,transactions_header.csv
T00018042,2024-01-07,2024-01-07 16:30:49,S016,C000909,Online,43.83,6.57,1,gen_20251127_091607,transactions_header.csv
T00002913,07/23/24,2024-07-23 19:46:10,S015,,Card,44.86,0.0,1,gen_20251127_091606,transactions_header.csv
T00011667,2024-05-23,2024-05-23 15:02:07,S023,C003792,Card,90.45,4.52,1,gen_20251127_091607,transactions_header.csv
T00016583,2024-08-24,2024-08-24 03:22:06,S029,C003384,cash,72.07,3.6,1,gen_20251127_091607,transactions_header.csv
T00001039,2024-05-04,2024-05-04 10:03:18,S015,C001048,Online,91.36,NA,1,gen_20251127_091605,transactions_header.csv
T00018318,10/24/24,2024-10-24 09:07:31,S003,C003379,Card,90.14,4.51,2,gen_20251127_091607,transactions_header.csv
T00005715,11/27/24,2024-11-27 04:41:37,S018,C004172,Cash,42.94,4.29,2,gen_20251127_091606,transactions_header.csv
T00003580,2024-12-14,2024-12-14 10:47:29,S017,C000449,Cash,35.68,1.78,1,gen_20251127_091606,transactions_header.csv
T00005200,01/10/24,2024-01-10 11:14:58,S012,C002050,Cash,12.86,NA,1,gen_20251127_091606,transactions_header.csv
T00017062,2024-10-25,2024-10-25 04:46:58,S015,C001630,Card,53.18,0.0,3,gen_20251127_091607,transactions_header.csv
T00012897,2024-01-14,2024-01-14 13:37:48,S010,C002234,Card,28.26,1.41,1,gen_20251127_091607,transactions_header.csv
T00003708,10/08/24,2024-10-08 03:45:40,S023,C000198,Online,66.78,10.02,1,gen_20251127_091606,transactions_header.csv
T00016450,2024-04-04,2024-04-04 21:43:21,S030,C002576,Online,41.93,2.1,2,gen_20251127_091607,transactions_header.csv
T00016404,2024-09-18,2024-09-18 00:18:40,S021,,Cash,50.91,7.64,1,gen_20251127_091607,transactions_header.csv
T00000730,2024-09-15,2024-09-15 13:54:09,S004,C002825,Cash,40.66,2.03,1,gen_20251127_091605,transactions_header.csv
T00010478,12/14/24,2024-12-14 11:50:12,S025,C004467,Cash,25.07,3.76,1,gen_20251127_091606,transactions_header.csv
T00001641,2024-10-28,2024-10-28 10:21:30,S011,C003189,Cash,35.28,0.0,1,gen_20251127_091605,transactions_header.csv
T00005849,08/05/24,2024-08-05 15:56:41,S020,C002137,Cash,-90.45,0.0,3,gen_20251127_091606,transactions_header.csv
T00018834,2024-08-19,2024-08-19 15:58:41,S022,C003467,Online,58.2,8.73,1,gen_20251127_091607,transactions_header.csv
T00013893,2024-07-14,2024-07-14 16:23:35,S026,C001005,Card,41.7,4.17,3,gen_20251127_091607,transactions_header.csv
T00010964,2024-07-21,2024-07-21 23:17:54,S026,C001070,Card,100.09,5.0,1,gen_20251127_091606,transactions_header.csv
T00000543,04/14/24,2024-04-14 14:05:54,S020,C004646,Online,87.02,0.0,3,gen_20251127_091605,transactions_header.csv
T00008952,11/26/24,2024-11-26 20:41:35,S020,C004812,Cash,50.97,5.1,1,gen_20251127_091606,transactions_header.csv
T00001066,2024-12-19,2024-12-19 04:11:22,S001,C001613,Online,$23.63,2.36,1,gen_20251127_091605,transactions_header.csv
T00005130,2024-11-28,2024-11-28 14:03:31,S023,,Card,52.5,7.88,1,gen_20251127_091606,transactions_header.csv
T00011855,2024-12-02,2024-12-02 09:13:51,S026,C004954,Card,8.3,0.83,1,gen_20251127_091607,transactions_header.csv
T00000147,2024-09-21,2024-09-21 06:42:18,S029,C001104,Online,33.47,0.0,2,gen_20251127_091605,transactions_header.csv
T00012718,05/05/24,2024-05-05 13:10:33,S024,C000750,Cash,63.32,0.0,1,gen_20251127_091607,transactions_header.csv
T00019463,2024-07-14,2024-07-14 22:16:33,S019,C004876,Online,23.13,1.16,1,gen_20251127_091607,transactions_header.csv
T00000242,2024-08-16,2024-08-16 18:11:54,S007,C002109,Card,73.67,3.68,2,gen_20251127_091605,transactions_header.csv
T00015905,2024-03-30,2024-03-30 02:11:25,S020,C002469,Online,$51.70,7.75,1,gen_20251127_091607,transactions_header.csv
T00018011,2024-06-28,2024-06-28 03:32:06,S017,,Cash,31.97,0.0,1,gen_20251127_091607,transactions_header.csv
T00015924,07/23/24,2024-07-23 16:00:30,S010,C000284,Cash,2.71,0.14,1,gen_20251127_091607,transactions_header.csv
T00007529,2024-08-04,2024-08-04 01:23:08,S013,C003119,Cash,95.29,4.76,2,gen_20251127_091606,transactions_header.csv
T00015774,02/21/24,2024-02-21 18:24:48,S016,,Card,$48.99,4.9,1,gen_20251127_091607,transactions_header.csv
T00010501,2024-01-27,2024-01-27 07:48:33,S029,C000814,Cash,18.63,1.86,1,gen_20251127_091606,transactions_header.csv
T00001953,2024-09-12,2024-09-12 11:26:51,S005,C001751,Online,70.22,,1,gen_20251127_091605,transactions_header.csv
T00008310,2024-04-21,2024-04-21 22:41:04,S003,C003967,Card,8.91,0.45,3,gen_20251127_091606,transactions_header.csv
T00017232,2024-12-16,2024-12-16 23:36:51,S030,C001586,Card,35.51,1.78,1,gen_20251127_091607,transactions_header.csv
T00001595,2024-09-23,2024-09-23 18:35:47,S019,C003128,Cash,71.98,10.8,1,gen_20251127_091605,transactions_header.csv
T00007835,11/13/24,2024-11-13 20:02:47,S023,C001846,Cash,69.88,10.48,1,gen_20251127_091606,transactions_header.csv
T00008853,2024-06-26,2024-06-26 11:54:55,S010,C000269,Online,72.76,3.64,1,gen_20251127_091606,transactions_header.csv
T00018799,2024-12-22,2024-12-22 14:00:12,S014,C001856,Card,37.66,3.77,2,gen_20251127_091607,transactions_header.csv
T00009614,2024-02-15,2024-02-15 00:12:38,S029,C003572,Cash,103.84,,2,gen_20251127_091606,transactions_header.csv
T00005283,2024-07-16,2024-07-16 21:14:38,S018,C001595,Online,14.62,1.46,5,gen_20251127_091606,transactions_header.csv
T00017257,12/24/24,2024-12-24 08:23:44,S021,C000739,Cash,49.28,7.39,1,gen_20251127_091607,transactions_header.csv
T00009116,10/17/24,2024-10-17 19:47:18,S005,,Online,71.28,0.0,7,gen_20251127_091606,transactions_header.csv
T00002681,02/12/24,2024-02-12 04:28:38,S002,C003487,Cash,99.54,9.95,5,gen_20251127_091605,transactions_header.csv
T00016153,2024-04-17,2024-04-17 09:18:20,S003,C001675,Card,56.3,5.63,1,gen_20251127_091607,transactions_header.csv
T00002079,2024-10-27,2024-10-27 11:32:51,S014,C000454,Online,$75.21,11.28,4,gen_20251127_091605,transactions_header.csv
T00004372,08/21/24,2024-08-21 09:11:46,S018,C004976,Cash,80.28,0.0,1,gen_20251127_091606,transactions_header.csv
T00017241,06/20/24,2024-06-20 23:25:36,S017,C002019,Cash,-67.22,0.0,1,gen_20251127_091607,transactions_header.csv
T00011380,2024-11-08,2024-11-08 06:06:05,S019,C000748,Cash,85.67,0.0,1,gen_20251127_091606,transactions_header.csv
T00016192,09/29/24,2024-09-29 15:02:31,S011,C000576,Card,0,0.0,3,gen_20251127_091607,transactions_header.csv
T00006926,07/12/24,2024-07-12 20:25:19,S028,C002699,Card,48.26,4.83,3,gen_20251127_091606,transactions_header.csv
T00000001,2024-01-27,2024-01-27 14:49:37,S009,,Card,21.44,1.07,2,gen_20251127_091605,transactions_header.csv
T00007502,04/12/24,2024-04-12 09:11:47,S020,,Online,$101.30,5.07,2,gen_20251127_091606,transactions_header.csv
T00009392,2024-10-16,2024-10-16 20:46:54,S028,C003051,Online,$35.60,5.34,7,gen_20251127_091606,transactions_header.csv
T00016442,06/09/24,2024-06-09 22:45:19,S009,C000233,Online,83.66,0.0,1,gen_20251127_091607,transactions_header.csv
T00010388,2024-01-03,2024-01-03 14:36:01,S025,C001318,Card,19.5,1.95,1,gen_20251127_091606,transactions_header.csv
T00005469,2024-10-05,2024-10-05 16:36:58,S018,C004928,Online,$55.51,5.55,1,gen_20251127_091606,transactions_header.csv
T00015635,2024-01-02,2024-01-02 21:50:42,S001,C001750,Card,26.39,3.96,5,gen_20251127_091607,transactions_header.csv
T00002145,06/16/24,2024-06-16 00:28:34,S007,,Online,99.85,9.98,1,gen_20251127_091605,transactions_header.csv
T00014494,05/23/24,2024-05-23 17:45:12,S028,C000366,Card,80.18,12.03,2,gen_20251127_091607,transactions_header.csv
T00008478,2024-07-17,2024-07-17 16:45:53,S022,C000246,card,42.9,2.15,1,gen_20251127_091606,transactions_header.csv
T00015058,2024-08-16,2024-08-16 14:20:57,S030,C003223,Card,71.67,0.0,1,gen_20251127_091607,transactions_header.csv
T00003683,09/28/24,2024-09-28 20:00:21,S005,C000633,Online,89.69,4.48,1,gen_20251127_091606,transactions_header.csv
T00008724,2024-02-17,2024-02-17 02:07:31,S023,C004701,Card,93.58,9.36,1,gen_20251127_091606,transactions_header.csv
T00002067,2024-01-30,2024-01-30 08:52:09,S006,C003950,Cash,41.99,6.3,6,gen_20251127_091605,transactions_header.csv
T00019478,2024-04-25,2024-04-25 15:48:33,S004,C003630,Cash,43.55,2.18,1,gen_20251127_091607,transactions_header.csv
T00019242,02/21/24,2024-02-21 11:37:49,S014,C001694,Card,15.84,0.79,2,gen_20251127_091607,transactions_header.csv
T00015785,2024-02-28,2024-02-28 12:41:32,S025,C002003,Cash,-79.14,3.96,5,gen_20251127_091607,transactions_header.csv
T00019409,06/04/24,2024-06-04 17:49:16,S027,C004576,Online,33.57,1.68,3,gen_20251127_091607,transactions_header.csv
T00002272,2024-03-12,2024-03-12 11:10:36,S011,C003636,Cash,58.67,8.8,2,gen_20251127_091605,transactions_header.csv
T00013407,2024-01-15,2024-01-15 03:44:46,S011,C001463,Card,43.51,6.53,1,gen_20251127_091607,transactions_header.csv
T00017645,2024-08-08,2024-08-08 21:56:41,S006,C003546,Online,40.23,4.02,1,gen_20251127_091607,transactions_header.csv
T00003560,2024-06-15,2024-06-15 06:21:56,S020,NA,Card,54.57,8.19,5,gen_20251127_091606,transactions_header.csv
T00013142,04/16/24,2024-04-16 17:55:38,S004,C002194,Cash,36.28,3.63,7,gen_20251127_091607,transactions_header.csv
T00009543,04/01/24,2024-04-01 23:13:56,S012,C004946,Online,33.2,1.66,6,gen_20251127_091606,transactions_header.csv
T00012291,06/23/24,2024-06-23 02:15:58,S007,C002621,Cash,$43.02,0.0,1,gen_20251127_091607,transactions_header.csv
T00016170,2024-09-14,2024-09-14 04:57:11,S004,C001895,Online,120.26,18.04,3,gen_20251127_091607,transactions_header.csv
T00018544,2024-11-06,2024-11-06 07:00:29,S021,C004752,Cash,25.16,2.52,2,gen_20251127_091607,transactions_header.csv
T00010200,2024-02-29,2024-02-29 11:10:23,S011,C001059,Card,114.07,17.11,7,gen_20251127_091606,transactions_header.csv
T00015144,11/30/24,2024-11-30 11:38:00,S030,C003691,Card,81.64,8.16,1,gen_20251127_091607,transactions_header.csv
T00014732,11/15/24,2024-11-15 16:12:46,S014,,Card,36.77,0.0,2,gen_20251127_091607,transactions_header.csv
T00015612,2024-11-07,2024-11-07 00:29:33,S023,C003644,Online,42.18,2.11,4,gen_20251127_091607,transactions_header.csv
T00011098,10/09/24,2024-10-09 16:48:53,S003,C003231,Cash,24.62,0.0,1,gen_20251127_091606,transactions_header.csv
T00018632,01/24/24,2024-01-24 20:58:35,S019,C003311,Card,12.49,1.87,1,gen_20251127_091607,transactions_header.csv
T00005023,2024-03-20,2024-03-20 11:05:44,S008,,Cash,77.0,3.85,3,gen_20251127_091606,transactions_header.csv
T00006245,2024-01-09,2024-01-09 12:27:37,S025,C001499,Online,55.62,5.56,1,gen_20251127_091606,transactions_header.csv
T00018532,11/25/24,2024-11-25 05:06:04,S027,C003962,Online,46.18,2.31,8,gen_20251127_091607,transactions_header.csv
T00006933,07/08/24,2024-07-08 06:23:55,S018,C002869,Card,80.96,,1,gen_20251127_091606,transactions_header.csv
T00009781,12/28/24,2024-12-28 21:13:59,S001,,Online,54.6,5.46,1,gen_20251127_091606,transactions_header.csv
T00009251,09/11/24,2024-09-11 23:05:28,S026,C003596,Online,30.53,0.0,1,gen_20251127_091606,transactions_header.csv
T00004732,2024-06-02,2024-06-02 23:00:44,S017,C002069,Cash,79.41,3.97,1,gen_20251127_091606,transactions_header.csv
T00018688,09/22/24,2024-09-22 05:38:13,S011,,Cash,39.05,1.95,3,gen_20251127_091607,transactions_header.csv
T00013837,2024-12-24,2024-12-24 15:07:40,S026,C002280,Card,39.99,6.0,1,gen_20251127_091607,transactions_header.csv
T00015719,2024-08-02,2024-08-02 21:55:09,S011,C001757,Cash,104.9,10.49,1,gen_20251127_091607,transactions_header.csv
T00003450,12/08/24,2024-12-08 19:07:55,S009,C001007,Online,$110.46,5.52,1,gen_20251127_091606,transactions_header.csv
T00012843,04/26/24,2024-04-26 12:24:23,S018,NA,Cash,60.22,9.03,2,gen_20251127_091607,transactions_header.csv
T00005724,2024-08-08,2024-08-08 14:10:18,S025,C000596,Cash,26.11,NA,2,gen_20251127_091606,transactions_header.csv
T00006370,2024-03-06,2024-03-06 09:50:28,S017,C001070,Cash,19.64,1.96,1,gen_20251127_091606,transactions_header.csv
T00014201,04/08/24,2024-04-08 23:16:58,S012,C000619,Online,28.53,0.0,1,gen_20251127_091607,transactions_header.csv
T00017663,2024-01-26,2024-01-26 13:05:29,S012,C002700,Online,42.36,6.35,8,gen_20251127_091607,transactions_header.csv
T00010658,06/10/24,2024-06-10 03:45:02,S021,C001636,Cash,$80.68,8.07,1,gen_20251127_091606,transactions_header.csv
T00013935,2024-07-07,2024-07-07 02:06:03,S006,C000051,Card,111.19,0.0,1,gen_20251127_091607,transactions_header.csv
T00019890,2024-08-04,2024-08-04 13:12:30,S011,C003694,Online,$20.00,2.0,2,gen_20251127_091607,transactions_header.csv
T00015883,05/24/24,2024-05-24 11:53:19,S018,C003929,Online,82.22,8.22,2,gen_20251127_091607,transactions_header.csv
T00007592,02/13/24,2024-02-13 20:23:03,S022,C002195,Cash,41.75,0.0,8,gen_20251127_091606,transactions_header.csv
T00019843,2024-12-09,2024-12-09 22:33:06,S007,,Cash,$73.01,10.95,1,gen_20251127_091607,transactions_header.csv
T00009821,2024-11-23,2024-11-23 21:00:36,S006,C002336,Cash,68.46,10.27,1,gen_20251127_091606,transactions_header.csv
T00009618,03/07/24,2024-03-07 14:45:41,S010,C000683,Cash,36.04,1.8,4,gen_20251127_091606,transactions_header.csv
T00017219,12/11/24,2024-12-11 22:16:21,S017,C000901,card,0.3,,1,gen_20251127_091607,transactions_header.csv
T00017954,2024-05-10,2024-05-10 14:38:23,S013,,Cash,60.6,0.0,2,gen_20251127_091607,transactions_header.csv
T00018838,2024-10-31,2024-10-31 17:35:24,S020,C003481,Card,110.54,16.58,8,gen_20251127_091607,transactions_header.csv
T00019216,02/10/24,2024-02-10 22:30:11,S020,C004739,card,56.29,5.63,3,gen_20251127_091607,transactions_header.csv
T00001176,12/07/24,2024-12-07 09:29:02,S002,,card,$44.23,NA,2,gen_20251127_091605,transactions_header.csv
T00009697,07/24/24,2024-07-24 00:46:40,S014,C001727,Cash,71.84,7.18,2,gen_20251127_091606,transactions_header.csv
T00013177,2024-09-15,2024-09-15 22:29:55,S028,C003379,Online,3.72,0.56,7,gen_20251127_091607,transactions_header.csv
T00017438,2024-04-15,2024-04-15 07:14:59,S004,C003684,Online,55.35,0.0,1,gen_20251127_091607,transactions_header.csv
T00009718,2024-02-14,2024-02-14 15:40:32,S007,C000799,Card,7.74,0.39,3,gen_20251127_091606,transactions_header.csv
T00014867,2024-04-01,2024-04-01 04:59:37,S010,,Online,$27.69,0.0,1,gen_20251127_091607,transactions_header.csv
T00006187,03/26/24,2024-03-26 15:18:49,S022,C002315,Card,22.54,1.13,3,gen_20251127_091606,transactions_header.csv
T00011844,2024-10-07,2024-10-07 19:56:42,S011,C003624,Card,48.26,0.0,1,gen_20251127_091607,transactions_header.csv
T00005035,2024-06-12,2024-06-12 07:45:30,S019,,Card,58.15,5.82,5,gen_20251127_091606,transactions_header.csv
T00017393,2024-07-30,2024-07-30 05:18:27,S009,C003558,Card,58.85,8.83,1,gen_20251127_091607,transactions_header.csv
T00013215,01/24/24,2024-01-24 11:22:36,S028,C002669,card,34.56,1.73,1,gen_20251127_091607,transactions_header.csv
T00015646,07/15/24,2024-07-15 22:11:14,S015,,Card,53.74,5.37,1,gen_20251127_091607,transactions_header.csv
T00005924,2024-02-14,2024-02-14 15:14:46,S014,C004777,Online,58.09,2.9,2,gen_20251127_091606,transactions_header.csv
T00016825,01/18/24,2024-01-18 13:12:11,S013,C002262,Cash,67.52,,7,gen_20251127_091607,transactions_header.csv
T00014352,12/09/24,2024-12-09 17:29:13,S023,C002529,Card,84.5,4.23,2,gen_20251127_091607,transactions_header.csv
T00011752,07/28/24,2024-07-28 10:29:38,S008,,Card,38.78,3.88,5,gen_20251127_091607,transactions_header.csv
T00006016,12/14/24,2024-12-14 11:56:11,S015,C000644,Cash,49.37,0.0,1,gen_20251127_091606,transactions_header.csv
T00008543,11/29/24,2024-11-29 17:06:48,S003,C004982,Cash,43.57,0.0,1,gen_20251127_091606,transactions_header.csv
T00010060,02/13/24,2024-02-13 03:37:09,S025,C002377,Online,19.59,0.98,1,gen_20251127_091606,transactions_header.csv
T00007278,2024-05-21,2024-05-21 19:24:26,S016,C000945,Cash,65.31,6.53,2,gen_20251127_091606,transactions_header.csv
T00003264,05/11/24,2024-05-11 22:48:04,S019,C002426,Card,39.34,0.0,1,gen_20251127_091606,transactions_header.csv
T00019765,02/12/24,2024-02-12 08:45:40,S027,C002784,Card,75.22,7.52,1,gen_20251127_091607,transactions_header.csv
T00011185,12/24/24,2024-12-24 11:06:44,S019,C002595,Cash,50.7,0.0,1,gen_20251127_091606,transactions_header.csv
T00007557,2024-07-14,2024-07-14 10:28:59,S030,C004250,Card,45.3,,2,gen_20251127_091606,transactions_header.csv
T00012755,2024-05-01,2024-05-01 01:52:47,S028,C002367,Online,105.53,15.83,3,gen_20251127_091607,transactions_header.csv
T00012768,2024-02-05,2024-02-05 17:55:20,S015,C001901,Online,41.72,4.17,7,gen_20251127_091607,transactions_header.csv
T00011563,11/01/24,2024-11-01 17:50:21,S025,C002310,Cash,74.21,0.0,2,gen_20251127_091606,transactions_header.csv
T00001167,12/28/24,2024-12-28 19:37:48,S022,C002983,Cash,25.28,3.79,2,gen_20251127_091605,transactions_header.csv
T00011392,2024-06-29,2024-06-29 19:29:40,S018,C000166,Card,13.35,0.0,1,gen_20251127_091606,transactions_header.csv
T00014402,2024-06-15,2024-06-15 08:23:21,S008,C003037,Cash,32.99,3.3,2,gen_20251127_091607,transactions_header.csv
T00018423,08/03/24,2024-08-03 17:33:35,S014,,Card,45.92,4.59,1,gen_20251127_091607,transactions_header.csv
T00019660,09/26/24,2024-09-26 18:03:37,S013,C004694,Card,50.34,0.0,1,gen_20251127_091607,transactions_header.csv
T00010052,2024-07-10,2024-07-10 23:50:40,S014,C003088,Cash,64.64,3.23,1,gen_20251127_091606,transactions_header.csv
T00013358,2024-06-11,2024-06-11 05:07:48,S004,,Card,37.18,5.58,7,gen_20251127_091607,transactions_header.csv
T00015655,08/26/24,2024-08-26 16:14:41,S012,C001489,Card,68.15,6.82,1,gen_20251127_091607,transactions_header.csv
T00005720,09/03/24,2024-09-03 00:35:56,S019,C002835,Online,77.31,0.0,1,gen_20251127_091606,transactions_header.csv
T00001784,03/02/24,2024-03-02 16:44:21,S028,C004109,Card,6.46,0.65,2,gen_20251127_091605,transactions_header.csv
T00001414,08/19/24,2024-08-19 12:14:53,S030,C003308,Card,86.91,0.0,1,gen_20251127_091605,transactions_header.csv
T00001131,09/26/24,2024-09-26 07:57:37,S020,C001978,Cash,$72.09,0.0,2,gen_20251127_091605,transactions_header.csv
T00003571,07/07/24,2024-07-07 14:13:22,S024,C000728,Cash,61.3,3.06,3,gen_20251127_091606,transactions_header.csv
T00012034,01/28/24,2024-01-28 09:00:07,S022,C000900,Cash,97.42,4.87,1,gen_20251127_091607,transactions_header.csv
T00013736,04/12/24,2024-04-12 00:46:23,S008,C004195,Online,81.55,8.15,3,gen_20251127_091607,transactions_header.csv
T00013962,2024-07-24,2024-07-24 10:56:35,S006,,Online,23.37,0.0,2,gen_20251127_091607,transactions_header.csv
T00010423,09/26/24,2024-09-26 15:32:29,S021,C004518,Online,70.94,7.09,1,gen_20251127_091606,transactions_header.csv
T00007402,2024-04-07,2024-04-07 00:00:28,S005,C004770,Card,1.71,0.26,1,gen_20251127_091606,transactions_header.csv
T00014602,12/18/24,2024-12-18 06:52:43,S023,C004906,Card,73.39,7.34,2,gen_20251127_091607,transactions_header.csv
T00001622,04/24/24,2024-04-24 23:25:47,S010,C002642,card,54.31,8.15,1,gen_20251127_091605,transactions_header.csv
T00005338,03/22/24,2024-03-22 06:05:35,S023,C004654,Cash,49.62,2.48,8,gen_20251127_091606,transactions_header.csv
T00011918,2024-01-22,2024-01-22 13:15:38,S007,C003017,online,100.26,5.01,2,gen_20251127_091607,transactions_header.csv
T00008529,04/05/24,2024-04-05 07:18:33,S030,C004148,Cash,29.23,2.92,2,gen_20251127_091606,transactions_header.csv
T00008087,09/12/24,2024-09-12 02:31:34,S024,C003303,Card,23.71,1.19,7,gen_20251127_091606,transactions_header.csv
T00010665,2024-10-12,2024-10-12 19:22:01,S005,C000324,Cash,76.6,11.49,6,gen_20251127_091606,transactions_header.csv
T00015198,2024-12-31,2024-12-31 04:25:58,S009,C001348,Card,8.29,0.0,1,gen_20251127_091607,transactions_header.csv
T00017043,05/12/24,2024-05-12 02:35:15,S014,C001185,Online,69.32,3.47,1,gen_20251127_091607,transactions_header.csv
T00008183,2024-11-20,2024-11-20 19:25:44,S013,C002145,Online,13.49,0.67,4,gen_20251127_091606,transactions_header.csv
T00009254,10/23/24,2024-10-23 10:25:40,S010,C002634,Card,$70.16,7.02,3,gen_20251127_091606,transactions_header.csv
T00011273,2024-07-12,2024-07-12 04:21:12,S018,NA,Online,0,0.0,1,gen_20251127_091606,transactions_header.csv
T00010044,2024-04-17,2024-04-17 20:02:38,S016,,Online,26.85,4.03,1,gen_20251127_091606,transactions_header.csv
T00007682,2024-08-19,2024-08-19 01:29:50,S012,C001132,Online,53.55,2.68,2,gen_20251127_091606,transactions_header.csv
T00005866,2024-07-28,2024-07-28 06:47:05,S030,C001857,Card,71.01,10.65,2,gen_20251127_091606,transactions_header.csv
T00018659,2024-11-05,2024-11-05 08:41:30,S007,C002989,Cash,56.08,8.41,2,gen_20251127_091607,transactions_header.csv
T00003299,2024-07-14,2024-07-14 11:30:06,S011,C000739,Card,30.99,1.55,1,gen_20251127_091606,transactions_header.csv
T00013880,05/12/24,2024-05-12 23:02:29,S013,NA,Card,42.55,0.0,1,gen_20251127_091607,transactions_header.csv
T00018452,12/18/24,2024-12-18 14:42:57,S017,C004503,Cash,96.71,4.84,2,gen_20251127_091607,transactions_header.csv
T00012136,2024-12-03,2024-12-03 14:43:41,S017,C000955,Cash,81.03,12.15,2,gen_20251127_091607,transactions_header.csv
T00009619,2024-03-18,2024-03-18 15:17:00,S020,C000482,Card,52.07,7.81,1,gen_20251127_091606,transactions_header.csv
T00012786,2024-03-21,2024-03-21 20:04:44,S030,,Cash,15.02,1.5,2,gen_20251127_091607,transactions_header.csv
T00008399,09/07/24,2024-09-07 21:30:04,S020,C000211,Online,80.08,0.0,2,gen_20251127_091606,transactions_header.csv
T00006221,09/01/24,2024-09-01 01:46:23,S014,C000435,Cash,73.75,3.69,1,gen_20251127_091606,transactions_header.csv
T00005273,2024-03-28,2024-03-28 08:23:55,S007,C004567,Online,104.28,0.0,2,gen_20251127_091606,transactions_header.csv
T00005136,2024-11-23,2024-11-23 14:30:10,S013,C004986,Card,43.35,4.33,7,gen_20251127_091606,transactions_header.csv
T00003711,07/09/24,2024-07-09 23:44:58,S001,C002934,Cash,34.3,0.0,3,gen_20251127_091606,transactions_header.csv
T00016397,11/23/24,2024-11-23 03:38:02,S011,C004053,Online,57.78,2.89,1,gen_20251127_091607,transactions_header.csv
T00010354,01/27/24,2024-01-27 02:42:32,S020,C001184,Card,93.72,4.69,1,gen_20251127_091606,transactions_header.csv
T00012234,07/02/24,2024-07-02 00:13:44,S013,C002234,Card,42.4,,1,gen_20251127_091607,transactions_header.csv
T00004591,2024-04-22,2024-04-22 15:26:40,S005,,Cash,73.04,10.96,2,gen_20251127_091606,transactions_header.csv
T00012377,2024-03-27,2024-03-27 05:11:10,S002,C004182,Card,30.9,1.54,1,gen_20251127_091607,transactions_header.csv
T00006625,01/05/24,2024-01-05 23:29:42,S002,C002028,Cash,137.91,,1,gen_20251127_091606,transactions_header.csv
T00003296,2024-12-13,2024-12-13 01:59:46,S003,C004394,Card,34.76,,2,gen_20251127_091606,transactions_header.csv
T00019415,06/22/24,2024-06-22 15:38:58,S016,C003151,Cash,49.2,0.0,4,gen_20251127_091607,transactions_header.csv
T00006358,2024-01-04,2024-01-04 08:56:42,S009,C003294,Online,35.72,0.0,2,gen_20251127_091606,transactions_header.csv
T00008915,2024-12-08,2024-12-08 07:07:08,S010,C003308,Online,140.01,0.0,2,gen_20251127_091606,transactions_header.csv
T00013219,03/08/24,2024-03-08 22:26:12,S011,C002243,Card,83.21,0.0,2,gen_20251127_091607,transactions_header.csv
T00006292,09/25/24,2024-09-25 18:48:34,S026,C004705,Card,121.39,0.0,1,gen_20251127_091606,transactions_header.csv
T00006260,11/10/24,2024-11-10 07:44:05,S011,C001506,Cash,56.93,2.85,2,gen_20251127_091606,transactions_header.csv
T00013401,2024-07-23,2024-07-23 14:31:58,S024,C004861,Online,88.24,4.41,4,gen_20251127_091607,transactions_header.csv
T00009318,06/15/24,2024-06-15 23:39:55,S024,C003310,Online,82.89,4.14,2,gen_20251127_091606,transactions_header.csv
T00013413,2024-09-01,2024-09-01 19:52:49,S016,C001684,Card,62.21,NA,1,gen_20251127_091607,transactions_header.csv
T00008650,04/01/24,2024-04-01 05:06:42,S006,,Online,45.1,,3,gen_20251127_091606,transactions_header.csv
T00009936,07/29/24,2024-07-29 16:18:47,S008,,Online,14.37,0.72,1,gen_20251127_091606,transactions_header.csv
T00015537,2024-10-16,2024-10-16 22:30:45,S028,C003547,Online,27.34,4.1,1,gen_20251127_091607,transactions_header.csv
T00006650,2024-04-02,2024-04-02 19:53:31,S010,C001736,Card,31.39,0.0,1,gen_20251127_091606,transactions_header.csv
T00016369,2024-11-12,2024-11-12 21:25:17,S029,C002551,Card,43.23,4.32,1,gen_20251127_091607,transactions_header.csv
T00015294,2024-06-24,2024-06-24 11:01:24,S022,C004050,Online,40.35,2.02,2,gen_20251127_091607,transactions_header.csv
T00011585,2024-01-07,2024-01-07 15:33:05,S007,C001049,Online,72.16,10.82,1,gen_20251127_091606,transactions_header.csv
T00019823,08/23/24,2024-08-23 21:54:41,S029,C004765,Card,2.67,0.4,1,gen_20251127_091607,transactions_header.csv
T00006849,2024-07-05,2024-07-05 22:55:20,S013,C001798,Online,59.96,6.0,3,gen_20251127_091606,transactions_header.csv
T00005385,2024-05-05,2024-05-05 11:53:15,S024,NA,Cash,29.38,0.0,6,gen_20251127_091606,transactions_header.csv
T00012515,2024-11-17,2024-11-17 04:59:21,S015,C002329,Card,27.84,1.39,1,gen_20251127_091607,transactions_header.csv
T00007133,11/20/24,2024-11-20 17:56:47,S010,C001473,Card,54.38,,1,gen_20251127_091606,transactions_header.csv
T00007016,02/11/24,2024-02-11 14:08:00,S018,C004438,Cash,55.71,0.0,1,gen_20251127_091606,transactions_header.csv
T00018186,2024-05-11,2024-05-11 03:38:36,S002,C004711,Card,32.89,,6,gen_20251127_091607,transactions_header.csv
T00014440,2024-05-14,2024-05-14 09:51:55,S027,C000671,Online,$122.68,0.0,2,gen_20251127_091607,transactions_header.csv
T00000484,2024-02-10,2024-02-10 11:54:38,S028,C001900,Cash,44.74,2.24,2,gen_20251127_091605,transactions_header.csv
T00009244,09/05/24,2024-09-05 23:57:36,S021,C003248,Card,17.66,1.77,2,gen_20251127_091606,transactions_header.csv
T00001316,08/28/24,2024-08-28 10:10:51,S007,C002638,Online,73.53,3.68,1,gen_20251127_091605,transactions_header.csv
T00003016,2024-07-25,2024-07-25 03:51:27,S011,C000731,Cash,22.71,3.41,4,gen_20251127_091606,transactions_header.csv
T00013707,09/13/24,2024-09-13 03:05:51,S030,C001771,Cash,49.32,7.4,2,gen_20251127_091607,transactions_header.csv
T00018759,2024-04-15,2024-04-15 10:56:08,S005,C003707,Cash,16.43,0.82,4,gen_20251127_091607,transactions_header.csv
T00010347,2024-06-02,2024-06-02 11:19:30,S024,C004014,Online,71.56,10.73,2,gen_20251127_091606,transactions_header.csv
T00018751,2024-11-03,2024-11-03 23:45:06,S011,C003636,Cash,26.4,2.64,1,gen_20251127_091607,transactions_header.csv
T00012912,2024-08-05,2024-08-05 03:30:56,S013,C000096,Online,69.05,6.91,2,gen_20251127_091607,transactions_header.csv
T00018327,01/16/24,2024-01-16 13:23:16,S001,C004864,Card,36.22,,2,gen_20251127_091607,transactions_header.csv
T00008837,12/26/24,2024-12-26 18:55:57,S017,C004831,Online,70.02,,2,gen_20251127_091606,transactions_header.csv
T00016113,2024-07-31,2024-07-31 23:30:09,S030,C001084,Online,51.22,5.12,6,gen_20251127_091607,transactions_header.csv
T00018861,11/03/24,2024-11-03 11:50:05,S004,C002910,Card,26.71,4.01,1,gen_20251127_091607,transactions_header.csv
T00008901,2024-08-22,2024-08-22 12:58:19,S009,C001561,Online,0,0.0,2,gen_20251127_091606,transactions_header.csv
T00002486,09/05/24,2024-09-05 20:57:30,S028,C002474,Cash,36.46,1.82,1,gen_20251127_091605,transactions_header.csv
T00012241,2024-05-14,2024-05-14 12:15:08,S011,C004499,Card,61.18,NA,6,gen_20251127_091607,transactions_header.csv
T00010975,01/02/24,2024-01-02 16:21:42,S019,,online,60.29,3.01,8,gen_20251127_091606,transactions_header.csv
T00013009,08/09/24,2024-08-09 01:58:10,S008,C001011,Online,$24.60,1.23,6,gen_20251127_091607,transactions_header.csv
T00015334,2024-06-25,2024-06-25 20:28:21,S006,C003237,Cash,100.75,15.11,1,gen_20251127_091607,transactions_header.csv
T00000908,03/13/24,2024-03-13 01:15:15,S002,C003590,Cash,80.76,4.04,2,gen_20251127_091605,transactions_header.csv
T00001577,2024-03-13,2024-03-13 22:25:30,S030,C002494,Cash,5.73,0.86,7,gen_20251127_091605,transactions_header.csv
T00007810,11/26/24,2024-11-26 03:19:08,S006,C001544,Online,46.68,7.0,3,gen_20251127_091606,transactions_header.csv
T00011808,08/25/24,2024-08-25 13:07:11,S020,C003251,Cash,35.66,1.78,2,gen_20251127_091607,transactions_header.csv
T00015249,04/21/24,2024-04-21 13:34:25,S008,C004510,Card,68.2,3.41,1,gen_20251127_091607,transactions_header.csv
T00019917,06/06/24,2024-06-06 07:01:16,S022,C002171,Cash,63.65,3.18,3,gen_20251127_091607,transactions_header.csv
T00001340,03/06/24,2024-03-06 04:27:19,S006,,Cash,65.31,3.27,1,gen_20251127_091605,transactions_header.csv
T00005835,2024-03-25,2024-03-25 10:22:18,S029,C002253,Cash,2.48,0.37,2,gen_20251127_091606,transactions_header.csv
T00014252,05/12/24,2024-05-12 21:05:34,S008,C000815,Card,37.09,,2,gen_20251127_091607,transactions_header.csv
T00013666,2024-12-09,2024-12-09 15:01:11,S019,C002796,Online,$53.49,8.02,3,gen_20251127_091607,transactions_header.csv
T00005602,2024-02-12,2024-02-12 04:50:19,S015,C003186,Online,39.23,1.96,2,gen_20251127_091606,transactions_header.csv
T00018642,2024-11-14,2024-11-14 14:27:12,S004,C000748,Online,50.64,2.53,2,gen_20251127_091607,transactions_header.csv
T00006386,2024-06-10,2024-06-10 11:48:48,S023,C001358,Online,-34.11,0.0,1,gen_20251127_091606,transactions_header.csv
T00008886,2024-06-18,2024-06-18 23:31:59,S003,C003436,Online,42.17,2.11,2,gen_20251127_091606,transactions_header.csv
T00001990,2024-06-02,2024-06-02 05:17:39,S012,C001023,Card,85.28,0.0,2,gen_20251127_091605,transactions_header.csv
T00005906,2024-02-10,2024-02-10 20:24:46,S025,C003944,Online,$65.63,NA,1,gen_20251127_091606,transactions_header.csv
T00007337,10/28/24,2024-10-28 21:33:56,S014,C000528,Cash,23.86,1.19,1,gen_20251127_091606,transactions_header.csv
T00016947,2024-12-14,2024-12-14 10:28:04,S004,C000871,Cash,12.85,1.29,2,gen_20251127_091607,transactions_header.csv
T00012027,10/15/24,2024-10-15 07:11:36,S017,C004416,Cash,2.14,0.21,1,gen_20251127_091607,transactions_header.csv
T00015970,07/04/24,2024-07-04 05:04:36,S004,C004580,Cash,28.94,1.45,2,gen_20251127_091607,transactions_header.csv
T00004741,2024-12-01,2024-12-01 08:46:58,S005,C002052,Online,48.69,7.3,1,gen_20251127_091606,transactions_header.csv
T00014830,11/25/24,2024-11-25 22:30:23,S015,C000750,Card,79.24,NA,1,gen_20251127_091607,transactions_header.csv
T00004270,2024-12-28,2024-12-28 12:42:21,S006,C002788,Card,30.91,1.55,1,gen_20251127_091606,transactions_header.csv
T00019300,2024-02-02,2024-02-02 17:23:18,S012,C000611,Online,40.95,0.0,1,gen_20251127_091607,transactions_header.csv
T00000122,08/29/24,2024-08-29 02:45:17,S029,C000189,Cash,19.4,0.0,2,gen_20251127_091605,transactions_header.csv
T00002610,09/16/24,2024-09-16 16:00:17,S015,C000118,card,133.22,0.0,1,gen_20251127_091605,transactions_header.csv
T00005422,2024-05-08,2024-05-08 09:24:53,S002,C003088,Card,51.55,NA,2,gen_20251127_091606,transactions_header.csv
T00020000,2024-09-20,2024-09-20 23:10:57,S003,C001748,Cash,57.05,8.56,2,gen_20251127_091608,transactions_header.csv
T00017639,2024-05-16,2024-05-16 21:18:12,S006,C001639,Online,30.96,NA,1,gen_20251127_091607,transactions_header.csv
T00010698,2024-10-01,2024-10-01 03:40:54,S026,C004486,Online,51.42,7.71,4,gen_20251127_091606,transactions_header.csv
T00003837,2024-11-03,2024-11-03 11:19:16,S026,C002093,Cash,29.17,1.46,1,gen_20251127_091606,transactions_header.csv
T00015795,2024-07-01,2024-07-01 07:48:49,S011,C000787,Cash,82.42,8.24,2,gen_20251127_091607,transactions_header.csv
T00000954,04/10/24,2024-04-10 16:59:06,S026,C003402,Cash,$17.72,1.77,7,gen_20251127_091605,transactions_header.csv
T00015793,2024-04-07,2024-04-07 09:28:37,S006,C001410,Card,85.92,12.89,6,gen_20251127_091607,transactions_header.csv
T00004059,04/20/24,2024-04-20 21:57:08,S016,C002696,Cash,64.15,6.42,1,gen_20251127_091606,transactions_header.csv
T00013034,2024-06-03,2024-06-03 23:47:41,S015,,Online,19.7,1.97,6,gen_20251127_091607,transactions_header.csv
T00011331,07/06/24,2024-07-06 22:12:20,S019,C000125,Online,86.69,NA,1,gen_20251127_091606,transactions_header.csv
T00015798,07/20/24,2024-07-20 11:04:46,S009,C002634,Cash,0,0,2,gen_20251127_091607,transactions_header.csv
T00014148,2024-03-23,2024-03-23 02:16:03,S015,C003602,Online,24.97,1.25,2,gen_20251127_091607,transactions_header.csv
T00011823,05/23/24,2024-05-23 14:11:35,S006,C003570,Card,71.06,0.0,2,gen_20251127_091607,transactions_header.csv
T00010528,07/25/24,2024-07-25 14:48:36,S010,C001586,Card,66.22,0.0,1,gen_20251127_091606,transactions_header.csv
T00004631,07/30/24,2024-07-30 04:42:25,S024,C004357,Online,7.91,0.79,2,gen_20251127_091606,transactions_header.csv
T00002541,2024-09-01,2024-09-01 09:21:14,S004,C001023,Card,56.48,NA,1,gen_20251127_091605,transactions_header.csv
T00005278,11/06/24,2024-11-06 12:48:38,S008,C000639,Cash,53.03,2.65,1,gen_20251127_091606,transactions_header.csv
T00001271,2024-02-22,2024-02-22 14:08:18,S010,C004858,Online,$56.86,0.0,1,gen_20251127_091605,transactions_header.csv
T00005459,08/27/24,2024-08-27 05:42:20,S028,,Card,84.97,8.5,1,gen_20251127_091606,transactions_header.csv
T00005555,2024-06-13,2024-06-13 08:07:46,S010,C000364,Cash,61.23,0.0,1,gen_20251127_091606,transactions_header.csv
T00001692,2024-01-04,2024-01-04 20:01:55,S026,,Card,15.8,0.79,2,gen_20251127_091605,transactions_header.csv
T00017722,03/06/24,2024-03-06 04:04:27,S019,C001314,Online,83.22,8.32,1,gen_20251127_091607,transactions_header.csv
T00017522,11/29/24,2024-11-29 08:49:50,S022,C002975,Online,67.81,10.17,3,gen_20251127_091607,transactions_header.csv
T00009923,10/24/24,2024-10-24 18:34:40,S001,C003551,Cash,0,0.0,2,gen_20251127_091606,transactions_header.csv
T00002728,2024-11-15,2024-11-15 21:52:55,S015,,Card,89.6,13.44,2,gen_20251127_091605,transactions_header.csv
T00009788,2024-06-14,2024-06-14 22:26:27,S019,C003652,Online,0,0,8,gen_20251127_091606,transactions_header.csv
T00016256,07/03/24,2024-07-03 01:58:15,S012,C000434,Cash,2.4,0.12,2,gen_20251127_091607,transactions_header.csv
T00011317,01/21/24,2024-01-21 12:16:04,S026,,card,18.88,1.89,7,gen_20251127_091606,transactions_header.csv
T00014745,2024-12-22,2024-12-22 23:37:32,S004,C000673,Card,$66.59,3.33,1,gen_20251127_091607,transactions_header.csv
T00013236,09/20/24,2024-09-20 16:23:44,S007,C004644,Cash,61.23,9.18,3,gen_20251127_091607,transactions_header.csv
T00002975,2024-12-23,2024-12-23 17:05:05,S011,C004185,Online,38.41,5.76,1,gen_20251127_091606,transactions_header.csv
T00015397,2024-03-24,2024-03-24 00:01:48,S005,C004164,Online,11.72,NA,1,gen_20251127_091607,transactions_header.csv
T00007406,2024-09-07,2024-09-07 04:21:00,S028,C004969,Card,$65.45,6.55,6,gen_20251127_091606,transactions_header.csv
T00017356,12/10/24,2024-12-10 23:46:45,S008,C000972,Cash,15.88,0.0,1,gen_20251127_091607,transactions_header.csv
T00002046,07/08/24,2024-07-08 12:10:00,S027,C003428,Cash,0,0.0,1,gen_20251127_091605,transactions_header.csv
T00019309,2024-08-15,2024-08-15 18:47:32,S025,C003758,Card,-56.42,2.82,2,gen_20251127_091607,transactions_header.csv
T00014878,2024-02-12,2024-02-12 17:29:02,S030,,Cash,13.77,1.38,1,gen_20251127_091607,transactions_header.csv
T00008342,2024-07-26,2024-07-26 23:04:10,S014,C003233,Card,$73.85,,1,gen_20251127_091606,transactions_header.csv
T00014998,2024-04-20,2024-04-20 15:21:47,S029,C000559,card,48.06,,1,gen_20251127_091607,transactions_header.csv
T00002737,11/07/24,2024-11-07 15:12:37,S022,C000011,Card,73.64,3.68,4,gen_20251127_091605,transactions_header.csv
T00017762,2024-11-20,2024-11-20 15:52:40,S015,C004987,Cash,0,0.0,1,gen_20251127_091607,transactions_header.csv
T00007388,2024-07-20,2024-07-20 12:26:12,S011,C000530,Card,$43.93,6.59,6,gen_20251127_091606,transactions_header.csv
T00001209,06/19/24,2024-06-19 09:15:08,S014,C002071,Card,47.95,0.0,7,gen_20251127_091605,transactions_header.csv
T00013873,01/14/24,2024-01-14 19:49:17,S030,C003983,Online,62.49,,2,gen_20251127_091607,transactions_header.csv
T00011360,05/13/24,2024-05-13 06:20:21,S018,C001316,Cash,39.48,5.92,1,gen_20251127_091606,transactions_header.csv
T00008917,03/21/24,2024-03-21 17:38:04,S021,C003938,Online,43.71,6.56,2,gen_20251127_091606,transactions_header.csv
T00019755,10/24/24,2024-10-24 01:30:36,S024,C000440,Card,50.07,2.5,1,gen_20251127_091607,transactions_header.csv
T00017293,07/07/24,2024-07-07 04:00:13,S017,C003582,online,91.86,4.59,2,gen_20251127_091607,transactions_header.csv
T00019732,10/26/24,2024-10-26 05:06:33,S010,C001437,Card,49.98,7.5,1,gen_20251127_091607,transactions_header.csv
T00019561,10/15/24,2024-10-15 14:20:00,S001,C004792,Card,15.24,0.0,3,gen_20251127_091607,transactions_header.csv
T00016330,08/13/24,2024-08-13 04:34:50,S001,C004541,Online,44.81,6.72,1,gen_20251127_091607,transactions_header.csv
T00015809,2024-07-03,2024-07-03 14:24:46,S016,C003388,Online,12.88,0.64,4,gen_20251127_091607,transactions_header.csv
T00012981,2024-07-16,2024-07-16 05:05:16,S030,C004134,Cash,54.01,2.7,4,gen_20251127_091607,transactions_header.csv
T00001091,2024-07-27,2024-07-27 20:51:04,S019,C001278,Online,$68.22,10.23,1,gen_20251127_091605,transactions_header.csv
T00003121,03/02/24,2024-03-02 02:37:54,S005,C004000,Card,67.33,0.0,1,gen_20251127_091606,transactions_header.csv
T00019603,2024-06-26,2024-06-26 21:13:09,S003,,Online,48.84,,1,gen_20251127_091607,transactions_header.csv
T00014048,02/01/24,2024-02-01 18:11:13,S003,C000480,Card,30.99,0.0,1,gen_20251127_091607,transactions_header.csv
T00003509,04/03/24,2024-04-03 12:09:22,S008,C004006,Card,42.43,2.12,2,gen_20251127_091606,transactions_header.csv
T00004849,2024-01-24,2024-01-24 21:13:55,S017,C001740,Cash,6.47,0.0,2,gen_20251127_091606,transactions_header.csv
T00001534,2024-01-06,2024-01-06 14:10:21,S028,C003350,Online,50.19,2.51,3,gen_20251127_091605,transactions_header.csv
T00004673,06/15/24,2024-06-15 19:49:48,S023,C003905,Cash,0.7,NA,2,gen_20251127_091606,transactions_header.csv
T00001412,04/03/24,2024-04-03 14:59:40,S025,C001598,Card,8.48,0.85,1,gen_20251127_091605,transactions_header.csv
T00010187,2024-08-13,2024-08-13 05:20:16,S014,C002401,Online,67.19,3.36,3,gen_20251127_091606,transactions_header.csv
T00015036,05/10/24,2024-05-10 03:10:47,S002,,Online,0,0.0,5,gen_20251127_091607,transactions_header.csv
T00003201,2024-10-24,2024-10-24 04:24:29,S012,C003643,Card,25.01,0.0,3,gen_20251127_091606,transactions_header.csv
T00003700,2024-01-01,2024-01-01 11:25:58,S003,C003703,Cash,23.24,0.0,1,gen_20251127_091606,transactions_header.csv
T00002615,09/20/24,2024-09-20 15:40:05,S001,C000149,Cash,34.84,3.48,1,gen_20251127_091605,transactions_header.csv
T00011630,05/13/24,2024-05-13 07:07:24,S012,C004983,Online,0,0,2,gen_20251127_091606,transactions_header.csv
T00017684,05/01/24,2024-05-01 00:41:32,S024,C000142,Cash,59.5,8.92,1,gen_20251127_091607,transactions_header.csv
T00002547,02/10/24,2024-02-10 15:29:53,S018,C001952,card,20.03,3.0,1,gen_20251127_091605,transactions_header.csv
T00003726,02/29/24,2024-02-29 20:07:27,S018,C001817,Cash,11.57,0.58,2,gen_20251127_091606,transactions_header.csv
T00004200,2024-06-17,2024-06-17 08:03:31,S023,,Online,0,,1,gen_20251127_091606,transactions_header.csv
T00004780,03/10/24,2024-03-10 02:06:48,S006,C001301,Cash,58.64,5.86,3,gen_20251127_091606,transactions_header.csv
T00010485,2024-10-26,2024-10-26 21:30:41,S022,,Cash,71.84,0.0,1,gen_20251127_091606,transactions_header.csv
T00002665,2024-09-11,2024-09-11 16:53:34,S006,C000666,Cash,72.91,3.65,1,gen_20251127_091605,transactions_header.csv
T00017752,09/14/24,2024-09-14 14:00:27,S015,C004630,Card,63.79,0.0,1,gen_20251127_091607,transactions_header.csv
T00011320,2024-03-01,2024-03-01 12:08:04,S020,C001329,Online,66.13,0.0,1,gen_20251127_091606,transactions_header.csv
T00016329,2024-01-23,2024-01-23 18:29:39,S006,C003931,Online,57.8,,1,gen_20251127_091607,transactions_header.csv
T00014585,11/30/24,2024-11-30 01:48:33,S001,C002781,Cash,44.36,6.65,2,gen_20251127_091607,transactions_header.csv
T00017419,2024-01-25,2024-01-25 23:45:36,S006,NA,Cash,14.53,0.73,1,gen_20251127_091607,transactions_header.csv
T00017735,2024-07-15,2024-07-15 20:24:29,S006,C004350,Card,81.07,0.0,1,gen_20251127_091607,transactions_header.csv
T00010255,11/04/24,2024-11-04 23:14:35,S010,C002486,Card,24.53,1.23,1,gen_20251127_091606,transactions_header.csv
T00001458,03/25/24,2024-03-25 18:06:27,S019,C004286,Cash,52.2,2.61,3,gen_20251127_091605,transactions_header.csv
T00007950,2024-09-14,2024-09-14 08:59:24,S013,C000392,Card,0,0.0,1,gen_20251127_091606,transactions_header.csv
T00017498,2024-07-12,2024-07-12 13:17:52,S026,C000851,Cash,110.51,16.58,2,gen_20251127_091607,transactions_header.csv
T00008497,2024-06-13,2024-06-13 18:54:04,S028,C000349,Cash,52.02,2.6,1,gen_20251127_091606,transactions_header.csv
T00015728,11/10/24,2024-11-10 21:34:40,S023,C003199,Cash,118.63,0.0,4,gen_20251127_091607,transactions_header.csv
T00013824,2024-02-10,2024-02-10 21:18:40,S001,C003187,Online,0,0.0,1,gen_20251127_091607,transactions_header.csv
T00018377,05/27/24,2024-05-27 21:06:32,S026,C002539,Card,72.72,7.27,3,gen_20251127_091607,transactions_header.csv
T00010907,11/18/24,2024-11-18 11:49:33,S007,C003466,Card,33.44,5.02,1,gen_20251127_091606,transactions_header.csv
T00013886,2024-12-08,2024-12-08 02:20:48,S017,C002528,Card,121.94,0.0,1,gen_20251127_091607,transactions_header.csv
T00006203,2024-08-23,2024-08-23 17:47:10,S028,C002934,Online,26.26,1.31,1,gen_20251127_091606,transactions_header.csv
T00010789,2024-04-23,2024-04-23 22:06:34,S016,C000623,Cash,61.78,9.27,1,gen_20251127_091606,transactions_header.csv
T00016581,02/09/24,2024-02-09 23:19:35,S023,C003022,Cash,24.37,0.0,2,gen_20251127_091607,transactions_header.csv
T00016452,2024-03-11,2024-03-11 16:09:42,S013,C002959,Online,44.27,0.0,2,gen_20251127_091607,transactions_header.csv
T00002951,2024-02-12,2024-02-12 03:16:19,S006,C000166,Card,0,0.0,3,gen_20251127_091606,transactions_header.csv
T00005759,2024-08-31,2024-08-31 11:48:14,S008,C001149,Cash,45.94,4.59,6,gen_20251127_091606,transactions_header.csv
T00001394,2024-08-10,2024-08-10 09:22:03,S028,C002439,Card,3.0,0.45,1,gen_20251127_091605,transactions_header.csv
T00019609,2024-04-06,2024-04-06 21:17:17,S020,C000623,Cash,46.38,6.96,1,gen_20251127_091607,transactions_header.csv
T00019707,12/05/24,2024-12-05 04:05:38,S002,C001800,Cash,44.69,,1,gen_20251127_091607,transactions_header.csv
T00007568,08/20/24,2024-08-20 16:52:07,S013,C000190,Online,6.05,0.0,2,gen_20251127_091606,transactions_header.csv
T00013832,2024-10-17,2024-10-17 07:37:04,S030,C003411,Card,45.52,0.0,5,gen_20251127_091607,transactions_header.csv
T00007354,2024-10-17,2024-10-17 21:44:46,S015,C002735,Cash,71.73,0.0,1,gen_20251127_091606,transactions_header.csv
T00003015,2024-11-19,2024-11-19 12:22:09,S005,C000784,cash,51.05,7.66,2,gen_20251127_091606,transactions_header.csv
T00015417,2024-11-18,2024-11-18 20:45:32,S027,C004753,Card,34.79,1.74,2,gen_20251127_091607,transactions_header.csv
T00016802,07/27/24,2024-07-27 18:26:23,S001,C000157,Online,90.33,9.03,1,gen_20251127_091607,transactions_header.csv
T00006978,08/22/24,2024-08-22 18:07:13,S030,C003486,Online,82.41,8.24,1,gen_20251127_091606,transactions_header.csv
T00013097,2024-04-15,2024-04-15 10:01:49,S004,,online,47.58,,1,gen_20251127_091607,transactions_header.csv
T00004549,01/17/24,2024-01-17 15:55:47,S020,C001307,Card,$49.48,0.0,2,gen_20251127_091606,transactions_header.csv
T00013642,2024-03-24,2024-03-24 15:09:15,S006,C001122,Online,68.66,NA,1,gen_20251127_091607,transactions_header.csv
T00008359,2024-07-27,2024-07-27 16:59:44,S018,C004903,Online,42.71,2.14,5,gen_20251127_091606,transactions_header.csv
T00013316,04/20/24,2024-04-20 22:02:14,S006,C002930,Cash,71.07,0.0,1,gen_20251127_091607,transactions_header.csv
T00019825,02/22/24,2024-02-22 07:39:18,S029,C002773,Online,40.48,4.05,8,gen_20251127_091607,transactions_header.csv
T00008930,07/15/24,2024-07-15 14:08:36,S030,C003617,Online,105.17,,1,gen_20251127_091606,transactions_header.csv
T00001768,05/14/24,2024-05-14 16:52:32,S020,C003254,Cash,61.4,6.14,1,gen_20251127_091605,transactions_header.csv
T00015332,2024-09-27,2024-09-27 23:24:01,S013,C000636,Online,49.75,,1,gen_20251127_091607,transactions_header.csv
T00011118,2024-12-06,2024-12-06 02:35:19,S008,NA,Online,105.21,0.0,3,gen_20251127_091606,transactions_header.csv
T00008484,2024-04-29,2024-04-29 11:47:19,S029,C002292,Card,59.11,5.91,1,gen_20251127_091606,transactions_header.csv
T00012819,2024-06-22,2024-06-22 03:41:42,S029,C002156,Online,39.24,1.96,2,gen_20251127_091607,transactions_header.csv
T00016948,2024-03-08,2024-03-08 04:52:59,S018,C004497,Card,111.72,0.0,5,gen_20251127_091607,transactions_header.csv
T00011296,2024-03-07,2024-03-07 00:36:15,S030,,Cash,$73.77,11.07,3,gen_20251127_091606,transactions_header.csv
T00010654,11/30/24,2024-11-30 11:21:40,S007,C002108,Cash,$0.00,0.0,3,gen_20251127_091606,transactions_header.csv
T00009332,2024-05-06,2024-05-06 06:51:51,S009,C004253,Online,53.73,5.37,1,gen_20251127_091606,transactions_header.csv
T00007917,05/28/24,2024-05-28 02:25:40,S019,C004890,Online,29.87,2.99,1,gen_20251127_091606,transactions_header.csv
T00019396,07/28/24,2024-07-28 15:11:35,S015,C001330,Card,87.14,8.71,1,gen_20251127_091607,transactions_header.csv
T00005858,03/23/24,2024-03-23 23:15:47,S022,C003827,Cash,82.3,4.12,2,gen_20251127_091606,transactions_header.csv
T00006246,2024-07-28,2024-07-28 01:07:05,S019,C003806,Card,$50.91,0.0,4,gen_20251127_091606,transactions_header.csv
T00010036,08/14/24,2024-08-14 23:05:50,S026,C000564,Card,8.9,0.45,1,gen_20251127_091606,transactions_header.csv
T00019075,02/23/24,2024-02-23 00:20:22,S029,C002662,Card,3.95,0.59,5,gen_20251127_091607,transactions_header.csv
T00011379,2024-01-13,2024-01-13 08:05:26,S024,C000540,Cash,94.33,NA,1,gen_20251127_091606,transactions_header.csv
T00014259,06/01/24,2024-06-01 23:34:07,S003,C004959,Cash,43.64,2.18,1,gen_20251127_091607,transactions_header.csv
T00012960,2024-08-25,2024-08-25 06:46:12,S016,C001180,Online,$23.64,1.18,2,gen_20251127_091607,transactions_header.csv
T00008021,12/04/24,2024-12-04 17:41:09,S003,C000667,Online,0,0.0,1,gen_20251127_091606,transactions_header.csv
T00006563,12/30/24,2024-12-30 13:27:26,S005,NA,Online,0,0.0,5,gen_20251127_091606,transactions_header.csv
T00006892,2024-12-11,2024-12-11 04:18:39,S019,C000733,Cash,$46.90,2.35,1,gen_20251127_091606,transactions_header.csv
T00009521,2024-05-29,2024-05-29 02:56:45,S023,C002466,Card,44.07,2.2,2,gen_20251127_091606,transactions_header.csv
T00004105,12/21/24,2024-12-21 22:57:35,S006,,Cash,16.59,2.49,1,gen_20251127_091606,transactions_header.csv
T00011498,2024-11-19,2024-11-19 18:11:14,S027,C001493,Online,35.87,0.0,1,gen_20251127_091606,transactions_header.csv
T00016465,01/14/24,2024-01-14 16:17:09,S022,NA,Cash,45.74,6.86,3,gen_20251127_091607,transactions_header.csv
T00013367,2024-03-04,2024-03-04 19:55:18,S002,C000665,Online,33.95,5.09,5,gen_20251127_091607,transactions_header.csv
T00013131,10/29/24,2024-10-29 15:43:06,S003,C003364,Cash,59.13,2.96,1,gen_20251127_091607,transactions_header.csv
T00015498,10/05/24,2024-10-05 08:10:40,S028,C000506,Cash,41.62,6.24,1,gen_20251127_091607,transactions_header.csv
T00005941,2024-08-11,2024-08-11 08:26:30,S014,C001799,Cash,65.14,3.26,1,gen_20251127_091606,transactions_header.csv
T00001003,2024-09-14,2024-09-14 06:25:46,S010,C001407,Cash,74.43,7.44,1,gen_20251127_091605,transactions_header.csv
T00001062,08/22/24,2024-08-22 07:00:02,S006,C001967,card,36.69,0.0,1,gen_20251127_091605,transactions_header.csv
T00014901,03/30/24,2024-03-30 00:56:52,S007,C001455,Online,87.6,NA,5,gen_20251127_091607,transactions_header.csv
T00014403,04/20/24,2024-04-20 02:43:41,S024,C001248,Cash,27.93,4.19,1,gen_20251127_091607,transactions_header.csv
T00005108,12/10/24,2024-12-10 13:29:23,S005,C003958,Cash,33.39,5.01,1,gen_20251127_091606,transactions_header.csv
T00009154,03/26/24,2024-03-26 23:02:52,S023,C002745,Online,$43.84,2.19,1,gen_20251127_091606,transactions_header.csv
T00017707,12/18/24,2024-12-18 07:05:15,S012,C002080,Card,50.89,0.0,1,gen_20251127_091607,transactions_header.csv
T00016782,05/30/24,2024-05-30 01:28:46,S007,,Cash,65.5,3.28,2,gen_20251127_091607,transactions_header.csv
T00009882,05/13/24,2024-05-13 07:52:53,S015,,Online,78.26,0.0,1,gen_20251127_091606,transactions_header.csv
T00014071,2024-11-21,2024-11-21 18:19:22,S001,C002748,Cash,3.88,,2,gen_20251127_091607,transactions_header.csv
T00006282,03/09/24,2024-03-09 19:19:10,S014,C004174,Cash,$16.37,1.64,4,gen_20251127_091606,transactions_header.csv
T00008036,09/09/24,2024-09-09 18:49:57,S012,C000878,Card,102.98,10.3,2,gen_20251127_091606,transactions_header.csv
T00011000,06/19/24,2024-06-19 18:52:46,S006,C004879,Card,0.03,0.0,1,gen_20251127_091606,transactions_header.csv
T00014243,2024-06-28,2024-06-28 16:03:30,S017,C004247,Online,110.67,16.6,2,gen_20251127_091607,transactions_header.csv
T00010820,2024-03-12,2024-03-12 05:05:24,S026,,Online,15.89,1.59,6,gen_20251127_091606,transactions_header.csv
T00006581,2024-05-20,2024-05-20 21:11:16,S022,C002113,Cash,84.42,4.22,5,gen_20251127_091606,transactions_header.csv
T00010085,04/22/24,2024-04-22 19:01:28,S030,C001401,Card,33.34,5.0,1,gen_20251127_091606,transactions_header.csv
T00019382,2024-06-13,2024-06-13 18:38:29,S027,C004482,Card,14.16,1.42,2,gen_20251127_091607,transactions_header.csv
T00012574,02/14/24,2024-02-14 11:36:38,S017,C002509,Card,27.0,4.05,2,gen_20251127_091607,transactions_header.csv
T00005454,10/26/24,2024-10-26 16:50:17,S005,C004087,Online,30.78,4.62,1,gen_20251127_091606,transactions_header.csv
T00002147,11/25/24,2024-11-25 09:54:19,S006,C002055,Cash,62.59,0.0,1,gen_20251127_091605,transactions_header.csv
T00016544,10/29/24,2024-10-29 05:19:07,S003,C003645,Cash,24.44,3.67,1,gen_20251127_091607,transactions_header.csv
T00005853,11/25/24,2024-11-25 10:14:11,S029,C004051,Card,23.17,3.48,4,gen_20251127_091606,transactions_header.csv
T00002663,05/24/24,2024-05-24 06:50:36,S016,C004069,Online,13.2,NA,1,gen_20251127_091605,transactions_header.csv
T00008966,2024-01-22,2024-01-22 20:08:16,S007,C002824,Cash,31.28,4.69,2,gen_20251127_091606,transactions_header.csv
T00014460,03/19/24,2024-03-19 14:36:03,S026,C000835,Card,18.36,0.0,4,gen_20251127_091607,transactions_header.csv
T00015052,2024-02-02,2024-02-02 05:37:06,S016,C004894,Online,75.59,11.34,2,gen_20251127_091607,transactions_header.csv
T00007528,05/05/24,2024-05-05 15:20:06,S012,,Online,100.84,NA,6,gen_20251127_091606,transactions_header.csv
T00015481,11/02/24,2024-11-02 06:17:51,S011,C002496,Online,32.12,3.21,1,gen_20251127_091607,transactions_header.csv
T00000587,2024-10-09,2024-10-09 01:23:05,S030,,Card,61.83,3.09,1,gen_20251127_091605,transactions_header.csv
T00017665,06/12/24,2024-06-12 00:50:50,S019,C002742,Online,65.81,6.58,3,gen_20251127_091607,transactions_header.csv
T00014859,2024-03-12,2024-03-12 03:48:12,S027,C002808,Card,50.3,5.03,1,gen_20251127_091607,transactions_header.csv
T00003195,02/04/24,2024-02-04 04:33:53,S027,C003301,Cash,36.41,5.46,1,gen_20251127_091606,transactions_header.csv
T00001838,2024-07-23,2024-07-23 06:16:47,S013,C000872,Card,10.26,0.51,1,gen_20251127_091605,transactions_header.csv
T00002954,01/31/24,2024-01-31 23:40:43,S008,C004719,Cash,50.11,5.01,1,gen_20251127_091606,transactions_header.csv
T00002267,2024-09-28,2024-09-28 23:15:07,S021,C000727,Cash,100.11,0.0,2,gen_20251127_091605,transactions_header.csv
T00011637,04/16/24,2024-04-16 03:37:13,S023,C003106,Card,85.26,0.0,1,gen_20251127_091606,transactions_header.csv
T00004694,05/17/24,2024-05-17 21:53:25,S015,C004148,Online,54.18,8.13,1,gen_20251127_091606,transactions_header.csv
T00010133,2024-01-12,2024-01-12 00:42:54,S016,C001211,Card,0,0,1,gen_20251127_091606,transactions_header.csv
T00011861,03/26/24,2024-03-26 18:31:18,S001,C001283,Card,63.27,9.49,1,gen_20251127_091607,transactions_header.csv
T00006025,2024-01-28,2024-01-28 08:21:48,S013,C002184,Cash,76.64,0.0,1,gen_20251127_091606,transactions_header.csv
T00016976,07/17/24,2024-07-17 17:46:23,S010,C001415,Online,119.25,0.0,6,gen_20251127_091607,transactions_header.csv
T00018394,02/15/24,2024-02-15 13:07:09,S027,C003570,Cash,73.41,,7,gen_20251127_091607,transactions_header.csv
T00007801,2024-03-27,2024-03-27 13:16:14,S001,C002771,online,20.14,2.01,6,gen_20251127_091606,transactions_header.csv
T00007609,04/11/24,2024-04-11 18:18:32,S028,C004654,Online,$62.64,,2,gen_20251127_091606,transactions_header.csv
T00006920,09/11/24,2024-09-11 06:15:06,S027,C003036,card,48.0,NA,1,gen_20251127_091606,transactions_header.csv
T00010713,03/09/24,2024-03-09 13:59:47,S001,C001389,Cash,42.43,4.24,2,gen_20251127_091606,transactions_header.csv
T00014898,2024-09-12,2024-09-12 18:46:14,S017,C002726,Cash,105.4,10.54,1,gen_20251127_091607,transactions_header.csv
T00003796,12/02/24,2024-12-02 07:03:19,S024,C004129,Online,72.27,7.23,2,gen_20251127_091606,transactions_header.csv
T00004448,01/02/24,2024-01-02 11:11:55,S012,C000097,Online,54.5,8.17,1,gen_20251127_091606,transactions_header.csv
T00001281,2024-03-13,2024-03-13 18:28:10,S018,C003457,Card,53.76,8.06,4,gen_20251127_091605,transactions_header.csv
T00017753,2024-09-09,2024-09-09 15:27:10,S004,C001932,Cash,$80.68,8.07,1,gen_20251127_091607,transactions_header.csv
T00018934,11/08/24,2024-11-08 08:36:53,S016,,Online,-4.67,0.23,2,gen_20251127_091607,transactions_header.csv
T00016756,12/11/24,2024-12-11 01:55:28,S006,C000425,Card,38.66,0.0,1,gen_20251127_091607,transactions_header.csv
T00010070,2024-01-14,2024-01-14 04:36:16,S020,C003864,Cash,61.38,9.21,1,gen_20251127_091606,transactions_header.csv
T00008949,03/29/24,2024-03-29 15:42:27,S019,C000481,Card,62.04,0.0,1,gen_20251127_091606,transactions_header.csv
T00011032,2024-01-19,2024-01-19 04:03:42,S023,C000978,Online,97.13,9.71,2,gen_20251127_091606,transactions_header.csv
T00012435,10/16/24,2024-10-16 03:33:27,S006,C004117,Cash,21.51,1.08,3,gen_20251127_091607,transactions_header.csv
T00008785,09/23/24,2024-09-23 00:44:00,S021,C002400,Card,40.47,2.02,1,gen_20251127_091606,transactions_header.csv
T00002639,2024-05-06,2024-05-06 15:49:21,S004,C003194,Cash,$45.77,2.29,2,gen_20251127_091605,transactions_header.csv
T00009876,10/15/24,2024-10-15 10:43:24,S021,C004393,card,14.09,2.11,1,gen_20251127_091606,transactions_header.csv
T00009855,04/13/24,2024-04-13 01:11:33,S028,C001043,Cash,85.63,4.28,1,gen_20251127_091606,transactions_header.csv
T00004485,11/28/24,2024-11-28 00:59:52,S002,C001273,Online,15.65,0.0,2,gen_20251127_091606,transactions_header.csv
T00019805,2024-02-11,2024-02-11 02:57:31,S006,,Card,12.85,1.29,1,gen_20251127_091607,transactions_header.csv
T00007151,10/30/24,2024-10-30 15:35:43,S010,C004958,Cash,71.15,,3,gen_20251127_091606,transactions_header.csv
T00009683,04/17/24,2024-04-17 06:46:18,S028,C002943,Card,18.11,2.72,1,gen_20251127_091606,transactions_header.csv
T00014765,2024-07-06,2024-07-06 14:39:40,S011,C003389,Card,62.65,9.4,1,gen_20251127_091607,transactions_header.csv
T00006594,2024-01-21,2024-01-21 15:07:33,S015,C004921,Online,101.45,10.15,2,gen_20251127_091606,transactions_header.csv
T00004198,2024-10-11,2024-10-11 11:37:18,S007,C000894,cash,64.92,9.74,3,gen_20251127_091606,transactions_header.csv
T00003546,03/13/24,2024-03-13 05:55:35,S001,C001257,Card,2.81,0.28,1,gen_20251127_091606,transactions_header.csv
T00015398,11/25/24,2024-11-25 12:10:16,S021,C001783,Card,41.62,,1,gen_20251127_091607,transactions_header.csv
T00005655,02/28/24,2024-02-28 18:08:53,S005,C002898,Cash,3.44,0.52,3,gen_20251127_091606,transactions_header.csv
T00009052,10/21/24,2024-10-21 18:53:08,S022,C003525,Cash,69.66,6.97,2,gen_20251127_091606,transactions_header.csv
T00002443,2024-11-16,2024-11-16 02:35:34,S003,C001456,Card,101.2,15.18,1,gen_20251127_091605,transactions_header.csv
T00006326,2024-12-10,2024-12-10 18:42:49,S026,C002602,Card,110.49,16.57,2,gen_20251127_091606,transactions_header.csv
T00015574,03/30/24,2024-03-30 01:06:32,S027,C004983,Cash,34.23,1.71,2,gen_20251127_091607,transactions_header.csv
T00001973,12/01/24,2024-12-01 22:27:46,S002,C003007,Card,28.53,4.28,2,gen_20251127_091605,transactions_header.csv
T00015289,06/28/24,2024-06-28 06:35:27,S004,C000346,Card,42.82,6.42,2,gen_20251127_091607,transactions_header.csv
T00001571,09/27/24,2024-09-27 11:23:07,S028,C002157,Card,51.82,7.77,1,gen_20251127_091605,transactions_header.csv
T00001399,07/14/24,2024-07-14 03:27:58,S024,C003091,Card,9.89,0.0,1,gen_20251127_091605,transactions_header.csv
T00002282,10/30/24,2024-10-30 05:01:34,S010,C003065,Online,32.35,0.0,1,gen_20251127_091605,transactions_header.csv
T00008824,2024-02-20,2024-02-20 17:51:17,S029,C002955,Cash,133.36,6.67,2,gen_20251127_091606,transactions_header.csv
T00007496,04/20/24,2024-04-20 20:06:01,S015,C002136,Card,62.55,6.25,7,gen_20251127_091606,transactions_header.csv
T00006530,11/07/24,2024-11-07 09:00:50,S030,C002815,Online,12.51,1.88,1,gen_20251127_091606,transactions_header.csv
T00002022,2024-02-29,2024-02-29 15:24:33,S009,C003753,Card,39.39,0.0,1,gen_20251127_091605,transactions_header.csv
T00010424,2024-06-29,2024-06-29 23:37:06,S003,C004279,Online,42.24,6.34,8,gen_20251127_091606,transactions_header.csv
T00017304,2024-01-19,2024-01-19 20:35:27,S023,C000280,cash,79.53,,2,gen_20251127_091607,transactions_header.csv
T00014613,04/02/24,2024-04-02 00:08:56,S001,C004856,Online,$3.06,0.15,1,gen_20251127_091607,transactions_header.csv
T00011401,05/07/24,2024-05-07 23:57:38,S028,C004160,Online,$76.85,3.84,1,gen_20251127_091606,transactions_header.csv
T00002506,2024-01-01,2024-01-01 16:39:40,S013,C004309,Cash,0,0.0,2,gen_20251127_091605,transactions_header.csv
T00006864,2024-07-22,2024-07-22 09:10:26,S030,C001981,Online,0,0,1,gen_20251127_091606,transactions_header.csv
T00009689,01/17/24,2024-01-17 12:37:43,S025,C000955,Cash,85.63,4.28,1,gen_20251127_091606,transactions_header.csv
T00004206,2024-12-24,2024-12-24 20:52:52,S014,C004491,Card,16.17,1.62,4,gen_20251127_091606,transactions_header.csv
T00002003,2024-07-28,2024-07-28 07:56:10,S014,C002101,Cash,84.49,12.67,1,gen_20251127_091605,transactions_header.csv
T00018853,05/08/24,2024-05-08 06:34:23,S030,C001694,Cash,57.61,5.76,1,gen_20251127_091607,transactions_header.csv
T00002557,09/08/24,2024-09-08 07:55:16,S015,C000739,Card,26.18,,1,gen_20251127_091605,transactions_header.csv
T00015832,02/27/24,2024-02-27 06:04:59,S025,C001079,Cash,45.89,4.59,2,gen_20251127_091607,transactions_header.csv
T00002306,04/10/24,2024-04-10 10:20:50,S009,C003625,Online,$110.17,11.02,1,gen_20251127_091605,transactions_header.csv
T00019794,2024-04-22,2024-04-22 08:35:09,S027,C002306,Cash,54.82,0.0,3,gen_20251127_091607,transactions_header.csv
T00004497,10/09/24,2024-10-09 02:13:04,S007,C001932,Cash,0,0.0,1,gen_20251127_091606,transactions_header.csv
T00008333,2024-02-04,2024-02-04 12:17:54,S025,C004730,Online,64.99,3.25,1,gen_20251127_091606,transactions_header.csv
T00013283,04/20/24,2024-04-20 23:44:56,S028,C001722,card,59.84,8.98,8,gen_20251127_091607,transactions_header.csv
T00008693,02/09/24,2024-02-09 17:23:45,S023,C002794,Card,62.51,6.25,1,gen_20251127_091606,transactions_header.csv
T00000903,10/13/24,2024-10-13 20:35:49,S021,C002724,Cash,81.76,0.0,3,gen_20251127_091605,transactions_header.csv
T00007307,07/11/24,2024-07-11 09:32:21,S026,C001782,Online,7.48,0.0,1,gen_20251127_091606,transactions_header.csv
T00017357,2024-08-05,2024-08-05 06:57:46,S012,C003251,Card,$64.03,9.6,1,gen_20251127_091607,transactions_header.csv
T00000182,2024-11-20,2024-11-20 05:04:15,S022,C004462,Cash,41.95,0.0,1,gen_20251127_091605,transactions_header.csv
T00001064,12/05/24,2024-12-05 19:47:22,S008,C004281,Cash,54.6,2.73,1,gen_20251127_091605,transactions_header.csv
T00017460,2024-11-20,2024-11-20 20:02:01,S013,C004817,Card,2.68,0.4,2,gen_20251127_091607,transactions_header.csv
T00018076,05/26/24,2024-05-26 03:45:15,S012,C004670,Online,42.1,6.32,3,gen_20251127_091607,transactions_header.csv
T00011508,12/13/24,2024-12-13 02:35:45,S028,C001446,Online,14.32,1.43,1,gen_20251127_091606,transactions_header.csv
T00017949,2024-12-26,2024-12-26 06:57:46,S026,C001518,Cash,53.81,5.38,1,gen_20251127_091607,transactions_header.csv
T00001854,2024-07-14,2024-07-14 00:22:07,S016,C001326,Card,29.03,1.45,1,gen_20251127_091605,transactions_header.csv
T00005997,07/03/24,2024-07-03 17:16:02,S026,C002343,Cash,43.23,6.48,1,gen_20251127_091606,transactions_header.csv
T00009732,02/25/24,2024-02-25 00:51:08,S018,C001804,Cash,$61.47,3.07,2,gen_20251127_091606,transactions_header.csv
T00006351,03/17/24,2024-03-17 04:20:39,S026,C004180,Online,67.53,6.75,3,gen_20251127_091606,transactions_header.csv
T00004904,11/10/24,2024-11-10 10:05:56,S029,C001752,Card,46.87,4.69,5,gen_20251127_091606,transactions_header.csv
T00009086,05/16/24,2024-05-16 13:05:53,S028,C002331,Online,68.28,3.41,2,gen_20251127_091606,transactions_header.csv
T00006052,2024-01-02,2024-01-02 19:55:51,S015,,Card,46.11,6.92,1,gen_20251127_091606,transactions_header.csv
T00001459,2024-12-22,2024-12-22 07:37:19,S021,C004494,Card,123.89,6.19,6,gen_20251127_091605,transactions_header.csv
T00004490,11/26/24,2024-11-26 10:10:26,S013,C004819,Cash,60.69,0.0,1,gen_20251127_091606,transactions_header.csv
T00014471,2024-06-09,2024-06-09 16:15:58,S024,C001429,Cash,40.91,4.09,2,gen_20251127_091607,transactions_header.csv
T00005654,2024-07-16,2024-07-16 13:22:47,S017,C004227,Online,$46.44,0.0,3,gen_20251127_091606,transactions_header.csv
T00011040,11/19/24,2024-11-19 03:35:15,S016,,card,38.59,0.0,2,gen_20251127_091606,transactions_header.csv
T00013322,12/17/24,2024-12-17 07:21:07,S007,C002363,Cash,50.98,2.55,3,gen_20251127_091607,transactions_header.csv
T00018365,08/12/24,2024-08-12 21:25:01,S010,C003662,Online,$26.57,0.0,1,gen_20251127_091607,transactions_header.csv
T00001927,2024-09-13,2024-09-13 23:45:55,S008,NA,Card,79.4,3.97,1,gen_20251127_091605,transactions_header.csv
T00008238,05/28/24,2024-05-28 08:05:43,S025,C000092,Card,59.57,,1,gen_20251127_091606,transactions_header.csv
T00016841,2024-07-06,2024-07-06 11:45:11,S029,C003790,Card,66.19,0.0,2,gen_20251127_091607,transactions_header.csv
T00010576,2024-04-01,2024-04-01 12:00:23,S004,NA,Online,53.27,7.99,1,gen_20251127_091606,transactions_header.csv
T00014927,07/05/24,2024-07-05 19:07:19,S024,C002214,Online,67.36,0.0,5,gen_20251127_091607,transactions_header.csv
T00016168,02/26/24,2024-02-26 00:08:26,S022,C003805,Online,70.72,7.07,1,gen_20251127_091607,transactions_header.csv
T00007031,2024-05-11,2024-05-11 06:15:57,S012,C003007,Online,9.34,,5,gen_20251127_091606,transactions_header.csv
T00017632,01/08/24,2024-01-08 13:50:16,S019,C002678,Card,-99.9,0.0,1,gen_20251127_091607,transactions_header.csv
T00000051,09/30/24,2024-09-30 20:00:55,S003,C000020,Online,78.17,0.0,1,gen_20251127_091605,transactions_header.csv
T00017628,03/18/24,2024-03-18 12:13:52,S022,C004075,Cash,40.45,2.02,1,gen_20251127_091607,transactions_header.csv
T00003657,2024-12-15,2024-12-15 04:05:09,S001,C004587,Cash,82.38,12.36,2,gen_20251127_091606,transactions_header.csv
T00006484,09/28/24,2024-09-28 14:34:34,S016,C000787,Card,28.21,2.82,2,gen_20251127_091606,transactions_header.csv
T00002498,03/20/24,2024-03-20 21:46:08,S020,C001820,Cash,63.18,6.32,2,gen_20251127_091605,transactions_header.csv
T00013960,05/06/24,2024-05-06 00:00:16,S030,C000621,Cash,84.01,12.6,1,gen_20251127_091607,transactions_header.csv
T00004973,06/24/24,2024-06-24 16:55:45,S005,C002376,Card,76.02,7.6,3,gen_20251127_091606,transactions_header.csv
T00016252,02/04/24,2024-02-04 19:04:31,S015,,Cash,76.06,7.61,4,gen_20251127_091607,transactions_header.csv
T00005091,2024-03-24,2024-03-24 15:29:30,S020,C004337,Card,53.07,5.31,1,gen_20251127_091606,transactions_header.csv
T00012165,03/08/24,2024-03-08 21:19:09,S023,C002569,Card,113.08,5.65,1,gen_20251127_091607,transactions_header.csv
T00002459,06/03/24,2024-06-03 08:23:40,S014,C000460,Card,74.23,7.42,3,gen_20251127_091605,transactions_header.csv
T00009091,02/07/24,2024-02-07 01:32:18,S021,C002188,Online,53.47,5.35,2,gen_20251127_091606,transactions_header.csv
T00015587,2024-07-18,2024-07-18 22:29:00,S029,C002209,Cash,92.71,13.91,2,gen_20251127_091607,transactions_header.csv
T00008611,2024-09-05,2024-09-05 19:36:57,S021,C004826,Cash,34.72,5.21,1,gen_20251127_091606,transactions_header.csv
T00008361,07/16/24,2024-07-16 13:16:06,S015,C003114,Cash,96.85,14.53,2,gen_20251127_091606,transactions_header.csv
T00008139,12/07/24,2024-12-07 13:55:39,S017,C003073,Card,61.05,3.05,1,gen_20251127_091606,transactions_header.csv
T00003948,11/24/24,2024-11-24 00:44:10,S024,C004528,Online,0,0,5,gen_20251127_091606,transactions_header.csv
T00007925,2024-09-17,2024-09-17 17:21:47,S003,C002128,Online,45.61,,4,gen_20251127_091606,transactions_header.csv
T00009799,2024-11-11,2024-11-11 01:11:45,S028,C001958,Cash,32.65,NA,1,gen_20251127_091606,transactions_header.csv
T00015772,2024-02-15,2024-02-15 17:39:26,S022,C000465,Cash,71.22,NA,2,gen_20251127_091607,transactions_header.csv
T00004190,09/19/24,2024-09-19 16:47:17,S030,C004386,Cash,26.08,0.0,1,gen_20251127_091606,transactions_header.csv
T00015733,11/19/24,2024-11-19 12:45:18,S001,C002825,Cash,48.06,2.4,5,gen_20251127_091607,transactions_header.csv
T00014387,08/19/24,2024-08-19 10:41:06,S027,C001076,Cash,0,0.0,2,gen_20251127_091607,transactions_header.csv
T00004421,09/21/24,2024-09-21 10:44:35,S017,C004361,Card,97.35,9.73,1,gen_20251127_091606,transactions_header.csv
T00007908,2024-08-31,2024-08-31 21:29:53,S006,C004206,Card,27.37,1.37,2,gen_20251127_091606,transactions_header.csv
T00017674,2024-03-13,2024-03-13 19:02:50,S018,C000541,Online,99.92,9.99,2,gen_20251127_091607,transactions_header.csv
T00017443,02/05/24,2024-02-05 09:45:05,S006,C004161,Online,95.94,14.39,1,gen_20251127_091607,transactions_header.csv
T00010462,2024-02-08,2024-02-08 13:12:51,S030,C002684,online,59.97,,4,gen_20251127_091606,transactions_header.csv
T00004149,12/12/24,2024-12-12 22:11:17,S008,C000058,Online,7.25,0.36,2,gen_20251127_091606,transactions_header.csv
T00008467,01/03/24,2024-01-03 00:00:49,S005,C004445,Card,26.3,NA,2,gen_20251127_091606,transactions_header.csv
T00001098,08/08/24,2024-08-08 09:21:32,S024,C000718,Online,0,0,1,gen_20251127_091605,transactions_header.csv
T00018623,11/23/24,2024-11-23 01:04:41,S004,C000500,Cash,0,0.0,1,gen_20251127_091607,transactions_header.csv
T00011056,2024-01-24,2024-01-24 06:40:38,S014,C003318,Card,80.61,4.03,1,gen_20251127_091606,transactions_header.csv
T00005161,2024-11-30,2024-11-30 19:03:52,S020,,Online,25.89,1.29,2,gen_20251127_091606,transactions_header.csv
T00016900,2024-12-04,2024-12-04 03:48:02,S016,C004585,Card,100.51,0.0,1,gen_20251127_091607,transactions_header.csv
T00011877,11/13/24,2024-11-13 11:56:12,S003,C001746,Online,31.13,NA,2,gen_20251127_091607,transactions_header.csv
T00015547,2024-07-02,2024-07-02 05:55:33,S004,C004168,Online,61.91,9.29,1,gen_20251127_091607,transactions_header.csv
T00012223,12/23/24,2024-12-23 15:21:20,S003,C001902,Online,65.49,9.82,1,gen_20251127_091607,transactions_header.csv
T00000206,04/07/24,2024-04-07 05:36:53,S015,C002825,Card,73.98,NA,1,gen_20251127_091605,transactions_header.csv
T00003951,2024-02-23,2024-02-23 01:34:48,S015,C002597,Card,63.96,3.2,3,gen_20251127_091606,transactions_header.csv
T00005928,03/08/24,2024-03-08 15:51:34,S029,C002123,card,51.97,0.0,1,gen_20251127_091606,transactions_header.csv
T00005024,2024-05-06,2024-05-06 21:36:41,S019,C002918,online,$66.06,3.3,1,gen_20251127_091606,transactions_header.csv
T00002087,2024-01-18,2024-01-18 23:48:56,S009,C002796,Card,0,0.0,2,gen_20251127_091605,transactions_header.csv
T00015504,10/09/24,2024-10-09 18:04:39,S017,C003198,Online,76.46,0.0,2,gen_20251127_091607,transactions_header.csv
T00003616,2024-01-30,2024-01-30 02:33:30,S009,C002388,Card,17.6,1.76,1,gen_20251127_091606,transactions_header.csv
T00018969,08/17/24,2024-08-17 13:42:13,S015,C001693,Card,$76.95,11.54,7,gen_20251127_091607,transactions_header.csv
T00001671,2024-02-15,2024-02-15 01:53:25,S021,NA,card,75.61,0.0,2,gen_20251127_091605,transactions_header.csv
T00006686,2024-11-19,2024-11-19 08:06:09,S023,C002570,Card,-58.85,5.89,2,gen_20251127_091606,transactions_header.csv
T00010697,03/15/24,2024-03-15 13:53:51,S014,C004467,Online,85.78,12.87,5,gen_20251127_091606,transactions_header.csv
T00006791,10/19/24,2024-10-19 08:05:07,S009,C004206,Cash,6.15,0.31,1,gen_20251127_091606,transactions_header.csv
T00002590,04/25/24,2024-04-25 03:31:53,S004,C002389,Card,12.18,1.83,1,gen_20251127_091605,transactions_header.csv
T00005118,12/27/24,2024-12-27 08:21:40,S030,C001294,Cash,82.81,12.42,6,gen_20251127_091606,transactions_header.csv
T00017069,2024-03-07,2024-03-07 10:50:40,S008,C003696,Cash,67.82,NA,6,gen_20251127_091607,transactions_header.csv
T00013294,2024-09-19,2024-09-19 02:51:34,S012,C004473,Online,73.66,3.68,7,gen_20251127_091607,transactions_header.csv
T00018483,08/12/24,2024-08-12 07:33:17,S013,C001020,Card,66.63,0.0,1,gen_20251127_091607,transactions_header.csv
T00000432,2024-03-19,2024-03-19 21:25:01,S025,C002932,Online,56.87,8.53,1,gen_20251127_091605,transactions_header.csv
T00002534,2024-03-17,2024-03-17 17:17:49,S002,C003022,Card,56.35,2.82,5,gen_20251127_091605,transactions_header.csv
T00002203,05/30/24,2024-05-30 07:40:27,S015,C001942,Cash,43.19,2.16,3,gen_20251127_091605,transactions_header.csv
T00001573,05/22/24,2024-05-22 07:42:39,S014,C000036,Online,64.6,NA,1,gen_20251127_091605,transactions_header.csv
T00013787,09/08/24,2024-09-08 22:17:40,S008,C002653,Online,54.26,2.71,2,gen_20251127_091607,transactions_header.csv
T00010629,2024-06-26,2024-06-26 23:11:53,S009,C004278,Online,27.28,0.0,1,gen_20251127_091606,transactions_header.csv
T00016613,2024-11-03,2024-11-03 01:08:01,S021,C002226,Card,20.51,2.05,1,gen_20251127_091607,transactions_header.csv
T00004511,2024-07-16,2024-07-16 17:25:03,S020,NA,Cash,0,0.0,6,gen_20251127_091606,transactions_header.csv
T00001278,2024-05-23,2024-05-23 05:04:17,S027,C004345,Card,12.83,1.92,5,gen_20251127_091605,transactions_header.csv
T00009684,11/19/24,2024-11-19 00:32:58,S004,C004072,Cash,35.69,,2,gen_20251127_091606,transactions_header.csv
T00007923,2024-05-26,2024-05-26 01:49:19,S012,C000666,Online,53.07,5.31,1,gen_20251127_091606,transactions_header.csv
T00006963,12/16/24,2024-12-16 05:20:42,S025,C000627,Cash,28.8,,1,gen_20251127_091606,transactions_header.csv
T00003779,12/10/24,2024-12-10 07:50:41,S010,C001187,Online,44.88,4.49,4,gen_20251127_091606,transactions_header.csv
T00005479,02/08/24,2024-02-08 06:22:41,S005,C001836,Cash,45.41,,1,gen_20251127_091606,transactions_header.csv
T00018672,12/28/24,2024-12-28 15:05:08,S023,C000355,Online,66.38,9.96,1,gen_20251127_091607,transactions_header.csv
T00010229,2024-07-03,2024-07-03 18:56:56,S026,C001871,Online,45.81,0.0,7,gen_20251127_091606,transactions_header.csv
T00008397,10/14/24,2024-10-14 18:06:42,S018,C004993,Cash,-60.25,9.04,1,gen_20251127_091606,transactions_header.csv
T00004107,2024-04-28,2024-04-28 06:40:43,S028,C003223,Card,73.16,,2,gen_20251127_091606,transactions_header.csv
T00019631,2024-10-16,2024-10-16 15:46:54,S021,C001455,Card,11.19,1.12,2,gen_20251127_091607,transactions_header.csv
T00017947,05/02/24,2024-05-02 10:49:12,S022,C001151,Cash,0,0.0,1,gen_20251127_091607,transactions_header.csv
T00004510,2024-11-28,2024-11-28 02:01:48,S010,NA,Cash,76.71,,2,gen_20251127_091606,transactions_header.csv
T00019519,03/25/24,2024-03-25 21:53:45,S008,C002385,Online,82.88,0.0,1,gen_20251127_091607,transactions_header.csv
T00010064,09/10/24,2024-09-10 03:32:03,S012,C000071,Card,151.22,15.12,1,gen_20251127_091606,transactions_header.csv
T00019845,2024-04-12,2024-04-12 20:05:49,S011,C002440,Card,23.56,NA,2,gen_20251127_091607,transactions_header.csv
T00001373,03/11/24,2024-03-11 21:41:29,S004,C004123,Online,42.79,NA,1,gen_20251127_091605,transactions_header.csv
T00000885,2024-07-02,2024-07-02 10:27:06,S021,C001011,Online,37.08,,2,gen_20251127_091605,transactions_header.csv
T00006827,2024-04-01,2024-04-01 11:37:53,S011,C002549,Cash,62.78,3.14,1,gen_20251127_091606,transactions_header.csv
T00001040,2024-06-17,2024-06-17 07:03:11,S024,C003903,Cash,20.49,1.02,1,gen_20251127_091605,transactions_header.csv
T00019725,2024-11-22,2024-11-22 16:25:06,S022,C004905,Cash,64.04,9.61,1,gen_20251127_091607,transactions_header.csv
T00001471,2024-06-24,2024-06-24 07:53:38,S011,NA,Cash,20.93,0.0,3,gen_20251127_091605,transactions_header.csv
T00014730,09/21/24,2024-09-21 05:02:14,S024,C001602,Cash,115.38,11.54,3,gen_20251127_091607,transactions_header.csv
T00000294,12/31/24,2024-12-31 10:39:50,S017,C002980,Card,62.07,3.1,7,gen_20251127_091605,transactions_header.csv
T00002446,2024-11-27,2024-11-27 03:42:02,S018,C000325,Card,26.61,1.33,2,gen_20251127_091605,transactions_header.csv
T00010734,2024-10-22,2024-10-22 06:45:09,S021,C000894,Cash,59.55,8.93,1,gen_20251127_091606,transactions_header.csv
T00008214,2024-02-02,2024-02-02 13:17:47,S004,C000602,Card,64.58,9.69,4,gen_20251127_091606,transactions_header.csv
T00017972,2024-04-09,2024-04-09 07:18:24,S018,C004633,Cash,0,0,2,gen_20251127_091607,transactions_header.csv
T00012483,07/25/24,2024-07-25 23:37:23,S012,C000440,Cash,113.95,11.4,2,gen_20251127_091607,transactions_header.csv
T00018345,2024-01-04,2024-01-04 11:01:08,S022,C001616,Online,50.59,2.53,2,gen_20251127_091607,transactions_header.csv
T00016422,01/21/24,2024-01-21 00:04:25,S005,C002748,Card,73.49,7.35,1,gen_20251127_091607,transactions_header.csv
T00014677,08/29/24,2024-08-29 13:30:00,S009,C003688,Card,70.05,7.0,1,gen_20251127_091607,transactions_header.csv
T00009238,2024-09-18,2024-09-18 19:16:12,S017,C000032,Cash,48.57,4.86,2,gen_20251127_091606,transactions_header.csv
T00012430,2024-03-27,2024-03-27 07:26:19,S003,C004920,Online,79.03,7.9,3,gen_20251127_091607,transactions_header.csv
T00005184,2024-01-25,2024-01-25 22:46:59,S018,C004622,Cash,73.49,11.02,1,gen_20251127_091606,transactions_header.csv
T00002096,2024-04-24,2024-04-24 01:21:31,S013,C003713,Online,14.65,1.47,1,gen_20251127_091605,transactions_header.csv
T00003858,2024-02-10,2024-02-10 21:01:32,S004,C001776,cash,31.02,,1,gen_20251127_091606,transactions_header.csv
T00018440,2024-10-26,2024-10-26 19:40:53,S019,C000935,Cash,24.83,0.0,2,gen_20251127_091607,transactions_header.csv
T00006149,08/29/24,2024-08-29 22:01:10,S005,NA,Card,46.51,6.98,1,gen_20251127_091606,transactions_header.csv
T00007302,2024-07-23,2024-07-23 18:45:40,S030,C001639,Cash,40.86,2.04,3,gen_20251127_091606,transactions_header.csv
T00003478,03/06/24,2024-03-06 05:39:11,S011,C002258,Online,91.5,13.72,1,gen_20251127_091606,transactions_header.csv
T00006162,02/24/24,2024-02-24 23:35:16,S019,C001487,Online,19.5,0.0,2,gen_20251127_091606,transactions_header.csv
T00001195,04/23/24,2024-04-23 11:42:48,S018,C002930,Card,58.84,0.0,1,gen_20251127_091605,transactions_header.csv
T00002637,05/14/24,2024-05-14 05:41:01,S028,C003472,Cash,52.69,5.27,2,gen_20251127_091605,transactions_header.csv
T00001011,2024-05-10,2024-05-10 20:33:58,S014,C002355,Card,33.38,,2,gen_20251127_091605,transactions_header.csv
T00006835,11/07/24,2024-11-07 17:27:30,S021,C000138,Card,$54.27,,3,gen_20251127_091606,transactions_header.csv
T00003653,10/05/24,2024-10-05 09:54:29,S009,C001635,Online,41.89,4.19,5,gen_20251127_091606,transactions_header.csv
T00011403,2024-02-26,2024-02-26 04:50:53,S019,C001572,Cash,67.65,6.77,4,gen_20251127_091606,transactions_header.csv
T00014056,2024-10-25,2024-10-25 04:29:01,S026,C002337,Cash,38.3,3.83,6,gen_20251127_091607,transactions_header.csv
T00003434,2024-03-02,2024-03-02 02:59:48,S015,,Online,0,0.0,2,gen_20251127_091606,transactions_header.csv
T00017606,2024-08-26,2024-08-26 00:24:40,S030,C003984,Online,0,0.0,1,gen_20251127_091607,transactions_header.csv
T00014383,2024-02-02,2024-02-02 10:01:36,S017,C004898,Online,82.05,8.21,1,gen_20251127_091607,transactions_header.csv
T00014660,05/14/24,2024-05-14 11:56:29,S024,C000798,Online,0,0,4,gen_20251127_091607,transactions_header.csv
T00013312,2024-05-28,2024-05-28 22:30:44,S006,C001116,Online,39.29,0.0,1,gen_20251127_091607,transactions_header.csv
T00015320,04/11/24,2024-04-11 01:40:31,S012,C004446,Cash,8.01,,1,gen_20251127_091607,transactions_header.csv
T00011308,2024-12-14,2024-12-14 15:38:06,S023,C000709,Cash,64.72,9.71,3,gen_20251127_091606,transactions_header.csv
T00012258,2024-01-29,2024-01-29 04:30:06,S002,C004479,Online,-50.12,5.01,2,gen_20251127_091607,transactions_header.csv
T00009786,07/07/24,2024-07-07 08:11:25,S025,,Cash,64.88,0.0,2,gen_20251127_091606,transactions_header.csv
T00000901,03/28/24,2024-03-28 05:15:44,S023,,Card,$14.58,2.19,2,gen_20251127_091605,transactions_header.csv
T00017319,2024-01-06,2024-01-06 16:17:09,S018,C000370,Online,85.86,8.59,1,gen_20251127_091607,transactions_header.csv
T00000935,10/11/24,2024-10-11 17:10:22,S012,C000901,Online,54.78,2.74,1,gen_20251127_091605,transactions_header.csv
T00006628,08/29/24,2024-08-29 14:54:18,S022,C000841,Cash,57.87,5.79,1,gen_20251127_091606,transactions_header.csv
T00009051,2024-10-09,2024-10-09 21:33:10,S028,C001546,Cash,79.48,3.97,1,gen_20251127_091606,transactions_header.csv
T00007713,2024-11-21,2024-11-21 09:33:18,S027,C004563,Card,90.63,13.59,1,gen_20251127_091606,transactions_header.csv
T00011991,05/13/24,2024-05-13 23:31:40,S006,,Online,15.81,0.0,1,gen_20251127_091607,transactions_header.csv
T00007503,03/27/24,2024-03-27 13:17:42,S014,C002141,Cash,44.16,0.0,2,gen_20251127_091606,transactions_header.csv
T00008140,2024-11-24,2024-11-24 08:20:49,S005,C004550,Cash,14.87,2.23,7,gen_20251127_091606,transactions_header.csv
T00018519,2024-01-04,2024-01-04 17:25:08,S009,C001522,Online,33.61,5.04,7,gen_20251127_091607,transactions_header.csv
T00003303,06/19/24,2024-06-19 03:38:13,S014,C002934,Cash,43.11,4.31,2,gen_20251127_091606,transactions_header.csv
T00001344,12/05/24,2024-12-05 17:15:55,S027,C004841,Cash,62.95,6.3,1,gen_20251127_091605,transactions_header.csv
T00009542,10/16/24,2024-10-16 02:06:56,S006,C000024,Card,82.38,0.0,4,gen_20251127_091606,transactions_header.csv
T00007555,2024-09-20,2024-09-20 19:41:51,S023,C003551,Card,41.06,0.0,1,gen_20251127_091606,transactions_header.csv
T00000360,07/23/24,2024-07-23 06:55:39,S027,C004076,Card,83.5,4.17,1,gen_20251127_091605,transactions_header.csv
T00012355,06/22/24,2024-06-22 16:17:55,S006,C004999,Cash,29.05,,1,gen_20251127_091607,transactions_header.csv
T00009241,2024-08-10,2024-08-10 03:42:05,S011,C002745,Cash,$41.97,2.1,4,gen_20251127_091606,transactions_header.csv
T00018577,2024-06-29,2024-06-29 19:53:40,S001,C001447,Cash,88.74,,1,gen_20251127_091607,transactions_header.csv
T00018062,07/15/24,2024-07-15 16:21:26,S004,C001752,Online,28.37,4.26,2,gen_20251127_091607,transactions_header.csv
T00000960,2024-05-27,2024-05-27 15:10:46,S005,C004274,Online,38.35,0.0,2,gen_20251127_091605,transactions_header.csv
T00018087,01/21/24,2024-01-21 01:49:17,S021,NA,Card,0.36,0.04,2,gen_20251127_091607,transactions_header.csv
T00001149,2024-03-23,2024-03-23 00:41:18,S020,C003907,Cash,14.09,0.7,1,gen_20251127_091605,transactions_header.csv
T00002955,09/23/24,2024-09-23 02:02:54,S007,C001513,Cash,18.79,0.94,1,gen_20251127_091606,transactions_header.csv
T00008826,2024-09-03,2024-09-03 14:25:19,S027,C004274,Cash,0,0.0,1,gen_20251127_091606,transactions_header.csv
T00004340,09/14/24,2024-09-14 17:28:33,S029,C003592,Card,66.41,6.64,1,gen_20251127_091606,transactions_header.csv
T00002052,2024-09-07,2024-09-07 08:29:03,S024,C002815,Card,16.27,1.63,2,gen_20251127_091605,transactions_header.csv
T00017205,2024-03-26,2024-03-26 18:15:59,S030,C001637,Cash,45.15,4.51,5,gen_20251127_091607,transactions_header.csv
T00002055,2024-09-11,2024-09-11 13:07:03,S001,C000039,Card,86.1,8.61,1,gen_20251127_091605,transactions_header.csv
T00012869,2024-01-02,2024-01-02 00:12:32,S026,C004151,Cash,67.25,6.73,1,gen_20251127_091607,transactions_header.csv
T00015116,04/06/24,2024-04-06 18:51:20,S012,C001580,Online,0,0.0,1,gen_20251127_091607,transactions_header.csv
T00015836,2024-07-10,2024-07-10 00:44:48,S026,C004408,Online,42.21,2.11,1,gen_20251127_091607,transactions_header.csv
T00002502,2024-05-22,2024-05-22 11:06:14,S022,C004327,Online,83.1,4.16,1,gen_20251127_091605,transactions_header.csv
T00018215,04/21/24,2024-04-21 22:12:02,S002,C003457,card,26.94,4.04,1,gen_20251127_091607,transactions_header.csv
T00008469,08/06/24,2024-08-06 21:45:49,S029,C002402,Online,51.73,0.0,1,gen_20251127_091606,transactions_header.csv
T00010130,08/11/24,2024-08-11 14:21:18,S020,C002488,Online,0,0.0,2,gen_20251127_091606,transactions_header.csv
T00013721,11/17/24,2024-11-17 08:38:54,S010,C004431,Online,55.44,8.32,3,gen_20251127_091607,transactions_header.csv
T00018982,2024-08-18,2024-08-18 09:48:05,S011,C001976,Cash,72.6,7.26,3,gen_20251127_091607,transactions_header.csv
T00015555,02/14/24,2024-02-14 06:04:09,S007,C002380,Online,94.93,4.75,1,gen_20251127_091607,transactions_header.csv
T00015069,2024-10-12,2024-10-12 04:23:56,S004,C001543,Card,25.21,0.0,1,gen_20251127_091607,transactions_header.csv
T00002324,02/09/24,2024-02-09 05:06:53,S021,,Card,15.36,0.0,1,gen_20251127_091605,transactions_header.csv
T00000223,06/05/24,2024-06-05 19:50:00,S030,C002415,Cash,81.81,8.18,1,gen_20251127_091605,transactions_header.csv
T00007569,12/02/24,2024-12-02 19:16:11,S027,C000143,Card,27.82,4.17,1,gen_20251127_091606,transactions_header.csv
T00009376,06/05/24,2024-06-05 02:13:41,S016,,Cash,31.41,4.71,2,gen_20251127_091606,transactions_header.csv
T00011751,02/26/24,2024-02-26 11:33:30,S010,C003725,Card,44.07,6.61,2,gen_20251127_091607,transactions_header.csv
T00004346,2024-01-10,2024-01-10 16:27:03,S013,C004504,Online,45.46,NA,1,gen_20251127_091606,transactions_header.csv
T00008659,2024-09-06,2024-09-06 22:22:00,S024,NA,Card,53.05,7.96,3,gen_20251127_091606,transactions_header.csv
T00003157,2024-08-20,2024-08-20 02:14:56,S006,C004333,Online,63.39,9.51,3,gen_20251127_091606,transactions_header.csv
T00000669,02/15/24,2024-02-15 23:39:04,S003,C004376,Online,53.77,8.07,6,gen_20251127_091605,transactions_header.csv
T00016255,04/24/24,2024-04-24 16:30:55,S004,C004174,Online,0,0.0,6,gen_20251127_091607,transactions_header.csv
T00007661,2024-12-08,2024-12-08 18:45:09,S009,C001789,Card,65.42,NA,4,gen_20251127_091606,transactions_header.csv
T00010854,02/02/24,2024-02-02 06:26:43,S024,C004852,cash,65.58,9.84,1,gen_20251127_091606,transactions_header.csv
T00005129,2024-05-11,2024-05-11 14:32:26,S025,C002886,Cash,50.68,2.53,8,gen_20251127_091606,transactions_header.csv
T00016140,10/31/24,2024-10-31 15:31:20,S006,,Online,70.44,0.0,1,gen_20251127_091607,transactions_header.csv
T00011522,07/15/24,2024-07-15 17:43:44,S025,C001189,Card,84.91,8.49,5,gen_20251127_091606,transactions_header.csv
T00018224,2024-05-17,2024-05-17 16:57:44,S004,C004302,Card,28.89,0.0,1,gen_20251127_091607,transactions_header.csv
T00008754,2024-05-01,2024-05-01 12:49:06,S018,C002668,Online,28.4,1.42,2,gen_20251127_091606,transactions_header.csv
T00013891,2024-02-26,2024-02-26 21:19:46,S030,C004363,Online,0,0.0,2,gen_20251127_091607,transactions_header.csv
T00014784,10/13/24,2024-10-13 02:16:45,S002,C001107,Cash,73.56,11.03,1,gen_20251127_091607,transactions_header.csv
T00003609,11/21/24,2024-11-21 16:29:22,S028,C002769,Cash,16.06,0.0,5,gen_20251127_091606,transactions_header.csv
T00017819,10/08/24,2024-10-08 20:49:50,S027,C001468,Cash,33.8,3.38,1,gen_20251127_091607,transactions_header.csv
T00013433,03/24/24,2024-03-24 21:52:03,S016,C001271,Cash,56.66,5.67,1,gen_20251127_091607,transactions_header.csv
T00005082,05/31/24,2024-05-31 00:33:52,S003,C001755,Cash,116.78,5.84,1,gen_20251127_091606,transactions_header.csv
T00019342,2024-12-13,2024-12-13 06:55:52,S021,C004423,Card,51.05,5.11,1,gen_20251127_091607,transactions_header.csv
T00004476,02/10/24,2024-02-10 00:03:49,S021,C004162,Card,106.1,0.0,1,gen_20251127_091606,transactions_header.csv
T00002609,2024-10-01,2024-10-01 18:45:43,S015,NA,Cash,123.4,12.34,1,gen_20251127_091605,transactions_header.csv
T00011119,07/21/24,2024-07-21 22:41:41,S014,C002832,Card,81.75,8.18,1,gen_20251127_091606,transactions_header.csv
T00004885,02/23/24,2024-02-23 16:48:51,S025,C003416,Online,58.67,2.93,3,gen_20251127_091606,transactions_header.csv
T00017563,2024-08-05,2024-08-05 17:57:34,S001,C000792,Cash,46.2,6.93,4,gen_20251127_091607,transactions_header.csv
T00004610,07/11/24,2024-07-11 12:28:10,S021,C001768,Card,39.07,5.86,1,gen_20251127_091606,transactions_header.csv
T00007976,05/11/24,2024-05-11 20:58:34,S015,C002397,Online,13.66,0.0,2,gen_20251127_091606,transactions_header.csv
T00019999,2024-08-26,2024-08-26 12:03:38,S012,C003074,Cash,-97.67,14.65,2,gen_20251127_091608,transactions_header.csv
T00004392,03/19/24,2024-03-19 09:10:38,S028,C003205,Card,31.54,1.58,1,gen_20251127_091606,transactions_header.csv
T00007937,2024-10-05,2024-10-05 21:05:29,S020,C000655,Card,77.1,0.0,5,gen_20251127_091606,transactions_header.csv
T00006211,12/04/24,2024-12-04 02:17:04,S005,C002286,Card,14.68,0.73,4,gen_20251127_091606,transactions_header.csv
T00002395,07/31/24,2024-07-31 17:06:15,S013,C001251,Cash,48.72,,1,gen_20251127_091605,transactions_header.csv
T00013271,2024-12-03,2024-12-03 20:39:34,S003,C002606,Online,94.99,4.75,1,gen_20251127_091607,transactions_header.csv
T00013858,12/03/24,2024-12-03 00:51:36,S019,C003350,Cash,91.23,4.56,1,gen_20251127_091607,transactions_header.csv
T00017511,09/27/24,2024-09-27 03:42:37,S009,C002450,Cash,44.68,0.0,1,gen_20251127_091607,transactions_header.csv
T00012913,2024-11-12,2024-11-12 21:07:10,S030,C001208,Card,58.37,0.0,2,gen_20251127_091607,transactions_header.csv
T00013130,11/23/24,2024-11-23 00:24:34,S003,C000621,Online,85.14,4.26,2,gen_20251127_091607,transactions_header.csv
T00005372,06/03/24,2024-06-03 08:11:34,S026,,Card,$57.61,,2,gen_20251127_091606,transactions_header.csv
T00014653,2024-03-28,2024-03-28 04:48:21,S027,C002424,Online,26.61,3.99,2,gen_20251127_091607,transactions_header.csv
T00018514,2024-03-05,2024-03-05 17:22:37,S020,C001038,cash,69.48,6.95,1,gen_20251127_091607,transactions_header.csv
T00008808,11/02/24,2024-11-02 01:01:36,S029,C001301,Online,69.49,0.0,1,gen_20251127_091606,transactions_header.csv
T00005558,04/29/24,2024-04-29 04:33:26,S025,C003843,Online,57.89,5.79,2,gen_20251127_091606,transactions_header.csv
T00003538,07/02/24,2024-07-02 18:51:31,S030,C000123,Cash,3.53,0.0,2,gen_20251127_091606,transactions_header.csv
T00015476,2024-06-06,2024-06-06 08:24:41,S009,C002213,Card,103.93,0.0,2,gen_20251127_091607,transactions_header.csv
T00013596,04/03/24,2024-04-03 19:36:14,S020,C003494,Card,0,0,1,gen_20251127_091607,transactions_header.csv
T00002747,2024-09-02,2024-09-02 14:35:57,S019,C001259,Cash,93.14,9.31,2,gen_20251127_091605,transactions_header.csv
T00000103,05/16/24,2024-05-16 11:09:24,S004,C000034,Online,47.64,0.0,1,gen_20251127_091605,transactions_header.csv
T00010382,12/19/24,2024-12-19 07:54:07,S008,C004516,Online,76.62,3.83,1,gen_20251127_091606,transactions_header.csv
T00001662,04/25/24,2024-04-25 13:55:37,S004,C001156,Cash,17.79,1.78,6,gen_20251127_091605,transactions_header.csv
T00013867,02/17/24,2024-02-17 03:42:43,S015,C003698,Cash,47.45,4.75,1,gen_20251127_091607,transactions_header.csv
T00007629,2024-12-15,2024-12-15 12:13:04,S026,C004221,Online,63.29,,2,gen_20251127_091606,transactions_header.csv
T00007986,2024-11-16,2024-11-16 03:17:02,S011,,Card,53.99,2.7,1,gen_20251127_091606,transactions_header.csv
T00009699,12/27/24,2024-12-27 02:47:23,S024,C003965,Online,10.61,0.53,2,gen_20251127_091606,transactions_header.csv
T00004348,10/17/24,2024-10-17 07:07:38,S007,C003186,Online,22.57,3.39,2,gen_20251127_091606,transactions_header.csv
T00012375,07/26/24,2024-07-26 17:54:56,S009,C004056,Card,35.93,5.39,1,gen_20251127_091607,transactions_header.csv
T00006914,06/26/24,2024-06-26 18:22:48,S015,C002556,Card,20.17,2.02,2,gen_20251127_091606,transactions_header.csv
T00001695,2024-06-01,2024-06-01 06:12:46,S019,C000963,Card,38.99,0.0,1,gen_20251127_091605,transactions_header.csv
T00014873,03/29/24,2024-03-29 21:37:44,S028,C000067,Online,53.21,2.66,2,gen_20251127_091607,transactions_header.csv
T00015654,2024-03-02,2024-03-02 19:07:26,S016,C003611,Card,60.82,3.04,2,gen_20251127_091607,transactions_header.csv
T00000519,2024-02-02,2024-02-02 11:03:38,S022,C003364,Cash,104.62,10.46,2,gen_20251127_091605,transactions_header.csv
T00011800,2024-01-18,2024-01-18 08:07:02,S004,C001083,Card,155.87,7.79,1,gen_20251127_091607,transactions_header.csv
T00008381,2024-06-07,2024-06-07 08:09:26,S023,C003276,Cash,56.74,5.67,2,gen_20251127_091606,transactions_header.csv
T00011787,2024-07-15,2024-07-15 05:24:21,S026,C002760,Cash,6.4,0.32,1,gen_20251127_091607,transactions_header.csv
T00013436,04/14/24,2024-04-14 01:05:20,S025,C001058,Online,81.43,NA,3,gen_20251127_091607,transactions_header.csv
T00002359,12/21/24,2024-12-21 04:29:48,S026,C004966,Online,61.17,0.0,2,gen_20251127_091605,transactions_header.csv
T00016304,02/05/24,2024-02-05 21:37:13,S018,C003404,Cash,51.98,5.2,6,gen_20251127_091607,transactions_header.csv
T00000938,2024-05-21,2024-05-21 17:20:07,S009,C002555,Online,72.94,7.29,6,gen_20251127_091605,transactions_header.csv
T00019801,2024-07-28,2024-07-28 19:01:44,S030,C003916,Cash,80.17,0.0,5,gen_20251127_091607,transactions_header.csv
T00006921,07/04/24,2024-07-04 10:00:30,S002,NA,Card,17.32,0.87,2,gen_20251127_091606,transactions_header.csv
T00012984,2024-01-05,2024-01-05 04:13:34,S021,C003620,Cash,52.72,2.64,1,gen_20251127_091607,transactions_header.csv
T00002135,09/23/24,2024-09-23 11:52:48,S009,C002571,Online,17.27,2.59,1,gen_20251127_091605,transactions_header.csv
T00008661,2024-09-19,2024-09-19 13:59:20,S030,C004027,Online,68.36,3.42,2,gen_20251127_091606,transactions_header.csv
T00007276,2024-02-25,2024-02-25 16:38:53,S008,C003867,Cash,19.95,2.0,2,gen_20251127_091606,transactions_header.csv
T00009114,2024-10-15,2024-10-15 13:44:19,S013,C003373,Cash,62.12,NA,1,gen_20251127_091606,transactions_header.csv
T00009839,10/03/24,2024-10-03 18:38:20,S025,NA,Online,30.38,0.0,2,gen_20251127_091606,transactions_header.csv
T00003120,2024-07-03,2024-07-03 03:55:17,S013,C000389,Online,87.44,8.74,2,gen_20251127_091606,transactions_header.csv
T00017863,2024-01-07,2024-01-07 07:09:42,S002,C004462,Card,0,0.0,2,gen_20251127_091607,transactions_header.csv
T00014748,2024-08-08,2024-08-08 23:57:23,S026,C000978,Online,82.25,4.11,1,gen_20251127_091607,transactions_header.csv
T00001211,2024-06-24,2024-06-24 05:23:02,S011,C004785,Card,4.11,0.21,2,gen_20251127_091605,transactions_header.csv
T00010563,2024-06-11,2024-06-11 01:06:09,S017,,Online,23.67,1.18,2,gen_20251127_091606,transactions_header.csv
T00001086,02/05/24,2024-02-05 13:51:42,S029,C001225,online,69.89,6.99,1,gen_20251127_091605,transactions_header.csv
T00016579,2024-11-22,2024-11-22 00:47:28,S009,C000548,Online,$32.93,4.94,2,gen_20251127_091607,transactions_header.csv
T00009130,07/01/24,2024-07-01 08:10:02,S021,C002555,cash,51.99,2.6,1,gen_20251127_091606,transactions_header.csv
T00005461,04/24/24,2024-04-24 03:06:55,S003,C001731,Card,$60.90,9.13,1,gen_20251127_091606,transactions_header.csv
T00009364,08/06/24,2024-08-06 22:31:55,S003,C000650,Cash,27.1,4.07,1,gen_20251127_091606,transactions_header.csv
T00010481,07/16/24,2024-07-16 04:07:50,S021,C001240,Cash,21.84,1.09,3,gen_20251127_091606,transactions_header.csv
T00013728,2024-09-22,2024-09-22 22:49:04,S001,C003221,Card,76.11,3.81,1,gen_20251127_091607,transactions_header.csv
T00011700,2024-07-23,2024-07-23 12:16:52,S012,C003706,Card,128.28,19.24,1,gen_20251127_091607,transactions_header.csv
T00013605,01/22/24,2024-01-22 17:18:40,S021,C000558,Cash,59.71,2.99,3,gen_20251127_091607,transactions_header.csv
T00012284,2024-07-19,2024-07-19 17:58:49,S020,NA,Cash,19.9,1.99,1,gen_20251127_091607,transactions_header.csv
T00003380,2024-03-23,2024-03-23 16:57:35,S018,C004006,Cash,46.06,2.3,2,gen_20251127_091606,transactions_header.csv
T00001319,2024-11-16,2024-11-16 15:46:21,S019,C001225,Card,74.54,7.45,1,gen_20251127_091605,transactions_header.csv
T00001770,2024-05-21,2024-05-21 08:31:54,S017,C000495,Online,29.72,4.46,2,gen_20251127_091605,transactions_header.csv
T00012790,09/30/24,2024-09-30 12:22:04,S007,C001659,Cash,21.09,1.05,2,gen_20251127_091607,transactions_header.csv
T00011492,08/04/24,2024-08-04 00:08:02,S006,C001504,Online,52.59,2.63,2,gen_20251127_091606,transactions_header.csv
T00006253,2024-01-17,2024-01-17 08:15:24,S015,C003023,Cash,96.76,0.0,1,gen_20251127_091606,transactions_header.csv
T00008289,2024-09-09,2024-09-09 02:19:21,S020,C002958,Online,12.44,1.24,2,gen_20251127_091606,transactions_header.csv
T00003563,09/27/24,2024-09-27 19:38:52,S002,C000557,Card,90.2,4.51,1,gen_20251127_091606,transactions_header.csv
T00000131,2024-09-12,2024-09-12 12:18:37,S010,C000259,Cash,43.08,4.31,1,gen_20251127_091605,transactions_header.csv
T00008569,2024-02-20,2024-02-20 20:01:50,S010,C000824,Cash,66.81,3.34,2,gen_20251127_091606,transactions_header.csv
T00014078,2024-12-09,2024-12-09 19:30:22,S029,C003041,Online,67.91,6.79,1,gen_20251127_091607,transactions_header.csv
T00012349,2024-02-19,2024-02-19 04:40:21,S011,C004321,Card,67.26,0.0,1,gen_20251127_091607,transactions_header.csv
T00005938,09/24/24,2024-09-24 00:44:39,S015,C000409,Online,$47.56,0.0,2,gen_20251127_091606,transactions_header.csv
T00007050,07/03/24,2024-07-03 13:09:19,S022,,Cash,90.22,,1,gen_20251127_091606,transactions_header.csv
T00016068,10/28/24,2024-10-28 17:46:10,S002,C002151,Online,82.01,4.1,2,gen_20251127_091607,transactions_header.csv
T00001826,01/03/24,2024-01-03 13:22:01,S021,C003912,Online,63.77,6.38,4,gen_20251127_091605,transactions_header.csv
T00005237,08/28/24,2024-08-28 11:31:03,S027,C000626,Online,32.95,3.3,1,gen_20251127_091606,transactions_header.csv
T00009496,07/15/24,2024-07-15 18:16:24,S029,C000268,Cash,71.26,3.56,1,gen_20251127_091606,transactions_header.csv
T00004230,06/17/24,2024-06-17 20:33:26,S001,C002088,Cash,86.08,0.0,8,gen_20251127_091606,transactions_header.csv
T00017300,02/23/24,2024-02-23 16:32:26,S017,C000600,Cash,29.86,2.99,1,gen_20251127_091607,transactions_header.csv
T00016007,12/11/24,2024-12-11 07:54:54,S006,C002874,Cash,73.3,,1,gen_20251127_091607,transactions_header.csv
T00012629,01/04/24,2024-01-04 02:26:47,S027,,Online,-61.82,0.0,1,gen_20251127_091607,transactions_header.csv
T00008705,2024-09-17,2024-09-17 23:52:24,S030,C004905,online,40.72,0.0,3,gen_20251127_091606,transactions_header.csv
T00004255,08/22/24,2024-08-22 18:04:25,S020,C002800,Cash,28.34,2.83,1,gen_20251127_091606,transactions_header.csv
T00002217,06/05/24,2024-06-05 23:38:20,S005,C001719,Cash,43.7,6.56,2,gen_20251127_091605,transactions_header.csv
T00002996,2024-05-17,2024-05-17 17:42:10,S018,,Online,23.46,1.17,5,gen_20251127_091606,transactions_header.csv
T00015422,2024-02-04,2024-02-04 16:10:55,S030,,Cash,69.56,0.0,5,gen_20251127_091607,transactions_header.csv
T00019454,2024-04-19,2024-04-19 04:43:06,S022,C001241,Card,63.39,0.0,7,gen_20251127_091607,transactions_header.csv
T00019608,2024-02-05,2024-02-05 17:33:28,S019,,Cash,99.99,0.0,4,gen_20251127_091607,transactions_header.csv
T00005334,2024-04-30,2024-04-30 10:30:34,S022,C002282,online,78.41,,1,gen_20251127_091606,transactions_header.csv
T00014773,2024-03-22,2024-03-22 06:50:42,S016,C003036,Cash,46.93,4.69,1,gen_20251127_091607,transactions_header.csv
T00009168,10/18/24,2024-10-18 17:17:28,S014,C000143,Online,29.9,0.0,1,gen_20251127_091606,transactions_header.csv
T00006368,2024-10-19,2024-10-19 14:50:40,S028,C004015,Card,63.95,,1,gen_20251127_091606,transactions_header.csv
T00007088,04/24/24,2024-04-24 01:21:10,S030,C000070,Online,58.66,2.93,4,gen_20251127_091606,transactions_header.csv
T00003941,2024-06-29,2024-06-29 23:34:08,S001,C000611,Card,47.01,2.35,1,gen_20251127_091606,transactions_header.csv
T00010032,02/27/24,2024-02-27 08:36:47,S003,C001609,Card,37.03,5.55,4,gen_20251127_091606,transactions_header.csv
T00009812,2024-12-24,2024-12-24 22:58:55,S026,C004253,cash,42.0,,1,gen_20251127_091606,transactions_header.csv
T00008620,05/15/24,2024-05-15 11:09:58,S024,C000562,Online,100.28,15.04,3,gen_20251127_091606,transactions_header.csv
T00017138,06/05/24,2024-06-05 03:07:34,S003,C004090,Online,89.5,4.48,1,gen_20251127_091607,transactions_header.csv
T00012990,2024-10-03,2024-10-03 14:43:56,S015,C003572,Cash,60.21,9.03,1,gen_20251127_091607,transactions_header.csv
T00003224,09/28/24,2024-09-28 14:24:02,S004,C004908,Card,43.02,2.15,2,gen_20251127_091606,transactions_header.csv
T00017032,07/14/24,2024-07-14 01:36:56,S016,C000704,Card,49.96,2.5,1,gen_20251127_091607,transactions_header.csv
T00018109,08/14/24,2024-08-14 04:11:05,S020,C000627,Online,96.52,4.83,2,gen_20251127_091607,transactions_header.csv
T00015027,2024-03-07,2024-03-07 14:09:03,S001,C003618,card,68.72,3.44,1,gen_20251127_091607,transactions_header.csv
T00000450,02/09/24,2024-02-09 23:26:57,S001,,online,34.38,1.72,3,gen_20251127_091605,transactions_header.csv
T00008098,03/16/24,2024-03-16 18:22:58,S010,C000494,Card,40.94,0.0,2,gen_20251127_091606,transactions_header.csv
T00010241,2024-03-09,2024-03-09 21:32:16,S001,C002674,Cash,55.87,5.59,1,gen_20251127_091606,transactions_header.csv
T00011641,2024-05-19,2024-05-19 15:22:40,S003,C000438,cash,15.89,1.59,1,gen_20251127_091606,transactions_header.csv
T00006670,2024-09-29,2024-09-29 07:49:18,S004,C000007,Online,36.74,3.67,5,gen_20251127_091606,transactions_header.csv
T00017076,09/04/24,2024-09-04 16:54:28,S023,C003288,Cash,57.22,2.86,1,gen_20251127_091607,transactions_header.csv
T00017840,07/12/24,2024-07-12 11:50:12,S020,C000948,Online,39.62,3.96,6,gen_20251127_091607,transactions_header.csv
T00008767,04/07/24,2024-04-07 23:43:07,S026,C002731,Cash,11.54,0.58,1,gen_20251127_091606,transactions_header.csv
T00000536,2024-08-23,2024-08-23 23:45:56,S001,C002467,Cash,73.35,7.33,1,gen_20251127_091605,transactions_header.csv
T00007122,2024-04-12,2024-04-12 20:56:05,S012,C001949,Card,68.35,3.42,1,gen_20251127_091606,transactions_header.csv
T00010269,2024-09-09,2024-09-09 11:27:03,S006,C003744,Online,55.77,8.37,2,gen_20251127_091606,transactions_header.csv
T00001837,2024-05-08,2024-05-08 09:18:33,S028,C001017,Cash,57.2,8.58,2,gen_20251127_091605,transactions_header.csv
T00018000,2024-10-28,2024-10-28 12:05:58,S028,C000297,Card,3.31,,1,gen_20251127_091607,transactions_header.csv
T00011757,05/10/24,2024-05-10 12:45:10,S016,C002116,Card,18.26,,3,gen_20251127_091607,transactions_header.csv
T00016697,2024-09-26,2024-09-26 16:32:21,S015,C001310,Online,30.72,1.54,4,gen_20251127_091607,transactions_header.csv
T00010502,2024-02-11,2024-02-11 02:32:48,S003,C002267,Online,59.2,5.92,2,gen_20251127_091606,transactions_header.csv
T00004308,01/29/24,2024-01-29 15:32:59,S021,,Online,85.49,8.55,1,gen_20251127_091606,transactions_header.csv
T00001891,06/13/24,2024-06-13 00:20:23,S020,C004281,Cash,40.56,2.03,1,gen_20251127_091605,transactions_header.csv
T00018106,2024-09-17,2024-09-17 00:47:52,S006,C001956,Card,0,0.0,7,gen_20251127_091607,transactions_header.csv
T00007404,05/21/24,2024-05-21 10:10:33,S030,C004583,Cash,6.69,,1,gen_20251127_091606,transactions_header.csv
T00001689,2024-06-10,2024-06-10 21:38:28,S018,C000647,Online,0,0.0,2,gen_20251127_091605,transactions_header.csv
T00011944,01/08/24,2024-01-08 10:35:28,S028,,Online,16.32,0.82,1,gen_20251127_091607,transactions_header.csv
T00005865,2024-06-25,2024-06-25 01:14:21,S010,C004315,Cash,89.43,13.41,1,gen_20251127_091606,transactions_header.csv
T00019639,2024-07-01,2024-07-01 00:57:40,S019,C004918,online,85.87,8.59,3,gen_20251127_091607,transactions_header.csv
T00011888,08/03/24,2024-08-03 16:08:11,S019,C000013,Card,92.36,0.0,5,gen_20251127_091607,transactions_header.csv
T00005386,03/27/24,2024-03-27 20:19:16,S002,C002298,Card,63.46,3.17,4,gen_20251127_091606,transactions_header.csv
T00011887,2024-06-07,2024-06-07 03:59:33,S019,C003754,Cash,66.88,10.03,1,gen_20251127_091607,transactions_header.csv
T00013885,2024-04-13,2024-04-13 20:38:33,S019,C003082,Online,85.23,12.78,1,gen_20251127_091607,transactions_header.csv
T00000455,2024-10-15,2024-10-15 13:11:16,S019,C001515,Card,$16.72,2.51,2,gen_20251127_091605,transactions_header.csv
T00018006,2024-07-11,2024-07-11 05:03:08,S005,,Cash,1.0,0.15,1,gen_20251127_091607,transactions_header.csv
T00018403,2024-04-21,2024-04-21 19:09:57,S014,C004515,Online,35.2,1.76,2,gen_20251127_091607,transactions_header.csv
T00013124,2024-04-11,2024-04-11 11:33:50,S025,C003798,Card,$32.89,,1,gen_20251127_091607,transactions_header.csv
T00003853,2024-08-02,2024-08-02 02:04:44,S026,C002956,Online,11.48,1.15,1,gen_20251127_091606,transactions_header.csv
T00000183,2024-11-19,2024-11-19 07:54:31,S016,,Online,0,0.0,2,gen_20251127_091605,transactions_header.csv
T00005253,11/11/24,2024-11-11 06:18:57,S026,,Card,35.58,,2,gen_20251127_091606,transactions_header.csv
T00007829,2024-10-14,2024-10-14 21:16:53,S024,,Cash,14.39,0.72,3,gen_20251127_091606,transactions_header.csv
T00013968,10/09/24,2024-10-09 14:08:58,S022,C003588,Cash,$51.36,0.0,1,gen_20251127_091607,transactions_header.csv
T00010765,2024-07-16,2024-07-16 17:35:35,S010,C001849,Online,52.28,5.23,1,gen_20251127_091606,transactions_header.csv
T00019641,2024-07-30,2024-07-30 14:19:05,S003,C001220,Online,79.62,3.98,1,gen_20251127_091607,transactions_header.csv
T00000100,2024-02-18,2024-02-18 23:34:17,S007,C001983,Cash,47.61,NA,1,gen_20251127_091605,transactions_header.csv
T00017745,01/18/24,2024-01-18 04:24:51,S009,NA,Online,18.88,2.83,1,gen_20251127_091607,transactions_header.csv
T00010530,04/19/24,2024-04-19 15:32:09,S021,C004107,Card,78.18,,1,gen_20251127_091606,transactions_header.csv
T00008830,2024-07-22,2024-07-22 23:29:50,S010,C003630,Online,71.14,0.0,3,gen_20251127_091606,transactions_header.csv
T00009692,2024-01-26,2024-01-26 17:35:20,S001,C000210,Cash,53.43,0.0,1,gen_20251127_091606,transactions_header.csv
T00018611,2024-02-01,2024-02-01 04:23:23,S018,C004916,Card,93.74,9.37,1,gen_20251127_091607,transactions_header.csv
T00013682,01/12/24,2024-01-12 10:33:11,S016,C003937,Cash,25.04,1.25,2,gen_20251127_091607,transactions_header.csv
T00001708,2024-09-12,2024-09-12 18:03:27,S021,,Card,45.8,6.87,1,gen_20251127_091605,transactions_header.csv
T00000255,2024-05-25,2024-05-25 15:01:15,S002,,Cash,60.62,9.09,1,gen_20251127_091605,transactions_header.csv
T00012043,2024-04-01,2024-04-01 08:17:37,S007,C000756,Card,88.27,8.83,3,gen_20251127_091607,transactions_header.csv
T00006294,07/10/24,2024-07-10 22:19:11,S003,C003743,Online,68.42,NA,1,gen_20251127_091606,transactions_header.csv
T00001303,2024-08-27,2024-08-27 02:47:05,S012,C002939,Online,26.79,2.68,1,gen_20251127_091605,transactions_header.csv
T00013440,01/04/24,2024-01-04 20:41:33,S005,NA,Online,62.81,6.28,2,gen_20251127_091607,transactions_header.csv
T00007900,06/09/24,2024-06-09 06:35:24,S027,NA,Cash,68.58,6.86,1,gen_20251127_091606,transactions_header.csv
T00004462,2024-06-05,2024-06-05 04:02:42,S008,C001968,Cash,102.72,,1,gen_20251127_091606,transactions_header.csv
T00015802,03/13/24,2024-03-13 23:49:43,S026,C003981,Online,45.67,2.28,1,gen_20251127_091607,transactions_header.csv
T00003931,10/15/24,2024-10-15 18:55:30,S008,C000882,Online,15.48,0.0,2,gen_20251127_091606,transactions_header.csv
T00012812,05/21/24,2024-05-21 22:46:43,S012,C002743,Online,44.65,2.23,3,gen_20251127_091607,transactions_header.csv
T00000934,2024-09-06,2024-09-06 04:20:16,S006,NA,Online,22.52,0.0,1,gen_20251127_091605,transactions_header.csv
T00014357,09/21/24,2024-09-21 02:07:00,S001,C000481,Cash,71.98,3.6,2,gen_20251127_091607,transactions_header.csv
T00009085,01/12/24,2024-01-12 04:39:34,S008,C004986,Cash,1.39,0.14,5,gen_20251127_091606,transactions_header.csv
T00006516,2024-05-22,2024-05-22 20:11:00,S020,C002124,Online,$40.04,0.0,1,gen_20251127_091606,transactions_header.csv
T00002010,03/30/24,2024-03-30 13:09:26,S019,C003758,Card,65.45,9.82,1,gen_20251127_091605,transactions_header.csv
T00008115,12/14/24,2024-12-14 13:00:25,S030,C002632,Cash,88.76,,1,gen_20251127_091606,transactions_header.csv
T00006247,2024-01-18,2024-01-18 22:59:04,S018,C003003,Online,119.28,5.96,1,gen_20251127_091606,transactions_header.csv
T00002875,2024-02-11,2024-02-11 22:50:01,S008,C000802,Online,0,0.0,1,gen_20251127_091606,transactions_header.csv
T00015616,2024-02-24,2024-02-24 00:12:34,S007,C000597,Online,$0.00,0.0,5,gen_20251127_091607,transactions_header.csv
T00001038,10/20/24,2024-10-20 12:00:30,S022,C001139,Online,61.39,9.21,1,gen_20251127_091605,transactions_header.csv
T00002705,2024-03-29,2024-03-29 21:34:47,S002,C003681,Cash,48.7,0.0,3,gen_20251127_091605,transactions_header.csv
T00008273,2024-04-25,2024-04-25 12:00:58,S018,,Cash,38.94,5.84,1,gen_20251127_091606,transactions_header.csv
T00007948,2024-08-16,2024-08-16 23:13:53,S009,C003236,Online,54.99,8.25,2,gen_20251127_091606,transactions_header.csv
T00014786,02/19/24,2024-02-19 05:52:01,S027,C003349,Cash,17.09,,4,gen_20251127_091607,transactions_header.csv
T00013475,2024-11-11,2024-11-11 02:51:40,S020,C002124,Online,40.47,2.02,2,gen_20251127_091607,transactions_header.csv
T00006106,2024-04-30,2024-04-30 04:45:42,S014,C003421,Online,69.96,10.49,1,gen_20251127_091606,transactions_header.csv
T00012078,05/28/24,2024-05-28 05:48:11,S022,,Online,14.85,2.23,6,gen_20251127_091607,transactions_header.csv
T00008624,2024-02-16,2024-02-16 10:25:03,S005,C002177,Card,19.95,,2,gen_20251127_091606,transactions_header.csv
T00011277,2024-07-01,2024-07-01 11:14:05,S003,C000175,Cash,121.19,12.12,2,gen_20251127_091606,transactions_header.csv
T00009294,2024-12-24,2024-12-24 22:15:04,S023,C004340,Online,58.42,2.92,2,gen_20251127_091606,transactions_header.csv
T00007179,2024-09-10,2024-09-10 21:11:37,S020,C000688,Online,69.44,3.47,1,gen_20251127_091606,transactions_header.csv
T00010821,06/01/24,2024-06-01 09:34:11,S012,C001286,Card,65.66,9.85,2,gen_20251127_091606,transactions_header.csv
T00010438,05/08/24,2024-05-08 17:56:42,S015,C004192,Card,0,0.0,1,gen_20251127_091606,transactions_header.csv
T00009809,2024-11-03,2024-11-03 11:18:01,S024,C001467,Online,86.63,4.33,1,gen_20251127_091606,transactions_header.csv
T00009746,2024-03-12,2024-03-12 20:30:49,S003,C002317,Cash,31.9,1.59,1,gen_20251127_091606,transactions_header.csv
T00007787,11/02/24,2024-11-02 07:34:20,S011,C002472,Card,64.83,,2,gen_20251127_091606,transactions_header.csv
T00001541,03/14/24,2024-03-14 08:37:15,S027,C000396,Cash,75.76,,1,gen_20251127_091605,transactions_header.csv
T00010633,2024-01-20,2024-01-20 23:20:54,S014,C000242,Card,43.12,2.16,1,gen_20251127_091606,transactions_header.csv
T00002698,2024-09-01,2024-09-01 08:05:46,S009,C002445,Online,79.15,7.92,1,gen_20251127_091605,transactions_header.csv
T00002287,08/22/24,2024-08-22 11:44:31,S001,C003894,Online,60.15,3.01,3,gen_20251127_091605,transactions_header.csv
T00016864,05/12/24,2024-05-12 05:26:43,S027,C002752,Online,0,0.0,1,gen_20251127_091607,transactions_header.csv
T00009316,11/19/24,2024-11-19 17:48:25,S020,C000416,Online,33.21,0.0,7,gen_20251127_091606,transactions_header.csv
T00011618,2024-06-01,2024-06-01 12:55:56,S009,C000660,Cash,44.78,2.24,1,gen_20251127_091606,transactions_header.csv
T00013964,12/26/24,2024-12-26 18:36:23,S019,C004434,Cash,11.21,0.0,3,gen_20251127_091607,transactions_header.csv
T00015342,06/16/24,2024-06-16 14:20:33,S025,C003362,Online,49.3,2.46,3,gen_20251127_091607,transactions_header.csv
T00019329,2024-10-03,2024-10-03 21:25:30,S007,C003773,Online,$40.53,4.05,4,gen_20251127_091607,transactions_header.csv
T00017867,02/17/24,2024-02-17 20:14:46,S015,C002037,Online,19.75,NA,2,gen_20251127_091607,transactions_header.csv
T00008883,2024-02-01,2024-02-01 21:59:16,S011,C004714,Online,57.19,5.72,6,gen_20251127_091606,transactions_header.csv
T00015534,05/29/24,2024-05-29 12:49:58,S027,C001378,Online,43.7,0.0,1,gen_20251127_091607,transactions_header.csv
T00011033,2024-04-20,2024-04-20 01:22:29,S025,C001379,Card,21.52,0.0,5,gen_20251127_091606,transactions_header.csv
T00008456,12/05/24,2024-12-05 00:09:35,S011,C002755,Card,8.46,0.0,3,gen_20251127_091606,transactions_header.csv
T00012065,2024-08-02,2024-08-02 00:28:18,S025,C000251,Cash,30.63,4.59,2,gen_20251127_091607,transactions_header.csv
T00007299,09/10/24,2024-09-10 22:21:59,S029,C001825,Online,102.71,10.27,6,gen_20251127_091606,transactions_header.csv
T00008629,2024-05-09,2024-05-09 03:49:56,S023,C001292,Online,51.71,7.76,3,gen_20251127_091606,transactions_header.csv
T00017299,2024-11-10,2024-11-10 07:57:55,S008,C004126,Card,83.25,12.49,1,gen_20251127_091607,transactions_header.csv
T00001334,03/16/24,2024-03-16 14:44:25,S025,C000673,Cash,12.56,,6,gen_20251127_091605,transactions_header.csv
T00005788,2024-03-11,2024-03-11 01:27:47,S008,C004218,Online,18.05,1.81,3,gen_20251127_091606,transactions_header.csv
T00015735,2024-08-26,2024-08-26 16:39:00,S005,C000686,Online,66.88,3.34,1,gen_20251127_091607,transactions_header.csv
T00010205,06/17/24,2024-06-17 06:40:16,S013,C000590,Online,63.21,NA,1,gen_20251127_091606,transactions_header.csv
T00004439,05/23/24,2024-05-23 02:21:28,S030,NA,Card,8.79,0.0,7,gen_20251127_091606,transactions_header.csv
T00001985,2024-08-19,2024-08-19 03:44:58,S018,C004671,Online,$32.49,1.62,1,gen_20251127_091605,transactions_header.csv
T00009956,10/27/24,2024-10-27 01:15:36,S007,C000999,Cash,81.77,12.27,1,gen_20251127_091606,transactions_header.csv
T00002436,01/05/24,2024-01-05 09:48:55,S012,C004539,Cash,29.96,0.0,3,gen_20251127_091605,transactions_header.csv
T00015495,2024-02-26,2024-02-26 19:22:33,S015,C002988,Card,36.74,0.0,2,gen_20251127_091607,transactions_header.csv
T00018129,01/13/24,2024-01-13 17:33:23,S007,C000078,Card,61.22,6.12,2,gen_20251127_091607,transactions_header.csv
T00015558,2024-09-06,2024-09-06 22:35:48,S016,C004585,Card,31.9,4.78,3,gen_20251127_091607,transactions_header.csv
T00011420,05/23/24,2024-05-23 17:42:52,S017,C003769,Online,28.22,4.23,1,gen_20251127_091606,transactions_header.csv
T00019485,09/13/24,2024-09-13 14:35:03,S022,C002593,Card,$0.24,0.0,1,gen_20251127_091607,transactions_header.csv
T00003921,2024-01-04,2024-01-04 19:22:25,S030,C002077,Cash,70.09,10.51,2,gen_20251127_091606,transactions_header.csv
T00014618,12/03/24,2024-12-03 20:16:41,S025,C003694,Card,47.15,,1,gen_20251127_091607,transactions_header.csv
T00009793,01/24/24,2024-01-24 08:18:17,S009,C002771,Cash,69.58,10.44,2,gen_20251127_091606,transactions_header.csv
T00005964,05/29/24,2024-05-29 14:22:28,S026,,Card,135.41,0.0,2,gen_20251127_091606,transactions_header.csv
T00004752,01/15/24,2024-01-15 10:36:14,S025,NA,Card,2.27,0.23,2,gen_20251127_091606,transactions_header.csv
T00018206,09/16/24,2024-09-16 18:15:35,S006,C004189,Online,37.89,NA,3,gen_20251127_091607,transactions_header.csv
T00004449,02/24/24,2024-02-24 12:16:43,S021,C001496,Cash,89.08,0.0,1,gen_20251127_091606,transactions_header.csv
T00002814,01/15/24,2024-01-15 01:05:02,S008,NA,Card,60.06,6.01,5,gen_20251127_091605,transactions_header.csv
T00019264,2024-04-04,2024-04-04 07:20:43,S011,C002266,Cash,71.41,0.0,1,gen_20251127_091607,transactions_header.csv
T00000537,02/18/24,2024-02-18 22:51:39,S019,,Card,68.4,3.42,3,gen_20251127_091605,transactions_header.csv
T00013395,11/19/24,2024-11-19 05:01:51,S007,C003422,Card,121.89,12.19,2,gen_20251127_091607,transactions_header.csv
T00001140,11/11/24,2024-11-11 14:07:43,S024,C003371,Card,29.06,1.45,1,gen_20251127_091605,transactions_header.csv
T00004117,2024-08-13,2024-08-13 11:21:31,S023,C003077,card,53.68,8.05,1,gen_20251127_091606,transactions_header.csv
T00006347,2024-08-02,2024-08-02 10:31:52,S021,C003512,Online,0,NA,2,gen_20251127_091606,transactions_header.csv
T00017497,2024-05-04,2024-05-04 05:59:40,S022,C001986,Cash,$23.23,2.32,2,gen_20251127_091607,transactions_header.csv
T00008294,2024-09-14,2024-09-14 17:26:00,S013,C000411,Online,19.43,2.91,2,gen_20251127_091606,transactions_header.csv
T00015175,06/09/24,2024-06-09 01:42:05,S017,C004335,Online,28.1,2.81,1,gen_20251127_091607,transactions_header.csv
T00000618,05/26/24,2024-05-26 18:10:11,S028,C004940,Cash,80.65,4.03,3,gen_20251127_091605,transactions_header.csv
T00001311,11/07/24,2024-11-07 00:17:54,S017,C001438,Cash,58.5,NA,1,gen_20251127_091605,transactions_header.csv
T00015405,2024-07-10,2024-07-10 22:13:03,S009,C001111,Cash,48.71,2.44,2,gen_20251127_091607,transactions_header.csv
T00015304,2024-07-01,2024-07-01 17:15:32,S025,C000362,Cash,$39.14,5.87,1,gen_20251127_091607,transactions_header.csv
T00003252,04/23/24,2024-04-23 09:59:50,S022,,Card,36.78,5.52,4,gen_20251127_091606,transactions_header.csv
T00003548,2024-08-02,2024-08-02 10:35:14,S015,C001202,Card,$40.58,0.0,1,gen_20251127_091606,transactions_header.csv
T00014117,07/12/24,2024-07-12 14:49:46,S014,C000094,Card,19.51,1.95,3,gen_20251127_091607,transactions_header.csv
T00015268,2024-10-01,2024-10-01 16:07:35,S005,C002169,Cash,75.41,NA,4,gen_20251127_091607,transactions_header.csv
T00015582,2024-09-10,2024-09-10 04:20:54,S002,C003109,Card,66.46,3.32,1,gen_20251127_091607,transactions_header.csv
T00015770,2024-01-17,2024-01-17 11:11:36,S028,C003316,Online,26.14,0.0,2,gen_20251127_091607,transactions_header.csv
T00016294,08/19/24,2024-08-19 21:32:33,S025,,Online,36.32,1.82,1,gen_20251127_091607,transactions_header.csv
T00008887,10/28/24,2024-10-28 03:58:58,S022,C002442,card,63.87,0.0,1,gen_20251127_091606,transactions_header.csv
T00008026,2024-07-07,2024-07-07 17:29:33,S004,C004914,Online,40.62,6.09,2,gen_20251127_091606,transactions_header.csv
T00008109,07/15/24,2024-07-15 07:04:14,S023,C000172,Card,90.94,,1,gen_20251127_091606,transactions_header.csv
T00010303,02/24/24,2024-02-24 09:35:48,S015,,Online,10.21,0.0,1,gen_20251127_091606,transactions_header.csv
T00007325,02/15/24,2024-02-15 06:22:11,S014,,Cash,65.75,9.86,2,gen_20251127_091606,transactions_header.csv
T00001122,08/19/24,2024-08-19 18:30:13,S019,C002451,Online,30.4,0.0,1,gen_20251127_091605,transactions_header.csv
T00002657,01/01/24,2024-01-01 02:29:55,S018,C001354,Online,32.74,,4,gen_20251127_091605,transactions_header.csv
T00003479,11/14/24,2024-11-14 12:27:47,S002,C001711,Online,22.15,1.11,1,gen_20251127_091606,transactions_header.csv
T00006154,08/13/24,2024-08-13 02:24:31,S022,C004040,Online,75.86,0.0,2,gen_20251127_091606,transactions_header.csv
T00017556,05/12/24,2024-05-12 09:23:51,S013,C003356,Online,65.62,0.0,1,gen_20251127_091607,transactions_header.csv
T00014501,2024-02-23,2024-02-23 17:28:59,S012,C001979,Card,88.05,13.21,1,gen_20251127_091607,transactions_header.csv
T00015427,01/09/24,2024-01-09 23:41:17,S027,,Card,68.45,0.0,1,gen_20251127_091607,transactions_header.csv
T00010828,2024-09-21,2024-09-21 20:10:49,S008,C004654,Card,100.75,0.0,1,gen_20251127_091606,transactions_header.csv
T00014479,11/06/24,2024-11-06 14:25:36,S004,C003662,Cash,41.15,0.0,1,gen_20251127_091607,transactions_header.csv
T00003527,11/28/24,2024-11-28 08:51:31,S023,C004750,Online,72.77,10.92,1,gen_20251127_091606,transactions_header.csv
T00017420,2024-10-06,2024-10-06 09:25:21,S005,C004700,Card,73.74,NA,3,gen_20251127_091607,transactions_header.csv
T00001836,2024-09-11,2024-09-11 04:03:24,S014,C002235,Cash,79.16,,1,gen_20251127_091605,transactions_header.csv
T00015245,07/31/24,2024-07-31 17:02:30,S001,C000538,Cash,69.7,3.49,1,gen_20251127_091607,transactions_header.csv
T00017264,2024-09-05,2024-09-05 03:38:48,S017,C002537,Online,59.25,0.0,3,gen_20251127_091607,transactions_header.csv
T00008067,02/07/24,2024-02-07 04:08:28,S028,C002548,Card,21.62,2.16,2,gen_20251127_091606,transactions_header.csv
T00001043,07/30/24,2024-07-30 19:29:59,S012,C004748,Online,124.16,6.21,1,gen_20251127_091605,transactions_header.csv
T00015939,2024-11-01,2024-11-01 22:08:08,S020,C003649,Online,65.84,,1,gen_20251127_091607,transactions_header.csv
T00005538,2024-08-27,2024-08-27 05:11:29,S026,C003368,Cash,13.47,2.02,1,gen_20251127_091606,transactions_header.csv
T00000983,2024-04-19,2024-04-19 05:04:19,S027,C000888,Cash,0,0,1,gen_20251127_091605,transactions_header.csv
T00011312,2024-07-30,2024-07-30 03:41:32,S002,C003234,Online,75.21,0.0,4,gen_20251127_091606,transactions_header.csv
T00016840,2024-10-31,2024-10-31 01:21:36,S020,C002499,Online,19.57,0.0,8,gen_20251127_091607,transactions_header.csv
T00017398,2024-04-11,2024-04-11 13:54:47,S017,C002284,Cash,101.7,10.17,2,gen_20251127_091607,transactions_header.csv
T00007919,2024-12-08,2024-12-08 21:49:35,S025,C004271,Online,75.21,3.76,3,gen_20251127_091606,transactions_header.csv
T00017850,11/13/24,2024-11-13 01:22:06,S027,,Card,14.66,0.0,1,gen_20251127_091607,transactions_header.csv
T00019358,02/03/24,2024-02-03 01:07:57,S025,C002814,Card,96.84,4.84,1,gen_20251127_091607,transactions_header.csv
T00000378,2024-12-31,2024-12-31 15:42:36,S004,C004937,Online,70.83,10.62,1,gen_20251127_091605,transactions_header.csv
